insert into babel_2944_employeeData values ('a'),('b'),('c'),('d');
GO
~~START~~
int
0
~~END~~

~~ROW COUNT: 4~~


drop trigger babel_2944_updEmployeeData1;
GO

insert into babel_2944_employeeData values ('a'),('b'),('c'),('d');
GO
~~ROW COUNT: 4~~


delete from babel_2944_employeeData where Emp_First_name = 'a';
GO
~~START~~
int
0
~~END~~

~~ROW COUNT: 2~~


CREATE TRIGGER babel_2944_updEmployeeData3  ON babel_2944_employeeData  INSTEAD OF INSERT AS    
   select count(*) from deleted;
GO


insert into babel_2944_employeeData values ('bbb');
GO
~~START~~
int
0
~~END~~

~~ROW COUNT: 1~~


