USE db1_BABEL2170;
GO

-- Instead of Insert Trigger on View 
CREATE TRIGGER babel_2170_vu_employees_view_iot_insert ON babel_2170_vu_employees_view
INSTEAD OF INSERT
AS
BEGIN
    SELECT 'Trigger db1_BABEL2170.dbo.babel_2170_vu_employees_view_iot_insert Invoked'
END
GO

INSERT INTO babel_2170_vu_employees_view VALUES(5, 'alex', '1st Street', '5000');
GO
~~START~~
varchar
Trigger db1_BABEL2170.dbo.babel_2170_vu_employees_view_iot_insert Invoked
~~END~~

~~ROW COUNT: 1~~


SELECT COUNT(EmployeeID) FROM babel_2170_vu_employees;
GO
~~START~~
int
4
~~END~~


SELECT COUNT(EmployeeID) FROM babel_2170_vu_employees_view;
GO
~~START~~
int
4
~~END~~


-- Instead of Update Trigger on View 
CREATE TRIGGER babel_2170_vu_employees_view_iot_update ON babel_2170_vu_employees_view
INSTEAD OF UPDATE
AS
BEGIN
    SELECT 'Trigger db1_BABEL2170.dbo.babel_2170_vu_employees_view_iot_update Invoked'
END
GO

UPDATE babel_2170_vu_employees_view SET MonthSalary = MonthSalary +1 WHERE EmployeeID = 3;
GO
~~START~~
varchar
Trigger db1_BABEL2170.dbo.babel_2170_vu_employees_view_iot_update Invoked
~~END~~

~~ROW COUNT: 1~~


SELECT EmployeeID,EmployeeName, EmployeeAddress, MonthSalary FROM babel_2170_vu_employees WHERE EmployeeID = 3 ORDER BY EmployeeID;
GO
~~START~~
int#!#varchar#!#varchar#!#numeric
3#!#ana#!#1st Street#!#3000.00
~~END~~


BEGIN TRANSACTION
    UPDATE babel_2170_vu_employees_view SET MonthSalary = MonthSalary +1 WHERE EmployeeID IN (3, 4);
COMMIT TRANSACTION;
GO
~~START~~
varchar
Trigger db1_BABEL2170.dbo.babel_2170_vu_employees_view_iot_update Invoked
~~END~~

~~ROW COUNT: 2~~


SELECT EmployeeID, EmployeeName, EmployeeAddress, MonthSalary FROM babel_2170_vu_employees WHERE EmployeeID IN (3, 4) ORDER BY EmployeeID;
GO
~~START~~
int#!#varchar#!#varchar#!#numeric
3#!#ana#!#1st Street#!#3000.00
4#!#adam#!#1st Street#!#4000.00
~~END~~


-- Instead of Delete Trigger on View
CREATE TRIGGER babel_2170_vu_employees_view_iot_delete ON babel_2170_vu_employees_view
INSTEAD OF DELETE
AS
BEGIN
    SELECT 'Trigger db1_BABEL2170.dbo.babel_2170_vu_employees_view_iot_delete Invoked'
END
GO

BEGIN TRANSACTION
    DELETE FROM babel_2170_vu_employees_view WHERE EmployeeID IN (1, 2);
COMMIT TRANSACTION;
GO
~~START~~
varchar
Trigger db1_BABEL2170.dbo.babel_2170_vu_employees_view_iot_delete Invoked
~~END~~

~~ROW COUNT: 2~~


SELECT COUNT(EmployeeID) FROM babel_2170_vu_employees_view;
GO
~~START~~
int
4
~~END~~


SELECT COUNT(EmployeeID) FROM babel_2170_vu_employees;
GO
~~START~~
int
4
~~END~~


SELECT EmployeeID, EmployeeName, EmployeeAddress, MonthSalary FROM babel_2170_vu_employees_view ORDER BY EmployeeID;
GO
~~START~~
int#!#varchar#!#varchar#!#numeric
1#!#amber#!#1st Street#!#1000.00
2#!#angel#!#1st Street#!#2000.00
3#!#ana#!#1st Street#!#3000.00
4#!#adam#!#1st Street#!#4000.00
~~END~~


--- Tests multiple insert queries and check if inserted table can be accessed and trigger is working fine.
CREATE TRIGGER babel_2170_vu_employees_view_iot_bulkinsert ON babel_2170_vu_employees_view_bulkinsert
INSTEAD OF INSERT
AS
    SELECT * from INSERTED;
GO

BEGIN TRANSACTION
DECLARE @i int = 1
    WHILE @i <= 3
    BEGIN
        INSERT INTO babel_2170_vu_employees_view_bulkinsert VALUES(@i, 'bob', '1st Street', '1000');
        SET @i = @i + 1
    END
COMMIT TRANSACTION
GO
~~START~~
int#!#varchar#!#varchar#!#numeric
1#!#bob#!#1st Street#!#1000.00
~~END~~

~~ROW COUNT: 1~~

~~START~~
int#!#varchar#!#varchar#!#numeric
2#!#bob#!#1st Street#!#1000.00
~~END~~

~~ROW COUNT: 1~~

~~START~~
int#!#varchar#!#varchar#!#numeric
3#!#bob#!#1st Street#!#1000.00
~~END~~

~~ROW COUNT: 1~~



-- Test Instead of Update trigger in same db but cross schema 
-- Cleanup default dbo schema IO Update trigger
DROP TRIGGER IF EXISTS [dbo].[babel_2170_vu_employees_view_iot_update];
GO

CREATE TRIGGER [schema_2170].[babel_2170_vu_employees_view_iot_update] ON [schema_2170].[babel_2170_vu_employees_view]
INSTEAD OF UPDATE
AS
    SELECT 'Trigger db1_BABEL2170.schema_2170.babel_2170_vu_employees_view_iot_update Invoked'
GO

CREATE TRIGGER [babel_2170_vu_employees_view_iot_update] ON [babel_2170_vu_employees_view]
INSTEAD OF UPDATE
AS
    SELECT 'Trigger db1_BABEL2170.dbo.babel_2170_vu_employees_view_iot_update Invoked'
GO

UPDATE [schema_2170].[babel_2170_vu_employees_view] SET MonthSalary = MonthSalary +1 WHERE EmployeeID = 3;
GO
~~START~~
varchar
Trigger db1_BABEL2170.schema_2170.babel_2170_vu_employees_view_iot_update Invoked
~~END~~

~~ROW COUNT: 1~~


UPDATE [dbo].[babel_2170_vu_employees_view] SET MonthSalary = MonthSalary +1 WHERE EmployeeID = 3;
GO
~~START~~
varchar
Trigger db1_BABEL2170.dbo.babel_2170_vu_employees_view_iot_update Invoked
~~END~~

~~ROW COUNT: 1~~


DROP TRIGGER IF EXISTS[dbo].[babel_2170_vu_employees_view_iot_update];
GO

-- schema_2170 object cleanup
DROP TRIGGER IF EXISTS [schema_2170].babel_2170_vu_employees_view_iot_update;
GO

DROP VIEW IF EXISTS [schema_2170].babel_2170_vu_employees_view;
GO

DROP TABLE IF EXISTS [schema_2170].babel_2170_vu_employees;
GO

DROP SCHEMA IF EXISTS schema_2170;
GO

-- test multi-db mode
SELECT set_config('role', 'jdbc_user', false);
GO
~~START~~
text
jdbc_user
~~END~~


SELECT set_config('babelfishpg_tsql.migration_mode', 'multi-db', false);
GO
~~START~~
text
multi-db
~~END~~


CREATE DATABASE db2_BABEL2170;
GO

USE db2_BABEL2170;
GO

CREATE TABLE babel_2170_vu_employees
(
    EmployeeID      int NOT NULL,
    EmployeeName    VARCHAR(50),
    EmployeeAddress VARCHAR(50),
    MonthSalary     NUMERIC(10, 2)
)
GO

INSERT INTO babel_2170_vu_employees VALUES(1, 'amber', '1st Street', '1000');
INSERT INTO babel_2170_vu_employees VALUES(2, 'angel', '1st Street', '2000');
INSERT INTO babel_2170_vu_employees VALUES(3, 'ana', '1st Street', '3000');
INSERT INTO babel_2170_vu_employees VALUES(4, 'adam', '1st Street', '4000');
GO
~~ROW COUNT: 1~~

~~ROW COUNT: 1~~

~~ROW COUNT: 1~~

~~ROW COUNT: 1~~


CREATE VIEW babel_2170_vu_employees_view AS
SELECT EmployeeID,
       EmployeeName,
       EmployeeAddress,
       MonthSalary
FROM babel_2170_vu_employees
WHERE EmployeeName LIKE 'a%';
GO

-- create same name Instead of Insert trigger in second db to test Cross db behavior
CREATE TRIGGER babel_2170_vu_employees_view_iot_insert ON babel_2170_vu_employees_view
INSTEAD OF INSERT
AS
BEGIN
    SELECT 'Trigger db2_BABEL2170.dbo.babel_2170_vu_employees_view_iot_insert Invoked'
END
GO

-- should fire IOT trigger of second db
INSERT INTO babel_2170_vu_employees_view VALUES(5, 'alex', '1st Street db2_BABEL2170', '5000');
GO
~~START~~
varchar
Trigger db2_BABEL2170.dbo.babel_2170_vu_employees_view_iot_insert Invoked
~~END~~

~~ROW COUNT: 1~~


SELECT EmployeeID, EmployeeName, EmployeeAddress, MonthSalary FROM babel_2170_vu_employees WHERE EmployeeID =3;
GO
~~START~~
int#!#varchar#!#varchar#!#numeric
3#!#ana#!#1st Street#!#3000.00
~~END~~


SELECT EmployeeID, EmployeeName, EmployeeAddress, MonthSalary FROM babel_2170_vu_employees_view WHERE EmployeeID =5;
GO
~~START~~
int#!#varchar#!#varchar#!#numeric
~~END~~


-- clean  all objects in second database
DROP TRIGGER IF EXISTS babel_2170_vu_employees_view_iot_insert;
GO

DROP TRIGGER IF EXISTS babel_2170_vu_employees_view_iot_update;
GO

DROP TRIGGER IF EXISTS babel_2170_vu_employees_view_iot_delete;
GO

DROP VIEW IF EXISTS babel_2170_vu_employees_view;
GO

DROP TABLE IF EXISTS babel_2170_vu_employees;
GO

USE MASTER;
GO

DROP DATABASE IF EXISTS db2_BABEL2170;
GO
