insert into babel_2787_2_vu_prepare_employeeData values ('a'),('b'),('c'),('d');
GO
~~ROW COUNT: 4~~


CREATE TRIGGER babel_2787_2_vu_prepare_updEmployeeData  ON babel_2787_2_vu_prepare_employeeData  INSTEAD OF INSERT AS  
BEGIN  
   BEGIN TRAN;
    update babel_2787_2_vu_prepare_employeeData set Emp_First_name = 'dddd';
   Rollback tran;
END
GO

insert into babel_2787_2_vu_prepare_employeeData values ('e')
GO
~~ROW COUNT: 4~~

~~ERROR (Code: 3609)~~

~~ERROR (Message: The transaction ended in the trigger. The batch has been aborted.)~~


select * from babel_2787_2_vu_prepare_employeeData
GO
~~START~~
int#!#varchar
1#!#a
2#!#b
3#!#c
4#!#d
~~END~~


drop trigger babel_2787_2_vu_prepare_updEmployeeData;
GO

CREATE TRIGGER babel_2787_2_vu_prepare_updEmployeeData  ON babel_2787_2_vu_prepare_employeeData  INSTEAD OF UPDATE AS  
BEGIN  
   BEGIN TRAN;
    insert into babel_2787_2_vu_prepare_employeeData values ('e')
   Rollback tran;
END
GO

update babel_2787_2_vu_prepare_employeeData set Emp_First_name = 'dddd';
GO
~~ROW COUNT: 1~~

~~ERROR (Code: 3609)~~

~~ERROR (Message: The transaction ended in the trigger. The batch has been aborted.)~~


select * from babel_2787_2_vu_prepare_employeeData
GO
~~START~~
int#!#varchar
1#!#a
2#!#b
3#!#c
4#!#d
~~END~~


drop trigger babel_2787_2_vu_prepare_updEmployeeData;
GO

CREATE TRIGGER babel_2787_2_vu_prepare_updEmployeeData  ON babel_2787_2_vu_prepare_employeeData  INSTEAD OF DELETE AS  
BEGIN  
   BEGIN TRAN;
    update babel_2787_2_vu_prepare_employeeData set Emp_First_name = 'dddd';
   Rollback tran;
END
GO

delete from babel_2787_2_vu_prepare_employeeData where Emp_First_name = 'a';
GO
~~ROW COUNT: 4~~

~~ERROR (Code: 3609)~~

~~ERROR (Message: The transaction ended in the trigger. The batch has been aborted.)~~


select * from babel_2787_2_vu_prepare_employeeData
GO
~~START~~
int#!#varchar
1#!#a
2#!#b
3#!#c
4#!#d
~~END~~

