-- tsql
USE my_babel_cross_db_vu_prepare_db1;
GO

SELECT current_user;
GO
~~START~~
varchar
dbo
~~END~~


INSERT INTO master.dbo.babel_cross_db_vu_prepare_master_t1 VALUES (10);
GO
~~ROW COUNT: 1~~


SELECT * FROM master.dbo.babel_cross_db_vu_prepare_master_t1 ORDER BY id;
GO
~~START~~
int#!#int
1#!#10
~~END~~


SELECT * FROM master..babel_cross_db_vu_prepare_master_t1 ORDER BY id;
GO
~~START~~
int#!#int
1#!#10
~~END~~


EXEC master.dbo.babel_cross_db_vu_prepare_master_p1
GO
~~START~~
int
10
~~END~~


EXEC master.dbo.babel_cross_db_vu_prepare_master_p2
GO
~~START~~
int
1
~~END~~


-- tab1 resolves to master.babel_cross_db_vu_prepare_myschema.babel_cross_db_vu_prepare_tab1
EXEC master.babel_cross_db_vu_prepare_myschema.babel_cross_db_vu_prepare_proc1
GO
~~ROW COUNT: 1~~

~~START~~
int
1
~~END~~


-- tab1 resolves to master.dbo.babel_cross_db_vu_prepare_tab1
EXEC master.babel_cross_db_vu_prepare_myschema.babel_cross_db_vu_prepare_proc2
GO

SELECT * from master.dbo.babel_cross_db_vu_prepare_tab1;
GO
~~START~~
int#!#int
~~END~~


USE my_babel_cross_db_vu_prepare_db1
GO

-- runtime error
EXEC master.dbo.babel_cross_db_vu_prepare_master_p3
GO
~~ERROR (Code: 8134)~~

~~ERROR (Message: division by zero)~~


EXEC master..babel_cross_db_vu_prepare_master_p2
GO
~~START~~
int
1
~~END~~


UPDATE master.dbo.babel_cross_db_vu_prepare_master_t1
SET a = 11
WHERE id = 1;
GO
~~ROW COUNT: 1~~


SELECT * FROM master.dbo.babel_cross_db_vu_prepare_master_t1 ORDER BY id;
GO
~~START~~
int#!#int
1#!#11
~~END~~


DELETE FROM master.dbo.babel_cross_db_vu_prepare_master_t1
WHERE id = 1;
GO
~~ROW COUNT: 1~~


SELECT * FROM master.dbo.babel_cross_db_vu_prepare_master_t1 ORDER BY id;
GO
~~START~~
int#!#int
~~END~~


SELECT current_user;
GO
~~START~~
varchar
dbo
~~END~~


CREATE PROCEDURE my_babel_cross_db_vu_prepare_db1_p2
AS
INSERT INTO master.dbo.babel_cross_db_vu_prepare_master_t1 VALUES (10);
GO

EXEC my_babel_cross_db_vu_prepare_db1_p2;
GO
~~ROW COUNT: 1~~


EXEC my_babel_cross_db_vu_prepare_db1_p2;
GO
~~ROW COUNT: 1~~


EXEC my_babel_cross_db_vu_prepare_db1_p2;
GO
~~ROW COUNT: 1~~


INSERT INTO dbo.babel_cross_db_vu_prepare_db1_t1 (a)
SELECT (a) FROM master.dbo.babel_cross_db_vu_prepare_master_t1;
GO
~~ROW COUNT: 3~~


INSERT INTO dbo.babel_cross_db_vu_prepare_db1_t1 (a)
OUTPUT inserted.a INTO master.dbo.babel_cross_db_vu_prepare_master_t1 (a)
VALUES (30);
GO
~~ROW COUNT: 1~~


-- Expect an error
INSERT INTO dbo.babel_cross_db_vu_prepare_db1_t1 (a)
EXECUTE master.dbo.babel_cross_db_vu_prepare_master_p1;
GO
~~ROW COUNT: 4~~


EXECUTE master.dbo.babel_cross_db_vu_prepare_master_p1;
GO
~~START~~
int
10
10
10
30
~~END~~


SELECT current_user;
GO
~~START~~
varchar
dbo
~~END~~


INSERT INTO dbo.my_babel_cross_db_vu_prepare_db1_t2 VALUES (20);
GO
~~ROW COUNT: 1~~


INSERT INTO master.dbo.babel_cross_db_vu_prepare_master_t1 (a)
SELECT (a) FROM my_babel_cross_db_vu_prepare_db1_t2;
GO
~~ROW COUNT: 1~~


SELECT * FROM master.dbo.babel_cross_db_vu_prepare_master_t1 ORDER BY id;
GO
~~START~~
int#!#int
2#!#10
3#!#10
4#!#10
5#!#30
6#!#20
~~END~~


USE master
GO

CREATE LOGIN babel_cross_db_vu_prepare_johndoe WITH PASSWORD = '12345678';
GO

CREATE USER babel_cross_db_vu_prepare_master_janedoe FOR LOGIN babel_cross_db_vu_prepare_johndoe;
GO

USE my_babel_cross_db_vu_prepare_db1;
GO

CREATE USER babel_cross_db_vu_prepare_db1_janedoe FOR LOGIN babel_cross_db_vu_prepare_johndoe;
GO

-- tsql 	user=babel_cross_db_vu_prepare_johndoe 		password=12345678
USE master
GO

SELECT current_user;
GO
~~START~~
varchar
babel_cross_db_vu_prepare_master_janedoe
~~END~~


SELECT * FROM my_babel_cross_db_vu_prepare_db1.dbo.babel_cross_db_vu_prepare_db1_t1 ORDER BY a;
GO
~~ERROR (Code: 33557097)~~

~~ERROR (Message: permission denied for table babel_cross_db_vu_prepare_db1_t1)~~


USE my_babel_cross_db_vu_prepare_db1;
GO

SELECT current_user;
GO
~~START~~
varchar
babel_cross_db_vu_prepare_db1_janedoe
~~END~~


SELECT * FROM master.dbo.babel_cross_db_vu_prepare_master_t1 ORDER BY id;
GO
~~ERROR (Code: 33557097)~~

~~ERROR (Message: permission denied for table babel_cross_db_vu_prepare_master_t1)~~


-- tsql
USE master
GO

GRANT SELECT ON dbo.babel_cross_db_vu_prepare_master_t1 TO babel_cross_db_vu_prepare_master_janedoe;
GO

GRANT EXECUTE ON dbo.babel_cross_db_vu_prepare_master_p2 TO babel_cross_db_vu_prepare_master_janedoe;
GO

USE my_babel_cross_db_vu_prepare_db1;
GO

GRANT SELECT ON dbo.babel_cross_db_vu_prepare_db1_t1 TO babel_cross_db_vu_prepare_db1_janedoe;
GO

-- tsql 	user=babel_cross_db_vu_prepare_johndoe 		password=12345678
USE master
GO

USE my_babel_cross_db_vu_prepare_db1;
GO

EXEC master.dbo.babel_cross_db_vu_prepare_master_p2
GO
~~START~~
int
1
~~END~~


SELECT * FROM master.dbo.babel_cross_db_vu_prepare_master_t1 ORDER BY id;
GO
~~START~~
int#!#int
2#!#10
3#!#10
4#!#10
5#!#30
6#!#20
~~END~~


USE master;
GO

-- tsql
USE my_babel_cross_db_vu_prepare_db1
GO

REVOKE SELECT ON dbo.babel_cross_db_vu_prepare_db1_t1 FROM babel_cross_db_vu_prepare_db1_janedoe
GO

DROP USER babel_cross_db_vu_prepare_db1_janedoe
GO

USE master
GO

REVOKE SELECT ON dbo.babel_cross_db_vu_prepare_master_t1 FROM babel_cross_db_vu_prepare_master_janedoe
GO

REVOKE EXECUTE ON dbo.babel_cross_db_vu_prepare_master_p2 FROM babel_cross_db_vu_prepare_master_janedoe
GO

DROP USER babel_cross_db_vu_prepare_master_janedoe;
GO

-- psql

-- Need to terminate active session before cleaning up the login
SELECT pg_terminate_backend(pid) FROM pg_stat_get_activity(NULL)
WHERE sys.suser_name(usesysid) = 'babel_cross_db_vu_prepare_johndoe'
AND backend_type = 'client backend' AND usesysid IS NOT NULL;
GO
~~START~~
bool
t
~~END~~

-- Wait to sync with another session
SELECT pg_sleep(1);
GO
~~START~~
void

~~END~~


-- tsql
DROP LOGIN babel_cross_db_vu_prepare_johndoe;
GO

-- tsql
USE master
GO

INSERT INTO my_babel_cross_db_vu_prepare_db1.dbo.my_babel_cross_db_vu_prepare_db1_t3 (a) VALUES (10);
GO
~~ROW COUNT: 1~~


CREATE PROCEDURE babel_cross_db_vu_prepare_master_p4
AS
INSERT INTO my_babel_cross_db_vu_prepare_db1.dbo.my_babel_cross_db_vu_prepare_db1_t3 VALUES (1);
GO

EXEC babel_cross_db_vu_prepare_master_p4;
GO
~~ROW COUNT: 1~~


EXEC babel_cross_db_vu_prepare_master_p4;
GO
~~ROW COUNT: 1~~


INSERT INTO dbo.babel_cross_db_vu_prepare_master_t2 (b)
SELECT a FROM my_babel_cross_db_vu_prepare_db1.dbo.my_babel_cross_db_vu_prepare_db1_t3
WHERE id = 1;
GO
~~ROW COUNT: 1~~


SELECT * FROM dbo.babel_cross_db_vu_prepare_master_t2 ORDER BY b;
GO
~~START~~
int
10
~~END~~


EXEC my_babel_cross_db_vu_prepare_db1.dbo.my_babel_cross_db_vu_prepare_db1_p1;
GO
~~START~~
int
10
~~END~~


DROP PROCEDURE babel_cross_db_vu_prepare_master_p4
GO

USE my_babel_cross_db_vu_prepare_db1
GO

USE master;
GO

DROP TABLE babel_cross_db_vu_prepare_tab1;
GO

-- reset the login password
ALTER LOGIN babel_cross_db_vu_prepare_l1 with password = '12345678';
GO

ALTER LOGIN babel_cross_db_vu_prepare_l2 with password = '12345678';
GO

ALTER LOGIN babel_cross_db_vu_prepare_l3 with password = '12345678';
GO

-- tsql user=babel_cross_db_vu_prepare_l1 password=12345678
USE master;
GO

-- bare SELECT table/view from db1, which login babel_cross_db_vu_prepare_l1 has privilege, should be successful
SELECT * FROM my_babel_cross_db_vu_prepare_db1.babel_cross_db_vu_prepare_s2.babel_cross_db_vu_prepare_t2 ORDER BY id;
GO
~~START~~
int#!#varchar
1#!#abc
~~END~~


SELECT * FROM my_babel_cross_db_vu_prepare_db1.babel_cross_db_vu_prepare_s2.babel_cross_db_vu_prepare_v2;
GO
~~START~~
int#!#int#!#varchar
1#!#1#!#abc
~~END~~


-- bare SELECT function from db1, which login babel_cross_db_vu_prepare_l1 has privilege, should be successful
SELECT my_babel_cross_db_vu_prepare_db1.babel_cross_db_vu_prepare_s2.babel_cross_db_vu_prepare_f2(1);
GO
~~START~~
int
1
~~END~~


-- bare SELECT table from db1, which login babel_cross_db_vu_prepare_l1 does not have privilege, should throw error
SELECT * FROM my_babel_cross_db_vu_prepare_db1.dbo.babel_cross_db_vu_prepare_t2 ORDER BY id;
GO
~~ERROR (Code: 33557097)~~

~~ERROR (Message: permission denied for table babel_cross_db_vu_prepare_t2)~~


-- bare SELECT function from db1, which login babel_cross_db_vu_prepare_l1 does not have privilege, should throw error
SELECT my_babel_cross_db_vu_prepare_db1.dbo.babel_cross_db_vu_prepare_f2(1);
GO
~~ERROR (Code: 33557097)~~

~~ERROR (Message: permission denied for function babel_cross_db_vu_prepare_f2)~~


-- SELECT from a view in db1 which references objects in db1, which login babel_cross_db_vu_prepare_l1 has privilege, should be successful
SELECT * FROM babel_cross_db_vu_prepare_s1.babel_cross_db_vu_prepare_v1;
GO
~~START~~
int#!#int#!#varchar#!#varchar
1#!#1#!#def#!#abc
~~END~~


SELECT * FROM babel_cross_db_vu_prepare_s1.babel_cross_db_vu_prepare_v1_nested;
GO
~~START~~
int#!#int#!#varchar#!#varchar
1#!#1#!#def#!#abc
~~END~~


SELECT * FROM babel_cross_db_vu_prepare_s1.babel_cross_db_vu_prepare_v5_nested;
GO
~~START~~
int
1
~~END~~


-- SELECT from a view in db1 which references tables in db1, which login babel_cross_db_vu_prepare_l1 does not have privilege, should throw error
SELECT * FROM babel_cross_db_vu_prepare_s1.babel_cross_db_vu_prepare_v2;
GO
~~ERROR (Code: 33557097)~~

~~ERROR (Message: permission denied for table babel_cross_db_vu_prepare_t2)~~


SELECT * FROM babel_cross_db_vu_prepare_s1.babel_cross_db_vu_prepare_v2_nested;
GO
~~ERROR (Code: 33557097)~~

~~ERROR (Message: permission denied for table babel_cross_db_vu_prepare_t2)~~


-- SELECT from a view in db1 which references functions in db1, which login babel_cross_db_vu_prepare_l1 does not have privilege, should throw error
SELECT * FROM babel_cross_db_vu_prepare_s1.babel_cross_db_vu_prepare_v3;
GO
~~ERROR (Code: 33557097)~~

~~ERROR (Message: permission denied for function babel_cross_db_vu_prepare_f2)~~


SELECT * FROM babel_cross_db_vu_prepare_s1.babel_cross_db_vu_prepare_v3_nested;
GO
~~ERROR (Code: 33557097)~~

~~ERROR (Message: permission denied for function babel_cross_db_vu_prepare_f2)~~


-- View containing cross-db tables on which login babel_cross_db_vu_prepare_l1 does not have permission on either of joined tables, should throw error
SELECT * FROM babel_cross_db_vu_prepare_s1.babel_cross_db_vu_prepare_v4;
GO
~~ERROR (Code: 33557097)~~

~~ERROR (Message: permission denied for table babel_cross_db_vu_prepare_t2)~~


SELECT * FROM babel_cross_db_vu_prepare_s1.babel_cross_db_vu_prepare_v4_nested;
GO
~~ERROR (Code: 33557097)~~

~~ERROR (Message: permission denied for table babel_cross_db_vu_prepare_t2)~~


-- Execute procedure from db1
EXEC my_babel_cross_db_vu_prepare_db1.babel_cross_db_vu_prepare_s2.babel_cross_db_vu_prepare_p2;
GO
~~START~~
int#!#varchar
1#!#abc
~~END~~

~~START~~
int#!#int#!#varchar
1#!#1#!#abc
~~END~~


-- Execute procedure in db1 which accesses cross database objects
EXEC babel_cross_db_vu_prepare_s1.babel_cross_db_vu_prepare_p1;
GO
~~START~~
int#!#varchar
1#!#def
~~END~~

~~START~~
int#!#varchar
1#!#abc
~~END~~

~~START~~
int#!#int#!#varchar#!#varchar
1#!#1#!#def#!#abc
~~END~~

~~ERROR (Code: 33557097)~~

~~ERROR (Message: permission denied for table babel_cross_db_vu_prepare_t2)~~


EXEC babel_cross_db_vu_prepare_s1.babel_cross_db_vu_prepare_p1_nested;
GO
~~START~~
int#!#varchar
1#!#def
~~END~~

~~START~~
int#!#varchar
1#!#abc
~~END~~

~~START~~
int#!#int#!#varchar#!#varchar
1#!#1#!#def#!#abc
~~END~~

~~ERROR (Code: 33557097)~~

~~ERROR (Message: permission denied for table babel_cross_db_vu_prepare_t2)~~


-- call procedure babel_cross_db_vu_prepare_p1 from a db1
USE my_babel_cross_db_vu_prepare_db1
GO

EXEC master.babel_cross_db_vu_prepare_s1.babel_cross_db_vu_prepare_p1;
GO
~~START~~
int#!#varchar
1#!#def
~~END~~

~~START~~
int#!#varchar
1#!#abc
~~END~~

~~START~~
int#!#int#!#varchar#!#varchar
1#!#1#!#def#!#abc
~~END~~

~~ERROR (Code: 33557097)~~

~~ERROR (Message: permission denied for table babel_cross_db_vu_prepare_t2)~~


-- call procedure babel_cross_db_vu_prepare_p1_nested from a db1
USE my_babel_cross_db_vu_prepare_db1
GO

EXEC master.babel_cross_db_vu_prepare_s1.babel_cross_db_vu_prepare_p1_nested;
GO
~~START~~
int#!#varchar
1#!#def
~~END~~

~~START~~
int#!#varchar
1#!#abc
~~END~~

~~START~~
int#!#int#!#varchar#!#varchar
1#!#1#!#def#!#abc
~~END~~

~~ERROR (Code: 33557097)~~

~~ERROR (Message: permission denied for table babel_cross_db_vu_prepare_t2)~~


-- SELECT from a plpgsql which accesses cross-db table should be successful
USE master
GO

SELECT dbo.babel_cross_db_vu_prepare_pg_func();
GO
~~START~~
int
1
~~END~~


-- tsql
USE my_babel_cross_db_vu_prepare_db1
GO

SELECT * FROM master.dbo.babel_cross_db_vu_prepare_v1 ORDER BY id;
GO
~~START~~
int
1
2
3
4
5
6
~~END~~


create user user_cannot_connect for login babel_cross_db_vu_prepare_l2;
go

revoke connect from user_cannot_connect;
go

GRANT CONNECT TO guest;
GO

grant select on babel_cross_db_vu_prepare_db1_t1 to guest;
go

-- tsql user=babel_cross_db_vu_prepare_l2 password=12345678
USE my_babel_cross_db_vu_prepare_db1
GO

select current_user
go
~~START~~
varchar
user_cannot_connect
~~END~~


select has_dbaccess('my_babel_cross_db_vu_prepare_db1');
go
~~START~~
int
1
~~END~~


select * from dbo.babel_cross_db_vu_prepare_db1_t1; -- should not use guest privilege
go
~~ERROR (Code: 33557097)~~

~~ERROR (Message: permission denied for table babel_cross_db_vu_prepare_db1_t1)~~


USE master
GO

-- tsql
USE my_babel_cross_db_vu_prepare_db1
GO

revoke select on babel_cross_db_vu_prepare_db1_t1 from guest;
go

drop user user_cannot_connect;
go

-- tsql user=babel_cross_db_vu_prepare_l2 password=12345678
-- cross-db tests for guest user
USE master
GO

-- expect error since guest user does not have permission on babel_cross_db_vu_prepare_v1
SELECT * FROM dbo.babel_cross_db_vu_prepare_v1 ORDER BY id;
GO
~~ERROR (Code: 33557097)~~

~~ERROR (Message: permission denied for view babel_cross_db_vu_prepare_v1)~~


-- tsql
-- now grant the SELECT privilege to guest
USE master
GO

GRANT SELECT ON dbo.babel_cross_db_vu_prepare_v1 TO guest;
GO

-- tsql user=babel_cross_db_vu_prepare_l2 password=12345678
USE master
GO

SELECT * FROM dbo.babel_cross_db_vu_prepare_v1 ORDER BY id;
GO
~~START~~
int
1
2
3
4
5
6
~~END~~


-- tsql user=babel_cross_db_vu_prepare_l3 password=12345678
USE master
GO

-- login babel_cross_db_vu_prepare_l3 has mapped user in master
-- database so following SELECT should fail.
SELECT * FROM babel_cross_db_vu_prepare_t4;
GO
~~ERROR (Code: 33557097)~~

~~ERROR (Message: permission denied for table babel_cross_db_vu_prepare_t4)~~


-- tsql
-- now moreve mapped user from login babel_cross_db_vu_prepare_l3 in master database
DROP USER babel_cross_db_vu_prepare_u3;
GO

-- now that login babel_cross_db_vu_prepare_l3 does not have a mapped user in master
-- database so following SELECT should succeed as guest was granted SELECT privilege.
SELECT * FROM babel_cross_db_vu_prepare_t4;
GO
~~START~~
int
~~END~~


-- tsql
-- Cross-db testcases for statements in batch/block
USE master;
GO

-- Batches having system objects
BEGIN; SELECT DISTINCT 1 FROM my_babel_cross_db_vu_prepare_db1.dbo.sysdatabases; BEGIN; SELECT DISTINCT 1 FROM babel_cross_db_vu_prepare_master_t1; END; END;
GO
~~START~~
int
1
~~END~~

~~START~~
int
1
~~END~~


BEGIN; SELECT DISTINCT 1 FROM babel_cross_db_vu_prepare_master_t1; BEGIN SELECT DISTINCT 1 FROM my_babel_cross_db_vu_prepare_db1.dbo.sysdatabases; END; END;
GO
~~START~~
int
1
~~END~~

~~START~~
int
1
~~END~~


BEGIN; SELECT DISTINCT 1 FROM my_babel_cross_db_vu_prepare_db1.dbo.sysdatabases; END; BEGIN; SELECT DISTINCT 1 FROM babel_cross_db_vu_prepare_master_t1; END;
GO
~~START~~
int
1
~~END~~

~~START~~
int
1
~~END~~


BEGIN; SELECT DISTINCT 1 FROM babel_cross_db_vu_prepare_master_t1; END; BEGIN SELECT DISTINCT 1 FROM my_babel_cross_db_vu_prepare_db1.dbo.sysdatabases; END;
GO
~~START~~
int
1
~~END~~

~~START~~
int
1
~~END~~


SELECT DISTINCT 1 FROM babel_cross_db_vu_prepare_master_t1;
SELECT DISTINCT 1 FROM my_babel_cross_db_vu_prepare_db1.dbo.sysdatabases;
GO
~~START~~
int
1
~~END~~

~~START~~
int
1
~~END~~


SELECT DISTINCT 1 FROM my_babel_cross_db_vu_prepare_db1.dbo.sysdatabases;
SELECT DISTINCT 1 FROM babel_cross_db_vu_prepare_master_t1;
GO
~~START~~
int
1
~~END~~

~~START~~
int
1
~~END~~


SELECT DISTINCT 1 FROM babel_cross_db_vu_prepare_master_t1;
SELECT DISTINCT 1 FROM my_babel_cross_db_vu_prepare_db1.dbo.sysdatabases;
SELECT DISTINCT 1 FROM babel_cross_db_vu_prepare_master_t1;
GO
~~START~~
int
1
~~END~~

~~START~~
int
1
~~END~~

~~START~~
int
1
~~END~~


SELECT DISTINCT 1 FROM my_babel_cross_db_vu_prepare_db1.dbo.sysdatabases;
SELECT DISTINCT 1 FROM babel_cross_db_vu_prepare_master_t1;
SELECT DISTINCT 1 FROM my_babel_cross_db_vu_prepare_db1.dbo.sysdatabases;
GO
~~START~~
int
1
~~END~~

~~START~~
int
1
~~END~~

~~START~~
int
1
~~END~~


-- batch inside transaction
BEGIN TRAN;
GO

SELECT DISTINCT 1 FROM my_babel_cross_db_vu_prepare_db1.dbo.sysdatabases;
SELECT DISTINCT 1 FROM babel_cross_db_vu_prepare_master_t1;
SELECT DISTINCT 1 FROM my_babel_cross_db_vu_prepare_db1.dbo.sysdatabases;
GO
~~START~~
int
1
~~END~~

~~START~~
int
1
~~END~~

~~START~~
int
1
~~END~~


COMMIT;
GO

-- system objects refferred via sys schema
-- for sys.databases
BEGIN; SELECT DISTINCT 1 FROM my_babel_cross_db_vu_prepare_db1.sys.databases; BEGIN; SELECT DISTINCT 1 FROM babel_cross_db_vu_prepare_master_t1; END; END;
GO
~~START~~
int
1
~~END~~

~~START~~
int
1
~~END~~


BEGIN; SELECT DISTINCT 1 FROM babel_cross_db_vu_prepare_master_t1; BEGIN SELECT DISTINCT 1 FROM my_babel_cross_db_vu_prepare_db1.sys.databases; END; END;
GO
~~START~~
int
1
~~END~~

~~START~~
int
1
~~END~~


BEGIN; SELECT DISTINCT 1 FROM my_babel_cross_db_vu_prepare_db1.sys.databases; END; BEGIN; SELECT DISTINCT 1 FROM babel_cross_db_vu_prepare_master_t1; END;
GO
~~START~~
int
1
~~END~~

~~START~~
int
1
~~END~~


BEGIN; SELECT DISTINCT 1 FROM babel_cross_db_vu_prepare_master_t1; END; BEGIN SELECT DISTINCT 1 FROM my_babel_cross_db_vu_prepare_db1.sys.databases; END;
GO
~~START~~
int
1
~~END~~

~~START~~
int
1
~~END~~


SELECT DISTINCT 1 FROM babel_cross_db_vu_prepare_master_t1;
SELECT DISTINCT 1 FROM my_babel_cross_db_vu_prepare_db1.sys.databases;
GO
~~START~~
int
1
~~END~~

~~START~~
int
1
~~END~~


SELECT DISTINCT 1 FROM my_babel_cross_db_vu_prepare_db1.sys.databases;
SELECT DISTINCT 1 FROM babel_cross_db_vu_prepare_master_t1;
GO
~~START~~
int
1
~~END~~

~~START~~
int
1
~~END~~


SELECT DISTINCT 1 FROM babel_cross_db_vu_prepare_master_t1;
SELECT DISTINCT 1 FROM my_babel_cross_db_vu_prepare_db1.sys.databases;
SELECT DISTINCT 1 FROM babel_cross_db_vu_prepare_master_t1;
GO
~~START~~
int
1
~~END~~

~~START~~
int
1
~~END~~

~~START~~
int
1
~~END~~


SELECT DISTINCT 1 FROM my_babel_cross_db_vu_prepare_db1.sys.databases;
SELECT DISTINCT 1 FROM babel_cross_db_vu_prepare_master_t1;
SELECT DISTINCT 1 FROM my_babel_cross_db_vu_prepare_db1.sys.databases;
GO
~~START~~
int
1
~~END~~

~~START~~
int
1
~~END~~

~~START~~
int
1
~~END~~


-- for sys.sysdatabases
BEGIN; SELECT DISTINCT 1 FROM my_babel_cross_db_vu_prepare_db1.sys.sysdatabases; BEGIN; SELECT DISTINCT 1 FROM babel_cross_db_vu_prepare_master_t1; END; END;
GO
~~START~~
int
1
~~END~~

~~START~~
int
1
~~END~~


BEGIN; SELECT DISTINCT 1 FROM babel_cross_db_vu_prepare_master_t1; BEGIN SELECT DISTINCT 1 FROM my_babel_cross_db_vu_prepare_db1.sys.sysdatabases; END; END;
GO
~~START~~
int
1
~~END~~

~~START~~
int
1
~~END~~


BEGIN; SELECT DISTINCT 1 FROM my_babel_cross_db_vu_prepare_db1.sys.sysdatabases; END; BEGIN; SELECT DISTINCT 1 FROM babel_cross_db_vu_prepare_master_t1; END;
GO
~~START~~
int
1
~~END~~

~~START~~
int
1
~~END~~


BEGIN; SELECT DISTINCT 1 FROM babel_cross_db_vu_prepare_master_t1; END; BEGIN SELECT DISTINCT 1 FROM my_babel_cross_db_vu_prepare_db1.sys.sysdatabases; END;
GO
~~START~~
int
1
~~END~~

~~START~~
int
1
~~END~~


SELECT DISTINCT 1 FROM babel_cross_db_vu_prepare_master_t1;
SELECT DISTINCT 1 FROM my_babel_cross_db_vu_prepare_db1.sys.sysdatabases;
GO
~~START~~
int
1
~~END~~

~~START~~
int
1
~~END~~


SELECT DISTINCT 1 FROM my_babel_cross_db_vu_prepare_db1.sys.sysdatabases;
SELECT DISTINCT 1 FROM babel_cross_db_vu_prepare_master_t1;
GO
~~START~~
int
1
~~END~~

~~START~~
int
1
~~END~~


SELECT DISTINCT 1 FROM babel_cross_db_vu_prepare_master_t1;
SELECT DISTINCT 1 FROM my_babel_cross_db_vu_prepare_db1.sys.sysdatabases;
SELECT DISTINCT 1 FROM babel_cross_db_vu_prepare_master_t1;
GO
~~START~~
int
1
~~END~~

~~START~~
int
1
~~END~~

~~START~~
int
1
~~END~~


SELECT DISTINCT 1 FROM my_babel_cross_db_vu_prepare_db1.sys.sysdatabases;
SELECT DISTINCT 1 FROM babel_cross_db_vu_prepare_master_t1;
SELECT DISTINCT 1 FROM my_babel_cross_db_vu_prepare_db1.sys.sysdatabases;
GO
~~START~~
int
1
~~END~~

~~START~~
int
1
~~END~~

~~START~~
int
1
~~END~~


-- Batches having user created objects
BEGIN; SELECT DISTINCT 1 FROM my_babel_cross_db_vu_prepare_db1.dbo.babel_cross_db_vu_prepare_db1_t1; BEGIN; SELECT DISTINCT 1 FROM babel_cross_db_vu_prepare_master_t1; END; END;
GO
~~START~~
int
1
~~END~~

~~START~~
int
1
~~END~~


BEGIN; SELECT DISTINCT 1 FROM babel_cross_db_vu_prepare_master_t1; BEGIN SELECT DISTINCT 1 FROM my_babel_cross_db_vu_prepare_db1.dbo.babel_cross_db_vu_prepare_db1_t1; END; END;
GO
~~START~~
int
1
~~END~~

~~START~~
int
1
~~END~~


BEGIN; SELECT DISTINCT 1 FROM my_babel_cross_db_vu_prepare_db1.dbo.babel_cross_db_vu_prepare_db1_t1; END; BEGIN; SELECT DISTINCT 1 FROM babel_cross_db_vu_prepare_master_t1; END;
GO
~~START~~
int
1
~~END~~

~~START~~
int
1
~~END~~


BEGIN; SELECT DISTINCT 1 FROM babel_cross_db_vu_prepare_master_t1; END; BEGIN SELECT DISTINCT 1 FROM my_babel_cross_db_vu_prepare_db1.dbo.babel_cross_db_vu_prepare_db1_t1; END;
GO
~~START~~
int
1
~~END~~

~~START~~
int
1
~~END~~


SELECT DISTINCT 1 FROM babel_cross_db_vu_prepare_master_t1;
SELECT DISTINCT 1 FROM my_babel_cross_db_vu_prepare_db1.dbo.babel_cross_db_vu_prepare_db1_t1;
GO
~~START~~
int
1
~~END~~

~~START~~
int
1
~~END~~


SELECT DISTINCT 1 FROM my_babel_cross_db_vu_prepare_db1.dbo.babel_cross_db_vu_prepare_db1_t1;
SELECT DISTINCT 1 FROM babel_cross_db_vu_prepare_master_t1;
GO
~~START~~
int
1
~~END~~

~~START~~
int
1
~~END~~


SELECT DISTINCT 1 FROM babel_cross_db_vu_prepare_master_t1;
SELECT DISTINCT 1 FROM my_babel_cross_db_vu_prepare_db1.dbo.babel_cross_db_vu_prepare_db1_t1;
SELECT DISTINCT 1 FROM babel_cross_db_vu_prepare_master_t1;
GO
~~START~~
int
1
~~END~~

~~START~~
int
1
~~END~~

~~START~~
int
1
~~END~~


SELECT DISTINCT 1 FROM my_babel_cross_db_vu_prepare_db1.dbo.babel_cross_db_vu_prepare_db1_t1;
SELECT DISTINCT 1 FROM babel_cross_db_vu_prepare_master_t1;
SELECT DISTINCT 1 FROM my_babel_cross_db_vu_prepare_db1.dbo.babel_cross_db_vu_prepare_db1_t1;
GO
~~START~~
int
1
~~END~~

~~START~~
int
1
~~END~~

~~START~~
int
1
~~END~~


-- Batches having different types of DMLs
BEGIN; INSERT INTO my_babel_cross_db_vu_prepare_db1.dbo.babel_cross_db_vu_prepare_db1_t1 VALUES (1); BEGIN; SELECT DISTINCT 1 FROM babel_cross_db_vu_prepare_master_t1; END; END;
GO
~~ROW COUNT: 1~~

~~START~~
int
1
~~END~~


BEGIN; SELECT DISTINCT 1 FROM babel_cross_db_vu_prepare_master_t1; BEGIN; INSERT INTO my_babel_cross_db_vu_prepare_db1.dbo.babel_cross_db_vu_prepare_db1_t1 VALUES (1); END; END;
GO
~~START~~
int
1
~~END~~

~~ROW COUNT: 1~~


BEGIN; UPDATE my_babel_cross_db_vu_prepare_db1.dbo.babel_cross_db_vu_prepare_db1_t1 SET a = 2; BEGIN; SELECT DISTINCT 1 FROM babel_cross_db_vu_prepare_master_t1; END; END;
GO
~~ROW COUNT: 10~~

~~START~~
int
1
~~END~~


BEGIN; SELECT DISTINCT 1 FROM babel_cross_db_vu_prepare_master_t1; BEGIN; UPDATE my_babel_cross_db_vu_prepare_db1.dbo.babel_cross_db_vu_prepare_db1_t1 SET a = 2; END; END;
GO
~~START~~
int
1
~~END~~

~~ROW COUNT: 10~~


BEGIN; DELETE FROM my_babel_cross_db_vu_prepare_db1.dbo.babel_cross_db_vu_prepare_db1_t1 WHERE a = 2; BEGIN; SELECT DISTINCT 1 FROM babel_cross_db_vu_prepare_master_t1; END; END;
GO
~~ROW COUNT: 10~~

~~START~~
int
1
~~END~~


BEGIN; SELECT DISTINCT 1 FROM babel_cross_db_vu_prepare_master_t1; BEGIN; DELETE FROM my_babel_cross_db_vu_prepare_db1.dbo.babel_cross_db_vu_prepare_db1_t1 WHERE a = 2; END; END;
GO
~~START~~
int
1
~~END~~


-- Batches with subqueries
SELECT DISTINCT (SELECT DISTINCT 1 FROM my_babel_cross_db_vu_prepare_db1.dbo.babel_cross_db_vu_prepare_db1_t1 t2 WHERE t2.a = t1.a) FROM babel_cross_db_vu_prepare_master_t1 t1;
SELECT DISTINCT 1 FROM babel_cross_db_vu_prepare_master_t1;
GO
~~START~~
int
<NULL>
~~END~~

~~START~~
int
1
~~END~~


SELECT DISTINCT 1 FROM babel_cross_db_vu_prepare_master_t1;
SELECT DISTINCT (SELECT DISTINCT 1 FROM my_babel_cross_db_vu_prepare_db1.dbo.babel_cross_db_vu_prepare_db1_t1 t2 WHERE t2.a = t1.a) FROM babel_cross_db_vu_prepare_master_t1 t1;
GO
~~START~~
int
1
~~END~~

~~START~~
int
<NULL>
~~END~~


-- Batches with DDL and DML combination
BEGIN; SELECT DISTINCT 1 FROM my_babel_cross_db_vu_prepare_db1.dbo.sysdatabases; BEGIN CREATE TABLE babel_cross_db_vu_verify_tempt(a int); SELECT DISTINCT 1 FROM babel_cross_db_vu_verify_tempt; END; END;
GO
~~START~~
int
1
~~END~~

~~START~~
int
~~END~~


DROP TABLE babel_cross_db_vu_verify_tempt;
GO

BEGIN; CREATE TABLE babel_cross_db_vu_verify_tempt(a int); SELECT DISTINCT 1 FROM babel_cross_db_vu_verify_tempt; BEGIN; SELECT DISTINCT 1 FROM my_babel_cross_db_vu_prepare_db1.dbo.sysdatabases; END; END;
GO
~~START~~
int
~~END~~

~~START~~
int
1
~~END~~


DROP TABLE babel_cross_db_vu_verify_tempt;
GO

-- temp table creation
BEGIN; SELECT DISTINCT 1 FROM my_babel_cross_db_vu_prepare_db1.dbo.sysdatabases; BEGIN CREATE TABLE #babel_cross_db_vu_verify_tempt(a int); SELECT DISTINCT 1 FROM #babel_cross_db_vu_verify_tempt; END; END;
GO
~~START~~
int
1
~~END~~

~~START~~
int
~~END~~


SELECT DISTINCT 1 FROM #babel_cross_db_vu_verify_tempt;
GO
~~START~~
int
~~END~~


DROP TABLE #babel_cross_db_vu_verify_tempt;
GO

-- [TESTCASE GROUP START] Batches with proc execution and DMLs
USE master;
GO

EXEC babel_cross_db_vu_prepare_master_p1
SELECT * FROM my_babel_cross_db_vu_prepare_db1.dbo.babel_cross_db_vu_prepare_db1_t1 ORDER BY a;
GO
~~START~~
int
10
10
10
30
20
~~END~~

~~START~~
int
~~END~~


EXEC my_babel_cross_db_vu_prepare_db1.dbo.my_babel_cross_db_vu_prepare_db1_p1
SELECT * FROM babel_cross_db_vu_prepare_master_t1 ORDER BY id, a
GO
~~START~~
int
10
~~END~~

~~START~~
int#!#int
2#!#10
3#!#10
4#!#10
5#!#30
6#!#20
~~END~~


USE my_babel_cross_db_vu_prepare_db1;
GO

EXEC my_babel_cross_db_vu_prepare_db1_p1
SELECT * FROM master.dbo.babel_cross_db_vu_prepare_master_t1 ORDER BY id, a
GO
~~START~~
int
10
~~END~~

~~START~~
int#!#int
2#!#10
3#!#10
4#!#10
5#!#30
6#!#20
~~END~~


EXEC master.dbo.babel_cross_db_vu_prepare_master_p1
SELECT * FROM my_babel_cross_db_vu_prepare_db1.dbo.babel_cross_db_vu_prepare_db1_t1 ORDER BY a;
GO
~~START~~
int
10
10
10
30
20
~~END~~

~~START~~
int
~~END~~



-- [TESTCASE GROUP END] Batches with proc execution and DMLs
-- [TESTCASE GROUP START] Cross-db SELECT INTO
-- TODO: related to BABEL-4934 - Cross-db SELECT INTO statement is not currently supported correctly
USE master;
GO

-- New table gets created in my_babel_cross_db_vu_prepare_db1.dbo schema
SELECT 1 INTO new_table1 FROM my_babel_cross_db_vu_prepare_db1.sys.sysdatabases;
GO

SELECT * FROM new_table1;
GO
~~ERROR (Code: 33557097)~~

~~ERROR (Message: relation "new_table1" does not exist)~~


USE my_babel_cross_db_vu_prepare_db1;
GO

DROP TABLE new_table1;
GO

USE master;
GO

SELECT 1 INTO new_table2 FROM my_babel_cross_db_vu_prepare_db1.dbo.babel_cross_db_vu_prepare_db1_t1;
GO

SELECT * FROM new_table2;
GO
~~START~~
int
~~END~~


DROP TABLE new_table2;
GO


-- [TESTCASE GROUP END] Cross-db SELECT INTO
-- [TESTCASE GROUP START] INSERT/UPDATE/SELECT INTO statements
-- Prepare: Populate some rows in test tables
-- CAUTION: Here we are dropping all the rows and then again inserting some rows for ease of validation
USE master;
GO

DELETE FROM dbo.babel_cross_db_vu_prepare_master_t1;
GO
~~ROW COUNT: 5~~


DELETE FROM dbo.babel_cross_db_vu_prepare_master_t2;
GO
~~ROW COUNT: 1~~


DELETE FROM babel_cross_db_vu_prepare_s1.babel_cross_db_vu_prepare_t1;
GO
~~ROW COUNT: 1~~


USE my_babel_cross_db_vu_prepare_db1;
GO

DELETE FROM dbo.babel_cross_db_vu_prepare_db1_t1;
GO

DELETE FROM dbo.my_babel_cross_db_vu_prepare_db1_t2;
GO
~~ROW COUNT: 1~~


DELETE FROM babel_cross_db_vu_prepare_s2.babel_cross_db_vu_prepare_t2;
GO
~~ROW COUNT: 1~~


USE master;
GO

INSERT INTO dbo.babel_cross_db_vu_prepare_master_t1 (a) VALUES (1), (2), (3), (5);
GO
~~ROW COUNT: 4~~


INSERT INTO dbo.babel_cross_db_vu_prepare_master_t2 (b) VALUES (10), (20), (30), (50);
GO
~~ROW COUNT: 4~~


INSERT INTO babel_cross_db_vu_prepare_s1.babel_cross_db_vu_prepare_t1 (name) VALUES ('Alice'), ('Bob'), ('Charlie'), ('Same');
GO
~~ROW COUNT: 4~~


USE my_babel_cross_db_vu_prepare_db1;
GO

INSERT INTO dbo.babel_cross_db_vu_prepare_db1_t1 (a) VALUES (5), (7), (8), (9);
GO
~~ROW COUNT: 4~~


INSERT INTO dbo.my_babel_cross_db_vu_prepare_db1_t2 (a) VALUES (50), (70), (80), (90);
GO
~~ROW COUNT: 4~~


INSERT INTO babel_cross_db_vu_prepare_s2.babel_cross_db_vu_prepare_t2 (name) VALUES ('David'), ('Eva'), ('Frank'), ('Same');
GO
~~ROW COUNT: 4~~


USE master;
GO

-- INSERT INTO - Insert data from master database table into my_babel_cross_db_vu_prepare_db1 database table
BEGIN TRAN;
GO

INSERT INTO my_babel_cross_db_vu_prepare_db1.dbo.babel_cross_db_vu_prepare_db1_t1 (a)
SELECT a 
FROM master.dbo.babel_cross_db_vu_prepare_master_t1;
GO
~~ROW COUNT: 4~~


SELECT * FROM my_babel_cross_db_vu_prepare_db1.dbo.babel_cross_db_vu_prepare_db1_t1 ORDER BY a;
GO
~~START~~
int
1
2
3
5
5
7
8
9
~~END~~


ROLLBACK;
GO

-- UPDATE - Update data in my_babel_cross_db_vu_prepare_db1 database table based on data from master database table
BEGIN TRAN;
GO

UPDATE my_babel_cross_db_vu_prepare_db1.dbo.babel_cross_db_vu_prepare_db1_t1
SET a = m.a * 2
FROM master.dbo.babel_cross_db_vu_prepare_master_t1 m
WHERE my_babel_cross_db_vu_prepare_db1.dbo.babel_cross_db_vu_prepare_db1_t1.a = m.a;
GO
~~ROW COUNT: 1~~


SELECT * FROM my_babel_cross_db_vu_prepare_db1.dbo.babel_cross_db_vu_prepare_db1_t1 ORDER BY a;
GO
~~START~~
int
7
8
9
10
~~END~~


ROLLBACK;
GO

-- CROSSDB INSERT WITH JOIN - Insert data into my_babel_cross_db_vu_prepare_db1 table using data from both databases
USE my_babel_cross_db_vu_prepare_db1;
GO

BEGIN TRAN;
GO

INSERT INTO dbo.my_babel_cross_db_vu_prepare_db1_t2 (a)
SELECT t1.a
FROM master.dbo.babel_cross_db_vu_prepare_master_t1 t1
JOIN dbo.babel_cross_db_vu_prepare_db1_t1 t2 ON t1.a = t2.a;
GO
~~ROW COUNT: 1~~


SELECT * FROM dbo.my_babel_cross_db_vu_prepare_db1_t2 ORDER BY a;
GO
~~START~~
int
5
50
70
80
90
~~END~~


ROLLBACK;
GO

-- CROSSDB UPDATE USING SUBQUERY - Update data in master database table using a subquery from my_babel_cross_db_vu_prepare_db1 database
USE master;
GO

BEGIN TRAN;
GO

UPDATE dbo.babel_cross_db_vu_prepare_master_t2
SET b = (SELECT MAX(a) FROM my_babel_cross_db_vu_prepare_db1.dbo.babel_cross_db_vu_prepare_db1_t1)
WHERE b IS NULL;
GO

ROLLBACK;
GO

-- CROSSDB INSERT INTO TABLE IN CUSTOM SCHEMA - Insert data from master database into a table in a custom schema in my_babel_cross_db_vu_prepare_db1 database
BEGIN TRAN;
GO

INSERT INTO my_babel_cross_db_vu_prepare_db1.babel_cross_db_vu_prepare_s2.babel_cross_db_vu_prepare_t2 (name)
SELECT name
FROM babel_cross_db_vu_prepare_s1.babel_cross_db_vu_prepare_t1;
GO
~~ROW COUNT: 4~~


ROLLBACK;
GO

-- CROSSDB UPDATE USING VIEW - Update data in my_babel_cross_db_vu_prepare_db1 database using a view from master database
BEGIN TRAN;
GO

UPDATE t
SET t.name = v.t1_name
FROM my_babel_cross_db_vu_prepare_db1.babel_cross_db_vu_prepare_s2.babel_cross_db_vu_prepare_t2 t
JOIN babel_cross_db_vu_prepare_s1.babel_cross_db_vu_prepare_v1 v ON t.id = v.id;
GO
~~ROW COUNT: 4~~


ROLLBACK;
GO

-- cleanup populated data
USE master;
GO

DELETE FROM dbo.babel_cross_db_vu_prepare_master_t1;
GO
~~ROW COUNT: 4~~


DELETE FROM dbo.babel_cross_db_vu_prepare_master_t2;
GO
~~ROW COUNT: 4~~


DELETE FROM babel_cross_db_vu_prepare_s1.babel_cross_db_vu_prepare_t1;
GO
~~ROW COUNT: 4~~


USE my_babel_cross_db_vu_prepare_db1;
GO

DELETE FROM dbo.babel_cross_db_vu_prepare_db1_t1;
GO
~~ROW COUNT: 4~~


DELETE FROM dbo.my_babel_cross_db_vu_prepare_db1_t2;
GO
~~ROW COUNT: 4~~


DELETE FROM babel_cross_db_vu_prepare_s2.babel_cross_db_vu_prepare_t2;
GO
~~ROW COUNT: 4~~



-- tsql
-- [TESTCASE GROUP END] INSERT/UPDATE/SELECT INTO statements
-- [TESTCASE GROUP START] Batches for testing default_database and default_schema setting
USE master;
GO

CREATE LOGIN babel_cross_db_vu_verify_lgn1 WITH PASSWORD = '12345678';
GO

CREATE USER babel_cross_db_vu_verify_master_user_with_def_sch FOR login babel_cross_db_vu_verify_lgn1 WITH default_schema = babel_cross_db_vu_prepare_s1;
GO

GRANT SELECT ON babel_cross_db_vu_prepare_s1.babel_cross_db_vu_prepare_t1 TO babel_cross_db_vu_verify_master_user_with_def_sch;
GO

USE my_babel_cross_db_vu_prepare_db1;
GO

CREATE USER babel_cross_db_vu_verify_db1_user_with_def_sch FOR LOGIN babel_cross_db_vu_verify_lgn1 WITH default_schema = babel_cross_db_vu_prepare_s2;
GO

GRANT SELECT ON babel_cross_db_vu_prepare_s2.babel_cross_db_vu_prepare_t2 TO babel_cross_db_vu_verify_db1_user_with_def_sch;
GO

-- tsql user=babel_cross_db_vu_verify_lgn1 password=12345678
USE master;
GO

-- TODO: Fix BABEL-5050
SELECT * FROM babel_cross_db_vu_prepare_t1; SELECT * FROM my_babel_cross_db_vu_prepare_db1..babel_cross_db_vu_prepare_t2;
GO
~~START~~
int#!#varchar
~~END~~

~~ERROR (Code: 33557097)~~

~~ERROR (Message: permission denied for table babel_cross_db_vu_prepare_t2)~~


SELECT * FROM babel_cross_db_vu_prepare_t1; SELECT * FROM my_babel_cross_db_vu_prepare_db1.babel_cross_db_vu_prepare_s2.babel_cross_db_vu_prepare_t2;
GO
~~START~~
int#!#varchar
~~END~~

~~START~~
int#!#varchar
~~END~~


USE my_babel_cross_db_vu_prepare_db1;
GO

-- TODO: Fix BABEL-5050
SELECT * FROM babel_cross_db_vu_prepare_t2; SELECT * FROM master..babel_cross_db_vu_prepare_t1;
GO
~~START~~
int#!#varchar
~~END~~

~~ERROR (Code: 33557097)~~

~~ERROR (Message: relation "master_dbo.babel_cross_db_vu_prepare_t1" does not exist)~~


SELECT * FROM babel_cross_db_vu_prepare_t2; SELECT * FROM master.babel_cross_db_vu_prepare_s1.babel_cross_db_vu_prepare_t1;
GO
~~START~~
int#!#varchar
~~END~~

~~START~~
int#!#varchar
~~END~~


-- terminate-tsql-conn user=babel_cross_db_vu_verify_lgn1 password=12345678

-- tsql
-- cleanup for "Batches for testing default_database and default_schema setting"
USE my_babel_cross_db_vu_prepare_db1;
GO

REVOKE SELECT ON babel_cross_db_vu_prepare_s2.babel_cross_db_vu_prepare_t2 FROM babel_cross_db_vu_verify_db1_user_with_def_sch;
GO

DROP USER babel_cross_db_vu_verify_db1_user_with_def_sch;
GO

USE master;
GO

REVOKE SELECT ON babel_cross_db_vu_prepare_s1.babel_cross_db_vu_prepare_t1 FROM babel_cross_db_vu_verify_master_user_with_def_sch;
GO

DROP USER babel_cross_db_vu_verify_master_user_with_def_sch;
GO

DROP LOGIN babel_cross_db_vu_verify_lgn1;
GO


-- tsql
-- [TESTCASE GROUP END] Batches for testing default_database and default_schema setting
USE master
GO

USE my_babel_cross_db_vu_prepare_db1;
GO

EXECUTE dbo.babel_5448_p03;
GO
~~START~~
varchar
This is correct datbase dbname = master
~~END~~

~~START~~
varchar
This is correct datbase dbname = master
~~END~~

~~START~~
varchar
This is correct datbase dbname = master
~~END~~

~~START~~
varchar
This is correct datbase dbname = master
~~END~~


SELECT db_name()
GO
~~START~~
nvarchar
my_babel_cross_db_vu_prepare_db1
~~END~~

EXECUTE dbo.sp_test_babel_5448_3;
GO
~~START~~
nvarchar
This is correct: master.dbo.sp_test_babel_5448_1
~~END~~

~~START~~
nvarchar
This is correct: master.dbo.sp_test_babel_5448_1
~~END~~

~~START~~
nvarchar
This is correct: master.dbo.sp_test_babel_5448_1
~~END~~

~~START~~
nvarchar
This is correct: master.dbo.sp_test_babel_5448_1
~~END~~

