-- tsql
USE MASTER;
GO

CREATE SCHEMA myschema;
GO

CREATE TABLE dbo.master_t1 (id int identity, a int);
GO

CREATE PROCEDURE dbo.master_p1
AS
SELECT a FROM dbo.master_t1;
GO

CREATE TABLE myschema.tab1( a int);
GO
 
CREATE PROCEDURE myschema.proc1
AS
INSERT INTO tab1 values(1);
SELECT * from tab1;
GO

CREATE PROCEDURE myschema.proc2
AS
CREATE TABLE tab1(a int, b int);
GO

CREATE PROCEDURE dbo.master_p2
AS
SELECT 1;
GO

CREATE PROCEDURE dbo.master_p3
AS
SELECT 1/0;
GO

CREATE DATABASE db1;
GO

USE db1;
GO

SELECT current_user;
GO
~~START~~
varchar
dbo
~~END~~


INSERT INTO master.dbo.master_t1 VALUES (10);
GO
~~ROW COUNT: 1~~


SELECT * FROM master.dbo.master_t1 ORDER BY id;
GO
~~START~~
int#!#int
1#!#10
~~END~~


SELECT * FROM master..master_t1 ORDER BY id;
GO
~~START~~
int#!#int
1#!#10
~~END~~


EXEC master.dbo.master_p1
GO
~~START~~
int
10
~~END~~


master.dbo.master_p1
GO
~~START~~
int
10
~~END~~


EXEC master.dbo.master_p2
GO
~~START~~
int
1
~~END~~


-- tab1 resolves to master.myschema.tab1
EXEC master.myschema.proc1
GO
~~ROW COUNT: 1~~

~~START~~
int
1
~~END~~


-- tab1 resolves to master.dbo.tab1
EXEC master.myschema.proc2
GO

SELECT * from master.dbo.tab1;
GO
~~START~~
int#!#int
~~END~~


-- runtime error
EXEC master.dbo.master_p3
GO
~~ERROR (Code: 8134)~~

~~ERROR (Message: division by zero)~~


EXEC master..master_p2
GO
~~START~~
int
1
~~END~~


UPDATE master.dbo.master_t1
SET a = 11
WHERE id = 1;
GO
~~ROW COUNT: 1~~


SELECT * FROM master.dbo.master_t1 ORDER BY id;
GO
~~START~~
int#!#int
1#!#11
~~END~~


DELETE FROM master.dbo.master_t1
WHERE id = 1;
GO
~~ROW COUNT: 1~~


SELECT * FROM master.dbo.master_t1 ORDER BY id;
GO
~~START~~
int#!#int
~~END~~


SELECT current_user;
GO
~~START~~
varchar
dbo
~~END~~


CREATE PROCEDURE p1
AS
INSERT INTO master.dbo.master_t1 VALUES (10);
GO

EXEC p1;
GO
~~ROW COUNT: 1~~


EXEC p1;
GO
~~ROW COUNT: 1~~


EXEC p1;
GO
~~ROW COUNT: 1~~


CREATE TABLE dbo.db1_t1 (a int);
GO

INSERT INTO dbo.db1_t1 (a)
SELECT (a) FROM master.dbo.master_t1;
GO
~~ROW COUNT: 3~~


INSERT INTO dbo.db1_t1 (a)
OUTPUT inserted.a INTO master.dbo.master_t1 (a)
VALUES (30);
GO
~~ROW COUNT: 1~~


-- Expect an error
INSERT INTO dbo.db1_t1 (a)
EXECUTE master.dbo.master_p1;
GO
~~ROW COUNT: 4~~


EXECUTE master.dbo.master_p1;
GO
~~START~~
int
10
10
10
30
~~END~~


SELECT current_user;
GO
~~START~~
varchar
dbo
~~END~~


CREATE TABLE dbo.db1_t2 (a int);
GO

INSERT INTO dbo.db1_t2 VALUES (20);
GO
~~ROW COUNT: 1~~


INSERT INTO master.dbo.master_t1 (a)
SELECT (a) FROM db1_t2;
GO
~~ROW COUNT: 1~~


SELECT * FROM master.dbo.master_t1 ORDER BY id;
GO
~~START~~
int#!#int
2#!#10
3#!#10
4#!#10
5#!#30
6#!#20
~~END~~


USE MASTER;
GO

--tsql
USE MASTER;
GO

CREATE LOGIN johndoe WITH PASSWORD = '12345678';
GO

CREATE USER master_janedoe FOR LOGIN johndoe;
GO

USE db1;
GO

CREATE USER db1_janedoe FOR LOGIN johndoe;
GO

-- tsql    user=johndoe    password=12345678
USE MASTER;
GO

SELECT current_user;
GO
~~START~~
varchar
master_janedoe
~~END~~


SELECT * FROM db1.dbo.db1_t1 ORDER BY a;
GO
~~ERROR (Code: 33557097)~~

~~ERROR (Message: permission denied for table db1_t1)~~


USE db1;
GO

EXEC master.dbo.master_p2
GO
~~ERROR (Code: 33557097)~~

~~ERROR (Message: permission denied for procedure master_p2)~~


SELECT current_user;
GO
~~START~~
varchar
db1_janedoe
~~END~~


SELECT * FROM master.dbo.master_t1 ORDER BY id;
GO
~~ERROR (Code: 33557097)~~

~~ERROR (Message: permission denied for table master_t1)~~


-- tsql
USE MASTER;
GO

GRANT SELECT ON dbo.master_t1 TO master_janedoe;
GO

GRANT EXECUTE ON dbo.master_p2 TO master_janedoe;
GO

USE db1;
GO

GRANT SELECT ON dbo.db1_t1 TO db1_janedoe;
GO

-- tsql user=johndoe password=12345678
USE MASTER;
GO

USE db1;
GO

EXEC master.dbo.master_p2
GO
~~START~~
int
1
~~END~~


SELECT * FROM master.dbo.master_t1 ORDER BY id;
GO
~~START~~
int#!#int
2#!#10
3#!#10
4#!#10
5#!#30
6#!#20
~~END~~


USE master;
GO

-- tsql
USE db1;
GO

REVOKE SELECT ON dbo.db1_t1 FROM db1_janedoe;
GO

USE MASTER;
GO

DROP DATABASE db1;
GO

DROP TABLE dbo.master_t1;
GO

DROP PROC dbo.master_p1;
GO

DROP PROC dbo.master_p2;
GO

DROP PROC dbo.master_p3;
GO

DROP PROC myschema.proc1;
GO

DROP PROC myschema.proc2;
go

DROP TABLE tab1;
go

DROP TABLE myschema.tab1;
GO

DROP SCHEMA myschema;
GO

DROP USER master_janedoe;
GO

-- psql

-- Need to terminate active session before cleaning up the login
SELECT pg_terminate_backend(pid) FROM pg_stat_get_activity(NULL) 
WHERE sys.suser_name(usesysid) = 'johndoe' AND backend_type = 'client backend' AND usesysid IS NOT NULL;
GO
~~START~~
bool
t
~~END~~

-- Wait to sync with another session
SELECT pg_sleep(1);
GO
~~START~~
void

~~END~~


-- tsql
DROP LOGIN johndoe;
GO

-- tsql
USE master;
GO

CREATE DATABASE db1;
GO

CREATE DATABASE db2;
GO

USE db1;
GO

CREATE PROCEDURE p1
AS
EXEC('USE db1');
SELECT 10;
GO

CREATE TABLE dbo.db1_t1 (id int identity, a int);
GO

USE db2;
GO

INSERT INTO db1.dbo.db1_t1 (a) VALUES (10);
GO
~~ROW COUNT: 1~~


CREATE PROCEDURE p1
AS
INSERT INTO db1.dbo.db1_t1 VALUES (1);
GO

EXEC p1;
GO
~~ROW COUNT: 1~~


EXEC p1;
GO
~~ROW COUNT: 1~~


CREATE TABLE dbo.db2_t1 (b int);
GO

INSERT INTO dbo.db2_t1 (b)
SELECT a FROM db1.dbo.db1_t1
WHERE id = 1;
GO
~~ROW COUNT: 1~~


SELECT * FROM dbo.db2_t1 ORDER BY b;
GO
~~START~~
int
10
~~END~~


EXEC db1.dbo.p1;
GO
~~START~~
int
10
~~END~~


DROP PROCEDURE p1
GO

-- tsql
USE db1;
GO

DROP TABLE db1_t1;
GO

USE master;
GO

DROP DATABASE db1;
GO

DROP DATABASE db2;
GO
