
-- tsql


-- All tests will be triggered from babel_5448_db database
-- For cross database, we will use master database
/*********************************/
/*********** SAME DB ************/
/*********************************/
USE babel_5448_db
GO

-- All objects should resolve to babel_5448_db.dbo schema in this call
EXEC dbo.babel_5448_p1
GO
~~START~~
nvarchar#!#nvarchar
babel_5448_db.dbo#!#babel_5448_db.dbo
~~END~~

~~START~~
varchar
babel_5448_db.dbo
~~END~~

~~START~~
varchar
=========== START OF TRIGGER EXECUTION ========== babel_5448_db.dbo
~~END~~

~~START~~
nvarchar
babel_5448_db.dbo
~~END~~

~~START~~
nvarchar
babel_5448_db.dbo
temp inserted row to check DML and trigger executiong
~~END~~

~~START~~
varchar
=========== END OF TRIGGER EXECUTION ========== babel_5448_db.dbo
~~END~~

~~ROW COUNT: 1~~

~~ROW COUNT: 1~~

~~START~~
nvarchar
babel_5448_db.dbo
~~END~~


-- All objects should resolve to babel_5448_db.babel_5448_s1 schema in this call
-- except EXEC call stmt
EXEC babel_5448_s1.babel_5448_p1
GO
~~START~~
nvarchar#!#nvarchar
babel_5448_db.babel_5448_s1#!#babel_5448_db.babel_5448_s1
~~END~~

~~START~~
varchar
babel_5448_db.dbo
~~END~~

~~START~~
varchar
=========== START OF TRIGGER EXECUTION ========== babel_5448_db.babel_5448_s1
~~END~~

~~START~~
nvarchar
babel_5448_db.babel_5448_s1
~~END~~

~~START~~
nvarchar
babel_5448_db.babel_5448_s1
temp inserted row to check DML and trigger executiong
~~END~~

~~START~~
varchar
=========== END OF TRIGGER EXECUTION ========== babel_5448_db.babel_5448_s1
~~END~~

~~ROW COUNT: 1~~

~~ROW COUNT: 1~~

~~START~~
nvarchar
babel_5448_db.babel_5448_s1
~~END~~



-- Now we will run the same procedures again but this time we will references objects from other schema
-- proc in dbo will reference objects from babel_5448_user_default_schema schema
-- proc in babel_5448_s1 will reference objects from dbo schema
ALTER PROCEDURE dbo.babel_5448_p1
AS
    SELECT babel_5448_user_default_schema.babel_5448_f(), * FROM babel_5448_user_default_schema.babel_5448_t;
    EXEC babel_5448_user_default_schema.babel_5448_p;
    INSERT INTO babel_5448_user_default_schema.babel_5448_t VALUES ('temp inserted row to check DML and trigger executiong');
    DELETE FROM babel_5448_user_default_schema.babel_5448_t WHERE length(id) > 50;
    -- CHECK IF ROW WAS DELETED FROM THE RIGHT TABLE
    SELECT * FROM babel_5448_user_default_schema.babel_5448_t;
GO

ALTER PROCEDURE babel_5448_s1.babel_5448_p1
AS
    SELECT dbo.babel_5448_f(), * FROM dbo.babel_5448_t;
    EXEC dbo.babel_5448_p;
    INSERT INTO dbo.babel_5448_t VALUES ('temp inserted row to check DML and trigger executiong');
    DELETE FROM dbo.babel_5448_t WHERE length(id) > 50;
    -- CHECK IF ROW WAS DELETED FROM THE RIGHT TABLE
    SELECT * FROM dbo.babel_5448_t;
GO

-- All objects should resolve to babel_5448_db.babel_5448_user_default_schema schema in this call
EXEC dbo.babel_5448_p1
GO
~~START~~
nvarchar#!#nvarchar
babel_5448_db.babel_5448_user_default_schema#!#babel_5448_db.babel_5448_user_default_schema
~~END~~

~~START~~
varchar
babel_5448_db.babel_5448_user_default_schema
~~END~~

~~START~~
varchar
=========== START OF TRIGGER EXECUTION ========== babel_5448_db.babel_5448_user_default_schema
~~END~~

~~START~~
nvarchar
babel_5448_db.babel_5448_user_default_schema
~~END~~

~~START~~
nvarchar
babel_5448_db.babel_5448_user_default_schema
temp inserted row to check DML and trigger executiong
~~END~~

~~START~~
varchar
=========== END OF TRIGGER EXECUTION ========== babel_5448_db.babel_5448_user_default_schema
~~END~~

~~ROW COUNT: 1~~

~~ROW COUNT: 1~~

~~START~~
nvarchar
babel_5448_db.babel_5448_user_default_schema
~~END~~


-- All objects should resolve to babel_5448_db.dbo schema in this call
EXEC babel_5448_s1.babel_5448_p1
GO
~~START~~
nvarchar#!#nvarchar
babel_5448_db.dbo#!#babel_5448_db.dbo
~~END~~

~~START~~
varchar
babel_5448_db.dbo
~~END~~

~~START~~
varchar
=========== START OF TRIGGER EXECUTION ========== babel_5448_db.dbo
~~END~~

~~START~~
nvarchar
babel_5448_db.dbo
~~END~~

~~START~~
nvarchar
babel_5448_db.dbo
temp inserted row to check DML and trigger executiong
~~END~~

~~START~~
varchar
=========== END OF TRIGGER EXECUTION ========== babel_5448_db.dbo
~~END~~

~~ROW COUNT: 1~~

~~ROW COUNT: 1~~

~~START~~
nvarchar
babel_5448_db.dbo
~~END~~


-- testing different schemas
-- procedure and function will be on same schema but
-- table & trigger will be different schema
-- basically testing row level search path changes
ALTER PROCEDURE dbo.babel_5448_p1
AS
    INSERT INTO babel_5448_user_default_schema.babel_5448_t SELECT babel_5448_f() FROM generate_series(1,3);
    -- trigger execution will tells use what the function resolved to
    -- and what the objects inside triggers resolved to
    DELETE FROM babel_5448_user_default_schema.babel_5448_t WHERE id != 'babel_5448_db.babel_5448_user_default_schema'
GO

ALTER PROCEDURE babel_5448_s1.babel_5448_p1
AS
    INSERT INTO dbo.babel_5448_t SELECT babel_5448_f() FROM generate_series(1,3);
    -- trigger execution will tells use what the function resolved to
    -- and what the objects inside triggers resolved to
    DELETE FROM dbo.babel_5448_t WHERE id != 'babel_5448_db.dbo'
GO


EXEC dbo.babel_5448_p1
GO
~~START~~
varchar
=========== START OF TRIGGER EXECUTION ========== babel_5448_db.babel_5448_user_default_schema
~~END~~

~~START~~
nvarchar
babel_5448_db.babel_5448_user_default_schema
~~END~~

~~START~~
nvarchar
babel_5448_db.babel_5448_user_default_schema
babel_5448_db.dbo
babel_5448_db.dbo
babel_5448_db.dbo
~~END~~

~~START~~
varchar
=========== END OF TRIGGER EXECUTION ========== babel_5448_db.babel_5448_user_default_schema
~~END~~

~~ROW COUNT: 3~~

~~ROW COUNT: 3~~


EXEC babel_5448_s1.babel_5448_p1
GO
~~START~~
varchar
=========== START OF TRIGGER EXECUTION ========== babel_5448_db.dbo
~~END~~

~~START~~
nvarchar
babel_5448_db.dbo
~~END~~

~~START~~
nvarchar
babel_5448_db.dbo
babel_5448_db.babel_5448_s1
babel_5448_db.babel_5448_s1
babel_5448_db.babel_5448_s1
~~END~~

~~START~~
varchar
=========== END OF TRIGGER EXECUTION ========== babel_5448_db.dbo
~~END~~

~~ROW COUNT: 3~~

~~ROW COUNT: 3~~


-- Test INSERT EXEC
CREATE TABLE #temp (col1 NVARCHAR(MAX), col2 NVARCHAR(MAX), col3 NVARCHAR(MAX), col4 NVARCHAR(MAX))
GO

INSERT INTO #temp EXEC dbo.babel_5448_p2
SELECT * FROM #temp
TRUNCATE TABLE #temp
GO
~~ROW COUNT: 1~~

~~START~~
nvarchar#!#nvarchar#!#nvarchar#!#nvarchar
babel_5448_db.dbo#!# |--ignorable entry--master.babel_5448_s2--| #!#babel_5448_db.dbo#!# |--ignorable entry--master.babel_5448_s2--| 
~~END~~


INSERT INTO #temp EXEC babel_5448_s1.babel_5448_p2
SELECT * FROM #temp
TRUNCATE TABLE #temp
GO
~~ROW COUNT: 1~~

~~START~~
nvarchar#!#nvarchar#!#nvarchar#!#nvarchar
babel_5448_db.babel_5448_s1#!# |--ignorable entry--master.babel_5448_s2--| #!#babel_5448_db.babel_5448_s1#!# |--ignorable entry--master.babel_5448_s2--| 
~~END~~


DROP TABLE #temp
GO


-- Test declare statement inside function
SELECT babel_5448_s1.babel_5448_f2();
-- Test declare statement inside function
SELECT babel_5448_s1.babel_5448_f3();
GO
~~START~~
nvarchar
babel_5448_db.babel_5448_s1
~~END~~

~~START~~
nvarchar
babel_5448_db.babel_5448_s1
~~END~~



/*********************************/
/*********** CROSS DB ************/
/*********************************/
USE babel_5448_db
GO

-- All objects should resolve to master.dbo schema in this call
EXEC master.dbo.babel_5448_p1
GO
~~START~~
nvarchar#!#nvarchar
master.dbo#!#master.dbo
~~END~~

~~START~~
varchar
master.dbo
~~END~~

~~START~~
varchar
=========== START OF TRIGGER EXECUTION ========== master.dbo
~~END~~

~~START~~
nvarchar
master.dbo
~~END~~

~~START~~
nvarchar
master.dbo
temp inserted row to check DML and trigger executiong
~~END~~

~~START~~
varchar
=========== END OF TRIGGER EXECUTION ========== master.dbo
~~END~~

~~ROW COUNT: 1~~

~~ROW COUNT: 1~~

~~START~~
nvarchar
master.dbo
~~END~~


-- All objects should resolve to master.babel_5448_s1 schema in this call
-- except EXEC call stmt
EXEC master.babel_5448_s1.babel_5448_p1
GO
~~START~~
nvarchar#!#nvarchar
master.babel_5448_s1#!#master.babel_5448_s1
~~END~~

~~START~~
varchar
master.dbo
~~END~~

~~START~~
varchar
=========== START OF TRIGGER EXECUTION ========== master.babel_5448_s1
~~END~~

~~START~~
nvarchar
master.babel_5448_s1
~~END~~

~~START~~
nvarchar
master.babel_5448_s1
temp inserted row to check DML and trigger executiong
~~END~~

~~START~~
varchar
=========== END OF TRIGGER EXECUTION ========== master.babel_5448_s1
~~END~~

~~ROW COUNT: 1~~

~~ROW COUNT: 1~~

~~START~~
nvarchar
master.babel_5448_s1
~~END~~


-- Now we need to alter the procedure so switch to master database 
-- alter the master database procedures and then execute then from
-- babel_5448_db again
USE master
GO

ALTER PROCEDURE dbo.babel_5448_p1
AS
    SELECT babel_5448_user_default_schema.babel_5448_f(), * FROM babel_5448_user_default_schema.babel_5448_t;
    EXEC babel_5448_user_default_schema.babel_5448_p;
    INSERT INTO babel_5448_user_default_schema.babel_5448_t VALUES ('temp inserted row to check DML and trigger executiong');
    DELETE FROM babel_5448_user_default_schema.babel_5448_t WHERE length(id) > 50;
    -- CHECK IF ROW WAS DELETED FROM THE RIGHT TABLE
    SELECT * FROM babel_5448_user_default_schema.babel_5448_t;
GO

ALTER PROCEDURE babel_5448_s1.babel_5448_p1
AS
    SELECT dbo.babel_5448_f(), * FROM dbo.babel_5448_t;
    EXEC dbo.babel_5448_p;
    INSERT INTO dbo.babel_5448_t VALUES ('temp inserted row to check DML and trigger executiong');
    DELETE FROM dbo.babel_5448_t WHERE length(id) > 50;
    -- CHECK IF ROW WAS DELETED FROM THE RIGHT TABLE
    SELECT * FROM dbo.babel_5448_t;
GO

USE babel_5448_db
GO

-- Now execute the altered master database procedures
-- All objects should resolve to master.babel_5448_user_default_schema schema in this call
EXEC master.dbo.babel_5448_p1
GO
~~START~~
nvarchar#!#nvarchar
master.babel_5448_user_default_schema#!#master.babel_5448_user_default_schema
~~END~~

~~START~~
varchar
master.babel_5448_user_default_schema
~~END~~

~~START~~
varchar
=========== START OF TRIGGER EXECUTION ========== master.babel_5448_user_default_schema
~~END~~

~~START~~
nvarchar
master.babel_5448_user_default_schema
~~END~~

~~START~~
nvarchar
master.babel_5448_user_default_schema
temp inserted row to check DML and trigger executiong
~~END~~

~~START~~
varchar
=========== END OF TRIGGER EXECUTION ========== master.babel_5448_user_default_schema
~~END~~

~~ROW COUNT: 1~~

~~ROW COUNT: 1~~

~~START~~
nvarchar
master.babel_5448_user_default_schema
~~END~~


-- All objects should resolve to master.dbo schema in this call
EXEC master.babel_5448_s1.babel_5448_p1
GO
~~START~~
nvarchar#!#nvarchar
master.dbo#!#master.dbo
~~END~~

~~START~~
varchar
master.dbo
~~END~~

~~START~~
varchar
=========== START OF TRIGGER EXECUTION ========== master.dbo
~~END~~

~~START~~
nvarchar
master.dbo
~~END~~

~~START~~
nvarchar
master.dbo
temp inserted row to check DML and trigger executiong
~~END~~

~~START~~
varchar
=========== END OF TRIGGER EXECUTION ========== master.dbo
~~END~~

~~ROW COUNT: 1~~

~~ROW COUNT: 1~~

~~START~~
nvarchar
master.dbo
~~END~~


-- Test INSERT EXEC
CREATE TABLE #temp (col1 NVARCHAR(MAX), col2 NVARCHAR(MAX), col3 NVARCHAR(MAX), col4 NVARCHAR(MAX))
GO

INSERT INTO #temp EXEC master.dbo.babel_5448_p2
SELECT * FROM #temp
TRUNCATE TABLE #temp
GO
~~ROW COUNT: 1~~

~~START~~
nvarchar#!#nvarchar#!#nvarchar#!#nvarchar
master.dbo#!# |--ignorable entry--master.babel_5448_s2--| #!#master.dbo#!# |--ignorable entry--master.babel_5448_s2--| 
~~END~~

EXEC master.babel_5448_s1.babel_5448_p2
GO
~~START~~
nvarchar#!#nvarchar#!#nvarchar#!#varchar
master.babel_5448_s1#!# |--ignorable entry--master.babel_5448_s2--| #!#master.babel_5448_s1#!# |--ignorable entry--master.babel_5448_s2--| 
~~END~~

INSERT INTO #temp EXEC master.babel_5448_s1.babel_5448_p2
SELECT * FROM #temp
TRUNCATE TABLE #temp
GO
~~ROW COUNT: 1~~

~~START~~
nvarchar#!#nvarchar#!#nvarchar#!#nvarchar
master.babel_5448_s1#!# |--ignorable entry--master.babel_5448_s2--| #!#master.babel_5448_s1#!# |--ignorable entry--master.babel_5448_s2--| 
~~END~~



-- Test declare statement inside function
SELECT master.babel_5448_s1.babel_5448_f2();
-- Test declare statement inside function
SELECT master.babel_5448_s1.babel_5448_f3();
GO
~~START~~
nvarchar
master.babel_5448_s1
~~END~~

~~START~~
nvarchar
master.babel_5448_s1
~~END~~


DROP TABLE #temp
GO



/************************************************************************************************/
/************************** START OF TRANSACTION AND ERROR **************************************/
/*********************** CASES TESTING WITH OBJECT RESOLUTION ***********************************/
/************************************************************************************************/
/*********** SAME DB ************/
EXEC babel_5448_s1.babel_5448_p5
SELECT * FROM babel_5448_t JOIN babel_5448_s2.babel_5448_v ON (1=1);
GO
~~START~~
varchar
========= START OF PROC WHICH WILL THROW STATEMENT TERMINATING ERROR ====================
~~END~~

~~START~~
nvarchar#!#varchar
babel_5448_db.babel_5448_s1#!# |--ignorable entry--master.babel_5448_s2--| 
~~END~~

~~ERROR (Code: 8134)~~

~~ERROR (Message: division by zero)~~

~~START~~
varchar
========= STATEMENT TERMINATING ERROR SO STILL IN EXECUTION AFTER ERROR ====================
~~END~~

~~START~~
nvarchar#!#varchar
babel_5448_db.babel_5448_s1#!# |--ignorable entry--master.babel_5448_s2--| 
~~END~~

~~START~~
nvarchar#!#varchar
babel_5448_db.dbo#!# |--ignorable entry--master.babel_5448_s2--| 
~~END~~


EXEC babel_5448_s1.babel_5448_p6
SELECT '========= CURRENT BATCH TERMINATING ERROR ONLY SO STILL IN EXECUTION OUTSIDE ERROR BATCH ===================='
SELECT * FROM babel_5448_t JOIN babel_5448_s2.babel_5448_v ON (1=1);
GO
~~START~~
varchar
========= START OF PROC WHICH WILL THROW BATCH TERMINATING ERROR ====================
~~END~~

~~START~~
nvarchar#!#varchar
babel_5448_db.babel_5448_s1#!# |--ignorable entry--master.babel_5448_s2--| 
~~END~~

~~ERROR (Code: 1752)~~

~~ERROR (Message: column "id1" of relation "#temp" is a generated column)~~

~~START~~
varchar
========= CURRENT BATCH TERMINATING ERROR ONLY SO STILL IN EXECUTION OUTSIDE ERROR BATCH ====================
~~END~~

~~START~~
nvarchar#!#varchar
babel_5448_db.dbo#!# |--ignorable entry--master.babel_5448_s2--| 
~~END~~


EXEC babel_5448_s1.babel_5448_p7
SELECT * FROM babel_5448_t JOIN babel_5448_s2.babel_5448_v ON (1=1);
GO
~~START~~
varchar
========= START OF PROC WHICH WILL THROW TRANSACTION TERMINATING ERROR ====================
~~END~~

~~START~~
nvarchar#!#varchar
babel_5448_db.babel_5448_s1#!# |--ignorable entry--master.babel_5448_s2--| 
~~END~~

~~ERROR (Code: 33557097)~~

~~ERROR (Message: relation "non_existent_table" does not exist)~~



SELECT '========= END OF TRANSACTION ABORTING ERROR ===================='
/*********** SAME DB ************/
/*********** BUT INSIDE TRAN ************/
BEGIN TRAN
GO
~~START~~
varchar
========= END OF TRANSACTION ABORTING ERROR ====================
~~END~~

EXEC babel_5448_s1.babel_5448_p5
SELECT * FROM babel_5448_t JOIN babel_5448_s2.babel_5448_v ON (1=1);
COMMIT
GO
~~START~~
varchar
========= START OF PROC WHICH WILL THROW STATEMENT TERMINATING ERROR ====================
~~END~~

~~START~~
nvarchar#!#varchar
babel_5448_db.babel_5448_s1#!# |--ignorable entry--master.babel_5448_s2--| 
~~END~~

~~ERROR (Code: 8134)~~

~~ERROR (Message: division by zero)~~

~~START~~
varchar
========= STATEMENT TERMINATING ERROR SO STILL IN EXECUTION AFTER ERROR ====================
~~END~~

~~START~~
nvarchar#!#varchar
babel_5448_db.babel_5448_s1#!# |--ignorable entry--master.babel_5448_s2--| 
~~END~~

~~START~~
nvarchar#!#varchar
babel_5448_db.dbo#!# |--ignorable entry--master.babel_5448_s2--| 
~~END~~


BEGIN TRAN
GO
EXEC babel_5448_s1.babel_5448_p6
SELECT '========= CURRENT BATCH TERMINATING ERROR ONLY SO STILL IN EXECUTION OUTSIDE ERROR BATCH ===================='
SELECT * FROM babel_5448_t JOIN babel_5448_s2.babel_5448_v ON (1=1);
COMMIT
GO
~~START~~
varchar
========= START OF PROC WHICH WILL THROW BATCH TERMINATING ERROR ====================
~~END~~

~~START~~
nvarchar#!#varchar
babel_5448_db.babel_5448_s1#!# |--ignorable entry--master.babel_5448_s2--| 
~~END~~

~~ERROR (Code: 1752)~~

~~ERROR (Message: column "id1" of relation "#temp" is a generated column)~~

~~START~~
varchar
========= CURRENT BATCH TERMINATING ERROR ONLY SO STILL IN EXECUTION OUTSIDE ERROR BATCH ====================
~~END~~

~~START~~
nvarchar#!#varchar
babel_5448_db.dbo#!# |--ignorable entry--master.babel_5448_s2--| 
~~END~~


BEGIN TRAN
GO
EXEC babel_5448_s1.babel_5448_p7
SELECT * FROM babel_5448_t JOIN babel_5448_s2.babel_5448_v ON (1=1);
GO
~~START~~
varchar
========= START OF PROC WHICH WILL THROW TRANSACTION TERMINATING ERROR ====================
~~END~~

~~START~~
nvarchar#!#varchar
babel_5448_db.babel_5448_s1#!# |--ignorable entry--master.babel_5448_s2--| 
~~END~~

~~ERROR (Code: 33557097)~~

~~ERROR (Message: relation "non_existent_table" does not exist)~~

SELECT '========= END OF TRANSACTION ABORTING ERROR ===================='
GO
~~START~~
varchar
========= END OF TRANSACTION ABORTING ERROR ====================
~~END~~



/*********** CROSS DB ************/
EXEC master.babel_5448_s1.babel_5448_p5
SELECT * FROM babel_5448_t JOIN babel_5448_s2.babel_5448_v ON (1=1);
GO
~~START~~
varchar
========= START OF PROC WHICH WILL THROW STATEMENT TERMINATING ERROR ====================
~~END~~

~~START~~
nvarchar#!#varchar
master.babel_5448_s1#!# |--ignorable entry--master.babel_5448_s2--| 
~~END~~

~~ERROR (Code: 8134)~~

~~ERROR (Message: division by zero)~~

~~START~~
varchar
========= STATEMENT TERMINATING ERROR SO STILL IN EXECUTION AFTER ERROR ====================
~~END~~

~~START~~
nvarchar#!#varchar
master.babel_5448_s1#!# |--ignorable entry--master.babel_5448_s2--| 
~~END~~

~~START~~
nvarchar#!#varchar
babel_5448_db.dbo#!# |--ignorable entry--master.babel_5448_s2--| 
~~END~~


EXEC master.babel_5448_s1.babel_5448_p6
SELECT '========= CURRENT BATCH TERMINATING ERROR ONLY SO STILL IN EXECUTION OUTSIDE ERROR BATCH ===================='
SELECT * FROM babel_5448_t JOIN babel_5448_s2.babel_5448_v ON (1=1);
GO
~~START~~
varchar
========= START OF PROC WHICH WILL THROW BATCH TERMINATING ERROR ====================
~~END~~

~~START~~
nvarchar#!#varchar
master.babel_5448_s1#!# |--ignorable entry--master.babel_5448_s2--| 
~~END~~

~~ERROR (Code: 1752)~~

~~ERROR (Message: column "id1" of relation "#temp" is a generated column)~~

~~START~~
varchar
========= CURRENT BATCH TERMINATING ERROR ONLY SO STILL IN EXECUTION OUTSIDE ERROR BATCH ====================
~~END~~

~~START~~
nvarchar#!#varchar
babel_5448_db.dbo#!# |--ignorable entry--master.babel_5448_s2--| 
~~END~~


EXEC master.babel_5448_s1.babel_5448_p7
SELECT * FROM babel_5448_t JOIN babel_5448_s2.babel_5448_v ON (1=1);
GO
~~START~~
varchar
========= START OF PROC WHICH WILL THROW TRANSACTION TERMINATING ERROR ====================
~~END~~

~~START~~
nvarchar#!#varchar
master.babel_5448_s1#!# |--ignorable entry--master.babel_5448_s2--| 
~~END~~

~~ERROR (Code: 33557097)~~

~~ERROR (Message: relation "non_existent_table" does not exist)~~



SELECT '========= END OF TRANSACTION ABORTING ERROR ===================='
/*********** CROSS DB ************/
/*********** BUT INSIDE TRAN ************/
BEGIN TRAN
GO
~~START~~
varchar
========= END OF TRANSACTION ABORTING ERROR ====================
~~END~~

EXEC master.babel_5448_s1.babel_5448_p5
SELECT * FROM babel_5448_t JOIN babel_5448_s2.babel_5448_v ON (1=1);
COMMIT
GO
~~START~~
varchar
========= START OF PROC WHICH WILL THROW STATEMENT TERMINATING ERROR ====================
~~END~~

~~START~~
nvarchar#!#varchar
master.babel_5448_s1#!# |--ignorable entry--master.babel_5448_s2--| 
~~END~~

~~ERROR (Code: 8134)~~

~~ERROR (Message: division by zero)~~

~~START~~
varchar
========= STATEMENT TERMINATING ERROR SO STILL IN EXECUTION AFTER ERROR ====================
~~END~~

~~START~~
nvarchar#!#varchar
master.babel_5448_s1#!# |--ignorable entry--master.babel_5448_s2--| 
~~END~~

~~START~~
nvarchar#!#varchar
babel_5448_db.dbo#!# |--ignorable entry--master.babel_5448_s2--| 
~~END~~


BEGIN TRAN
GO
EXEC master.babel_5448_s1.babel_5448_p6
SELECT '========= CURRENT BATCH TERMINATING ERROR ONLY SO STILL IN EXECUTION OUTSIDE ERROR BATCH ===================='
SELECT * FROM babel_5448_t JOIN babel_5448_s2.babel_5448_v ON (1=1);
COMMIT
GO
~~START~~
varchar
========= START OF PROC WHICH WILL THROW BATCH TERMINATING ERROR ====================
~~END~~

~~START~~
nvarchar#!#varchar
master.babel_5448_s1#!# |--ignorable entry--master.babel_5448_s2--| 
~~END~~

~~ERROR (Code: 1752)~~

~~ERROR (Message: column "id1" of relation "#temp" is a generated column)~~

~~START~~
varchar
========= CURRENT BATCH TERMINATING ERROR ONLY SO STILL IN EXECUTION OUTSIDE ERROR BATCH ====================
~~END~~

~~START~~
nvarchar#!#varchar
babel_5448_db.dbo#!# |--ignorable entry--master.babel_5448_s2--| 
~~END~~


BEGIN TRAN
GO
EXEC master.babel_5448_s1.babel_5448_p7
SELECT * FROM babel_5448_t JOIN babel_5448_s2.babel_5448_v ON (1=1);
GO
~~START~~
varchar
========= START OF PROC WHICH WILL THROW TRANSACTION TERMINATING ERROR ====================
~~END~~

~~START~~
nvarchar#!#varchar
master.babel_5448_s1#!# |--ignorable entry--master.babel_5448_s2--| 
~~END~~

~~ERROR (Code: 33557097)~~

~~ERROR (Message: relation "non_existent_table" does not exist)~~

SELECT '========= END OF TRANSACTION ABORTING ERROR ===================='
GO
~~START~~
varchar
========= END OF TRANSACTION ABORTING ERROR ====================
~~END~~



/************************************************************************************************/
/************************** START OF TRY CATCH BLOCK TESTS **************************************/
/************************************************************************************************/
USE babel_5448_db
GO

BEGIN TRY
    EXEC babel_5448_s1.babel_5448_p8
    SELECT 1/0;
END TRY
BEGIN CATCH
    SELECT * FROM babel_5448_t JOIN babel_5448_s2.babel_5448_v ON (1=1);
    USE msdb
    SELECT * FROM babel_5448_t JOIN babel_5448_s2.babel_5448_v ON (1=1);
END CATCH
GO
~~START~~
varchar
========= START OF PROC WHICH WILL THROW STATEMENT TERMINATING ERROR WITH TRY CATCH ====================
~~END~~

~~START~~
varchar
############ IN TRY BLOCK ############
~~END~~

~~START~~
nvarchar#!#varchar
babel_5448_db.babel_5448_s1#!# |--ignorable entry--master.babel_5448_s2--| 
~~END~~

~~START~~
varchar
############ IN CATCH BLOCK ############
~~END~~

~~START~~
nvarchar#!#varchar
babel_5448_db.babel_5448_s1#!# |--ignorable entry--master.babel_5448_s2--| 
~~END~~

~~START~~
varchar
========= STATEMENT TERMINATING ERROR SO STILL IN EXECUTION AFTER ERROR ====================
~~END~~

~~START~~
nvarchar#!#varchar
babel_5448_db.dbo#!# |--ignorable entry--master.babel_5448_s2--| 
~~END~~

~~ERROR (Code: 33557097)~~

~~ERROR (Message: relation "babel_5448_t" does not exist)~~


SELECT db_name()
GO
~~START~~
nvarchar
msdb
~~END~~


USE babel_5448_db
GO

BEGIN TRY
    EXEC babel_5448_s1.babel_5448_p8
    SELECT 1/0;
END TRY
BEGIN CATCH
    SELECT * FROM babel_5448_t JOIN babel_5448_s2.babel_5448_v ON (1=1);
    USE msdb
    SELECT * FROM babel_5448_t JOIN babel_5448_s2.babel_5448_v ON (1=1);
END CATCH
GO
~~START~~
varchar
========= START OF PROC WHICH WILL THROW STATEMENT TERMINATING ERROR WITH TRY CATCH ====================
~~END~~

~~START~~
varchar
############ IN TRY BLOCK ############
~~END~~

~~START~~
nvarchar#!#varchar
babel_5448_db.babel_5448_s1#!# |--ignorable entry--master.babel_5448_s2--| 
~~END~~

~~START~~
varchar
############ IN CATCH BLOCK ############
~~END~~

~~START~~
nvarchar#!#varchar
babel_5448_db.babel_5448_s1#!# |--ignorable entry--master.babel_5448_s2--| 
~~END~~

~~START~~
varchar
========= STATEMENT TERMINATING ERROR SO STILL IN EXECUTION AFTER ERROR ====================
~~END~~

~~START~~
nvarchar#!#varchar
babel_5448_db.dbo#!# |--ignorable entry--master.babel_5448_s2--| 
~~END~~

~~ERROR (Code: 33557097)~~

~~ERROR (Message: relation "babel_5448_t" does not exist)~~


SELECT db_name()
GO
~~START~~
nvarchar
msdb
~~END~~


USE babel_5448_db
GO


/*************************************************************************************/
/************************** START OF DDLs TESTS **************************************/
/*************************************************************************************/
EXEC babel_5448_s1.babel_5448_p9;
GO
~~ROW COUNT: 1~~

~~START~~
text
babel_5448_r2
~~END~~

~~ERROR (Code: 50000)~~

~~ERROR (Message: babel_5448_r2 is not a role.)~~

~~START~~
text
~~END~~

~~ROW COUNT: 1~~

~~START~~
text
babel_5448_r2
~~END~~


EXEC master.babel_5448_s1.babel_5448_p9;
GO
~~ROW COUNT: 1~~

~~START~~
text
babel_5448_r2
~~END~~

~~ROW COUNT: 1~~

~~START~~
text
babel_5448_r2
~~END~~

~~ERROR (Code: 50000)~~

~~ERROR (Message: babel_5448_r2 is not a role.)~~

~~START~~
text
~~END~~


-- tsql database=babel_5448_db
-- run this in a new connection to avoid hitting BABEL-5604
EXEC master.babel_5448_s1.babel_5448_p10;
GO
~~START~~
nvarchar#!#varchar
master.babel_5448_s1#!# |--ignorable entry--master.babel_5448_s2--| 
~~END~~

~~ROW COUNT: 1~~

~~START~~
text
babel_5448_r2
~~END~~

~~ERROR (Code: 50000)~~

~~ERROR (Message: babel_5448_r2 is not a role.)~~

~~START~~
text
~~END~~

~~ROW COUNT: 1~~

~~START~~
text
babel_5448_r2
~~END~~

