-- TEST 1: Basic CASCADE DELETE - trigger should fire once seeing all 5 deleted rows, not 5 times
INSERT INTO babel7022_parent SELECT 1 UNION SELECT 2 UNION SELECT 3 UNION SELECT 4 UNION SELECT 5
GO
~~ROW COUNT: 5~~


INSERT INTO babel7022_child (id, parent_id) SELECT 1,1 UNION SELECT 2,2 UNION SELECT 3,3 UNION SELECT 4,4 UNION SELECT 5,5
GO
~~ROW COUNT: 5~~


DELETE FROM babel7022_parent
GO
~~ROW COUNT: 5~~


-- fire_count should be exactly 1 row (trigger fired once) with rows_seen = 5,
-- proving single-fire rather than 5 firings of 1 row each
SELECT COUNT(*) AS fire_count, MAX(rows_seen) AS rows_seen_per_fire FROM babel7022_fire_count
GO
~~START~~
int#!#int
1#!#5
~~END~~


SELECT COUNT(*) AS history_count FROM babel7022_history
GO
~~START~~
int
5
~~END~~


SELECT id, parent_id FROM babel7022_history ORDER BY id
GO
~~START~~
int#!#int
1#!#1
2#!#2
3#!#3
4#!#4
5#!#5
~~END~~


-- TEST 2: Single parent cascading to 10 children - trigger should fire once with all 10 rows
INSERT INTO babel7022_parent2 VALUES (1)
GO
~~ROW COUNT: 1~~


INSERT INTO babel7022_child2 (parent_id, val)
  SELECT 1, 'child_' + CAST(n AS varchar)
  FROM (SELECT 1 AS n UNION SELECT 2 UNION SELECT 3 UNION SELECT 4 UNION SELECT 5
        UNION SELECT 6 UNION SELECT 7 UNION SELECT 8 UNION SELECT 9 UNION SELECT 10) t
GO
~~ROW COUNT: 10~~


DELETE FROM babel7022_parent2 WHERE id = 1
GO
~~ROW COUNT: 1~~


SELECT COUNT(*) AS history_count FROM babel7022_history2
GO
~~START~~
int
10
~~END~~


-- TEST 3: ON UPDATE CASCADE - trigger should fire once with all 5 updated child rows
INSERT INTO babel7022_parent3 VALUES (1, 'old'), (2, 'new')
GO
~~ROW COUNT: 2~~


INSERT INTO babel7022_child3 VALUES (1, 1, 'a'), (2, 1, 'b'), (3, 1, 'c'), (4, 1, 'd'), (5, 1, 'e')
GO
~~ROW COUNT: 5~~


UPDATE babel7022_parent3 SET id = 10 WHERE id = 1
GO
~~ROW COUNT: 1~~


SELECT COUNT(*) AS log_count FROM babel7022_update_log
GO
~~START~~
int
5
~~END~~


SELECT child_id, old_parent_id, new_parent_id FROM babel7022_update_log ORDER BY child_id
GO
~~START~~
int#!#int#!#int
1#!#1#!#10
2#!#1#!#10
3#!#1#!#10
4#!#1#!#10
5#!#1#!#10
~~END~~


-- TEST 4: Two triggers on same table - each should fire exactly once during CASCADE
INSERT INTO babel7022_parent4 SELECT 1 UNION SELECT 2 UNION SELECT 3 UNION SELECT 4 UNION SELECT 5
GO
~~ROW COUNT: 5~~


INSERT INTO babel7022_child4 SELECT 1,1 UNION SELECT 2,2 UNION SELECT 3,3 UNION SELECT 4,4 UNION SELECT 5,5
GO
~~ROW COUNT: 5~~


DELETE FROM babel7022_parent4
GO
~~ROW COUNT: 5~~


SELECT 'trigger_a' AS trigger_name, COUNT(*) AS fire_count, SUM(cnt) AS total_rows FROM babel7022_audit4a
GO
~~START~~
varchar#!#int#!#int
trigger_a#!#1#!#5
~~END~~


SELECT 'trigger_b' AS trigger_name, COUNT(*) AS fire_count, SUM(cnt) AS total_rows FROM babel7022_audit4b
GO
~~START~~
varchar#!#int#!#int
trigger_b#!#1#!#5
~~END~~


-- TEST 5: Nested CASCADE (grandparent -> parent -> child) - validates multi-level FK chains
INSERT INTO babel7022_gp VALUES (1), (2)
GO
~~ROW COUNT: 2~~


INSERT INTO babel7022_p VALUES (1, 1), (2, 1), (3, 2), (4, 2)
GO
~~ROW COUNT: 4~~


INSERT INTO babel7022_c VALUES (1, 1), (2, 1), (3, 3), (4, 3)
GO
~~ROW COUNT: 4~~


DELETE FROM babel7022_gp
GO
~~ROW COUNT: 2~~


SELECT tbl, del_count FROM babel7022_gp_log ORDER BY tbl
GO
~~START~~
varchar#!#int
child#!#4
parent#!#4
~~END~~


-- TEST 6: Direct DELETE without CASCADE - ensures normal trigger path is not regressed
INSERT INTO babel7022_standalone VALUES (1, 'a'), (2, 'b'), (3, 'c'), (4, 'd'), (5, 'e')
GO
~~ROW COUNT: 5~~


DELETE FROM babel7022_standalone
GO
~~ROW COUNT: 5~~


SELECT COUNT(*) AS log_count FROM babel7022_standalone_log
GO
~~START~~
int
5
~~END~~


-- TEST 7: INSERT trigger should not be affected by CASCADE DELETE on same table
INSERT INTO babel7022_parent7 VALUES (1), (2), (3)
GO
~~ROW COUNT: 3~~


INSERT INTO babel7022_child7 VALUES (1, 1), (2, 2), (3, 3)
GO
~~ROW COUNT: 3~~


SELECT COUNT(*) AS ins_log_count FROM babel7022_ins_log
GO
~~START~~
int
3
~~END~~


DELETE FROM babel7022_parent7
GO
~~ROW COUNT: 3~~


SELECT COUNT(*) AS ins_log_count FROM babel7022_ins_log
GO
~~START~~
int
3
~~END~~


-- TEST 8: Regular UPDATE trigger (no CASCADE) - ensures composite trigger path still works
INSERT INTO babel7022_t8 VALUES (1, 10), (2, 20), (3, 30)
GO
~~ROW COUNT: 3~~


UPDATE babel7022_t8 SET val = val + 100
GO
~~ROW COUNT: 3~~


SELECT COUNT(*) AS log_count FROM babel7022_t8_log
GO
~~START~~
int
3
~~END~~


SELECT id, old_val, new_val FROM babel7022_t8_log ORDER BY id
GO
~~START~~
int#!#int#!#int
1#!#10#!#110
2#!#20#!#120
3#!#30#!#130
~~END~~


-- TEST 9: CASCADE DELETE when parent has no children - trigger still fires with empty deleted
-- [BABEL-7027]: SQL Server does not fire the trigger in this case (log_count would be 0).
-- Babelfish fires it with an empty deleted table.
INSERT INTO babel7022_parent9 VALUES (1), (2), (3)
GO
~~ROW COUNT: 3~~


INSERT INTO babel7022_child9 VALUES (10, 2), (20, 3)
GO
~~ROW COUNT: 2~~


DELETE FROM babel7022_parent9 WHERE id = 1
GO
~~ROW COUNT: 1~~


SELECT * FROM babel7022_log9 ORDER BY cnt
GO
~~START~~
int
0
~~END~~


DELETE FROM babel7022_parent9 WHERE id = 2
GO
~~ROW COUNT: 1~~


SELECT * FROM babel7022_log9 ORDER BY cnt
GO
~~START~~
int
0
1
~~END~~


-- TEST 10: CASCADE DELETE inside explicit transaction - trigger should fire correctly within txn
INSERT INTO babel7022_parent10 VALUES (1), (2), (3)
GO
~~ROW COUNT: 3~~


INSERT INTO babel7022_child10 VALUES (1, 1), (2, 2), (3, 3)
GO
~~ROW COUNT: 3~~


BEGIN TRANSACTION
GO

DELETE FROM babel7022_parent10
GO
~~ROW COUNT: 3~~


SELECT COUNT(*) AS log_count FROM babel7022_log10
GO
~~START~~
int
3
~~END~~


COMMIT
GO

SELECT COUNT(*) AS log_count FROM babel7022_log10
GO
~~START~~
int
3
~~END~~


-- TEST 11: Separate DELETE statements should each fire trigger independently, no cross-bleed
INSERT INTO babel7022_parent11 VALUES (1), (2), (3)
GO
~~ROW COUNT: 3~~


INSERT INTO babel7022_child11 VALUES (1, 1), (2, 1), (3, 2), (4, 2), (5, 3), (6, 3)
GO
~~ROW COUNT: 6~~


DELETE FROM babel7022_parent11 WHERE id = 1
GO
~~ROW COUNT: 1~~


DELETE FROM babel7022_parent11 WHERE id = 2
GO
~~ROW COUNT: 1~~


DELETE FROM babel7022_parent11 WHERE id = 3
GO
~~ROW COUNT: 1~~


SELECT firing_num, del_count FROM babel7022_log11 ORDER BY firing_num
GO
~~START~~
int#!#int
1#!#2
2#!#2
3#!#2
~~END~~


-- TEST 12a: CASCADE DELETE + ROLLBACK - trigger effects undone, rows restored
INSERT INTO babel7022_parent12 VALUES (1), (2), (3), (4), (5)
GO
~~ROW COUNT: 5~~


INSERT INTO babel7022_child12 VALUES (1,1), (2,2), (3,3), (4,4), (5,5)
GO
~~ROW COUNT: 5~~


BEGIN TRANSACTION
GO

DELETE FROM babel7022_parent12
GO
~~ROW COUNT: 5~~


ROLLBACK TRANSACTION
GO

SELECT COUNT(*) AS log_count_after_rollback FROM babel7022_log12
GO
~~START~~
int
0
~~END~~


SELECT COUNT(*) AS parent_count_after_rollback FROM babel7022_parent12
GO
~~START~~
int
5
~~END~~


-- TEST 12b: CASCADE DELETE with SAVE TRANSACTION then COMMIT - trigger fires once
DELETE FROM babel7022_log12
GO

BEGIN TRANSACTION
GO

SAVE TRANSACTION sp1
GO

DELETE FROM babel7022_parent12
GO
~~ROW COUNT: 5~~


COMMIT TRANSACTION
GO

SELECT COUNT(*) AS log_count_after_savepoint_commit FROM babel7022_log12
GO
~~START~~
int
5
~~END~~


-- TEST 12c: ROLLBACK TO SAVEPOINT - work before savepoint survives, work after undone
DELETE FROM babel7022_child12
GO

DELETE FROM babel7022_parent12
GO

DELETE FROM babel7022_log12
GO
~~ROW COUNT: 5~~


INSERT INTO babel7022_parent12 VALUES (1), (2), (3), (4), (5)
GO
~~ROW COUNT: 5~~


INSERT INTO babel7022_child12 VALUES (1,1), (2,2), (3,3), (4,4), (5,5)
GO
~~ROW COUNT: 5~~


BEGIN TRANSACTION
GO

DELETE FROM babel7022_parent12 WHERE id IN (1, 2)
GO
~~ROW COUNT: 2~~


SAVE TRANSACTION sp1
GO

DELETE FROM babel7022_parent12 WHERE id IN (3, 4, 5)
GO
~~ROW COUNT: 3~~


ROLLBACK TRANSACTION sp1
GO

COMMIT TRANSACTION
GO

SELECT id, parent_id FROM babel7022_log12 ORDER BY id
GO
~~START~~
int#!#int
1#!#1
2#!#2
~~END~~


SELECT id FROM babel7022_parent12 ORDER BY id
GO
~~START~~
int
3
4
5
~~END~~


-- TEST 13a: trigger body with SAVE TRANSACTION - fires once per statement during CASCADE
INSERT INTO babel7022_parent13a VALUES (1), (2), (3), (4), (5)
GO
~~ROW COUNT: 5~~


INSERT INTO babel7022_child13a VALUES (1,1), (2,2), (3,3), (4,4), (5,5)
GO
~~ROW COUNT: 5~~


DELETE FROM babel7022_parent13a
GO
~~ROW COUNT: 5~~


SELECT COUNT(*) AS savepoint_in_trigger_count FROM babel7022_history13a
GO
~~START~~
int
5
~~END~~


-- TEST 13b: savepoint + rollback to savepoint inside trigger - only post-savepoint insert undone
INSERT INTO babel7022_parent13b VALUES (1), (2), (3), (4), (5)
GO
~~ROW COUNT: 5~~


INSERT INTO babel7022_child13b VALUES (1,1), (2,2), (3,3), (4,4), (5,5)
GO
~~ROW COUNT: 5~~


DELETE FROM babel7022_parent13b
GO
~~ROW COUNT: 5~~


SELECT parent_id, COUNT(*) AS cnt FROM babel7022_history13b GROUP BY parent_id ORDER BY parent_id
GO
~~START~~
int#!#int
-1#!#5
~~END~~


-- TEST 13c: trigger body with BEGIN TRANSACTION / COMMIT - fires once per statement
INSERT INTO babel7022_parent13c VALUES (1), (2), (3), (4), (5)
GO
~~ROW COUNT: 5~~


INSERT INTO babel7022_child13c VALUES (1,1), (2,2), (3,3), (4,4), (5,5)
GO
~~ROW COUNT: 5~~


DELETE FROM babel7022_parent13c
GO
~~ROW COUNT: 5~~


SELECT COUNT(*) AS begin_commit_in_trigger_count FROM babel7022_history13c
GO
~~START~~
int
5
~~END~~


-- TEST 13d: trigger body with full ROLLBACK - aborts the batch, everything rolled back
INSERT INTO babel7022_parent13d VALUES (1), (2), (3), (4), (5)
GO
~~ROW COUNT: 5~~


INSERT INTO babel7022_child13d VALUES (1,1), (2,2), (3,3), (4,4), (5,5)
GO
~~ROW COUNT: 5~~


DELETE FROM babel7022_parent13d
GO
~~ERROR (Code: 3609)~~

~~ERROR (Message: The transaction ended in the trigger. The batch has been aborted.)~~


SELECT COUNT(*) AS history_after_rollback FROM babel7022_history13d
GO
~~START~~
int
0
~~END~~


SELECT COUNT(*) AS parent_after_rollback FROM babel7022_parent13d
GO
~~START~~
int
5
~~END~~


-- TEST 14: Multi-row INSERT without cascade - trigger fires once seeing all rows
INSERT INTO babel7022_t14 VALUES (1,10), (2,20), (3,30), (4,40), (5,50)
GO
~~ROW COUNT: 5~~


SELECT COUNT(*) AS fire_count, MAX(rows_seen) AS rows_seen_per_fire FROM babel7022_fire14
GO
~~START~~
int#!#int
1#!#5
~~END~~


-- TEST 15: Multi-row UPDATE without cascade - trigger fires once seeing all rows
INSERT INTO babel7022_t15 VALUES (1,10), (2,20), (3,30), (4,40), (5,50)
GO
~~ROW COUNT: 5~~


UPDATE babel7022_t15 SET val = val + 1
GO
~~ROW COUNT: 5~~


SELECT COUNT(*) AS fire_count, MAX(rows_seen) AS rows_seen_per_fire FROM babel7022_fire15
GO
~~START~~
int#!#int
1#!#5
~~END~~


-- TEST 16: Multi-row DELETE without cascade - trigger fires once seeing all rows
INSERT INTO babel7022_t16 VALUES (1,10), (2,20), (3,30), (4,40), (5,50)
GO
~~ROW COUNT: 5~~


DELETE FROM babel7022_t16
GO
~~ROW COUNT: 5~~


SELECT COUNT(*) AS fire_count, MAX(rows_seen) AS rows_seen_per_fire FROM babel7022_fire16
GO
~~START~~
int#!#int
1#!#5
~~END~~


-- TEST 17: Chained triggers - each trigger in the chain fires once
INSERT INTO babel7022_parent17 VALUES (1), (2), (3), (4), (5)
GO
~~ROW COUNT: 5~~


INSERT INTO babel7022_child17 VALUES (1,1), (2,2), (3,3), (4,4), (5,5)
GO
~~ROW COUNT: 5~~


DELETE FROM babel7022_parent17
GO
~~ROW COUNT: 5~~


SELECT COUNT(*) AS audit_count FROM babel7022_audit17
GO
~~START~~
int
5
~~END~~


SELECT COUNT(*) AS audit_fire_count, MAX(rows_seen) AS rows_seen_per_fire FROM babel7022_audit17_fire
GO
~~START~~
int#!#int
1#!#5
~~END~~


-- TEST 18: ON DELETE SET NULL - deleting parents nulls children's FK via one UPDATE, trigger fires once
INSERT INTO babel7022_parent18 VALUES (1), (2), (3), (4), (5)
GO
~~ROW COUNT: 5~~


INSERT INTO babel7022_child18 VALUES (1,1), (2,2), (3,3), (4,4), (5,5)
GO
~~ROW COUNT: 5~~


DELETE FROM babel7022_parent18
GO
~~ROW COUNT: 5~~


SELECT COUNT(*) AS fire_count, MAX(rows_seen) AS rows_seen_per_fire FROM babel7022_fire18
GO
~~START~~
int#!#int
1#!#5
~~END~~


SELECT COUNT(*) AS null_children FROM babel7022_child18 WHERE parent_id IS NULL
GO
~~START~~
int
5
~~END~~


-- TEST 19: ON DELETE SET DEFAULT - deleting parents sets children's FK to default via one UPDATE, trigger fires once
INSERT INTO babel7022_parent19 VALUES (1), (2), (3), (4), (5), (99)
GO
~~ROW COUNT: 6~~


INSERT INTO babel7022_child19 VALUES (1,1), (2,2), (3,3), (4,4), (5,5)
GO
~~ROW COUNT: 5~~


DELETE FROM babel7022_parent19 WHERE id IN (1, 2, 3, 4, 5)
GO
~~ROW COUNT: 5~~


SELECT COUNT(*) AS fire_count, MAX(rows_seen) AS rows_seen_per_fire FROM babel7022_fire19
GO
~~START~~
int#!#int
1#!#5
~~END~~


SELECT COUNT(*) AS default_children FROM babel7022_child19 WHERE parent_id = 99
GO
~~START~~
int
5
~~END~~

