-- tsql user=l3014_1 password=12345678
-- CASE 1: Simple Table/View references inside views
-- CASE 1.1: View referring table (success: ownership chain dbo->dbo)
select * from v3014_1_1;
go
~~START~~
int
~~END~~


-- CASE 1.2: View referring multiple table joined (success: all tables owned by dbo)
select * from v3014_1_2;
go
~~START~~
int#!#int
~~END~~


-- CASE 1.3: Nesting case - one-level (success: view->view->table all dbo owned)
select * from v3014_1_3;
go
~~ERROR (Code: 33557097)~~

~~ERROR (Message: permission denied for view v3014_1_3)~~


-- CASE 1.4: Nesting case - two-level (success: recursive view reference in same owner)
select * from v3014_1_4;
go
~~START~~
int
~~END~~


-- CASE 2: Subquery inside views
-- CASE 2.1: Subquery in SELECT clause (success: correlated subquery within same owner)
select * from v3014_2_1;
go
~~START~~
int#!#int
~~END~~


-- CASE 2.2: Subquery in WHERE clause (success: IN subquery within same owner)
select * from v3014_2_2;
go
~~START~~
int
~~END~~


-- CASE 2.3: Subquery in FROM clause (success: derived table with join in same owner)
select * from v3014_2_3;
go
~~START~~
int#!#int
~~END~~


-- CASE 2.4: Correlated subquery in WHERE (success: EXISTS subquery within same owner)
select * from v3014_2_4;
go
~~START~~
int
~~END~~


-- CASE 2.5: Multiple nested subqueries (success: nested IN clauses all within same owner)
select * from v3014_2_5;
go
~~START~~
int
~~END~~


-- CASE 2.6: Subquery with function (failure: function ownership chain not supported)
select * from v3014_2_6;
go
~~ERROR (Code: 33557097)~~

~~ERROR (Message: permission denied for function f3014_a)~~


-- CASE 2.7: Subquery in HAVING clause (success: aggregate subquery within same owner)
select * from v3014_2_7;
go
~~START~~
int#!#int
~~END~~


-- CASE 2.8: Subquery with set operations (success: UNION and IN within same owner)
select * from v3014_2_8;
go
~~START~~
int
~~END~~


-- CASE 2.9: Simple CTE
SELECT * FROM v3014_2_9;
GO
~~START~~
int
~~END~~


-- CASE 2.10: CTE with JOIN
SELECT * FROM v3014_2_10;
GO
~~START~~
int#!#int
~~END~~


-- CASE 2.11: Nested CTEs
SELECT * FROM v3014_2_11;
GO
~~START~~
int
~~END~~


-- CASE 2.12: CTE with subquery
SELECT * FROM v3014_2_12;
GO
~~START~~
int
~~END~~


-- CASE 2.13: CASE expression with subquery (success: subquery in CASE expression within same owner)
SELECT * FROM v3014_2_13;
GO
~~START~~
int#!#varchar
~~END~~


-- CASE 2.14: EXISTS and NOT EXISTS subqueries in WHERE clause (success: EXISTS and NOT EXISTS subqueries within same owner)
SELECT * FROM v3014_2_14;
GO
~~START~~
int#!#varchar
~~END~~


-- CASE 3: Function/procedure references (negative tests)
-- CASE 3.1: Views with scalar function references
select * from v3014_3_1;
go
~~ERROR (Code: 33557097)~~

~~ERROR (Message: permission denied for function f3014_1)~~


-- CASE 3.2: Views with table-valued function references
select * from v3014_3_2;
go
~~ERROR (Code: 33557097)~~

~~ERROR (Message: permission denied for function f3014_2)~~


-- CASE 3.3: Views with multiple function references
select * from v3014_3_3;
go
~~ERROR (Code: 33557097)~~

~~ERROR (Message: permission denied for function f3014_2)~~


-- CASE 3.4: Views with table-returning function
select * from v3014_3_4;
go
~~ERROR (Code: 33557097)~~

~~ERROR (Message: permission denied for function f3014_5)~~


-- CASE 3.5: Views with nested function calls
select * from v3014_3_5;
go
~~ERROR (Code: 33557097)~~

~~ERROR (Message: permission denied for function f3014_3)~~


-- CASE 3.6: Views with function accessing tables
select * from v3014_3_6;
go
~~ERROR (Code: 33557097)~~

~~ERROR (Message: permission denied for function f3014_4)~~


-- CASE 4: Negative cases where owners are different
-- CASE 4.1: View in dbo schema referencing table in sch3014_b (failure: cross-owner direct reference)
select * from v3014_4_1;
go
~~ERROR (Code: 33557097)~~

~~ERROR (Message: permission denied for table t3014_1)~~


-- CASE 4.2: View in sch3014_b referencing table in dbo schema (failure: cross-owner direct reference)
select * from sch3014_b.v3014_4_2;
go
~~ERROR (Code: 33557097)~~

~~ERROR (Message: permission denied for table t3014_1)~~


-- CASE 4.3: View in dbo schema referencing view in sch3014_b (failure: cross-owner view reference)
select * from v3014_4_3;
go
~~ERROR (Code: 33557097)~~

~~ERROR (Message: permission denied for view v3014_a)~~


-- CASE 4.4: View in sch3014_b referencing view in dbo schema (failure: cross-owner view reference)
select * from sch3014_b.v3014_4_4;
go
~~ERROR (Code: 33557097)~~

~~ERROR (Message: permission denied for view v3014_a)~~


-- CASE 4.5: View in dbo schema with subquery referencing table in sch3014_b (failure: cross-owner subquery)
select * from v3014_4_5;
go
~~ERROR (Code: 33557097)~~

~~ERROR (Message: permission denied for table t3014_2)~~


-- CASE 4.6: View in sch3014_b with subquery referencing table in dbo schema (failure: cross-owner subquery)
select * from sch3014_b.v3014_4_6;
go
~~ERROR (Code: 33557097)~~

~~ERROR (Message: permission denied for table t3014_2)~~


-- CASE 4.7: View in dbo schema referencing tables from both dbo and sch3014_b (failure: mixed owner join)
select * from v3014_4_7;
go
~~ERROR (Code: 33557097)~~

~~ERROR (Message: permission denied for table t3014_2)~~


-- CASE 4.8: View in sch3014_b referencing tables from both sch3014_b and sch3014_c (failure: mixed owner join)
select * from sch3014_b.v3014_4_8;
go
~~ERROR (Code: 33557097)~~

~~ERROR (Message: permission denied for table t3014_2)~~


-- CASE 5: Multi-level ownership chaining scenarios
-- CASE 5.1: Three-level chaining, all dbo owned (success: complete ownership chain)
select * from v3014_5_1c;
go
~~START~~
int
~~END~~


-- CASE 5.2: Three-level mixed ownership dbo->sch3014_b->dbo (failure: broken ownership chain)
select * from v3014_5_2c;
go
~~ERROR (Code: 33557097)~~

~~ERROR (Message: permission denied for view v3014_5_2b)~~


-- CASE 5.3: Three-level mixed ownership with joins (failure: multiple broken chains)
select * from sch3014_c.v3014_5_3c;
go
~~ERROR (Code: 33557097)~~

~~ERROR (Message: permission denied for view v3014_5_3b)~~


-- CASE 5.4: Three-level with subqueries, all dbo owned (success: complete ownership chain with subqueries)
select * from v3014_5_4c;
go
~~START~~
int#!#int
~~END~~


-- CASE 5.5: Three-level mixed ownership with subqueries (failure: broken chains in subqueries)
select * from sch3014_c.v3014_5_5c;
go
~~ERROR (Code: 33557097)~~

~~ERROR (Message: permission denied for view v3014_5_5b)~~


-- CASE 6: Cross-database ownership chain should be disabled
-- CASE 6.1: View in current database referencing table in another database (failure: cross-db reference)
select * from v3014_6_1;
GO
~~ERROR (Code: 33557097)~~

~~ERROR (Message: permission denied for table t3014_cross_db)~~


-- CASE 6.2: View in another database referencing table in current database (failure: cross-db reference)
select * from db3014.dbo.v3014_6_2;
GO
~~ERROR (Code: 33557097)~~

~~ERROR (Message: permission denied for table t3014_1)~~


-- CASE 6.3: View with subquery referencing cross-database table (failure: cross-db in subquery)
select * from v3014_6_3;
GO
~~ERROR (Code: 33557097)~~

~~ERROR (Message: permission denied for table t3014_cross_db)~~


-- CASE 6.4: View with join to cross-database table (failure: cross-db join)
select * from v3014_6_4;
GO
~~ERROR (Code: 33557097)~~

~~ERROR (Message: permission denied for table t3014_cross_db)~~


-- CASE 7: Prep-Exec, Parametrized Query, Dynamic SQL cases
-- CASE 7.1: Parametrized query with ownership chain
-- First execution creates plan
DECLARE @param int = 1;
SELECT * FROM v3014_7_1 WHERE a = @param;
GO
~~START~~
int
~~END~~

-- Second execution uses cached plan
DECLARE @param int = 2;
SELECT * FROM v3014_7_1 WHERE a = @param;
GO
~~START~~
int
~~END~~


-- CASE 7.2: Parametrized query with joins
-- First execution creates plan
DECLARE @param int = 1;
SELECT * FROM v3014_7_2 WHERE a = @param;
GO
~~START~~
int#!#int
~~END~~

-- Second execution uses cached plan
DECLARE @param int = 2;
SELECT * FROM v3014_7_2 WHERE a = @param;
GO
~~START~~
int#!#int
~~END~~


-- CASE 7.3: Prepare/Execute with ownership chain
-- Prepare statement
DECLARE @handle int;
DECLARE @stmt nvarchar(max) = N'SELECT * FROM v3014_7_3 WHERE a = @p1';
EXEC sp_prepare @handle OUTPUT, N'@p1 int', @stmt;
GO
~~START~~
int
~~END~~

-- Execute prepared statement multiple times
EXEC sp_execute 1, 1;
GO
~~START~~
int
~~END~~

EXEC sp_execute 1, 2;
GO
~~START~~
int
~~END~~

-- Deallocate prepared statement
EXEC sp_unprepare 1;
GO

-- CASE 7.4: Dynamic SQL with ownership chain
DECLARE @sql nvarchar(max);
SET @sql = N'SELECT * FROM v3014_7_4 WHERE a = @id';
EXEC sp_executesql @sql, N'@id int', 1;
GO
~~START~~
int
~~END~~


-- CASE 8: DML-only ownership chaining
-- CASE 8.1: View with SELECT, INSERT permissions
SELECT * FROM v3014_8_1;  -- Should succeed
GO
~~START~~
int
~~END~~

INSERT INTO v3014_8_1 VALUES (1);  -- Should succeed
GO
~~ROW COUNT: 1~~

UPDATE v3014_8_1 SET a = 2 WHERE a = 1;  -- Should fail
GO
~~ERROR (Code: 33557097)~~

~~ERROR (Message: permission denied for view v3014_8_1)~~

DELETE FROM v3014_8_1 WHERE a = 1;  -- Should fail
GO
~~ERROR (Code: 33557097)~~

~~ERROR (Message: permission denied for view v3014_8_1)~~


-- CASE 8.2: View with SELECT, UPDATE permissions
SELECT * FROM v3014_8_2;  -- Should succeed
GO
~~START~~
int
1
~~END~~

INSERT INTO v3014_8_2 VALUES (2);  -- Should fail
GO
~~ERROR (Code: 33557097)~~

~~ERROR (Message: permission denied for view v3014_8_2)~~

UPDATE v3014_8_2 SET a = 3 WHERE a = 2;  -- Should succeed
GO
DELETE FROM v3014_8_2 WHERE a = 2;  -- Should fail
GO
~~ERROR (Code: 33557097)~~

~~ERROR (Message: permission denied for view v3014_8_2)~~


-- CASE 8.3: View with SELECT, DELETE permissions
SELECT * FROM v3014_8_3;  -- Should succeed
GO
~~START~~
int
1
~~END~~

INSERT INTO v3014_8_3 VALUES (3);  -- Should fail
GO
~~ERROR (Code: 33557097)~~

~~ERROR (Message: permission denied for view v3014_8_3)~~

UPDATE v3014_8_3 SET a = 4 WHERE a = 3;  -- Should fail
GO
~~ERROR (Code: 33557097)~~

~~ERROR (Message: permission denied for view v3014_8_3)~~

DELETE FROM v3014_8_3 WHERE a = 3;  -- Should succeed
GO

-- CASE 8.4: View with SELECT, INSERT, UPDATE permissions
SELECT * FROM v3014_8_4;  -- Should succeed
GO
~~START~~
int
1
~~END~~

INSERT INTO v3014_8_4 VALUES (4);  -- Should succeed
GO
~~ROW COUNT: 1~~

UPDATE v3014_8_4 SET a = 5 WHERE a = 4;  -- Should succeed
GO
~~ROW COUNT: 1~~

DELETE FROM v3014_8_4 WHERE a = 4;  -- Should fail
GO
~~ERROR (Code: 33557097)~~

~~ERROR (Message: permission denied for view v3014_8_4)~~


-- CASE 9: Trigger ownership chaining scenarios
-- TODO: will be passing after procedure/function support
-- CASE 9.1: AFTER INSERT trigger with same owner
INSERT INTO v3014_9_1 VALUES (1);  -- Should succeed and trigger should fire
GO
~~ROW COUNT: 1~~

~~ROW COUNT: 1~~

SELECT * FROM v3014_9_1;  -- Should show inserted value
GO
~~START~~
int
1
~~END~~

SELECT * FROM t3014_9_2;  -- Should fail (no direct access)
GO
~~ERROR (Code: 33557097)~~

~~ERROR (Message: permission denied for table t3014_9_2)~~


-- CASE 9.2: AFTER UPDATE trigger with different owner
INSERT INTO t3014_9_3 VALUES (1);  -- Setup data
GO
~~ERROR (Code: 33557097)~~

~~ERROR (Message: relation "t3014_9_3" does not exist)~~

UPDATE v3014_9_2 SET a = 2 WHERE a = 1;  -- Should fail due to trigger permission
GO
~~ERROR (Code: 33557097)~~

~~ERROR (Message: permission denied for table t3014_9_3)~~

SELECT * FROM v3014_9_2;  -- Should show original value
GO
~~ERROR (Code: 33557097)~~

~~ERROR (Message: permission denied for table t3014_9_3)~~


-- CASE 9.3: INSTEAD OF trigger same owner
INSERT INTO v3014_9_3 VALUES (1);  -- Should succeed through INSTEAD OF trigger
GO
~~ROW COUNT: 1~~

~~ROW COUNT: 1~~

SELECT * FROM v3014_9_3;  -- Should show inserted value
GO
~~START~~
int
1
~~END~~

SELECT * FROM t3014_9_5;  -- Should fail (no direct access)
GO
~~ERROR (Code: 33557097)~~

~~ERROR (Message: permission denied for table t3014_9_5)~~


-- CASE 9.4: Nested triggers same owner
INSERT INTO t3014_9_6 VALUES (1);  -- Setup data
GO
~~ERROR (Code: 33557097)~~

~~ERROR (Message: permission denied for table t3014_9_6)~~

DELETE FROM v3014_9_4 WHERE a = 1;  -- Should succeed and both triggers should fire
GO
SELECT * FROM v3014_9_4;  -- Should show empty
GO
~~START~~
int
~~END~~

SELECT * FROM t3014_9_7;  -- Should fail (no direct access)
GO
~~ERROR (Code: 33557097)~~

~~ERROR (Message: permission denied for table t3014_9_7)~~

SELECT * FROM t3014_9_8;  -- Should fail (no direct access)
GO
~~ERROR (Code: 33557097)~~

~~ERROR (Message: permission denied for table t3014_9_8)~~

-- terminate-tsql-conn user=l3014_1 password=12345678

-- tsql
---------------------------------------------------------
-- FUNCTION AND PROCEDURE TESTING FOR OWNERSHIP CHAINING
---------------------------------------------------------
CREATE DATABASE db3014_1;
GO
USE db3014_1;
GO

-- Create test users and schemas
CREATE LOGIN l3014_0 WITH PASSWORD = '[REDACTED:PASSWORD]';
CREATE LOGIN l3014_01 WITH PASSWORD = '[REDACTED:PASSWORD]';
CREATE USER u3014_0 FOR LOGIN l3014_0;
CREATE USER u3014_01 FOR LOGIN l3014_01;
GO

-- Create schemas (as admin)
CREATE SCHEMA sch3014_a AUTHORIZATION u3014_0;
CREATE SCHEMA sch3014_a1 AUTHORIZATION u3014_01;
GO


-- Section 1: basic ownership chaining
-- Create objects as dbo
CREATE TABLE dbo.t3014_1 (id INT, val VARCHAR(50));
INSERT INTO dbo.t3014_1 VALUES (1, 'test1'), (2, 'test2');
GO
~~ROW COUNT: 2~~


CREATE PROCEDURE dbo.sp3014_1
AS
BEGIN
    SELECT * FROM dbo.t3014_1;
END;
GO

GRANT EXECUTE ON dbo.sp3014_1 TO u3014_0;
REVOKE SELECT ON dbo.t3014_1 FROM u3014_0;
GO
-- terminate-tsql-conn
-- tsql user=l3014_0 password=[REDACTED:PASSWORD]
-- Test as u3014_0
USE db3014_1;
GO
EXEC dbo.sp3014_1;  -- Should succeed
GO
~~START~~
int#!#varchar
1#!#test1
2#!#test2
~~END~~

SELECT * FROM dbo.t3014_1;  -- Should fail
GO
~~ERROR (Code: 33557097)~~

~~ERROR (Message: permission denied for table t3014_1)~~



-- tsql user=l3014_01 password=[REDACTED:PASSWORD]
-- Test Section 2 : cross schema
-- Create objects as u3014_01
USE db3014_1;
GO
CREATE TABLE sch3014_a1.t3014_3 (id INT, val VARCHAR(50));
INSERT INTO sch3014_a1.t3014_3 VALUES (1, 'test1'), (2, 'test2');
GO
~~ROW COUNT: 2~~

-- terminate-tsql-conn user=l3014_01 password=[REDACTED:PASSWORD]

-- tsql user=l3014_0 password=[REDACTED:PASSWORD]
-- Create procedure as u3014_0
USE db3014_1;
GO
CREATE PROCEDURE sch3014_a.sp3014_3
AS
BEGIN
    SELECT * FROM sch3014_a1.t3014_3;
END;
GO

-- Test the cross-schema access
EXEC sch3014_a.sp3014_3;  -- Should fail due to broken ownership chain
GO
~~ERROR (Code: 33557097)~~

~~ERROR (Message: permission denied for table t3014_3)~~

SELECT * FROM sch3014_a1.t3014_3;
GO
~~ERROR (Code: 33557097)~~

~~ERROR (Message: permission denied for table t3014_3)~~

-- terminate-tsql-conn user=l3014_0 password=[REDACTED:PASSWORD]

-- tsql
USE db3014_1;
GO
drop table dbo.t3014_1
go
drop table sch3014_a1.t3014_3
go
drop procedure dbo.sp3014_1
go
drop procedure sch3014_a.sp3014_3
go
drop schema sch3014_a;
go
drop schema sch3014_a1
go
drop user u3014_0
go
drop user u3014_01
go
drop login l3014_0
GO
drop login l3014_01
GO
USE master;
GO
DROP DATABASE db3014_1;
GO
-- terminate-tsql-conn



-- tsql
---------------------------------------------------------
-- SECTION 2: NESTED OBJECT REFERENCES (CORRECTED)
---------------------------------------------------------
CREATE DATABASE db_nested_ref_v2;
GO
USE db_nested_ref_v2;
GO

-- Create test logins and users
CREATE LOGIN login_nest1_v2 WITH PASSWORD = '[REDACTED:PASSWORD]';
CREATE LOGIN login_nest2_v2 WITH PASSWORD = '[REDACTED:PASSWORD]';
CREATE LOGIN login_nest3_v2 WITH PASSWORD = '[REDACTED:PASSWORD]';
GO

CREATE USER user_nest1_v2 FOR LOGIN login_nest1_v2;
CREATE USER user_nest2_v2 FOR LOGIN login_nest2_v2;
CREATE USER user_nest3_v2 FOR LOGIN login_nest3_v2;
GO

-- Grant database access
GRANT CONNECT TO user_nest1_v2;
GRANT CONNECT TO user_nest2_v2;
GRANT CONNECT TO user_nest3_v2;
GO

-- Create schemas
CREATE SCHEMA schema_nest1_v2 AUTHORIZATION user_nest1_v2;
CREATE SCHEMA schema_nest2_v2 AUTHORIZATION user_nest2_v2;
go
-- terminate-tsql-conn


-- tsql user=login_nest1_v2 password=[REDACTED:PASSWORD]
---------------------------------------------------------
-- 2.1 Function Nesting
---------------------------------------------------------
-- Test Case 2.1.1: Function calling another function (same owner)
USE db_nested_ref_v2;
GO

CREATE FUNCTION schema_nest1_v2.inner_func1()
RETURNS INT
AS
BEGIN
    RETURN 42;
END;
GO

CREATE FUNCTION schema_nest1_v2.outer_func1()
RETURNS INT
AS
BEGIN
    RETURN schema_nest1_v2.inner_func1() + 10;
END;
GO

-- Grant EXECUTE permission on outer function only
-- Do NOT grant permission on inner_func1 to test ownership chaining
GRANT EXECUTE ON schema_nest1_v2.outer_func1 TO user_nest2_v2;
GO
-- terminate-tsql-conn user=login_nest1_v2 password=[REDACTED:PASSWORD]

-- tsql user=login_nest2_v2 password=[REDACTED:PASSWORD]
-- Test as user_nest2_v2
USE db_nested_ref_v2;
GO
SELECT schema_nest1_v2.outer_func1();  -- Should succeed through ownership chain
GO
~~START~~
int
52
~~END~~

SELECT schema_nest1_v2.inner_func1();  -- Should fail (no direct permission)
GO
~~ERROR (Code: 33557097)~~

~~ERROR (Message: permission denied for function inner_func1)~~

-- terminate-tsql-conn user=login_nest2_v2 password=[REDACTED:PASSWORD]

-- tsql user=login_nest2_v2 password=[REDACTED:PASSWORD]
-- Test Case 2.1.2: Function calling multiple functions (mixed ownership)
USE db_nested_ref_v2;
GO
CREATE FUNCTION schema_nest2_v2.func_nest2()
RETURNS INT
AS
BEGIN
    RETURN 20;
END;
GO
-- terminate-tsql-conn user=login_nest2_v2 password=[REDACTED:PASSWORD]

-- tsql user=login_nest1_v2 password=[REDACTED:PASSWORD]
USE db_nested_ref_v2;
GO
CREATE FUNCTION schema_nest1_v2.mixed_func()
RETURNS INT
AS
BEGIN
    RETURN schema_nest1_v2.inner_func1() + schema_nest2_v2.func_nest2();  -- Mixed ownership
END;
GO

-- Test
SELECT schema_nest1_v2.mixed_func();  -- Should fail due to broken ownership chain
GO
~~START~~
int
~~ERROR (Code: 33557097)~~

~~ERROR (Message: permission denied for function func_nest2)~~

-- terminate-tsql-conn user=login_nest1_v2 password=[REDACTED:PASSWORD]

-- tsql user=login_nest1_v2 password=[REDACTED:PASSWORD]
-- Test Case 2.1.3: Deep nesting (3+ levels)
USE db_nested_ref_v2;
GO
CREATE FUNCTION schema_nest1_v2.level1_func()
RETURNS INT
AS
BEGIN
    RETURN 1;
END;
GO

CREATE FUNCTION schema_nest1_v2.level2_func()
RETURNS INT
AS
BEGIN
    RETURN schema_nest1_v2.level1_func() + 1;
END;
GO

CREATE FUNCTION schema_nest1_v2.level3_func()
RETURNS INT
AS
BEGIN
    RETURN schema_nest1_v2.level2_func() + 1;
END;
GO

-- Grant permission only on top-level function
GRANT EXECUTE ON schema_nest1_v2.level3_func TO user_nest3_v2;
GO
-- terminate-tsql-conn user=login_nest1_v2 password=[REDACTED:PASSWORD]

-- tsql user=login_nest3_v2 password=[REDACTED:PASSWORD]
-- Test as user_nest3_v2
USE db_nested_ref_v2;
GO
SELECT schema_nest1_v2.level3_func();  -- Should succeed through ownership chain
GO
~~START~~
int
3
~~END~~

-- terminate-tsql-conn user=login_nest3_v2 password=[REDACTED:PASSWORD]


-- tsql user=login_nest1_v2 password=[REDACTED:PASSWORD]
---------------------------------------------------------
-- 2.2 View Integration
---------------------------------------------------------
-- Test Case 2.2.1: Function inside view (same owner)
USE db_nested_ref_v2;
GO
CREATE FUNCTION schema_nest1_v2.view_func1()
RETURNS INT
AS
BEGIN
    RETURN 100;
END;
GO

CREATE VIEW schema_nest1_v2.view_test1
AS
SELECT schema_nest1_v2.view_func1() AS result;
GO

-- Grant permission on view only
GRANT SELECT ON schema_nest1_v2.view_test1 TO user_nest2_v2;
GO
-- terminate-tsql-conn user=login_nest1_v2 password=[REDACTED:PASSWORD]

-- tsql user=login_nest2_v2 password=[REDACTED:PASSWORD]
-- Test as user_nest2_v2
USE db_nested_ref_v2;
GO
-- Function inside view, currently case not supported
SELECT * FROM schema_nest1_v2.view_test1;  -- Should not succeed through ownership chain
GO
~~ERROR (Code: 33557097)~~

~~ERROR (Message: permission denied for function view_func1)~~

-- terminate-tsql-conn user=login_nest2_v2 password=[REDACTED:PASSWORD]

-- tsql user=login_nest2_v2 password=[REDACTED:PASSWORD]
-- Test Case 2.2.2: Function inside view (different owner)
USE db_nested_ref_v2;
GO
CREATE VIEW schema_nest2_v2.view_test2
AS
SELECT schema_nest1_v2.view_func1() AS result;  -- Different owner
GO

-- Test
SELECT * FROM schema_nest2_v2.view_test2;  -- Should fail without proper permissions
GO
~~ERROR (Code: 33557097)~~

~~ERROR (Message: permission denied for function view_func1)~~

-- terminate-tsql-conn user=login_nest2_v2 password=[REDACTED:PASSWORD]

-- tsql user=login_nest1_v2 password=[REDACTED:PASSWORD]
-- Grant permission and test again
USE db_nested_ref_v2;
GO
GRANT EXECUTE ON schema_nest1_v2.view_func1 TO user_nest2_v2;
GO
-- terminate-tsql-conn user=login_nest1_v2 password=[REDACTED:PASSWORD]

-- tsql user=login_nest2_v2 password=[REDACTED:PASSWORD]
USE db_nested_ref_v2;
GO
SELECT * FROM schema_nest2_v2.view_test2;  -- Should now succeed
GO
~~START~~
int
100
~~END~~

-- terminate-tsql-conn user=login_nest2_v2 password=[REDACTED:PASSWORD]

-- tsql
---------------------------------------------------------
-- Cleanup Section 2
---------------------------------------------------------
USE db_nested_ref_v2;
GO
DROP VIEW schema_nest1_v2.view_test1;
DROP VIEW schema_nest2_v2.view_test2;
DROP FUNCTION schema_nest1_v2.inner_func1;
DROP FUNCTION schema_nest1_v2.outer_func1;
DROP FUNCTION schema_nest2_v2.func_nest2;
DROP FUNCTION schema_nest1_v2.mixed_func;
DROP FUNCTION schema_nest1_v2.level1_func;
DROP FUNCTION schema_nest1_v2.level2_func;
DROP FUNCTION schema_nest1_v2.level3_func;
DROP FUNCTION schema_nest1_v2.view_func1;
DROP SCHEMA schema_nest1_v2;
DROP SCHEMA schema_nest2_v2;
DROP USER user_nest1_v2;
DROP USER user_nest2_v2;
DROP USER user_nest3_v2;
GO
USE master;
GO
DROP DATABASE db_nested_ref_v2;
DROP LOGIN login_nest1_v2;
DROP LOGIN login_nest2_v2;
DROP LOGIN login_nest3_v2;
GO
-- terminate-tsql-conn

-- tsql
---------------------------------------------------------
-- SECTION 3: SCHEMA-LEVEL TESTING (CORRECTED)
---------------------------------------------------------
CREATE DATABASE db_schema_test_v3;
GO
USE db_schema_test_v3;
GO

-- Create test logins and users
CREATE LOGIN login_sch1_v3 WITH PASSWORD = '[REDACTED:PASSWORD]';
CREATE LOGIN login_sch2_v3 WITH PASSWORD = '[REDACTED:PASSWORD]';
GO

CREATE USER user_sch1_v3 FOR LOGIN login_sch1_v3;
CREATE USER user_sch2_v3 FOR LOGIN login_sch2_v3;
GO

-- Grant database access
GRANT CONNECT TO user_sch1_v3;
GRANT CONNECT TO user_sch2_v3;
GO

-- Create schemas
CREATE SCHEMA schema_sch1_v3 AUTHORIZATION user_sch1_v3;
CREATE SCHEMA schema_sch2_v3 AUTHORIZATION user_sch2_v3;
GO


---------------------------------------------------------
-- 3.1 Schema Ownership
---------------------------------------------------------
-- Test Case 3.1.1: Objects in same schema, different owners
-- Create table as dbo in schema owned by user_sch1_v3
CREATE TABLE schema_sch1_v3.table_sch1 (id INT, val VARCHAR(50));
INSERT INTO schema_sch1_v3.table_sch1 VALUES (1, 'test1');
GO
~~ROW COUNT: 1~~


-- terminate-tsql-conn

-- tsql user=login_sch1_v3 password=[REDACTED:PASSWORD]
-- Create procedure as user_sch1_v3
USE db_schema_test_v3;
GO
CREATE PROCEDURE schema_sch1_v3.proc_sch1
AS
BEGIN
    SELECT * FROM schema_sch1_v3.table_sch1;
END;
GO

-- Test - this should pass because as user have the permission on schema
EXEC schema_sch1_v3.proc_sch1; 
GO
~~START~~
int#!#varchar
1#!#test1
~~END~~

-- terminate-tsql-conn

-- tsql user=login_sch1_v3 password=[REDACTED:PASSWORD]
-- Test Case 3.1.2: Objects across different schemas
USE db_schema_test_v3;
GO
CREATE TABLE schema_sch1_v3.cross_table (id INT, val VARCHAR(50));
INSERT INTO schema_sch1_v3.cross_table VALUES (1, 'cross_test');
GO
~~ROW COUNT: 1~~

-- terminate-tsql-conn

-- tsql user=login_sch2_v3 password=[REDACTED:PASSWORD]
USE db_schema_test_v3;
GO
CREATE PROCEDURE schema_sch2_v3.cross_proc
AS
BEGIN
    SELECT * FROM schema_sch1_v3.cross_table;  -- Cross-schema access, different owners
END;
GO

-- Test - this should fail due to cross-schema access with different owners
EXEC schema_sch2_v3.cross_proc;  -- Should fail (cross-schema, different owners)
GO
~~ERROR (Code: 33557097)~~

~~ERROR (Message: permission denied for table cross_table)~~

-- terminate-tsql-conn

-- tsql user=login_sch1_v3 password=[REDACTED:PASSWORD]
-- Test Case 3.1.3: Same owner across different schemas (should work)
USE db_schema_test_v3;
GO
-- Create a procedure in schema_sch1_v3 that accesses table in same schema (same owner)
CREATE PROCEDURE schema_sch1_v3.same_owner_proc
AS
BEGIN
    SELECT * FROM schema_sch1_v3.cross_table;  -- Same owner
END;
GO

-- Grant execute permission to test user
GRANT EXECUTE ON schema_sch1_v3.same_owner_proc TO user_sch2_v3;
GO
-- terminate-tsql-conn

-- tsql user=login_sch2_v3 password=[REDACTED:PASSWORD]
-- Test as user_sch2_v3
USE db_schema_test_v3;
GO
EXEC schema_sch1_v3.same_owner_proc;  -- Should succeed through ownership chain
GO
~~START~~
int#!#varchar
1#!#cross_test
~~END~~

-- terminate-tsql-conn

-- tsql user=login_sch1_v3 password=[REDACTED:PASSWORD]
---------------------------------------------------------
-- 3.2 System Schema Interaction
---------------------------------------------------------
-- Test Case 3.2.1: References to system objects
USE db_schema_test_v3;
GO
CREATE PROCEDURE schema_sch1_v3.sys_proc
AS
BEGIN
    SELECT 1 as test_value;
    SELECT COUNT(*) as table_count FROM sys.tables;
END;
GO

-- Grant execute permission
GRANT EXECUTE ON schema_sch1_v3.sys_proc TO user_sch2_v3;
GO
-- terminate-tsql-conn user=login_sch1_v3 password=[REDACTED:PASSWORD]

-- tsql user=login_sch2_v3 password=[REDACTED:PASSWORD]
-- Test as user_sch2_v3
USE db_schema_test_v3;
GO
EXEC schema_sch1_v3.sys_proc;  -- Should succeed (system objects are accessible)
GO
~~START~~
int
1
~~END~~

~~START~~
int
0
~~END~~

-- terminate-tsql-conn user=login_sch2_v3 password=[REDACTED:PASSWORD]
-- tsql
---------------------------------------------------------
-- Cleanup Section 3
---------------------------------------------------------
USE db_schema_test_v3;
GO
DROP PROCEDURE schema_sch1_v3.proc_sch1;
DROP PROCEDURE schema_sch2_v3.cross_proc;
DROP PROCEDURE schema_sch1_v3.same_owner_proc;
DROP PROCEDURE schema_sch1_v3.sys_proc;
DROP TABLE schema_sch1_v3.table_sch1;
DROP TABLE schema_sch1_v3.cross_table;
DROP SCHEMA schema_sch1_v3;
DROP SCHEMA schema_sch2_v3;
DROP USER user_sch1_v3;
DROP USER user_sch2_v3;
GO
USE master;
GO
DROP DATABASE db_schema_test_v3;
DROP LOGIN login_sch1_v3;
DROP LOGIN login_sch2_v3;
GO
-- terminate-tsql-conn

-- tsql
---------------------------------------------------------
-- SECTION 4: DML OPERATIONS (CORRECTED)
---------------------------------------------------------
CREATE DATABASE db_dml_test_v4;
GO
USE db_dml_test_v4;
GO

-- Create test logins and users
CREATE LOGIN login_dml1_v4 WITH PASSWORD = '[REDACTED:PASSWORD]';
CREATE LOGIN login_dml2_v4 WITH PASSWORD = '[REDACTED:PASSWORD]';
GO

CREATE USER user_dml1_v4 FOR LOGIN login_dml1_v4;
CREATE USER user_dml2_v4 FOR LOGIN login_dml2_v4;
GO

-- Grant database access
GRANT CONNECT TO user_dml1_v4;
GRANT CONNECT TO user_dml2_v4;
GO

-- Create schemas
CREATE SCHEMA schema_dml1_v4 AUTHORIZATION user_dml1_v4;
CREATE SCHEMA schema_dml2_v4 AUTHORIZATION user_dml2_v4;
GO
-- terminate-tsql-conn

-- tsql user=login_dml1_v4 password=[REDACTED:PASSWORD]
---------------------------------------------------------
-- 4.1 Basic DML inside function/procedure
---------------------------------------------------------
-- Test Case 4.1.1: SELECT operations
USE db_dml_test_v4;
GO
CREATE TABLE schema_dml1_v4.select_table (id INT, val VARCHAR(50));
INSERT INTO schema_dml1_v4.select_table VALUES (1, 'test1'), (2, 'test2');
GO
~~ROW COUNT: 2~~


CREATE PROCEDURE schema_dml1_v4.select_proc
AS
BEGIN
    SELECT * FROM schema_dml1_v4.select_table WHERE id = 1;
END;
GO

-- Grant execute permission to test ownership chaining
GRANT EXECUTE ON schema_dml1_v4.select_proc TO user_dml2_v4;
GO
-- terminate-tsql-conn user=login_dml1_v4 password=[REDACTED:PASSWORD]

-- tsql user=login_dml2_v4 password=[REDACTED:PASSWORD]
-- Test as user_dml2_v4
USE db_dml_test_v4;
GO
EXEC schema_dml1_v4.select_proc;  -- Should succeed through ownership chain
GO
~~START~~
int#!#varchar
1#!#test1
~~END~~

-- terminate-tsql-conn user=login_dml2_v4 password=[REDACTED:PASSWORD]

-- tsql user=login_dml1_v4 password=[REDACTED:PASSWORD]
-- Test Case 4.1.2: INSERT operations
USE db_dml_test_v4;
GO
CREATE TABLE schema_dml1_v4.insert_table (id INT, val VARCHAR(50));
GO

CREATE PROCEDURE schema_dml1_v4.insert_proc
AS
BEGIN
    INSERT INTO schema_dml1_v4.insert_table VALUES (1, 'inserted');
END;
GO

-- Grant execute permission
GRANT EXECUTE ON schema_dml1_v4.insert_proc TO user_dml2_v4;
GO
-- terminate-tsql-conn user=login_dml1_v4 password=[REDACTED:PASSWORD]

-- tsql user=login_dml2_v4 password=[REDACTED:PASSWORD]
-- Test as user_dml2_v4
USE db_dml_test_v4;
GO
EXEC schema_dml1_v4.insert_proc;  -- Should succeed through ownership chain
GO
~~ROW COUNT: 1~~

-- terminate-tsql-conn user=login_dml2_v4 password=[REDACTED:PASSWORD]

-- tsql user=login_dml1_v4 password=[REDACTED:PASSWORD]
-- Test Case 4.1.3: UPDATE operations
USE db_dml_test_v4;
GO
CREATE TABLE schema_dml1_v4.update_table (id INT, val VARCHAR(50));
INSERT INTO schema_dml1_v4.update_table VALUES (1, 'original');
GO
~~ROW COUNT: 1~~


CREATE PROCEDURE schema_dml1_v4.update_proc
AS
BEGIN
    UPDATE schema_dml1_v4.update_table SET val = 'updated' WHERE id = 1;
END;
GO

-- Grant execute permission
GRANT EXECUTE ON schema_dml1_v4.update_proc TO user_dml2_v4;
GO
-- terminate-tsql-conn user=login_dml1_v4 password=[REDACTED:PASSWORD]

-- tsql user=login_dml2_v4 password=[REDACTED:PASSWORD]
-- Test as user_dml2_v4
USE db_dml_test_v4;
GO
EXEC schema_dml1_v4.update_proc;  -- Should succeed through ownership chain
GO
~~ROW COUNT: 1~~

-- terminate-tsql-conn user=login_dml2_v4 password=[REDACTED:PASSWORD]

-- tsql user=login_dml1_v4 password=[REDACTED:PASSWORD]
-- Test Case 4.1.4: DELETE operations
USE db_dml_test_v4;
GO
CREATE TABLE schema_dml1_v4.delete_table (id INT, val VARCHAR(50));
INSERT INTO schema_dml1_v4.delete_table VALUES (1, 'to_delete');
GO
~~ROW COUNT: 1~~


CREATE PROCEDURE schema_dml1_v4.delete_proc
AS
BEGIN
    DELETE FROM schema_dml1_v4.delete_table WHERE id = 1;
END;
GO

-- Grant execute permission
GRANT EXECUTE ON schema_dml1_v4.delete_proc TO user_dml2_v4;
GO
-- terminate-tsql-conn user=login_dml1_v4 password=[REDACTED:PASSWORD]

-- tsql user=login_dml2_v4 password=[REDACTED:PASSWORD]
-- Test as user_dml2_v4
USE db_dml_test_v4;
GO
EXEC schema_dml1_v4.delete_proc;  -- Should succeed through ownership chain
GO
~~ROW COUNT: 1~~

-- terminate-tsql-conn user=login_dml2_v4 password=[REDACTED:PASSWORD]


-- tsql user=login_dml1_v4 password=[REDACTED:PASSWORD]
---------------------------------------------------------
-- 4.2 Complex DML
---------------------------------------------------------
-- Test Case 4.2.1: Multi-table operations
USE db_dml_test_v4;
GO
CREATE TABLE schema_dml1_v4.source_table (id INT, val VARCHAR(50));
CREATE TABLE schema_dml1_v4.target_table (id INT, val VARCHAR(50));
INSERT INTO schema_dml1_v4.source_table VALUES (1, 'source1'), (2, 'source2');
GO
~~ROW COUNT: 2~~


CREATE PROCEDURE schema_dml1_v4.multi_table_proc
AS
BEGIN
    INSERT INTO schema_dml1_v4.target_table
    SELECT * FROM schema_dml1_v4.source_table;
    
    UPDATE t SET val = s.val + '_updated'
    FROM schema_dml1_v4.target_table t
    JOIN schema_dml1_v4.source_table s ON t.id = s.id;
END;
GO

-- Grant execute permission
GRANT EXECUTE ON schema_dml1_v4.multi_table_proc TO user_dml2_v4;
GO
-- terminate-tsql-conn user=login_dml1_v4 password=[REDACTED:PASSWORD]

-- tsql user=login_dml2_v4 password=[REDACTED:PASSWORD]
-- Test as user_dml2_v4
USE db_dml_test_v4;
GO
EXEC schema_dml1_v4.multi_table_proc;  -- Should succeed through ownership chain
GO
~~ROW COUNT: 2~~

~~ROW COUNT: 2~~

-- terminate-tsql-conn user=login_dml2_v4 password=[REDACTED:PASSWORD]

-- tsql user=login_dml1_v4 password=[REDACTED:PASSWORD]
-- Test Case 4.2.2: Transaction handling
USE db_dml_test_v4;
GO
CREATE TABLE schema_dml1_v4.trans_table (id INT, val VARCHAR(50));
GO

CREATE PROCEDURE schema_dml1_v4.trans_proc
AS
BEGIN
    BEGIN TRANSACTION;
    INSERT INTO schema_dml1_v4.trans_table VALUES (1, 'trans1');
    INSERT INTO schema_dml1_v4.trans_table VALUES (2, 'trans2');
    COMMIT TRANSACTION;
END;
GO

-- Grant execute permission
GRANT EXECUTE ON schema_dml1_v4.trans_proc TO user_dml2_v4;
GO
-- terminate-tsql-conn user=login_dml1_v4 password=[REDACTED:PASSWORD]

-- tsql user=login_dml2_v4 password=[REDACTED:PASSWORD]
-- Test as user_dml2_v4
USE db_dml_test_v4;
GO
EXEC schema_dml1_v4.trans_proc;  -- Should succeed through ownership chain
GO
~~ROW COUNT: 1~~

~~ROW COUNT: 1~~

-- terminate-tsql-conn user=login_dml2_v4 password=[REDACTED:PASSWORD]

-- tsql
---------------------------------------------------------
-- Cleanup Section 4
---------------------------------------------------------
USE db_dml_test_v4;
GO
DROP PROCEDURE schema_dml1_v4.select_proc;
DROP PROCEDURE schema_dml1_v4.insert_proc;
DROP PROCEDURE schema_dml1_v4.update_proc;
DROP PROCEDURE schema_dml1_v4.delete_proc;
DROP PROCEDURE schema_dml1_v4.multi_table_proc;
DROP PROCEDURE schema_dml1_v4.trans_proc;
DROP TABLE schema_dml1_v4.select_table;
DROP TABLE schema_dml1_v4.insert_table;
DROP TABLE schema_dml1_v4.update_table;
DROP TABLE schema_dml1_v4.delete_table;
DROP TABLE schema_dml1_v4.source_table;
DROP TABLE schema_dml1_v4.target_table;
DROP TABLE schema_dml1_v4.trans_table;
DROP SCHEMA schema_dml1_v4;
DROP SCHEMA schema_dml2_v4;
DROP USER user_dml1_v4;
DROP USER user_dml2_v4;
GO
USE master;
GO
DROP DATABASE db_dml_test_v4;
DROP LOGIN login_dml1_v4;
DROP LOGIN login_dml2_v4;
GO
-- terminate-tsql-conn

-- tsql
---------------------------------------------------------
-- SECTION 5: CROSS-DATABASE SCENARIOS
---------------------------------------------------------
CREATE DATABASE db_cross1;
CREATE DATABASE db_cross2;
GO

-- Setup db_cross1
USE db_cross1;
GO
CREATE LOGIN login_cross1 WITH PASSWORD = '[REDACTED:PASSWORD]';
CREATE LOGIN login_cross2 WITH PASSWORD = '[REDACTED:PASSWORD]';
CREATE USER user_cross1 FOR LOGIN login_cross1;
CREATE USER user_cross2 FOR LOGIN login_cross2;
GO
CREATE SCHEMA schema_cross1 AUTHORIZATION user_cross1;
GO

-- Setup db_cross2
USE db_cross2;
GO
CREATE USER user_cross1 FOR LOGIN login_cross1;
CREATE USER user_cross2 FOR LOGIN login_cross2;
GO
CREATE SCHEMA schema_cross1 AUTHORIZATION user_cross1;
GO


---------------------------------------------------------
-- 5.1 Basic Cross-DB Access
---------------------------------------------------------
-- Test Case 5.1.1: Function accessing table in different database
-- Create table in db_cross2
USE db_cross2;
GO
-- terminate-tsql-conn

-- tsql user=login_cross1 password=[REDACTED:PASSWORD]
USE db_cross2;
GO
CREATE TABLE schema_cross1.cross_table (id INT, val VARCHAR(50));
INSERT INTO schema_cross1.cross_table VALUES (1, 'cross_test');
GO
~~ROW COUNT: 1~~

-- terminate-tsql-conn user=login_cross1 password=[REDACTED:PASSWORD]

-- tsql user=login_cross1 password=[REDACTED:PASSWORD]
-- Create function in db_cross1
USE db_cross1;
GO
CREATE FUNCTION schema_cross1.cross_func()
RETURNS TABLE
AS
RETURN (SELECT * FROM db_cross2.schema_cross1.cross_table);
GO

-- Test
SELECT * FROM schema_cross1.cross_func();  -- Should succeed (same login across databases)
GO
~~START~~
int#!#varchar
1#!#cross_test
~~END~~

-- terminate-tsql-conn user=login_cross1 password=[REDACTED:PASSWORD]

-- tsql user=login_cross1 password=[REDACTED:PASSWORD]
-- Test Case 5.1.2: Procedure accessing table in different database
USE db_cross1;
GO
CREATE PROCEDURE schema_cross1.cross_proc
AS
BEGIN
    SELECT * FROM db_cross2.schema_cross1.cross_table;
END;
GO
GRANT EXECUTE ON schema_cross1.cross_proc TO user_cross2;
go

-- terminate-tsql-conn user=login_cross1 password=[REDACTED:PASSWORD]

-- tsql user=login_cross2 password=[REDACTED:PASSWORD]
-- Test as user_cross2
USE db_cross1;
GO
EXEC schema_cross1.cross_proc;
GO
~~ERROR (Code: 33557097)~~

~~ERROR (Message: permission denied for table cross_table)~~



---------------------------------------------------------
-- 5.2 Mixed Database Access
---------------------------------------------------------
-- Test Case 5.2.1: Function accessing objects across multiple databases
-- Create additional objects
USE db_cross1;
GO
-- terminate-tsql-conn user=login_cross2 password=[REDACTED:PASSWORD]

-- tsql user=login_cross1 password=[REDACTED:PASSWORD]
USE db_cross1;
GO
CREATE TABLE schema_cross1.local_table (id INT, val VARCHAR(50));
INSERT INTO schema_cross1.local_table VALUES (1, 'local_test');
GO
~~ROW COUNT: 1~~


CREATE PROCEDURE schema_cross1.mixed_proc
AS
BEGIN
    SELECT 'Local' AS source, * FROM schema_cross1.local_table
    UNION ALL
    SELECT 'Cross' AS source, * FROM db_cross2.schema_cross1.cross_table;
END;
GO
-- terminate-tsql-conn user=login_cross1 password=[REDACTED:PASSWORD]

-- tsql user=login_cross2 password=[REDACTED:PASSWORD]
-- Test as user_cross2
USE db_cross1;
GO
EXEC schema_cross1.mixed_proc;
GO
~~ERROR (Code: 33557097)~~

~~ERROR (Message: permission denied for procedure mixed_proc)~~

-- terminate-tsql-conn user=login_cross2 password=[REDACTED:PASSWORD]

-- tsql
---------------------------------------------------------
-- Cleanup Section 5
---------------------------------------------------------
USE db_cross1;
GO
DROP FUNCTION schema_cross1.cross_func;
DROP PROCEDURE schema_cross1.cross_proc;
DROP PROCEDURE schema_cross1.mixed_proc;
DROP TABLE schema_cross1.local_table;
DROP SCHEMA schema_cross1;
DROP USER user_cross1;
DROP USER user_cross2;
GO

USE db_cross2;
GO
DROP TABLE schema_cross1.cross_table;
DROP SCHEMA schema_cross1;
DROP USER user_cross1;
DROP USER user_cross2;
GO

USE master;
GO
DROP DATABASE db_cross1;
DROP DATABASE db_cross2;
DROP LOGIN login_cross1;
DROP LOGIN login_cross2;
GO
-- terminate-tsql-conn


-- tsql
---------------------------------------------------------
-- MISSING TEST CASES - CORRECTED VERSION
---------------------------------------------------------
CREATE DATABASE db_missing_tests_v2;
GO
USE db_missing_tests_v2;
GO

-- Create test logins and users
CREATE LOGIN login_test_a_v2 WITH PASSWORD = '[REDACTED:PASSWORD]';
CREATE LOGIN login_test_b_v2 WITH PASSWORD = '[REDACTED:PASSWORD]';
GO

CREATE USER user_test_a_v2 FOR LOGIN login_test_a_v2;
CREATE USER user_test_b_v2 FOR LOGIN login_test_b_v2;
GO

-- Grant database access
GRANT CONNECT TO user_test_a_v2;
GRANT CONNECT TO user_test_b_v2;
GO

-- Create schemas
CREATE SCHEMA schema_test_a_v2 AUTHORIZATION user_test_a_v2;
CREATE SCHEMA schema_test_b_v2 AUTHORIZATION user_test_b_v2;
GO
-- terminate-tsql-conn


-- tsql user=login_test_a_v2 password=[REDACTED:PASSWORD]
---------------------------------------------------------
-- Testing Table-Valued Functions
---------------------------------------------------------
-- Test Case: Inline Table-Valued Function
USE db_missing_tests_v2;
GO
CREATE TABLE schema_test_a_v2.products (id INT, name VARCHAR(50), price DECIMAL(10,2));
INSERT INTO schema_test_a_v2.products VALUES (1, 'Product1', 10.50), (2, 'Product2', 20.75);
GO
~~ROW COUNT: 2~~


-- Inline Table-Valued Function
CREATE FUNCTION schema_test_a_v2.get_products_by_price(@min_price DECIMAL(10,2))
RETURNS TABLE
AS
RETURN (SELECT * FROM schema_test_a_v2.products WHERE price >= @min_price);
GO

-- CORRECTED: Grant EXECUTE permission for functions
GRANT EXECUTE ON schema_test_a_v2.get_products_by_price TO user_test_b_v2;
GO
-- terminate-tsql-conn user=login_test_a_v2 password=[REDACTED:PASSWORD]

-- tsql user=login_test_b_v2 password=[REDACTED:PASSWORD]
-- Test as user_test_b_v2
USE db_missing_tests_v2;
GO
SELECT * FROM schema_test_a_v2.get_products_by_price(15.00);  -- Should succeed through ownership chain
GO
~~START~~
int#!#varchar#!#numeric
2#!#Product2#!#20.75000000
~~END~~

SELECT * FROM schema_test_a_v2.products;  -- Should fail (no direct permission)
GO
~~ERROR (Code: 33557097)~~

~~ERROR (Message: permission denied for table products)~~

-- terminate-tsql-conn user=login_test_b_v2 password=[REDACTED:PASSWORD]

-- tsql user=login_test_a_v2 password=[REDACTED:PASSWORD]
-- Test Case: Multi-Statement Table-Valued Function
USE db_missing_tests_v2;
GO
CREATE FUNCTION schema_test_a_v2.get_product_summary()
RETURNS @result TABLE (total_products INT, avg_price DECIMAL(10,2))
AS
BEGIN
    INSERT @result
    SELECT COUNT(*), AVG(price) FROM schema_test_a_v2.products;
    RETURN;
END;
GO

-- CORRECTED: Grant EXECUTE permission for functions
GRANT EXECUTE ON schema_test_a_v2.get_product_summary TO user_test_b_v2;
GO
-- terminate-tsql-conn user=login_test_a_v2 password=[REDACTED:PASSWORD]

-- tsql user=login_test_b_v2 password=[REDACTED:PASSWORD]
-- Test as user_test_b_v2
USE db_missing_tests_v2;
GO
SELECT * FROM schema_test_a_v2.get_product_summary();  -- Should succeed through ownership chain
GO
~~START~~
int#!#numeric
~~ERROR (Code: 33557097)~~

~~ERROR (Message: permission denied for table @result_get_product_summary)~~

-- terminate-tsql-conn user=login_test_b_v2 password=[REDACTED:PASSWORD]


-- tsql user=login_test_a_v2 password=[REDACTED:PASSWORD]
---------------------------------------------------------
-- Testing Triggers
---------------------------------------------------------
-- Test Case: AFTER INSERT Trigger
USE db_missing_tests_v2;
GO
CREATE TABLE schema_test_a_v2.orders (id INT, product_id INT, quantity INT);
CREATE TABLE schema_test_a_v2.audit_log (log_id INT IDENTITY(1,1), action VARCHAR(50), table_name VARCHAR(50));
GO

CREATE TRIGGER schema_test_a_v2.trg_orders_audit
ON schema_test_a_v2.orders
AFTER INSERT
AS
BEGIN
    INSERT INTO schema_test_a_v2.audit_log (action, table_name)
    SELECT 'INSERT', 'orders' FROM inserted;
END;
GO

-- Grant INSERT permission on orders table
GRANT INSERT ON schema_test_a_v2.orders TO user_test_b_v2;
GO
-- terminate-tsql-conn user=login_test_a_v2 password=[REDACTED:PASSWORD]

-- tsql user=login_test_b_v2 password=[REDACTED:PASSWORD]
-- Test as user_test_b_v2
USE db_missing_tests_v2;
GO
INSERT INTO schema_test_a_v2.orders VALUES (1, 1, 5);  -- Should succeed, trigger works through ownership chain
GO
~~ROW COUNT: 1~~

~~ROW COUNT: 1~~

-- terminate-tsql-conn user=login_test_b_v2 password=[REDACTED:PASSWORD]

-- tsql user=login_test_a_v2 password=[REDACTED:PASSWORD]
-- Verify trigger worked
USE db_missing_tests_v2;
GO
SELECT * FROM schema_test_a_v2.audit_log;  -- Should show the audit record
GO
~~START~~
int#!#varchar#!#varchar
1#!#INSERT#!#orders
~~END~~

-- terminate-tsql-conn user=login_test_a_v2 password=[REDACTED:PASSWORD]


-- tsql user=login_test_a_v2 password=[REDACTED:PASSWORD]
---------------------------------------------------------
-- Testing Dynamic SQL (LIMITATIONS IDENTIFIED)
---------------------------------------------------------
-- Test Case: Simple dynamic SQL in stored procedure
USE db_missing_tests_v2;
GO
CREATE PROCEDURE schema_test_a_v2.dynamic_select_proc(@table_name NVARCHAR(50))
AS
BEGIN
    DECLARE @sql NVARCHAR(MAX);
    SET @sql = N'SELECT COUNT(*) FROM schema_test_a_v2.' + @table_name;
    EXEC sp_executesql @sql;
END;
GO

-- Grant execute permission
GRANT EXECUTE ON schema_test_a_v2.dynamic_select_proc TO user_test_b_v2;
GO
-- terminate-tsql-conn user=login_test_a_v2 password=[REDACTED:PASSWORD]

-- tsql user=login_test_b_v2 password=[REDACTED:PASSWORD]
-- Test as user_test_b_v2
USE db_missing_tests_v2;
GO
-- NOTE: This may fail because dynamic SQL might not follow ownership chaining rules
EXEC schema_test_a_v2.dynamic_select_proc 'products';
GO
~~ERROR (Code: 33557097)~~

~~ERROR (Message: permission denied for table products)~~

-- terminate-tsql-conn user=login_test_b_v2 password=[REDACTED:PASSWORD]

-- tsql user=login_test_a_v2 password=[REDACTED:PASSWORD]
-- Test Case: Regular (non-dynamic) procedure for comparison
USE db_missing_tests_v2;
GO
CREATE PROCEDURE schema_test_a_v2.regular_select_proc
AS
BEGIN
    SELECT COUNT(*) FROM schema_test_a_v2.products;
END;
GO

-- Grant execute permission
GRANT EXECUTE ON schema_test_a_v2.regular_select_proc TO user_test_b_v2;
GO
-- terminate-tsql-conn user=login_test_a_v2 password=[REDACTED:PASSWORD]

-- tsql user=login_test_b_v2 password=[REDACTED:PASSWORD]
-- Test as user_test_b_v2
USE db_missing_tests_v2;
GO
EXEC schema_test_a_v2.regular_select_proc;  -- Should succeed through ownership chain
GO
~~START~~
int
2
~~END~~

-- terminate-tsql-conn user=login_test_b_v2 password=[REDACTED:PASSWORD]

-- tsql
---------------------------------------------------------
-- Cleanup
---------------------------------------------------------
USE db_missing_tests_v2;
GO
DROP TRIGGER schema_test_a_v2.trg_orders_audit;
DROP FUNCTION schema_test_a_v2.get_products_by_price;
DROP FUNCTION schema_test_a_v2.get_product_summary;
DROP PROCEDURE schema_test_a_v2.dynamic_select_proc;
DROP PROCEDURE schema_test_a_v2.regular_select_proc;
DROP TABLE schema_test_a_v2.products;
DROP TABLE schema_test_a_v2.orders;
DROP TABLE schema_test_a_v2.audit_log;
DROP SCHEMA schema_test_a_v2;
DROP SCHEMA schema_test_b_v2;
DROP USER user_test_a_v2;
DROP USER user_test_b_v2;
GO
USE master;
GO
DROP DATABASE db_missing_tests_v2;
DROP LOGIN login_test_a_v2;
DROP LOGIN login_test_b_v2;
GO
-- terminate-tsql-conn
