
-- Verify: Test PERSISTED computed columns with deterministic STABLE functions
SET QUOTED_IDENTIFIER ON
SET CONCAT_NULL_YIELDS_NULL ON
SET ANSI_NULLS ON
SET ANSI_PADDING ON
SET ANSI_WARNINGS ON
SET ARITHABORT ON
SET NUMERIC_ROUNDABORT OFF
GO


-- DDL: Should FAIL cases
-- CONVERT without explicit style (non-deterministic)
CREATE TABLE pcc_bad1 (d DATE, c AS CONVERT(VARCHAR(10), d) PERSISTED)
GO
~~ERROR (Code: 33557097)~~

~~ERROR (Message: generation expression is not immutable)~~


-- GETDATE (volatile)
CREATE TABLE pcc_bad2 (c AS GETDATE() PERSISTED)
GO
~~ERROR (Code: 33557097)~~

~~ERROR (Message: generation expression is not immutable)~~


-- NEWID (volatile)
CREATE TABLE pcc_bad3 (c AS NEWID() PERSISTED)
GO
~~ERROR (Code: 33557097)~~

~~ERROR (Message: generation expression is not immutable)~~


-- QUOTED_IDENTIFIER OFF at CREATE time
SET QUOTED_IDENTIFIER OFF
GO
CREATE TABLE pcc_bad4 (a VARCHAR(10), b VARCHAR(10), c AS (a+b) PERSISTED)
GO
~~ERROR (Code: 33557097)~~

~~ERROR (Message: CREATE/ALTER TABLE failed because the following SET options have incorrect settings: 'QUOTED_IDENTIFIER')~~

SET QUOTED_IDENTIFIER ON
GO

-- CONCAT_NULL_YIELDS_NULL OFF at CREATE time
SET CONCAT_NULL_YIELDS_NULL OFF
GO
CREATE TABLE pcc_bad5 (a VARCHAR(10), b VARCHAR(10), c AS (a+b) PERSISTED)
GO
~~ERROR (Code: 33557097)~~

~~ERROR (Message: CREATE/ALTER TABLE failed because the following SET options have incorrect settings: 'CONCAT_NULL_YIELDS_NULL')~~

SET CONCAT_NULL_YIELDS_NULL ON
GO

-- Bulk load table (with index on computed column for index tests)
CREATE TABLE pcc_bulk (
    id INT,
    a VARCHAR(20),
    b VARCHAR(20),
    c AS (a + b) PERSISTED
)
GO

CREATE INDEX ix_pcc_bulk_c ON pcc_bulk(c)
GO


-- DML GUC enforcement: INSERT / UPDATE / DELETE
-- Bulk: 10 non-null rows
INSERT INTO pcc_bulk (id, a, b) VALUES (1, 'A1', 'B1')
INSERT INTO pcc_bulk (id, a, b) VALUES (2, 'A2', 'B2')
INSERT INTO pcc_bulk (id, a, b) VALUES (3, 'A3', 'B3')
INSERT INTO pcc_bulk (id, a, b) VALUES (4, 'A4', 'B4')
INSERT INTO pcc_bulk (id, a, b) VALUES (5, 'A5', 'B5')
INSERT INTO pcc_bulk (id, a, b) VALUES (6, 'A6', 'B6')
INSERT INTO pcc_bulk (id, a, b) VALUES (7, 'A7', 'B7')
INSERT INTO pcc_bulk (id, a, b) VALUES (8, 'A8', 'B8')
INSERT INTO pcc_bulk (id, a, b) VALUES (9, 'A9', 'B9')
INSERT INTO pcc_bulk (id, a, b) VALUES (10, 'A10', 'B10')
GO
~~ROW COUNT: 1~~

~~ROW COUNT: 1~~

~~ROW COUNT: 1~~

~~ROW COUNT: 1~~

~~ROW COUNT: 1~~

~~ROW COUNT: 1~~

~~ROW COUNT: 1~~

~~ROW COUNT: 1~~

~~ROW COUNT: 1~~

~~ROW COUNT: 1~~


-- Bulk: 10 null rows (c = NULL because b is NULL and CONCAT_NULL_YIELDS_NULL ON)
INSERT INTO pcc_bulk (id, a, b) VALUES (11, 'X11', NULL)
INSERT INTO pcc_bulk (id, a, b) VALUES (12, 'X12', NULL)
INSERT INTO pcc_bulk (id, a, b) VALUES (13, 'X13', NULL)
INSERT INTO pcc_bulk (id, a, b) VALUES (14, 'X14', NULL)
INSERT INTO pcc_bulk (id, a, b) VALUES (15, 'X15', NULL)
INSERT INTO pcc_bulk (id, a, b) VALUES (16, 'X16', NULL)
INSERT INTO pcc_bulk (id, a, b) VALUES (17, 'X17', NULL)
INSERT INTO pcc_bulk (id, a, b) VALUES (18, 'X18', NULL)
INSERT INTO pcc_bulk (id, a, b) VALUES (19, 'X19', NULL)
INSERT INTO pcc_bulk (id, a, b) VALUES (20, 'X20', NULL)
GO
~~ROW COUNT: 1~~

~~ROW COUNT: 1~~

~~ROW COUNT: 1~~

~~ROW COUNT: 1~~

~~ROW COUNT: 1~~

~~ROW COUNT: 1~~

~~ROW COUNT: 1~~

~~ROW COUNT: 1~~

~~ROW COUNT: 1~~

~~ROW COUNT: 1~~


-- INSERT with correct GUCs (should PASS)
INSERT INTO pcc_concat (a, b) VALUES ('New', 'Row')
GO
~~ROW COUNT: 1~~


-- INSERT with CONCAT_NULL_YIELDS_NULL OFF (should FAIL)
SET CONCAT_NULL_YIELDS_NULL OFF
GO
INSERT INTO pcc_concat (a, b) VALUES ('Bad', 'Insert')
GO
~~ERROR (Code: 33557097)~~

~~ERROR (Message: INSERT failed because the following SET options have incorrect settings: 'CONCAT_NULL_YIELDS_NULL')~~

SET CONCAT_NULL_YIELDS_NULL ON
GO

-- UPDATE with CONCAT_NULL_YIELDS_NULL OFF (should FAIL)
SET CONCAT_NULL_YIELDS_NULL OFF
GO
UPDATE pcc_concat SET a = 'Changed' WHERE id = 1
GO
~~ERROR (Code: 33557097)~~

~~ERROR (Message: UPDATE failed because the following SET options have incorrect settings: 'CONCAT_NULL_YIELDS_NULL')~~

SET CONCAT_NULL_YIELDS_NULL ON
GO

-- DELETE with CONCAT_NULL_YIELDS_NULL OFF (should FAIL)
SET CONCAT_NULL_YIELDS_NULL OFF
GO
DELETE FROM pcc_concat WHERE id = 3
GO
~~ERROR (Code: 33557097)~~

~~ERROR (Message: DELETE failed because the following SET options have incorrect settings: 'CONCAT_NULL_YIELDS_NULL')~~

SET CONCAT_NULL_YIELDS_NULL ON
GO

-- INSERT with QUOTED_IDENTIFIER OFF (should FAIL)
SET QUOTED_IDENTIFIER OFF
GO
INSERT INTO pcc_concat (a, b) VALUES ('qi', 'off')
GO
~~ERROR (Code: 33557097)~~

~~ERROR (Message: INSERT failed because the following SET options have incorrect settings: 'QUOTED_IDENTIFIER')~~

SET QUOTED_IDENTIFIER ON
GO

-- Multiple GUCs wrong simultaneously (should FAIL with multiple GUCs listed)
SET QUOTED_IDENTIFIER OFF
SET CONCAT_NULL_YIELDS_NULL OFF
GO
INSERT INTO pcc_concat (a, b) VALUES ('multi', 'guc')
GO
~~ERROR (Code: 33557097)~~

~~ERROR (Message: INSERT failed because the following SET options have incorrect settings: 'QUOTED_IDENTIFIER, CONCAT_NULL_YIELDS_NULL')~~

SET QUOTED_IDENTIFIER ON
SET CONCAT_NULL_YIELDS_NULL ON
GO

-- DML on table WITHOUT computed cols (should PASS regardless of GUC)
SET CONCAT_NULL_YIELDS_NULL OFF
GO
INSERT INTO pcc_normal VALUES (2, 'no_computed_col')
GO
~~ROW COUNT: 1~~

SET CONCAT_NULL_YIELDS_NULL ON
GO


-- SELECT re-evaluation
-- SELECT with correct GUCs (uses stored values)
SELECT id, a, b, c FROM pcc_concat ORDER BY id
GO
~~START~~
int#!#varchar#!#varchar#!#varchar
1#!#Hello#!#World#!#HelloWorld
2#!#X#!#<NULL>#!#<NULL>
3#!#A#!#B#!#AB
4#!#<NULL>#!#test#!#<NULL>
5#!#New#!#Row#!#NewRow
~~END~~


-- SELECT with CONCAT_NULL_YIELDS_NULL OFF (re-evaluates)
SET CONCAT_NULL_YIELDS_NULL OFF
GO
SELECT id, a, b, c FROM pcc_concat ORDER BY id
GO
~~START~~
int#!#varchar#!#varchar#!#varchar
1#!#Hello#!#World#!#HelloWorld
2#!#X#!#<NULL>#!#X
3#!#A#!#B#!#AB
4#!#<NULL>#!#test#!#test
5#!#New#!#Row#!#NewRow
~~END~~


-- WHERE clause uses re-evaluated value
SELECT id, a, b, c FROM pcc_concat WHERE c = 'X'
GO
~~START~~
int#!#varchar#!#varchar#!#varchar
2#!#X#!#<NULL>#!#X
~~END~~


-- COUNT with re-evaluation (all rows non-null with GUC OFF)
SELECT COUNT(*) AS cnt FROM pcc_concat WHERE c IS NOT NULL
GO
~~START~~
int
5
~~END~~

SET CONCAT_NULL_YIELDS_NULL ON
GO

-- COUNT with correct GUC (NULL rows stay NULL)
SELECT COUNT(*) AS cnt FROM pcc_concat WHERE c IS NOT NULL
GO
~~START~~
int
3
~~END~~



-- Verify all whitelisted function outputs
-- SELECT * FROM pcc_convert ORDER BY id
-- GO
SELECT * FROM pcc_eomonth ORDER BY id
GO
~~START~~
int#!#date#!#date
1#!#2024-01-15#!#2024-01-31
2#!#2024-02-10#!#2024-02-29
~~END~~



-- SELECT * FROM pcc_cast ORDER BY id
-- GO
SELECT * FROM pcc_concatws ORDER BY id
GO
~~START~~
int#!#varchar#!#varchar#!#varchar#!#varchar
1#!#one#!#two#!#three#!#one-two-three
2#!#x#!#<NULL>#!#z#!#x-z
~~END~~






-- SELECT * FROM pcc_datetrunc ORDER BY id
-- GO
-- SELECT * FROM pcc_castbig ORDER BY id
-- GO
-- SELECT * FROM pcc_castsmall ORDER BY id
-- GO
-- SELECT * FROM pcc_conv_money ORDER BY id
-- GO
-- Query plan verification (BABELFISH_SHOWPLAN_ALL)
SELECT set_config('max_parallel_workers_per_gather', '0', false)
GO
~~START~~
text
0
~~END~~


-- Plan with GUC=ON (no re-evaluation, uses stored column)
SET BABELFISH_SHOWPLAN_ALL ON
GO
SELECT COUNT(*) FROM pcc_concat WHERE c IS NOT NULL
GO
~~START~~
text
Query Text: SELECT COUNT(*) FROM pcc_concat WHERE c IS NOT NULL
Aggregate  (cost=17.87..17.88 rows=1 width=4)
  ->  Seq Scan on pcc_concat  (cost=0.00..16.30 rows=627 width=0)
        Filter: (c IS NOT NULL)
~~END~~

~~START~~
text
Babelfish T-SQL Batch Parsing Time: 0.105 ms
~~END~~

SET BABELFISH_SHOWPLAN_ALL OFF
GO

-- Plan with GUC=OFF (expression substitution, re-evaluation)
SET CONCAT_NULL_YIELDS_NULL OFF
GO
SET BABELFISH_SHOWPLAN_ALL ON
GO
SELECT COUNT(*) FROM pcc_concat WHERE c IS NOT NULL
GO
~~START~~
text
Query Text: SELECT COUNT(*) FROM pcc_concat WHERE c IS NOT NULL
Aggregate  (cost=19.45..19.46 rows=1 width=4)
  ->  Seq Scan on pcc_concat  (cost=0.00..17.88 rows=627 width=0)
        Filter: ((babelfish_concat_wrapper((a)::text, (b)::text))::"varchar" IS NOT NULL)
~~END~~

~~START~~
text
Babelfish T-SQL Batch Parsing Time: 0.066 ms
~~END~~

SET BABELFISH_SHOWPLAN_ALL OFF
GO
SET CONCAT_NULL_YIELDS_NULL ON
GO


-- Index on computed column: query plan with and without re-evaluation
-- Force index usage so the plan is deterministic
SELECT set_config('enable_seqscan', 'off', false)
GO
~~START~~
text
off
~~END~~


-- Plan with GUC=ON (index on stored column can be used)
SET BABELFISH_SHOWPLAN_ALL ON
GO
SELECT id FROM pcc_bulk WHERE c = 'A1B1'
GO
~~START~~
text
Query Text: SELECT id FROM pcc_bulk WHERE c = 'A1B1'
Bitmap Heap Scan on pcc_bulk  (cost=4.17..11.28 rows=3 width=4)
  Recheck Cond: (c = 'A1B1'::"varchar")
  ->  Bitmap Index Scan on ix_pcc_bulk_cpcc_bulk7b655bdafee388b7f1628f324ee38b35  (cost=0.00..4.17 rows=3 width=0)
        Index Cond: (c = 'A1B1'::"varchar")
~~END~~

~~START~~
text
Babelfish T-SQL Batch Parsing Time: 0.074 ms
~~END~~

SET BABELFISH_SHOWPLAN_ALL OFF
GO

-- Plan with GUC=OFF 
SET CONCAT_NULL_YIELDS_NULL OFF
GO
SET BABELFISH_SHOWPLAN_ALL ON
GO
SELECT id FROM pcc_bulk WHERE c = 'A1B1'
GO
~~START~~
text
Query Text: SELECT id FROM pcc_bulk WHERE c = 'A1B1'
Seq Scan on pcc_bulk  (cost=0.00..19.45 rows=3 width=4)
  Disabled: true
  Filter: ((babelfish_concat_wrapper((a)::text, (b)::text))::"varchar" = 'A1B1'::"varchar")
~~END~~

~~START~~
text
Babelfish T-SQL Batch Parsing Time: 0.068 ms
~~END~~

SET BABELFISH_SHOWPLAN_ALL OFF
GO
SET CONCAT_NULL_YIELDS_NULL ON
GO

SELECT set_config('enable_seqscan', 'on', false)
GO
~~START~~
text
on
~~END~~


-- Index correctness: same point query returns same row regardless of GUC
SELECT id, c FROM pcc_bulk WHERE c = 'A1B1'
GO
~~START~~
int#!#varchar
1#!#A1B1
~~END~~

SET CONCAT_NULL_YIELDS_NULL OFF
GO
SELECT id, c FROM pcc_bulk WHERE c = 'A1B1'
GO
~~START~~
int#!#varchar
1#!#A1B1
~~END~~

SET CONCAT_NULL_YIELDS_NULL ON
GO

-- COUNT non-null with GUC=ON
SELECT COUNT(*) AS cnt FROM pcc_bulk WHERE c IS NOT NULL
GO
~~START~~
int
10
~~END~~


-- COUNT non-null with GUC=OFF
SET CONCAT_NULL_YIELDS_NULL OFF
GO
SELECT COUNT(*) AS cnt FROM pcc_bulk WHERE c IS NOT NULL
GO
~~START~~
int
20
~~END~~

SET CONCAT_NULL_YIELDS_NULL ON
GO


-- Views
-- View with correct GUCs
SELECT COUNT(*) AS cnt FROM pcc_view WHERE c IS NOT NULL
GO
~~START~~
int
3
~~END~~


-- View with wrong GUC (re-evaluates through view)
SET CONCAT_NULL_YIELDS_NULL OFF
GO
SELECT COUNT(*) AS cnt FROM pcc_view WHERE c IS NOT NULL
GO
~~START~~
int
5
~~END~~

SET CONCAT_NULL_YIELDS_NULL ON
GO


-- CTEs
-- CTE with correct GUCs
;WITH cte AS (SELECT c FROM pcc_concat WHERE c IS NOT NULL)
SELECT COUNT(*) AS cnt FROM cte
GO
~~START~~
int
3
~~END~~


-- CTE with wrong GUC (re-evaluates)
SET CONCAT_NULL_YIELDS_NULL OFF
GO
;WITH cte AS (SELECT c FROM pcc_concat WHERE c IS NOT NULL)
SELECT COUNT(*) AS cnt FROM cte
GO
~~START~~
int
5
~~END~~

SET CONCAT_NULL_YIELDS_NULL ON
GO


-- INSERT...SELECT
CREATE TABLE pcc_dst (val VARCHAR(50))
GO

-- INSERT...SELECT with correct GUCs
INSERT INTO pcc_dst SELECT c FROM pcc_concat WHERE a = 'Hello'
SELECT * FROM pcc_dst
DELETE FROM pcc_dst
GO
~~ROW COUNT: 1~~

~~START~~
varchar
HelloWorld
~~END~~

~~ROW COUNT: 1~~


-- INSERT...SELECT with wrong GUC (pcc_dst has no computed cols so INSERT passes)
SET CONCAT_NULL_YIELDS_NULL OFF
GO
INSERT INTO pcc_dst SELECT c FROM pcc_concat WHERE a = 'X'
GO
~~ROW COUNT: 1~~

SET CONCAT_NULL_YIELDS_NULL ON
GO
SELECT * FROM pcc_dst
DELETE FROM pcc_dst
GO
~~START~~
varchar
X
~~END~~

~~ROW COUNT: 1~~



-- JOINs
-- Self-JOIN with correct GUCs
SELECT t1.id, t1.c, t2.id AS id2, t2.c AS c2
FROM pcc_concat t1 JOIN pcc_concat t2 ON t1.c = t2.c
WHERE t1.id < t2.id
ORDER BY t1.id
GO
~~START~~
int#!#varchar#!#int#!#varchar
~~END~~


-- Self-JOIN with wrong GUC
SET CONCAT_NULL_YIELDS_NULL OFF
GO
SELECT t1.id, t1.c, t2.id AS id2, t2.c AS c2
FROM pcc_concat t1 JOIN pcc_concat t2 ON t1.c = t2.c
WHERE t1.id < t2.id
ORDER BY t1.id
GO
~~START~~
int#!#varchar#!#int#!#varchar
~~END~~

SET CONCAT_NULL_YIELDS_NULL ON
GO

-- JOIN between two different tables with computed cols
SET CONCAT_NULL_YIELDS_NULL OFF
GO
SELECT e.full_name, m.c, m.d
FROM pcc_concatfn e JOIN pcc_multi m ON e.first_name = m.a
GO
~~START~~
varchar#!#varchar#!#varchar
~~END~~

SET CONCAT_NULL_YIELDS_NULL ON
GO


-- Subqueries
SET CONCAT_NULL_YIELDS_NULL OFF
GO

-- IN subquery
SELECT id, a, b, c FROM pcc_concat WHERE c IN (SELECT c FROM pcc_concat WHERE a = 'X')
GO
~~START~~
int#!#varchar#!#varchar#!#varchar
2#!#X#!#<NULL>#!#X
~~END~~


-- Scalar subquery
SELECT a, (SELECT MAX(c) FROM pcc_concat) AS max_c FROM pcc_concat WHERE a = 'X'
GO
~~START~~
varchar#!#varchar
X#!#X
~~END~~


-- EXISTS subquery
SELECT t1.id, t1.c FROM pcc_concat t1
WHERE EXISTS (SELECT 1 FROM pcc_multi t2 WHERE t1.c = t2.c)
GO
~~START~~
int#!#varchar
~~END~~


SET CONCAT_NULL_YIELDS_NULL ON
GO


-- UNION / GROUP BY / HAVING / ORDER BY
SET CONCAT_NULL_YIELDS_NULL OFF
GO

-- UNION
SELECT c FROM pcc_concat WHERE a = 'X'
UNION
SELECT c FROM pcc_concat WHERE a = 'Hello'
GO
~~START~~
varchar
HelloWorld
X
~~END~~


-- GROUP BY computed column
SELECT c, COUNT(*) AS cnt FROM pcc_concat GROUP BY c ORDER BY c
GO
~~START~~
varchar#!#int
AB#!#1
HelloWorld#!#1
NewRow#!#1
test#!#1
X#!#1
~~END~~


-- HAVING on computed column
SELECT c, COUNT(*) AS cnt FROM pcc_concat GROUP BY c HAVING c IS NOT NULL ORDER BY c
GO
~~START~~
varchar#!#int
AB#!#1
HelloWorld#!#1
NewRow#!#1
test#!#1
X#!#1
~~END~~


-- ORDER BY computed column
SELECT id, a, b, c FROM pcc_concat ORDER BY c
GO
~~START~~
int#!#varchar#!#varchar#!#varchar
3#!#A#!#B#!#AB
1#!#Hello#!#World#!#HelloWorld
5#!#New#!#Row#!#NewRow
4#!#<NULL>#!#test#!#test
2#!#X#!#<NULL>#!#X
~~END~~


SET CONCAT_NULL_YIELDS_NULL ON
GO


-- Foreign key interactions
-- FK violation (value doesn't exist)
INSERT INTO pcc_fk_child VALUES (2, 99)
GO
~~ERROR (Code: 547)~~

~~ERROR (Message: insert or update on table "pcc_fk_child" violates foreign key constraint "fk_pcc_child")~~


-- FK child INSERT with wrong GUC (parent has computed col)
SET CONCAT_NULL_YIELDS_NULL OFF
GO
INSERT INTO pcc_fk_child VALUES (3, 3)
GO
~~ERROR (Code: 33557097)~~

~~ERROR (Message: INSERT failed because the following SET options have incorrect settings: 'CONCAT_NULL_YIELDS_NULL')~~

SET CONCAT_NULL_YIELDS_NULL ON
GO

-- FK child UPDATE with wrong GUC
SET CONCAT_NULL_YIELDS_NULL OFF
GO
UPDATE pcc_fk_child SET parent_c = 10 WHERE id = 1
GO
~~ERROR (Code: 33557097)~~

~~ERROR (Message: UPDATE failed because the following SET options have incorrect settings: 'CONCAT_NULL_YIELDS_NULL')~~

SET CONCAT_NULL_YIELDS_NULL ON
GO

-- FK child DELETE with wrong GUC
SET CONCAT_NULL_YIELDS_NULL OFF
GO
DELETE FROM pcc_fk_child WHERE id = 1
GO
~~ERROR (Code: 33557097)~~

~~ERROR (Message: DELETE failed because the following SET options have incorrect settings: 'CONCAT_NULL_YIELDS_NULL')~~

SET CONCAT_NULL_YIELDS_NULL ON
GO

-- SELECT from FK child with wrong GUC (should PASS — child has no computed cols)
SET CONCAT_NULL_YIELDS_NULL OFF
GO
SELECT * FROM pcc_fk_child
GO
~~START~~
int#!#int
1#!#3
~~END~~

SET CONCAT_NULL_YIELDS_NULL ON
GO

--INSERT with GUC ON 
SET CONCAT_NULL_YIELDS_NULL ON
GO
SELECT a, b, c INTO pcc_ctas_dest_on FROM pcc_ctas_source
GO
~~ROW COUNT: 3~~

--SELECT from destination table
SELECT a, b, c FROM pcc_ctas_dest_on ORDER BY a
GO
~~START~~
varchar#!#varchar#!#varchar
A#!#B#!#AB
Hello#!#World#!#HelloWorld
X#!#<NULL>#!#<NULL>
~~END~~


-- Test 2: CTAS with GUC=OFF (re-evaluates)
SET CONCAT_NULL_YIELDS_NULL OFF
GO

SELECT a, b, c INTO pcc_ctas_dest_off FROM pcc_ctas_source
GO
~~ROW COUNT: 3~~

SET CONCAT_NULL_YIELDS_NULL ON
GO
--SELECT from destination table
SELECT a, b, c FROM pcc_ctas_dest_off ORDER BY a
GO
~~START~~
varchar#!#varchar#!#varchar
A#!#B#!#AB
Hello#!#World#!#HelloWorld
X#!#<NULL>#!#X
~~END~~


--Checking the destination table with opposite GUC from the time of Insertion
SET CONCAT_NULL_YIELDS_NULL ON
GO

SELECT a, b, c FROM pcc_ctas_dest_off ORDER BY a
GO
~~START~~
varchar#!#varchar#!#varchar
A#!#B#!#AB
Hello#!#World#!#HelloWorld
X#!#<NULL>#!#X
~~END~~


SET CONCAT_NULL_YIELDS_NULL OFF
GO

SELECT a, b, c FROM pcc_ctas_dest_on ORDER BY a
GO
~~START~~
varchar#!#varchar#!#varchar
A#!#B#!#AB
Hello#!#World#!#HelloWorld
X#!#<NULL>#!#<NULL>
~~END~~


SET CONCAT_NULL_YIELDS_NULL ON
GO


-- Bulk load re-evaluation
-- COUNT with GUC=ON 
SELECT COUNT(*) AS cnt FROM pcc_bulk WHERE c IS NOT NULL
GO
~~START~~
int
10
~~END~~


-- COUNT with GUC=OFF 
SET CONCAT_NULL_YIELDS_NULL OFF
GO
SELECT COUNT(*) AS cnt FROM pcc_bulk WHERE c IS NOT NULL
GO
~~START~~
int
20
~~END~~

SET CONCAT_NULL_YIELDS_NULL ON
GO

-- Partition tables
CREATE PARTITION FUNCTION pcc_part_func (INT)
AS RANGE RIGHT FOR VALUES (10, 20, 30, 40)
GO

CREATE PARTITION SCHEME pcc_part_scheme
AS PARTITION pcc_part_func ALL TO ([PRIMARY])
GO

-- Partitioned table with PERSISTED computed col (not partition key)
CREATE TABLE pcc_part_persisted (
    id INT,
    a INT,
    b INT,
    c AS (a + b) PERSISTED
) ON pcc_part_scheme(id)
GO

INSERT INTO pcc_part_persisted (id, a, b) VALUES (5, 1, 2), (15, 3, 4), (25, 5, 6), (35, 7, 8), (45, 9, 10)
GO
~~ROW COUNT: 5~~


SELECT * FROM pcc_part_persisted ORDER BY id
GO
~~START~~
int#!#int#!#int#!#int
5#!#1#!#2#!#3
15#!#3#!#4#!#7
25#!#5#!#6#!#11
35#!#7#!#8#!#15
45#!#9#!#10#!#19
~~END~~


-- Partitioned table with CONCAT for re-evaluation
CREATE TABLE pcc_part_concat (
    id INT,
    first_name VARCHAR(20),
    last_name VARCHAR(20),
    full_name AS (first_name + ' ' + last_name) PERSISTED
) ON pcc_part_scheme(id)
GO

INSERT INTO pcc_part_concat (id, first_name, last_name) VALUES
    (5, 'Alice', 'Adams'), (15, 'Bob', NULL), (25, 'Charlie', 'Clark'),
    (35, 'David', 'Davis'), (45, 'Eve', 'Evans')
GO
~~ROW COUNT: 5~~


-- SELECT with correct GUCs on partitioned table
SELECT * FROM pcc_part_concat ORDER BY id
GO
~~START~~
int#!#varchar#!#varchar#!#varchar
5#!#Alice#!#Adams#!#Alice Adams
15#!#Bob#!#<NULL>#!#<NULL>
25#!#Charlie#!#Clark#!#Charlie Clark
35#!#David#!#Davis#!#David Davis
45#!#Eve#!#Evans#!#Eve Evans
~~END~~


-- SELECT with wrong GUC on partitioned table (re-evaluates)
SET CONCAT_NULL_YIELDS_NULL OFF
GO
SELECT * FROM pcc_part_concat ORDER BY id
GO
~~START~~
int#!#varchar#!#varchar#!#varchar
5#!#Alice#!#Adams#!#Alice Adams
15#!#Bob#!#<NULL>#!#Bob 
25#!#Charlie#!#Clark#!#Charlie Clark
35#!#David#!#Davis#!#David Davis
45#!#Eve#!#Evans#!#Eve Evans
~~END~~

SET CONCAT_NULL_YIELDS_NULL ON
GO

-- COUNT re-evaluation on partitioned table
SET CONCAT_NULL_YIELDS_NULL OFF
GO
SELECT COUNT(*) AS non_null_cnt FROM pcc_part_concat WHERE full_name IS NOT NULL
GO
~~START~~
int
5
~~END~~

SET CONCAT_NULL_YIELDS_NULL ON
GO
SELECT COUNT(*) AS non_null_cnt FROM pcc_part_concat WHERE full_name IS NOT NULL
GO
~~START~~
int
4
~~END~~


-- INSERT with wrong GUC into partitioned table (should FAIL)
SET CONCAT_NULL_YIELDS_NULL OFF
GO
INSERT INTO pcc_part_persisted (id, a, b) VALUES (50, 11, 12)
GO
~~ERROR (Code: 33557097)~~

~~ERROR (Message: INSERT failed because the following SET options have incorrect settings: 'CONCAT_NULL_YIELDS_NULL')~~

SET CONCAT_NULL_YIELDS_NULL ON
GO

-- DELETE with wrong GUC on partitioned table (should FAIL)
SET CONCAT_NULL_YIELDS_NULL OFF
GO
DELETE FROM pcc_part_persisted WHERE id = 5
GO
~~ERROR (Code: 33557097)~~

~~ERROR (Message: DELETE failed because the following SET options have incorrect settings: 'CONCAT_NULL_YIELDS_NULL')~~

SET CONCAT_NULL_YIELDS_NULL ON
GO

-- Verify data unchanged after failed DML on partitioned table
SELECT * FROM pcc_part_persisted ORDER BY id
GO
~~START~~
int#!#int#!#int#!#int
5#!#1#!#2#!#3
15#!#3#!#4#!#7
25#!#5#!#6#!#11
35#!#7#!#8#!#15
45#!#9#!#10#!#19
~~END~~


-- Partitioned table with CONVERT
CREATE TABLE pcc_part_convert (
    id INT,
    d DATE,
    formatted AS CONVERT(VARCHAR(10), d, 101) PERSISTED
) ON pcc_part_scheme(id)
GO

INSERT INTO pcc_part_convert (id, d) VALUES (5, '2024-01-15'), (15, '2024-06-20'), (25, '2024-12-25')
GO
~~ROW COUNT: 3~~


SELECT * FROM pcc_part_convert ORDER BY id
GO
~~START~~
int#!#date#!#varchar
5#!#2024-01-15#!#01/15/2024
15#!#2024-06-20#!#06/20/2024
25#!#2024-12-25#!#12/25/2024
~~END~~


-- ALTER TABLE ADD PERSISTED computed col to partitioned table
CREATE TABLE pcc_part_base (
    id INT,
    x INT,
    y INT
) ON pcc_part_scheme(id)
GO

INSERT INTO pcc_part_base VALUES (5, 10, 20), (15, 30, 40)
GO
~~ROW COUNT: 2~~


ALTER TABLE pcc_part_base ADD z AS (x + y) PERSISTED
GO

SELECT * FROM pcc_part_base ORDER BY id
GO
~~START~~
int#!#int#!#int#!#int
5#!#10#!#20#!#30
15#!#30#!#40#!#70
~~END~~


-- Drop partition tables, scheme and function
DROP TABLE pcc_part_base
GO
DROP TABLE pcc_part_convert
GO
DROP TABLE pcc_part_concat
GO
DROP TABLE pcc_part_persisted
GO
DROP PARTITION SCHEME pcc_part_scheme
GO
DROP PARTITION FUNCTION pcc_part_func
GO

-- ALTER TABLE ADD computed column
ALTER TABLE pcc_concat ADD d AS (b + a) PERSISTED
GO
SELECT id, a, b, c, d FROM pcc_concat ORDER BY id
GO
~~START~~
int#!#varchar#!#varchar#!#varchar#!#varchar
1#!#Hello#!#World#!#HelloWorld#!#WorldHello
2#!#X#!#<NULL>#!#<NULL>#!#<NULL>
3#!#A#!#B#!#AB#!#BA
4#!#<NULL>#!#test#!#<NULL>#!#<NULL>
5#!#New#!#Row#!#NewRow#!#RowNew
~~END~~


-- ALTER TABLE ADD computed col with wrong GUC (should FAIL)
SET CONCAT_NULL_YIELDS_NULL OFF
GO
ALTER TABLE pcc_concat ADD e AS (a + 'suffix') PERSISTED
GO
~~ERROR (Code: 33557097)~~

~~ERROR (Message: CREATE/ALTER TABLE failed because the following SET options have incorrect settings: 'CONCAT_NULL_YIELDS_NULL')~~

SET CONCAT_NULL_YIELDS_NULL ON
GO

-- DROP computed column
ALTER TABLE pcc_concat DROP COLUMN d
GO

-- Verify data unchanged after all failed DMLs
SELECT id, a, b, c FROM pcc_concat ORDER BY id
GO
~~START~~
int#!#varchar#!#varchar#!#varchar
1#!#Hello#!#World#!#HelloWorld
2#!#X#!#<NULL>#!#<NULL>
3#!#A#!#B#!#AB
4#!#<NULL>#!#test#!#<NULL>
5#!#New#!#Row#!#NewRow
~~END~~

