
-- test "SET ROWCOUNT value"
exec rowcount_vu_prepare_insert_proc;
GO
~~ROW COUNT: 1~~

~~ROW COUNT: 1~~

~~ROW COUNT: 1~~

~~ROW COUNT: 1~~

~~ROW COUNT: 4~~

~~ROW COUNT: 5~~


exec rowcount_vu_prepare_select_proc;
GO
~~START~~
int
13
~~END~~

~~START~~
int
1
~~END~~


exec rowcount_vu_prepare_update_proc;
GO
~~START~~
int
13
~~END~~

~~ROW COUNT: 1~~

~~START~~
int
1
~~END~~


exec rowcount_vu_prepare_delete_proc;
GO
~~START~~
int
6
~~END~~

~~ROW COUNT: 1~~

~~START~~
int
5
~~END~~



--  test "SET ROWCOUNT @variable"
exec rowcount_vu_prepare_insert_proc_var;
GO
~~ROW COUNT: 1~~

~~ROW COUNT: 1~~

~~ROW COUNT: 1~~

~~ROW COUNT: 1~~

~~ROW COUNT: 4~~

~~ROW COUNT: 5~~


exec rowcount_vu_prepare_select_proc_var;
GO
~~START~~
int
13
~~END~~

~~START~~
int
1
~~END~~


exec rowcount_vu_prepare_update_proc_var;
GO
~~START~~
int
13
~~END~~

~~ROW COUNT: 1~~

~~START~~
int
1
~~END~~


exec rowcount_vu_prepare_delete_proc_var;
GO
~~START~~
int
6
~~END~~

~~ROW COUNT: 1~~

~~START~~
int
5
~~END~~



-- check value 
select setting from pg_settings where name = 'babelfishpg_tsql.rowcount';
go
~~START~~
text
2147483647
~~END~~


-- nested proc
exec rowcount_vu_prepare_select_nested_proc_var
go
~~START~~
text
1
~~END~~

~~START~~
int
2
~~END~~

~~START~~
text
0
~~END~~

~~START~~
int
2
2
1
1
2
2
1
1
2
2
1
10
~~END~~


-- should throw syntax error
set rowcount -1
GO
~~ERROR (Code: 33557097)~~

~~ERROR (Message: syntax error near '-' at line 2 and character position 13)~~


set rowcount NULL
go
~~ERROR (Code: 33557097)~~

~~ERROR (Message: syntax error near 'NULL' at line 1 and character position 13)~~


-- should throw error
declare @v smallint = -1
set rowcount @v
GO
~~ERROR (Code: 33557097)~~

~~ERROR (Message: -1 is outside the valid range for parameter "babelfishpg_tsql.rowcount" (0 .. 2147483647))~~


declare @v smallint = NULL
SET ROWCOUNT @v
GO
~~ERROR (Code: 33557097)~~

~~ERROR (Message: Invalid argument for SET ROWCOUNT. Must be a non-null value.)~~


-- invalid set should throw error
DECLARE @value date = '2006-01-02'
SET ROWCOUNT @value
GO
~~ERROR (Code: 33557097)~~

~~ERROR (Message: invalid input syntax for type integer: "2006-01-02")~~


-- invalid set should throw error
DECLARE @value varchar(10) = 'abc'
SET ROWCOUNT @value
GO
~~ERROR (Code: 33557097)~~

~~ERROR (Message: invalid input syntax for type integer: "abc")~~


-- check value
select setting from pg_settings where name = 'babelfishpg_tsql.rowcount';
go
~~START~~
text
2147483647
~~END~~


-- implicit cast is allowed
DECLARE @value varchar(10) = '123'
SET ROWCOUNT @value
GO

select setting from pg_settings where name = 'babelfishpg_tsql.rowcount';
go
~~START~~
text
123
~~END~~


-- set int/bigint/smallint
DECLARE @value int = 2147483647
SET ROWCOUNT @value
GO

select setting from pg_settings where name = 'babelfishpg_tsql.rowcount';
go
~~START~~
text
2147483647
~~END~~


-- overflow should throw error
DECLARE @value bigint = 922337203685477580
SET ROWCOUNT @value
GO
~~ERROR (Code: 8115)~~

~~ERROR (Message: integer out of range)~~


SET ROWCOUNT 2147483649
go
~~ERROR (Code: 33557097)~~

~~ERROR (Message: invalid value for parameter "babelfishpg_tsql.rowcount": "2147483649")~~


select setting from pg_settings where name = 'babelfishpg_tsql.rowcount';
go
~~START~~
text
2147483647
~~END~~


DECLARE @value smallint = 3276
SET ROWCOUNT @value
GO

select setting from pg_settings where name = 'babelfishpg_tsql.rowcount';
go
~~START~~
text
3276
~~END~~


-- while loop
DECLARE @value smallint = 1
set rowcount @value
go

while 1=1
begin
    SELECT * from rowcount_vu_prepare_testing3 where k = 1;
    UPDATE rowcount_vu_prepare_testing3 SET k = 2 where k = 1;
    SELECT * from rowcount_vu_prepare_testing3 where k = 2;
    DELETE rowcount_vu_prepare_testing3 where k = 2;
    if @@rowcount = 0 break
end
go
~~START~~
int#!#int
1#!#1
~~END~~

~~ROW COUNT: 1~~

~~START~~
int#!#int
2#!#1
~~END~~

~~ROW COUNT: 1~~

~~START~~
int#!#int
1#!#2
~~END~~

~~ROW COUNT: 1~~

~~START~~
int#!#int
2#!#2
~~END~~

~~ROW COUNT: 1~~

~~START~~
int#!#int
1#!#3
~~END~~

~~ROW COUNT: 1~~

~~START~~
int#!#int
2#!#3
~~END~~

~~ROW COUNT: 1~~

~~START~~
int#!#int
~~END~~

~~START~~
int#!#int
~~END~~



-- error message should be in uppercase for stmt
declare @v int = NULL;
SET rowCounT @v
go
~~ERROR (Code: 33557097)~~

~~ERROR (Message: Invalid argument for SET ROWCOUNT. Must be a non-null value.)~~



-- parameter name should be in lowercase for stmt
declare @v int = -1;
SET rowCounT @v
go
~~ERROR (Code: 33557097)~~

~~ERROR (Message: -1 is outside the valid range for parameter "babelfishpg_tsql.rowcount" (0 .. 2147483647))~~

