USE babel_5010_vu_prepare_db1;
GO

SET NOCOUNT ON;
GO


-- special case: when table_qualifier only contains one % wildcard character and 0 or more space characters
-- should enumerate all databases
declare @p1 sys.nvarchar=''
declare @P2 sys.nvarchar=''
declare @P3 sys.nvarchar='%     '
declare @P4 sys.nvarchar=NULL
declare @fUsePattern bit = 1
INSERT INTO babel_5010_temp_table EXEC [sys].sp_tables @p1, @P2, @P3, @P4, @fUsePattern = @fUsePattern;
SELECT * FROM babel_5010_temp_table WHERE TABLE_QUALIFIER IN ('master', 'tempdb', 'msdb', 'babel_5010_vu_prepare_db1') ORDER BY TABLE_QUALIFIER;
DELETE FROM babel_5010_temp_table;
GO
~~START~~
varchar#!#nvarchar#!#nvarchar#!#nvarchar#!#bit
babel_5010_vu_prepare_db1#!#<NULL>#!#<NULL>#!#<NULL>#!#<NULL>
master#!#<NULL>#!#<NULL>#!#<NULL>#!#<NULL>
msdb#!#<NULL>#!#<NULL>#!#<NULL>#!#<NULL>
tempdb#!#<NULL>#!#<NULL>#!#<NULL>#!#<NULL>
~~END~~


declare @p1 sys.nvarchar=''
declare @P2 sys.nvarchar=''
declare @P3 sys.nvarchar='%'
declare @P4 sys.nvarchar=NULL
declare @fUsePattern bit = 1
INSERT INTO babel_5010_temp_table EXEC [sys].sp_tables @p1, @P2, @P3, @P4, @fUsePattern = @fUsePattern;
SELECT * FROM babel_5010_temp_table WHERE TABLE_QUALIFIER IN ('master', 'tempdb', 'msdb', 'babel_5010_vu_prepare_db1') ORDER BY TABLE_QUALIFIER;
DELETE FROM babel_5010_temp_table;
GO
~~START~~
varchar#!#nvarchar#!#nvarchar#!#nvarchar#!#bit
babel_5010_vu_prepare_db1#!#<NULL>#!#<NULL>#!#<NULL>#!#<NULL>
master#!#<NULL>#!#<NULL>#!#<NULL>#!#<NULL>
msdb#!#<NULL>#!#<NULL>#!#<NULL>#!#<NULL>
tempdb#!#<NULL>#!#<NULL>#!#<NULL>#!#<NULL>
~~END~~


INSERT INTO babel_5010_temp_table EXEC [sys].sp_tables @table_name = '', @table_owner = '', @table_qualifier = '%     ', @table_type = NULL, @fUsePattern = 1;
SELECT * FROM babel_5010_temp_table WHERE TABLE_QUALIFIER IN ('master', 'tempdb', 'msdb', 'babel_5010_vu_prepare_db1');
DELETE FROM babel_5010_temp_table;
GO
~~START~~
varchar#!#nvarchar#!#nvarchar#!#nvarchar#!#bit
babel_5010_vu_prepare_db1#!#<NULL>#!#<NULL>#!#<NULL>#!#<NULL>
master#!#<NULL>#!#<NULL>#!#<NULL>#!#<NULL>
msdb#!#<NULL>#!#<NULL>#!#<NULL>#!#<NULL>
tempdb#!#<NULL>#!#<NULL>#!#<NULL>#!#<NULL>
~~END~~


INSERT INTO babel_5010_temp_table EXEC [sys].sp_tables @table_name = '', @table_owner = '', @table_qualifier = '%', @table_type = NULL, @fUsePattern = 1;
SELECT * FROM babel_5010_temp_table WHERE TABLE_QUALIFIER IN ('master', 'tempdb', 'msdb', 'babel_5010_vu_prepare_db1') ORDER BY TABLE_QUALIFIER;
DELETE FROM babel_5010_temp_table;
GO
~~START~~
varchar#!#nvarchar#!#nvarchar#!#nvarchar#!#bit
babel_5010_vu_prepare_db1#!#<NULL>#!#<NULL>#!#<NULL>#!#<NULL>
master#!#<NULL>#!#<NULL>#!#<NULL>#!#<NULL>
msdb#!#<NULL>#!#<NULL>#!#<NULL>#!#<NULL>
tempdb#!#<NULL>#!#<NULL>#!#<NULL>#!#<NULL>
~~END~~


-- should return empty set
declare @p1 sys.nvarchar=''
declare @P2 sys.nvarchar=''
declare @P3 sys.nvarchar='     %'
declare @P4 sys.nvarchar=NULL
declare @fUsePattern bit = 1
EXEC [sys].sp_tables @p1, @P2, @P3, @P4, @fUsePattern = @fUsePattern
GO
~~START~~
varchar#!#varchar#!#varchar#!#varchar#!#varchar
~~END~~


declare @p1 sys.nvarchar=''
declare @P2 sys.nvarchar=''
declare @P3 sys.nvarchar='     %     '
declare @P4 sys.nvarchar=NULL
declare @fUsePattern bit = 1
EXEC [sys].sp_tables @p1, @P2, @P3, @P4, @fUsePattern = @fUsePattern
GO
~~START~~
varchar#!#varchar#!#varchar#!#varchar#!#varchar
~~END~~


declare @p1 sys.nvarchar='  '
declare @P2 sys.nvarchar=''
declare @P3 sys.nvarchar=NULL
declare @P4 sys.nvarchar=NULL
declare @fUsePattern bit = 1
EXEC [sys].sp_tables @p1, @P2, @P3, @P4, @fUsePattern = @fUsePattern
GO
~~START~~
varchar#!#varchar#!#varchar#!#varchar#!#varchar
~~END~~


-- should throw error
EXEC [sys].sp_tables @table_name = '', @table_owner = '', @table_qualifier = '  %', @table_type = NULL, @fUsePattern = 1;
GO
~~ERROR (Code: 33557097)~~

~~ERROR (Message: The database name component of the object qualifier must be the name of the current database.)~~


EXEC [sys].sp_tables @table_name = '', @table_owner = '', @table_qualifier = '  %   ', @table_type = NULL, @fUsePattern = 1;
GO
~~ERROR (Code: 33557097)~~

~~ERROR (Message: The database name component of the object qualifier must be the name of the current database.)~~


EXEC [sys].sp_tables @table_name = '', @table_owner = '', @table_qualifier = '%%', @table_type = NULL, @fUsePattern = 1;
GO
~~ERROR (Code: 33557097)~~

~~ERROR (Message: The database name component of the object qualifier must be the name of the current database.)~~


EXEC [sys].sp_tables @table_name = '', @table_owner = '', @table_qualifier = '%_', @table_type = NULL, @fUsePattern = 1;
GO
~~ERROR (Code: 33557097)~~

~~ERROR (Message: The database name component of the object qualifier must be the name of the current database.)~~


EXEC [sys].sp_tables @table_name = '', @table_owner = '', @table_qualifier = 'mast%', @table_type = NULL, @fUsePattern = 1;
GO
~~ERROR (Code: 33557097)~~

~~ERROR (Message: The database name component of the object qualifier must be the name of the current database.)~~


EXEC [sys].sp_tables @table_name = '', @table_owner = '', @table_qualifier = '%db', @table_type = NULL, @fUsePattern = 1;
GO
~~ERROR (Code: 33557097)~~

~~ERROR (Message: The database name component of the object qualifier must be the name of the current database.)~~


-- special case: when all parameters are empty string, should return empty set
EXEC [sys].sp_tables @table_name = '', @table_owner = '', @table_qualifier = '', @table_type = '', @fUsePattern = 0;
GO
~~START~~
varchar#!#varchar#!#varchar#!#varchar#!#varchar
~~END~~


EXEC [sys].sp_tables @table_name = '', @table_owner = '', @table_qualifier = '', @table_type = '';
GO
~~START~~
varchar#!#varchar#!#varchar#!#varchar#!#varchar
~~END~~


-- special case: when all parameters are NULL, should return all tables and views of current database i.e. babel_5010_vu_prepare_db1
EXEC [sys].sp_tables;
GO
~~START~~
varchar#!#varchar#!#varchar#!#varchar#!#varchar
babel_5010_vu_prepare_db1#!#dbo#!#babel_5010_temp_table#!#TABLE#!#<NULL>
babel_5010_vu_prepare_db1#!#dbo#!#babel_5010_vu_prepare_t1#!#TABLE#!#<NULL>
babel_5010_vu_prepare_db1#!#dbo#!#babel_5010_vu_prepare_t2#!#TABLE#!#<NULL>
babel_5010_vu_prepare_db1#!#dbo#!#babel_5010_vu_prepare_v1#!#VIEW#!#<NULL>
babel_5010_vu_prepare_db1#!#dbo#!#babel_5010_vu_prepare_v2#!#VIEW#!#<NULL>
babel_5010_vu_prepare_db1#!#dbo#!#sysdatabases#!#VIEW#!#<NULL>
~~END~~



-- NULL value tests
-- case 1: when table name is NULL
-- should return matching objects
EXEC [sys].sp_tables @table_owner = 'dbo', @table_qualifier = 'babel_5010_vu_prepare_db1', @table_type = "'TABLE'";
GO
~~START~~
varchar#!#varchar#!#varchar#!#varchar#!#varchar
babel_5010_vu_prepare_db1#!#dbo#!#babel_5010_temp_table#!#TABLE#!#<NULL>
babel_5010_vu_prepare_db1#!#dbo#!#babel_5010_vu_prepare_t1#!#TABLE#!#<NULL>
babel_5010_vu_prepare_db1#!#dbo#!#babel_5010_vu_prepare_t2#!#TABLE#!#<NULL>
~~END~~


EXEC [sys].sp_tables @table_owner = 'dbo', @table_qualifier = 'babel_5010_vu_prepare_db1', @table_type = "'VIEW'";
GO
~~START~~
varchar#!#varchar#!#varchar#!#varchar#!#varchar
babel_5010_vu_prepare_db1#!#dbo#!#babel_5010_vu_prepare_v1#!#VIEW#!#<NULL>
babel_5010_vu_prepare_db1#!#dbo#!#babel_5010_vu_prepare_v2#!#VIEW#!#<NULL>
babel_5010_vu_prepare_db1#!#dbo#!#sysdatabases#!#VIEW#!#<NULL>
~~END~~


EXEC [sys].sp_tables @table_owner = 'dbo', @table_qualifier = 'babel_5010_vu_prepare_db1', @table_type = "'TABLE','VIEW'";
GO
~~START~~
varchar#!#varchar#!#varchar#!#varchar#!#varchar
babel_5010_vu_prepare_db1#!#dbo#!#babel_5010_temp_table#!#TABLE#!#<NULL>
babel_5010_vu_prepare_db1#!#dbo#!#babel_5010_vu_prepare_t1#!#TABLE#!#<NULL>
babel_5010_vu_prepare_db1#!#dbo#!#babel_5010_vu_prepare_t2#!#TABLE#!#<NULL>
babel_5010_vu_prepare_db1#!#dbo#!#babel_5010_vu_prepare_v1#!#VIEW#!#<NULL>
babel_5010_vu_prepare_db1#!#dbo#!#babel_5010_vu_prepare_v2#!#VIEW#!#<NULL>
babel_5010_vu_prepare_db1#!#dbo#!#sysdatabases#!#VIEW#!#<NULL>
~~END~~


-- case 2: when table owner is NULL
-- should return matching objects
EXEC [sys].sp_tables @table_name = 'babel_5010_vu_prepare_t1', @table_qualifier = 'babel_5010_vu_prepare_db1', @table_type = "'TABLE'";
GO
~~START~~
varchar#!#varchar#!#varchar#!#varchar#!#varchar
babel_5010_vu_prepare_db1#!#dbo#!#babel_5010_vu_prepare_t1#!#TABLE#!#<NULL>
~~END~~


EXEC [sys].sp_tables @table_name = 'babel_5010_vu_prepare_v1', @table_qualifier = 'babel_5010_vu_prepare_db1', @table_type = "'VIEW'";
GO
~~START~~
varchar#!#varchar#!#varchar#!#varchar#!#varchar
babel_5010_vu_prepare_db1#!#dbo#!#babel_5010_vu_prepare_v1#!#VIEW#!#<NULL>
~~END~~


-- should return empty set
EXEC [sys].sp_tables @table_name = 'babel_5010_vu_prepare_v1', @table_qualifier = 'babel_5010_vu_prepare_db1', @table_type = "'TABLE'";
GO
~~START~~
varchar#!#varchar#!#varchar#!#varchar#!#varchar
~~END~~


-- case 3: when table qualifier is NULL
-- should return matching objects
EXEC [sys].sp_tables @table_name = 'babel_5010_vu_prepare_t1', @table_owner = 'dbo', @table_type = "'TABLE'";
GO
~~START~~
varchar#!#varchar#!#varchar#!#varchar#!#varchar
babel_5010_vu_prepare_db1#!#dbo#!#babel_5010_vu_prepare_t1#!#TABLE#!#<NULL>
~~END~~


EXEC [sys].sp_tables @table_name = 'babel_5010_vu_prepare_v1', @table_owner = 'dbo', @table_type = "'VIEW'";
GO
~~START~~
varchar#!#varchar#!#varchar#!#varchar#!#varchar
babel_5010_vu_prepare_db1#!#dbo#!#babel_5010_vu_prepare_v1#!#VIEW#!#<NULL>
~~END~~


SET NOCOUNT OFF;
GO

USE master;
GO
