SET TRANSACTION ISOLATION LEVEL SNAPSHOT

CREATE VIEW enr_view AS
    SELECT
        CASE
            WHEN relname LIKE '#pg_toast%' AND relname LIKE '%index%' THEN '#pg_toast_#oid_masked#_index'
            WHEN relname LIKE '#pg_toast%' THEN '#pg_toast_#oid_masked#'
            ELSE relname
        END AS relname
    FROM sys.babelfish_get_enr_list()
GO

CREATE TYPE temp_table_type FROM int
GO


CREATE PROCEDURE test_rollback_in_proc AS
BEGIN
    CREATE TABLE #t1(a int)
    INSERT INTO #t1 values (6)
    BEGIN TRAN;
        ALTER TABLE #t1 ADD b varchar(50)
        TRUNCATE TABLE #t1
        INSERT INTO #t1 VALUES (1, 'two')
        select * from #t1
        DROP TABLE #t1
        CREATE TABLE #t1(a varchar(100))
        INSERT INTO #t1 VALUES ('three')
        select * from #t1
        CREATE TABLE #t2(b varchar(50), a int identity primary key, )
        INSERT INTO #t2 VALUES ('four')
        SELECT * FROM #t2
        DROP TABLE #t2
    ROLLBACK;
    SELECT * FROM #t1
    SELECT * FROM #t2
END
GO



CREATE PROCEDURE implicit_rollback_in_proc AS 
BEGIN
    CREATE TABLE #t1(a int)
    ALTER TABLE #t1 ADD b varchar(50)
    INSERT INTO #t1 VALUES (1, 'two')
    select * from #t1
    DROP TABLE #t1
    CREATE TABLE #t1(a varchar(100))
    INSERT INTO #t1 VALUES ('three')
    select * from #t1
    CREATE TABLE #t2(b varchar(50), a int identity primary key, )
    INSERT INTO #t2 VALUES ('four')
    SELECT * FROM #t2
    DROP TABLE #t2
    INSERT INTO #t1 values (1, 2, 3)
    SELECT * FROM #t1
    SELECT * FROM #t2
END
GO

CREATE PROCEDURE tv_base_rollback AS
BEGIN
    DECLARE @tv TABLE (a int)
    INSERT INTO temp_tab_rollback_mytab VALUES (1)
    INSERT INTO @tv VALUES (1)
END
GO

CREATE PROCEDURE tv_tt_no_error AS
BEGIN
    DECLARE @tv TABLE (a int)
    CREATE TABLE #t1 (a int)
    INSERT INTO temp_tab_rollback_mytab VALUES (1)
    INSERT INTO @tv VALUES (1)
    INSERT INTO #t1 VALUES (1)
END
GO

CREATE PROCEDURE tv_mapped_error AS 
BEGIN 
    BEGIN TRAN 
        CREATE TABLE #t1 (a INT, b AS a + 1) 
        INSERT INTO #t1 (a) VALUES (1) 
        ALTER TABLE #t1 ADD CONSTRAINT constraint1 DEFAULT 1 FOR b 
    COMMIT TRAN 
END
GO

CREATE PROCEDURE tv_unmapped_error AS 
BEGIN 
    BEGIN TRAN 
        CREATE TABLE #t1 (a INT, b AS a + 1) 
        INSERT INTO #t1 (a) VALUES (1) 
        SELECT * FROM t2 
    COMMIT TRAN 
END
GO

CREATE FUNCTION func_get_sum_temp(@max_a int)
RETURNS int
AS
BEGIN
    DECLARE @result int;
    SELECT @result = SUM(c) FROM #t_func_idx WHERE a <= @max_a;
    RETURN @result;
END
GO

-- Function with COUNT aggregation
CREATE FUNCTION func_get_count_temp(@min_b int)
RETURNS int
AS
BEGIN
    DECLARE @result int;
    SELECT @result = COUNT(*) FROM #t_func_idx WHERE b >= @min_b;
    RETURN @result;
END
GO

-- Function with MIN/MAX aggregation
CREATE FUNCTION func_get_min_max_temp(@col char(1))
RETURNS int
AS
BEGIN
    DECLARE @result int;
    IF @col = 'a'
        SELECT @result = MAX(a) - MIN(a) FROM #t_func_idx;
    ELSE IF @col = 'b'
        SELECT @result = MAX(b) - MIN(b) FROM #t_func_idx;
    ELSE
        SELECT @result = MAX(c) - MIN(c) FROM #t_func_idx;
    RETURN @result;
END
GO

CREATE PROCEDURE test_temp_table_drop_intermediate_idx AS
BEGIN
    CREATE TABLE #t_procedure(a int default 1, b bigint primary key, c int);
    CREATE INDEX #idx1 ON #t_procedure(a);
    CREATE INDEX #idx2 ON #t_procedure(a,b);
    SELECT relname FROM sys.babelfish_get_enr_list() ORDER BY relname;
    DROP INDEX #idx1 ON #t_procedure;
    INSERT INTO #t_procedure(a, b, c) VALUES (4, 100, 2);
    SELECT * FROM #t_procedure;
END
GO








-- Procedure to test ALTER TABLE + INDEX + TRUNCATE (cache lookup fix)
CREATE PROCEDURE test_alter_index_truncate_cache_fix
AS
BEGIN
    SET XACT_ABORT ON
    CREATE TABLE #t0_qdomqw (id int, name varchar(100) COLLATE polish_cs_as)
    INSERT INTO #t0_qdomqw (id, name) VALUES (1282566819, 'geskxo')
    BEGIN TRANSACTION
        ALTER TABLE #t0_qdomqw ADD col_def_estp int DEFAULT 4
        UPDATE #t0_qdomqw SET name = 'slukgofiuazhigik' WHERE id IS NOT NULL
        SELECT * FROM #t0_qdomqw
        CREATE INDEX idx_eefi ON #t0_qdomqw (id)
        CREATE INDEX idx_eipj ON #t0_qdomqw (id)
    COMMIT TRANSACTION
    TRUNCATE TABLE #t0_qdomqw
    SELECT * FROM #t0_qdomqw
    DROP TABLE #t0_qdomqw
    SET XACT_ABORT OFF
END
GO

-- Cross Query Env Tests (BABEL-6268)
CREATE PROC p_drop AS DROP TABLE #test
GO

CREATE PROC p_drop_multi AS 
BEGIN 
    DROP TABLE #temp_proc_test 
END 
GO

CREATE PROC p_inner AS DROP TABLE #nested_test
GO

CREATE PROC p_outer AS EXEC p_inner
GO

CREATE PROC p_trans_drop AS 
BEGIN 
    BEGIN TRAN 
        INSERT INTO #trans_test VALUES (2, 'during') 
        DROP TABLE #trans_test 
    COMMIT 
END 
GO

CREATE PROC p_create_insert AS
BEGIN
    CREATE TABLE #proc_create(id int, name varchar(30))
    INSERT INTO #proc_create VALUES (1, 'first')
    INSERT INTO #proc_create VALUES (2, 'second')
    SELECT * FROM #proc_create
    DROP TABLE #proc_create
END
GO

CREATE PROC p_update_delete AS
BEGIN
    UPDATE #update_delete_test SET status = 'processed' WHERE id = 1
    DELETE FROM #update_delete_test WHERE value > 250
    INSERT INTO #update_delete_test VALUES (4, 'new', 150)
END
GO

CREATE PROC p_nested_inner AS
BEGIN
    INSERT INTO #nested_ops_test VALUES (2, 'from inner')
    UPDATE #nested_ops_test SET data = 'updated by inner' WHERE id = 1
END
GO

CREATE PROC p_nested_outer AS
BEGIN
    EXEC p_nested_inner
    DELETE FROM #nested_ops_test WHERE id = 2
    INSERT INTO #nested_ops_test VALUES (3, 'from outer')
END
GO

CREATE PROC p_rollback_ops AS
BEGIN
    INSERT INTO #rollback_ops_test VALUES (2, 200.00)
    BEGIN TRAN
        UPDATE #rollback_ops_test SET amount = amount * 2
        INSERT INTO #rollback_ops_test VALUES (3, 300.00)
        DELETE FROM #rollback_ops_test WHERE id = 1
        SELECT 'Inside transaction:' as label
        SELECT * FROM #rollback_ops_test
    ROLLBACK
    SELECT 'After rollback:' as label
END
GO

CREATE PROC p_multi_temp_ops AS
BEGIN
    CREATE TABLE #temp1(id int, name varchar(20))
    CREATE TABLE #temp2(id int, ref_id int, value varchar(30))
    
    INSERT INTO #temp1 VALUES (1, 'first')
    INSERT INTO #temp1 VALUES (2, 'second')
    
    INSERT INTO #temp2 VALUES (10, 1, 'ref to first')
    INSERT INTO #temp2 VALUES (20, 2, 'ref to second')
    
    UPDATE #temp1 SET name = 'updated first' WHERE id = 1
    DELETE FROM #temp2 WHERE ref_id = 2
    
    SELECT 'Temp1:' as label
    SELECT * FROM #temp1
    SELECT 'Temp2:' as label
    SELECT * FROM #temp2
    
    DROP TABLE #temp1
    DROP TABLE #temp2
END
GO

CREATE PROC p_error_ops AS
BEGIN
    INSERT INTO #error_ops_test VALUES (2, 'valid insert')
    UPDATE #error_ops_test SET data = 'updated' WHERE id = 1
    
    BEGIN TRY
        INSERT INTO #error_ops_test VALUES (1, 'duplicate key') -- Should fail
    END TRY
    BEGIN CATCH
        INSERT INTO #error_ops_test VALUES (3, 'error handled')
        SELECT 'Error caught: ' + ERROR_MESSAGE() as error_info
    END CATCH
END
GO

CREATE PROC p_truncate_ops AS
BEGIN
    SELECT 'Before truncate:' as label
    SELECT * FROM #truncate_test
    
    TRUNCATE TABLE #truncate_test
    
    INSERT INTO #truncate_test VALUES ('after truncate')
    SELECT 'After truncate:' as label
END
GO

CREATE PROC p_conditional_ops AS
BEGIN
    DECLARE @count int
    SELECT @count = COUNT(*) FROM #conditional_test WHERE value > 100
    
    IF @count > 0
    BEGIN
        UPDATE #conditional_test SET status = 'high_value' WHERE value > 100
        INSERT INTO #conditional_test VALUES (4, 'new_high', 200)
    END
    ELSE
    BEGIN
        DELETE FROM #conditional_test WHERE value < 60
    END
END
GO

-- INSERT INTO EXEC procedures
CREATE PROC p_insert_exec_basic AS 
BEGIN 
    SELECT 1 as id, 'first' as name 
    UNION ALL 
    SELECT 2, 'second' 
END
GO

CREATE PROC p_insert_exec_nested_inner AS
BEGIN
    SELECT 10 as id, 'inner data' as data
END
GO

CREATE PROC p_insert_exec_nested_outer AS
BEGIN
    CREATE TABLE #temp_inner(id int, data varchar(50))
    INSERT INTO #temp_inner EXEC p_insert_exec_nested_inner
    INSERT INTO #temp_inner VALUES (20, 'outer data')
    SELECT * FROM #temp_inner
    DROP TABLE #temp_inner
END
GO

CREATE PROC p_insert_exec_temp_ops AS
BEGIN
    CREATE TABLE #temp_ops(id int, status varchar(20), value int)
    INSERT INTO #temp_ops VALUES (1, 'active', 100)
    INSERT INTO #temp_ops VALUES (2, 'pending', 200)
    UPDATE #temp_ops SET status = 'processed' WHERE id = 1
    SELECT * FROM #temp_ops
    DROP TABLE #temp_ops
END
GO

CREATE PROC p_insert_exec_transaction AS
BEGIN
    CREATE TABLE #temp_trans(id int, amount decimal(10,2))
    INSERT INTO #temp_trans VALUES (1, 100.00)
    BEGIN TRAN
        INSERT INTO #temp_trans VALUES (2, 200.00)
        UPDATE #temp_trans SET amount = amount * 2
    ROLLBACK
    SELECT * FROM #temp_trans
    DROP TABLE #temp_trans
END
GO

CREATE PROC p_insert_exec_multi_results AS
BEGIN
    SELECT 1 as id, 'first result' as info
    SELECT 2 as id, 'second result' as info
    SELECT 3 as id, 'third result' as info
END
GO

CREATE PROC p_insert_exec_error_handling AS
BEGIN
    CREATE TABLE #temp_error(id int primary key, data varchar(20))
    INSERT INTO #temp_error VALUES (1, 'original')
    BEGIN TRY
        INSERT INTO #temp_error VALUES (1, 'duplicate')
    END TRY
    BEGIN CATCH
        INSERT INTO #temp_error VALUES (2, 'error handled')
    END CATCH
    SELECT * FROM #temp_error
    DROP TABLE #temp_error
END
GO

CREATE PROC p_insert_exec_table_var AS
BEGIN
    DECLARE @tv TABLE (id int, tv_data varchar(30))
    INSERT INTO @tv VALUES (1, 'from table var')
    INSERT INTO @tv VALUES (2, 'tv data')
    SELECT * FROM @tv
END
GO

CREATE PROC p_insert_exec_drop_table AS
BEGIN
    -- Return some data first
    SELECT 100 as id, 'before drop' as data
    
    -- Drop the target table
    DROP TABLE #insert_exec_drop_target
    
    -- Try to return more data (but table is already dropped)
    SELECT 200 as id, 'after drop' as data
END
GO


---------------------------------------------------------------------------
-- DROP TABLE IF EXISTS + CREATE TABLE in procedures (BABEL-6097)
---------------------------------------------------------------------------
-- Basic DROP IF EXISTS + CREATE pattern
CREATE PROC p_drop_if_exists_create AS 
BEGIN 
    DROP TABLE IF EXISTS #t 
    CREATE TABLE #t(a int) 
    INSERT INTO #t VALUES (1) 
    SELECT * FROM #t 
END
GO

-- Multiple DROP IF EXISTS + CREATE cycles
CREATE PROC p_multi_drop_create AS 
BEGIN 
    DROP TABLE IF EXISTS #t 
    CREATE TABLE #t(a int) 
    INSERT INTO #t VALUES (1) 
    
    DROP TABLE IF EXISTS #t 
    CREATE TABLE #t(a int, b varchar(20)) 
    INSERT INTO #t VALUES (2, 'second') 
    
    SELECT * FROM #t 
END
GO

-- DROP IF EXISTS + CREATE with different schemas
CREATE PROC p_drop_create_schema_change AS 
BEGIN 
    DROP TABLE IF EXISTS #t 
    CREATE TABLE #t(id int, name varchar(50)) 
    INSERT INTO #t VALUES (1, 'first') 
    
    DROP TABLE #t 
    CREATE TABLE #t(x int, y int, z varchar(100)) 
    INSERT INTO #t VALUES (10, 20, 'changed schema') 
    
    SELECT * FROM #t 
END
GO

-- DROP IF EXISTS + CREATE in transaction
CREATE PROC p_trans_drop_create AS 
BEGIN 
    BEGIN TRAN 
        DROP TABLE IF EXISTS #trans_t 
        CREATE TABLE #trans_t(a int, b varchar(30)) 
        INSERT INTO #trans_t VALUES (1, 'in transaction') 
    COMMIT 
    SELECT * FROM #trans_t 
END
GO

-- DROP IF EXISTS + CREATE with rollback
CREATE PROC p_rollback_drop_create AS 
BEGIN 
    CREATE TABLE #rb_t(original int) 
    INSERT INTO #rb_t VALUES (100) 
    
    BEGIN TRAN 
        DROP TABLE IF EXISTS #rb_t 
        CREATE TABLE #rb_t(new_col varchar(20)) 
        INSERT INTO #rb_t VALUES ('rolled back') 
    ROLLBACK 
    
    SELECT * FROM #rb_t 
END
GO

-- Multiple temp tables with DROP IF EXISTS + CREATE
CREATE PROC p_multi_tables_drop_create AS 
BEGIN 
    DROP TABLE IF EXISTS #t1 
    DROP TABLE IF EXISTS #t2 
    
    CREATE TABLE #t1(a int) 
    CREATE TABLE #t2(b varchar(20)) 
    
    INSERT INTO #t1 VALUES (1) 
    INSERT INTO #t2 VALUES ('test') 
    
    DROP TABLE IF EXISTS #t1 
    CREATE TABLE #t1(x int, y int) 
    INSERT INTO #t1 VALUES (10, 20) 
    
    SELECT * FROM #t1 
    SELECT * FROM #t2 
END
GO

-- DROP IF EXISTS + CREATE with indexes
CREATE PROC p_drop_create_with_index AS 
BEGIN 
    DROP TABLE IF EXISTS #idx_t 
    CREATE TABLE #idx_t(id int, name varchar(50)) 
    CREATE INDEX idx1 ON #idx_t(id) 
    INSERT INTO #idx_t VALUES (1, 'indexed') 
    SELECT * FROM #idx_t 
END
GO

-- DROP IF EXISTS + CREATE with constraints
CREATE PROC p_drop_create_constraints AS 
BEGIN 
    DROP TABLE IF EXISTS #const_t 
    CREATE TABLE #const_t(id int PRIMARY KEY, val int DEFAULT 100) 
    INSERT INTO #const_t(id) VALUES (1) 
    INSERT INTO #const_t VALUES (2, 200) 
    SELECT * FROM #const_t 
END
GO

-- DROP IF EXISTS + CREATE with ALTER TABLE
CREATE PROC p_drop_create_alter AS 
BEGIN 
    DROP TABLE IF EXISTS #alter_t 
    CREATE TABLE #alter_t(a int) 
    INSERT INTO #alter_t VALUES (1) 
    
    ALTER TABLE #alter_t ADD b varchar(20) 
    UPDATE #alter_t SET b = 'altered' 
    
    SELECT * FROM #alter_t 
END
GO

-- Conditional DROP IF EXISTS + CREATE
CREATE PROC p_conditional_drop_create AS 
BEGIN 
    DECLARE @flag int = 1 
    
    IF @flag = 1 
    BEGIN 
        DROP TABLE IF EXISTS #cond_t 
        CREATE TABLE #cond_t(a int) 
        INSERT INTO #cond_t VALUES (100) 
    END 
    
    SELECT * FROM #cond_t 
END
GO

-- DROP IF EXISTS + CREATE with TRUNCATE
CREATE PROC p_drop_create_truncate AS 
BEGIN 
    DROP TABLE IF EXISTS #trunc_t 
    CREATE TABLE #trunc_t(id int, data varchar(30)) 
    INSERT INTO #trunc_t VALUES (1, 'first') 
    INSERT INTO #trunc_t VALUES (2, 'second') 
    
    TRUNCATE TABLE #trunc_t 
    INSERT INTO #trunc_t VALUES (3, 'after truncate') 
    
    SELECT * FROM #trunc_t 
END
GO

-- Error handling with DROP IF EXISTS + CREATE
CREATE PROC p_error_drop_create AS 
BEGIN 
    BEGIN TRY 
        DROP TABLE IF EXISTS #err_t 
        CREATE TABLE #err_t(id int PRIMARY KEY) 
        INSERT INTO #err_t VALUES (1) 
        INSERT INTO #err_t VALUES (1) -- Duplicate key error 
    END TRY 
    BEGIN CATCH 
        SELECT 'Error: ' + ERROR_MESSAGE() as error_msg 
    END CATCH 
    
    SELECT * FROM #err_t 
END
GO

-- pg_class, pg_type, pg_depend, pg_attribute, pg_constraint, pg_index, pg_sequence are all covered by below tests. 
-------------------------------
-- Temp Table CREATE + ROLLBACK
-------------------------------
BEGIN TRAN
CREATE TABLE #temp_table_rollback_t1(a int identity primary key, b int)
select * from enr_view
ROLLBACK
GO
~~START~~
text
#temp_table_rollback_t1_a_seq
#temp_table_rollback_t1
#temp_table_rollback_t1_pkey
~~END~~


-- Should be empty
select * from enr_view
GO
~~START~~
text
~~END~~


-- Should not exist
SELECT * FROM #temp_table_rollback_t1
GO
~~ERROR (Code: 33557097)~~

~~ERROR (Message: relation "#temp_table_rollback_t1" does not exist)~~


BEGIN TRAN
CREATE TABLE #t1(a int)
INSERT INTO #t1 VALUES (1)
SELECT * FROM #t1
ROLLBACK
GO
~~ROW COUNT: 1~~

~~START~~
int
1
~~END~~


CREATE TABLE #t1(a int, b int)
GO

INSERT INTO #t1 VALUES (1, 1)
INSERT INTO #t1 VALUES (2, 1)
GO
~~ROW COUNT: 1~~

~~ROW COUNT: 1~~


INSERT INTO #t1 VALUES (3, 1)
GO
~~ROW COUNT: 1~~


SELECT * FROM #t1
GO
~~START~~
int#!#int
1#!#1
2#!#1
3#!#1
~~END~~


BEGIN TRAN
UPDATE #t1 SET a = a + 1 WHERE b = 1
SELECT * FROM #t1
ROLLBACK
GO
~~ROW COUNT: 3~~

~~START~~
int#!#int
2#!#1
3#!#1
4#!#1
~~END~~



SELECT * FROM #t1
DROP TABLE #t1
GO
~~START~~
int#!#int
1#!#1
2#!#1
3#!#1
~~END~~


-----------------------------
-- Temp Table DROP + ROLLBACK
-----------------------------
CREATE TABLE #temp_table_rollback_t1(a int identity primary key, b int)
go

INSERT INTO #temp_table_rollback_t1 VALUES (1)
GO
~~ROW COUNT: 1~~


BEGIN TRAN
DROP TABLE #temp_table_rollback_t1
ROLLBACK
go

-- Should still exist
select * from enr_view
GO
~~START~~
text
#temp_table_rollback_t1_pkey
#temp_table_rollback_t1_a_seq
#temp_table_rollback_t1
~~END~~


-- Should show results
BEGIN TRAN
select * from #temp_table_rollback_t1
COMMIT
go
~~START~~
int#!#int
1#!#1
~~END~~


-- Should not error
BEGIN TRAN
DROP TABLE #temp_table_rollback_t1
COMMIT
GO

----------------------------------------------------------
-- ALTER TABLE (BABEL-4912)
----------------------------------------------------------
CREATE TABLE #temp_table_rollback_t1 (a int, b int)
GO

BEGIN TRAN
ALTER TABLE #temp_table_rollback_t1 DROP COLUMN b
ROLLBACK
GO

BEGIN TRAN
ALTER TABLE #temp_table_rollback_t1 ALTER COLUMN b VARCHAR
ROLLBACK
GO

BEGIN TRAN
ALTER TABLE #temp_table_rollback_t1 ALTER COLUMN b VARCHAR
COMMIT
GO

BEGIN TRAN
ALTER TABLE #temp_table_rollback_t1 DROP COLUMN b
COMMIT
GO

DROP TABLE #temp_table_rollback_t1
GO

----------------------------------------------------------
-- Multiple tables in one transaction
----------------------------------------------------------
CREATE TABLE #temp_table_rollback_t1(a int identity primary key, b int, c varchar)
GO

create table #temp_table_rollback_t2(a varchar)
GO

BEGIN TRAN
DROP TABLE #temp_table_rollback_t1
DROP TABLE #temp_table_rollback_t2
ROLLBACK
GO

-- Tables are still visible and usable
select * from enr_view
GO
~~START~~
text
#temp_table_rollback_t1_pkey
#pg_toast_#oid_masked#_index
#pg_toast_#oid_masked#
#temp_table_rollback_t1_a_seq
#temp_table_rollback_t1
#pg_toast_#oid_masked#_index
#pg_toast_#oid_masked#
#temp_table_rollback_t2
~~END~~


INSERT INTO #temp_table_rollback_t1 values (1, 'b')
GO
~~ROW COUNT: 1~~


INSERT INTO #temp_table_rollback_t2 values ('c')
GO
~~ROW COUNT: 1~~


SELECT * FROM #temp_table_rollback_t1
GO
~~START~~
int#!#int#!#varchar
1#!#1#!#b
~~END~~


SELECT * FROM #temp_table_rollback_t2
GO
~~START~~
varchar
c
~~END~~


BEGIN TRAN
DROP TABLE #temp_table_rollback_t1
DROP TABLE #temp_table_rollback_t2
COMMIT
GO

BEGIN TRAN
    CREATE TABLE #t1(a int)
    ROLLBACK
GO

SELECT * FROM enr_view
go
~~START~~
text
~~END~~


CREATE TABLE #t1(a int, b int)
GO

CREATE TABLE #t2(c varchar(20), d int)
GO

INSERT INTO #t1 VALUES (1, 1)
INSERT INTO #t1 VALUES (2, 1)
INSERT INTO #t2 VALUES ('abc', 1)
GO
~~ROW COUNT: 1~~

~~ROW COUNT: 1~~

~~ROW COUNT: 1~~


INSERT INTO #t1 VALUES (3, 1)
INSERT INTO #t2 VALUES ('def', 1)
GO
~~ROW COUNT: 1~~

~~ROW COUNT: 1~~


SELECT * FROM #t1
GO
~~START~~
int#!#int
1#!#1
2#!#1
3#!#1
~~END~~


BEGIN TRAN
UPDATE #t1 SET a = a + 1 WHERE b = 1
UPDATE #t2 SET c = 'qed' WHERE d = 1
SELECT * FROM #t1
SELECT * FROM #t2
ROLLBACK
GO
~~ROW COUNT: 3~~

~~ROW COUNT: 2~~

~~START~~
int#!#int
2#!#1
3#!#1
4#!#1
~~END~~

~~START~~
varchar#!#int
qed#!#1
qed#!#1
~~END~~


SELECT * FROM #t1
SELECT * FROM #t2
GO
~~START~~
int#!#int
1#!#1
2#!#1
3#!#1
~~END~~

~~START~~
varchar#!#int
abc#!#1
def#!#1
~~END~~


DROP TABLE #t1
DROP TABLE #t2
GO

----------------------------------------------------------
-- Implicit rollback due to error
----------------------------------------------------------
CREATE TABLE #temp_table_rollback_t1(a int primary key, b int, c varchar)
CREATE TABLE #temp_table_rollback_t2(a int)
GO

INSERT INTO #temp_table_rollback_t2 VALUES (1)
GO
~~ROW COUNT: 1~~


-- Transaction will error out
BEGIN TRAN
drop table #temp_table_rollback_t2
insert into #temp_table_rollback_t1 values (1, 1, 1, 1) -- Too many columns, should error out
GO
~~ERROR (Code: 33557097)~~

~~ERROR (Message: INSERT has more expressions than target columns)~~


-- Table + data should still exist, due to implicit rollback. 
SELECT * FROM #temp_table_rollback_t2
GO
~~START~~
int
1
~~END~~


-- Duplicate key doesn't cause implicit rollback, so the drop will succeed here. 
BEGIN TRAN
drop table #temp_table_rollback_t2
insert into #temp_table_rollback_t1 values (1, 1, 'a')
insert into #temp_table_rollback_t1 values (1, 1, 'a')
GO
~~ROW COUNT: 1~~

~~ERROR (Code: 2627)~~

~~ERROR (Message: duplicate key value violates unique constraint "#temp_table_rollback_t1_pkey")~~


SELECT * FROM #temp_table_rollback_t2
GO
~~ERROR (Code: 33557097)~~

~~ERROR (Message: relation "#temp_table_rollback_t2" does not exist)~~


BEGIN TRAN
DROP TABLE #temp_table_rollback_t1
DROP TABLE #temp_table_rollback_t2
COMMIT
GO

SELECT * FROM enr_view;
GO
~~START~~
text
~~END~~



---------------------------------------------------------------------------
-- Same temp table name in one transaction
---------------------------------------------------------------------------
CREATE TABLE #temp_table_rollback_t3(c1 INT, c2 INT)
GO

BEGIN TRANSACTION
    ALTER TABLE #temp_table_rollback_t3 ADD C3 INT;
    INSERT INTO #temp_table_rollback_t3 VALUES (1, 2, 3)
    DROP TABLE #temp_table_rollback_t3
    CREATE TABLE #temp_table_rollback_t3(c1 INT, c2 INT)
COMMIT
GO
~~ROW COUNT: 1~~


DROP TABLE #temp_table_rollback_t3
GO

CREATE TABLE #temp_table_rollback_t4(c1 INT, c2 CHAR(10))
GO



BEGIN TRANSACTION
    DROP TABLE #temp_table_rollback_t4
    CREATE TABLE #temp_table_rollback_t4(c1 INT, c2 CHAR(10))
    INSERT INTO #temp_table_rollback_t4 VALUES (1, 'one')
    SELECT * FROM #temp_table_rollback_t4 -- should return 1, 'one'
    DROP TABLE #temp_table_rollback_t4
    INSERT INTO #temp_table_rollback_t4 VALUES (2, 'two')
    SELECT * FROM #temp_table_rollback_t4
COMMIT
GO
~~ROW COUNT: 1~~

~~START~~
int#!#char
1#!#one       
~~END~~

~~ERROR (Code: 33557097)~~

~~ERROR (Message: relation "#temp_table_rollback_t4" does not exist)~~


SELECT * FROM #temp_table_rollback_t4
GO
~~START~~
int#!#char
~~END~~


DROP TABLE #temp_table_rollback_t4
GO

CREATE TABLE #temp_table_rollback_t4(c1 INT, c2 CHAR(10))
GO



BEGIN TRANSACTION T1
ALTER TABLE #temp_table_rollback_t4 ADD C3 INT
DROP TABLE #temp_table_rollback_t4
CREATE TABLE #temp_table_rollback_t4(c1 INT, c2 CHAR(10))
DROP  TABLE #temp_table_rollback_t4
INSERT INTO #temp_table_rollback_t4 VALUES (2, 'two')
COMMIT
GO
~~ERROR (Code: 33557097)~~

~~ERROR (Message: relation "#temp_table_rollback_t4" does not exist)~~


DROP TABLE #temp_table_rollback_t4
GO


---------------------------------------------------------------------------
-- Index creation
---------------------------------------------------------------------------
-- Created index in transaction
CREATE TABLE #temp_table_rollback_t5(a int, b varchar, c int, d int)
GO

BEGIN TRAN
    CREATE INDEX #temp_table_rollback_t5_idx1 ON #temp_table_rollback_t5(a)
    INSERT INTO #temp_table_rollback_t5 VALUES (1, 'a', 2, 3)
ROLLBACK
GO
~~ROW COUNT: 1~~


SELECT * FROM #temp_table_rollback_t5
GO
~~START~~
int#!#varchar#!#int#!#int
~~END~~


INSERT INTO #temp_table_rollback_t5 VALUES (2, 'b', 3, 4)
GO
~~ROW COUNT: 1~~


BEGIN TRAN
    CREATE INDEX #temp_table_rollback_t5_idx1 ON #temp_table_rollback_t5(a)
    UPDATE #temp_table_rollback_t5 SET b = 'd' WHERE d = 4
    SELECT * FROM #temp_table_rollback_t5
COMMIT
GO
~~ROW COUNT: 1~~

~~START~~
int#!#varchar#!#int#!#int
2#!#d#!#3#!#4
~~END~~


BEGIN TRAN
    UPDATE #temp_table_rollback_t5 SET b = 'e' WHERE d = 4
    SELECT * FROM #temp_table_rollback_t5
ROLLBACK
GO
~~ROW COUNT: 1~~

~~START~~
int#!#varchar#!#int#!#int
2#!#e#!#3#!#4
~~END~~


SELECT * FROM #temp_table_rollback_t5
GO
~~START~~
int#!#varchar#!#int#!#int
2#!#d#!#3#!#4
~~END~~


DROP INDEX #temp_table_rollback_t5_idx1 ON #temp_table_rollback_t5
GO

SELECT * FROM #temp_table_rollback_t5
GO
~~START~~
int#!#varchar#!#int#!#int
2#!#d#!#3#!#4
~~END~~


SELECT * FROM enr_view
GO
~~START~~
text
#temp_table_rollback_t5
#pg_toast_#oid_masked#
#pg_toast_#oid_masked#_index
~~END~~



-- Drop index in transaction
CREATE INDEX #temp_table_rollback_t5_idx2 ON #temp_table_rollback_t5(b)
GO

BEGIN TRAN
    DROP INDEX #temp_table_rollback_t5_idx2 ON #temp_table_rollback_t5
    INSERT INTO #temp_table_rollback_t5 VALUES (3, 'c', 4, 5)
COMMIT
GO
~~ROW COUNT: 1~~


SELECT * FROM #temp_table_rollback_t5
GO
~~START~~
int#!#varchar#!#int#!#int
2#!#d#!#3#!#4
3#!#c#!#4#!#5
~~END~~


BEGIN TRAN
    DROP INDEX #temp_table_rollback_t5_idx2 ON #temp_table_rollback_t5
ROLLBACK
GO
~~ERROR (Code: 33557097)~~

~~ERROR (Message: index "#temp_table_rollback_t5_idx2#te2a202739f4e4dbd1ebea8195fe760b6f" does not exist)~~


SELECT * FROM #temp_table_rollback_t5
GO
~~START~~
int#!#varchar#!#int#!#int
2#!#d#!#3#!#4
3#!#c#!#4#!#5
~~END~~


DROP INDEX #temp_table_rollback_t5_idx2 ON #temp_table_rollback_t5
GO
~~ERROR (Code: 33557097)~~

~~ERROR (Message: index "#temp_table_rollback_t5_idx2#te2a202739f4e4dbd1ebea8195fe760b6f" does not exist)~~


CREATE INDEX #temp_table_rollback_t5_idx2 ON #temp_table_rollback_t5(b)
GO

DROP INDEX #temp_table_rollback_t5_idx2 ON #temp_table_rollback_t5
GO

SELECT * FROM #temp_table_rollback_t5
GO
~~START~~
int#!#varchar#!#int#!#int
2#!#d#!#3#!#4
3#!#c#!#4#!#5
~~END~~


-- Create and drop in transaction
BEGIN TRAN
    CREATE INDEX #temp_table_rollback_t5_idx3 ON #temp_table_rollback_t5(c)
    DROP INDEX #temp_table_rollback_t5_idx3 ON #temp_table_rollback_t5
ROLLBACK
GO

SELECT * FROM #temp_table_rollback_t5
GO
~~START~~
int#!#varchar#!#int#!#int
2#!#d#!#3#!#4
3#!#c#!#4#!#5
~~END~~


CREATE INDEX #temp_table_rollback_t5_idx3 ON #temp_table_rollback_t5(c)
DROP INDEX #temp_table_rollback_t5_idx3 ON #temp_table_rollback_t5
GO

SELECT * FROM #temp_table_rollback_t5
GO
~~START~~
int#!#varchar#!#int#!#int
2#!#d#!#3#!#4
3#!#c#!#4#!#5
~~END~~


-- Drop - Create
CREATE INDEX #temp_table_rollback_t5_idx4 ON #temp_table_rollback_t5(d)
GO

BEGIN TRAN
    DROP INDEX #temp_table_rollback_t5_idx4 ON #temp_table_rollback_t5
    CREATE INDEX #temp_table_rollback_t5_idx4 ON #temp_table_rollback_t5(c)
ROLLBACK
GO

SELECT * FROM #temp_table_rollback_t5
GO
~~START~~
int#!#varchar#!#int#!#int
2#!#d#!#3#!#4
3#!#c#!#4#!#5
~~END~~


DROP INDEX #temp_table_rollback_t5_idx4 ON #temp_table_rollback_t5
CREATE INDEX #temp_table_rollback_t5_idx4 ON #temp_table_rollback_t5(c)
GO

SELECT * FROM #temp_table_rollback_t5
GO
~~START~~
int#!#varchar#!#int#!#int
2#!#d#!#3#!#4
3#!#c#!#4#!#5
~~END~~


DROP TABLE #temp_table_rollback_t5
GO

SELECT * FROM enr_view
GO
~~START~~
text
~~END~~



-- DELETE, TRUNCATE
CREATE TABLE #t1(a int identity primary key, b int)
INSERT INTO #t1 VALUES (0)
INSERT INTO #t1 VALUES (1)
INSERT INTO #t1 VALUES (2)
INSERT INTO #t1 VALUES (3)
GO
~~ROW COUNT: 1~~

~~ROW COUNT: 1~~

~~ROW COUNT: 1~~

~~ROW COUNT: 1~~


BEGIN TRAN
    DELETE FROM #t1
    SELECT * FROM #t1
ROLLBACK
GO
~~ROW COUNT: 4~~

~~START~~
int#!#int
~~END~~


SELECT * FROM #t1
GO
~~START~~
int#!#int
1#!#0
2#!#1
3#!#2
4#!#3
~~END~~


-- Truncate should reset IDENTITY. But it should be restored on ROLLBACK.
BEGIN TRAN
    TRUNCATE TABLE #t1
    INSERT INTO #t1 VALUES (1)
    SELECT * FROM #t1
ROLLBACK
GO
~~ROW COUNT: 1~~

~~START~~
int#!#int
1#!#1
~~END~~


INSERT INTO #t1 VALUES (4)
GO
~~ROW COUNT: 1~~


SELECT * FROM #t1
DROP TABLE #t1
GO
~~START~~
int#!#int
1#!#0
2#!#1
3#!#2
4#!#3
5#!#4
~~END~~



---------------------------------------------------------------------------
-- Procedures
---------------------------------------------------------------------------
exec test_rollback_in_proc
GO
~~ROW COUNT: 1~~

~~ROW COUNT: 1~~

~~START~~
int#!#varchar
1#!#two
~~END~~

~~ROW COUNT: 1~~

~~START~~
varchar
three
~~END~~

~~ROW COUNT: 1~~

~~START~~
varchar#!#int
four#!#1
~~END~~

~~START~~
int
6
~~END~~

~~ERROR (Code: 33557097)~~

~~ERROR (Message: relation "#t2" does not exist)~~


BEGIN TRANSACTION
    CREATE TABLE #outer_tab1(a int)
    SELECT * FROM enr_view
    exec implicit_rollback_in_proc
    select * from #outer_tab1
ROLLBACK
GO
~~START~~
text
#outer_tab1
~~END~~

~~ROW COUNT: 1~~

~~START~~
int#!#varchar
1#!#two
~~END~~

~~ROW COUNT: 1~~

~~START~~
varchar
three
~~END~~

~~ROW COUNT: 1~~

~~START~~
varchar#!#int
four#!#1
~~END~~

~~ERROR (Code: 33557097)~~

~~ERROR (Message: INSERT has more expressions than target columns)~~


CREATE TABLE temp_tab_rollback_mytab(a int)
GO

BEGIN TRAN
CREATE TABLE #t1(a int)
INSERT INTO #t1 VALUES (1)
EXEC tv_base_rollback
DROP TABLE temp_tab_rollback_mytab
ROLLBACK
SELECT * FROM temp_tab_rollback_mytab
GO
~~ROW COUNT: 1~~

~~ROW COUNT: 1~~

~~ROW COUNT: 1~~

~~START~~
int
~~END~~


BEGIN TRAN
INSERT INTO temp_tab_rollback_mytab VALUES (2)
EXEC tv_tt_no_error
SELECT * FROM temp_tab_rollback_mytab
DROP TABLE temp_tab_rollback_mytab
ROLLBACK
GO
~~ROW COUNT: 1~~

~~ROW COUNT: 1~~

~~ROW COUNT: 1~~

~~ROW COUNT: 1~~

~~START~~
int
2
1
~~END~~


SELECT * FROM temp_tab_rollback_mytab
GO
~~START~~
int
~~END~~


BEGIN TRAN
INSERT INTO temp_tab_rollback_mytab VALUES (2)
CREATE TABLE #outer_table (a int)
INSERT INTO #outer_table VALUES (1)
EXEC tv_tt_no_error
SELECT * FROM temp_tab_rollback_mytab
DROP TABLE temp_tab_rollback_mytab
ROLLBACK
GO
~~ROW COUNT: 1~~

~~ROW COUNT: 1~~

~~ROW COUNT: 1~~

~~ROW COUNT: 1~~

~~ROW COUNT: 1~~

~~START~~
int
2
1
~~END~~


SELECT * FROM temp_tab_rollback_mytab
GO
~~START~~
int
~~END~~


SELECT * FROM #outer_table
GO
~~ERROR (Code: 33557097)~~

~~ERROR (Message: relation "#outer_table" does not exist)~~


DROP TABLE temp_tab_rollback_mytab
GO

-- Everything should be rolled back due to error
-- Nothing from the proc should be here either
SELECT * FROM enr_view
GO
~~START~~
text
~~END~~


---------------------------------------------------------------------------
-- Mixed permanent, TV, temp tables in/out of ENR.
---------------------------------------------------------------------------
-- Mixed create rollback
BEGIN TRAN
    DECLARE @tv TABLE (a1 int)
    CREATE TABLE #temp_table(a2 int)
    CREATE TABLE #temp_table_nonenr(a3 temp_table_type)
ROLLBACK
GO

SELECT * FROM enr_view
GO
~~START~~
text
~~END~~


-- Mixed insert rollback
DECLARE @tv TABLE (a1 int)
CREATE TABLE perm_table(a2 int)
CREATE TABLE #temp_table(a3 int)
CREATE TABLE #temp_table_nonenr(a3 temp_table_type)
BEGIN TRAN
    INSERT INTO @tv VALUES (1)
    INSERT INTO perm_table VALUES(2)
    INSERT INTO #temp_table VALUES(3)
    INSERT INTO #temp_table_nonenr VALUES (4)
    SELECT * FROM @tv
    SELECT * FROM perm_table
    SELECT * FROM #temp_table
    SELECT * FROM #temp_table_nonenr
ROLLBACK
-- Unaffected by rollback
SELECT * FROM @tv
-- Correctly rolled back
SELECT * FROM perm_table
-- Correctly rolled back
SELECT * FROM #temp_table
SELECT * FROM #temp_table_nonenr
SELECT * FROM enr_view
GO
~~ROW COUNT: 1~~

~~ROW COUNT: 1~~

~~ROW COUNT: 1~~

~~ROW COUNT: 1~~

~~START~~
int
1
~~END~~

~~START~~
int
2
~~END~~

~~START~~
int
3
~~END~~

~~START~~
int
4
~~END~~

~~START~~
int
1
~~END~~

~~START~~
int
~~END~~

~~START~~
int
~~END~~

~~START~~
int
~~END~~

~~START~~
text
@tv_0
#temp_table
~~END~~


SELECT * FROM enr_view
DROP TABLE #temp_table
DROP TABLE #temp_table_nonenr
DROP TABLE perm_table
GO
~~START~~
text
#temp_table
~~END~~


-- Mixed drop rollback
CREATE TABLE #temp_table(a int)
CREATE TABLE perm_table(a int)
CREATE TABLE #temp_table_nonenr(a3 temp_table_type)
GO

BEGIN TRAN
    DECLARE @tv TABLE(a int)
    SELECT * FROM enr_view
    DROP TABLE #temp_table
    DROP TABLE perm_table
    DROP TABLE #temp_table_nonenr
    SELECT * FROM enr_view
ROLLBACK
GO
~~START~~
text
#temp_table
@tv_0
~~END~~

~~START~~
text
@tv_0
~~END~~


SELECT * FROM enr_view
GO
~~START~~
text
#temp_table
~~END~~


DROP TABLE #temp_table
DROP TABLE perm_table
DROP TABLE #temp_table_nonenr
GO

-- Mixed rollback with mapped and unmapped errors
CREATE TABLE temp_table_rollback_t6 (a int)
GO

BEGIN TRY 
    BEGIN TRAN 
        DROP TABLE temp_table_rollback_t6 
        EXEC tv_mapped_error 
    ROLLBACK 
END TRY 
BEGIN CATCH 
    ROLLBACK 
END CATCH
GO
~~ROW COUNT: 1~~


SELECT @@trancount
SELECT * FROM temp_table_rollback_t6
GO
~~START~~
int
0
~~END~~

~~START~~
int
~~END~~


BEGIN TRY 
    BEGIN TRAN 
        DROP TABLE temp_table_rollback_t6 
        EXEC tv_unmapped_error 
    ROLLBACK 
END TRY 
BEGIN CATCH 
    ROLLBACK 
END CATCH
GO
~~ROW COUNT: 1~~


SELECT @@trancount
SELECT * FROM temp_table_rollback_t6
GO
~~START~~
int
0
~~END~~

~~START~~
int
~~END~~


DROP TABLE temp_table_rollback_t6
GO


---------------------------------------------------------------------------
-- Multiple COMMIT/ROLLBACK
---------------------------------------------------------------------------
CREATE TABLE #t1(a int)
GO



BEGIN TRAN
INSERT INTO #t1 VALUES (1)
COMMIT
BEGIN TRAN
UPDATE #t1 SET a = 2 WHERE a = 1
COMMIT
BEGIN TRAN
DROP TABLE #t1
ROLLBACK
GO
~~ROW COUNT: 1~~

~~ROW COUNT: 1~~


SELECT * FROM #t1
DROP TABLE #t1
GO
~~START~~
int
2
~~END~~






------------------------
BEGIN TRAN
CREATE TABLE #t1(a int)
COMMIT
BEGIN TRAN
INSERT INTO #t1 VALUES (1)
CREATE TABLE #t2(a int identity primary key, b varchar)
COMMIT
BEGIN TRAN
DROP TABLE #t1
CREATE INDEX #t2_idx ON #t2(b)
INSERT INTO #t2 VALUES ('a')
ROLLBACK
BEGIN TRAN
CREATE INDEX #t2_idx ON #t2(b)
INSERT INTO #t2 VALUES ('b')
SELECT * FROM #t1
SELECT * FROM #t2
DROP TABLE #t1
DROP TABLE #t2
COMMIT
GO
~~ROW COUNT: 1~~

~~ROW COUNT: 1~~

~~ROW COUNT: 1~~

~~START~~
int
1
~~END~~

~~START~~
int#!#varchar
2#!#b
~~END~~







----------------------------
BEGIN TRAN 
CREATE TABLE #t1(a int)
CREATE TABLE #t2(a int)
ROLLBACK
BEGIN TRAN
CREATE TABLE #t1(a varchar)
CREATE TABLE #t2(a varchar)
COMMIT
BEGIN TRAN
DROP TABLE #t1
DROP TABLE #t2
COMMIT
BEGIN TRAN
CREATE TABLE #t1(a int)
CREATE TABLE #t2(a int)
INSERT INTO #t1 VALUES (1)
ROLLBACK
SELECT * FROM enr_view
GO
~~ROW COUNT: 1~~

~~START~~
text
~~END~~







----------------------------
BEGIN TRAN
CREATE TABLE #t1 (a int)
COMMIT
BEGIN TRAN
DROP TABLE #t1 
ROLLBACK
BEGIN TRAN
DROP TABLE #t1
ROLLBACK
BEGIN TRAN
DROP TABLE #t1
ROLLBACK
BEGIN TRAN
INSERT INTO #t1 VALUES (1)
SELECT * FROM #t1
COMMIT
GO
~~ROW COUNT: 1~~

~~START~~
int
1
~~END~~


DROP TABLE #t1
GO




---------------------------------------------------------------------------
-- Cursor
---------------------------------------------------------------------------
-- Temp into permanent
DECLARE @v int
CREATE TABLE #t(a int)
insert into #t values (1)
insert into #t values (2)
insert into #t values (3)
CREATE TABLE perm_tab(a int)
DECLARE cur CURSOR FOR (select a from #t)
OPEN cur
WHILE @@fetch_status = 0
BEGIN
    fetch cur into @v
    insert into perm_tab values (@v)
END
CLOSE cur
DEALLOCATE cur
SELECT * FROM perm_tab
GO
~~ROW COUNT: 1~~

~~ROW COUNT: 1~~

~~ROW COUNT: 1~~

~~ROW COUNT: 1~~

~~ROW COUNT: 1~~

~~ROW COUNT: 1~~

~~ROW COUNT: 1~~

~~START~~
int
1
2
3
<NULL>
~~END~~



-- Permanent into temp
DECLARE @v int
CREATE TABLE #t2(b int)
DECLARE cur CURSOR FOR (select a from perm_tab)
OPEN cur
WHILE @@fetch_status = 0
BEGIN
    fetch cur into @v
    insert into #t2 values (@v)
END
CLOSE cur
DEALLOCATE cur
SELECT * FROM #t2
GO
~~ROW COUNT: 1~~

~~ROW COUNT: 1~~

~~ROW COUNT: 1~~

~~ROW COUNT: 1~~

~~ROW COUNT: 1~~

~~START~~
int
1
2
3
<NULL>
<NULL>
~~END~~


DROP TABLE perm_tab
GO


---------------------------------------------------------------------------
-- Trigger (can't be created on temp tables)
---------------------------------------------------------------------------
CREATE TABLE basetab(a int, b int)
GO

CREATE TRIGGER basetrig_insert ON basetab 
    FOR INSERT, UPDATE, DELETE
AS
    INSERT INTO #t1 VALUES (1)
GO

CREATE TABLE #t1(a int)
GO

BEGIN TRAN
    INSERT INTO basetab VALUES (1, 2)
    SELECT * FROM #t1
ROLLBACK
GO
~~ROW COUNT: 1~~

~~ROW COUNT: 1~~

~~START~~
int
1
~~END~~


SELECT * FROM basetab
SELECT * FROM #t1
GO
~~START~~
int#!#int
~~END~~

~~START~~
int
~~END~~


CREATE TRIGGER basetrig_rollback ON basetab
    FOR INSERT, UPDATE, DELETE
AS
    INSERT INTO #t1 VALUES (2)
    ROLLBACK
GO

INSERT INTO basetab VALUES (3, 4)
GO
~~ROW COUNT: 1~~

~~ROW COUNT: 1~~

~~ERROR (Code: 3609)~~

~~ERROR (Message: The transaction ended in the trigger. The batch has been aborted.)~~


SELECT * FROM #t1
GO
~~START~~
int
~~END~~


DROP TRIGGER basetrig_insert
GO

DROP TABLE basetab
GO


--------------------------------------------
-- DROPPING INTERMEDIATE INDEXES
--------------------------------------------
-- Setup with PRIMARY KEY 
CREATE TABLE #t_intermediate(a int PRIMARY KEY, b int, c int);
go

CREATE INDEX #idx1_intermediate ON #t_intermediate(b);
go

CREATE INDEX #idx2_intermediate ON #t_intermediate(c);
go

SELECT relname FROM sys.babelfish_get_enr_list() ORDER BY relname;
go
~~START~~
text
#idx1_intermediate#t_intermediac7f5304388db1261e76ff73fd7a648c9
#idx2_intermediate#t_intermedia4737c0efb12593904c8c76e1baf5043f
#t
#t1
#t2
#t_intermediate
#t_intermediate_pkey
~~END~~


DROP INDEX #idx1_intermediate ON #t_intermediate;
go

INSERT INTO #t_intermediate VALUES (1, 2, 3);
go
~~ROW COUNT: 1~~


SELECT * FROM #t_intermediate;
go
~~START~~
int#!#int#!#int
1#!#2#!#3
~~END~~


DROP TABLE #t_intermediate;
go

-- Create temp table with multiple indexes including composite
CREATE TABLE #t1_intermediate(a int, b int, c int);
go

CREATE INDEX #idx1_intermediate ON #t1_intermediate(a);
go

CREATE INDEX #idx2_intermediate ON #t1_intermediate(a, b);
go

CREATE INDEX #idx3_intermediate ON #t1_intermediate(c);
go

SELECT relname FROM sys.babelfish_get_enr_list() ORDER BY relname;
go
~~START~~
text
#idx1_intermediate#t1_intermedi3f930a87ab72166e910f7ddcf924df30
#idx2_intermediate#t1_intermedi2cf527ed557fefcaa607af16f2a5138d
#idx3_intermediate#t1_intermedi2a0ee21d2d154e1dfcb71a94a8970097
#t
#t1
#t1_intermediate
#t2
~~END~~


-- Drop intermediate composite index
DROP INDEX #idx2_intermediate ON #t1_intermediate;
go

INSERT INTO #t1_intermediate VALUES (1, 2, 3), (4, 5, 6), (7, 8, 9);
go
~~ROW COUNT: 3~~


INSERT INTO #t1_intermediate VALUES (10, 20, 30);
go
~~ROW COUNT: 1~~


INSERT INTO #t1_intermediate (a, b, c) VALUES (100, 200, 300);
go
~~ROW COUNT: 1~~


INSERT INTO #t1_intermediate (a, c, b) VALUES (11, 33, 22);
go
~~ROW COUNT: 1~~


SELECT * FROM #t1_intermediate;
go
~~START~~
int#!#int#!#int
1#!#2#!#3
4#!#5#!#6
7#!#8#!#9
10#!#20#!#30
100#!#200#!#300
11#!#22#!#33
~~END~~


SELECT * FROM #t1_intermediate WHERE a = 4;
go
~~START~~
int#!#int#!#int
4#!#5#!#6
~~END~~


SELECT * FROM #t1_intermediate WHERE b = 20;
go
~~START~~
int#!#int#!#int
10#!#20#!#30
~~END~~


SELECT * FROM #t1_intermediate WHERE c = 33;
go
~~START~~
int#!#int#!#int
11#!#22#!#33
~~END~~


SELECT * FROM #t1_intermediate ORDER BY a;
go
~~START~~
int#!#int#!#int
1#!#2#!#3
4#!#5#!#6
7#!#8#!#9
10#!#20#!#30
11#!#22#!#33
100#!#200#!#300
~~END~~


SELECT COUNT(*) AS total_rows, SUM(a) AS sum_a, AVG(b) AS avg_b, MAX(c) AS max_c FROM #t1_intermediate;
go
~~START~~
int#!#int#!#int#!#int
6#!#133#!#42#!#300
~~END~~


UPDATE #t1_intermediate SET b = 999 WHERE a = 1;
go
~~ROW COUNT: 1~~


SELECT * FROM #t1_intermediate WHERE a = 1;
go
~~START~~
int#!#int#!#int
1#!#999#!#3
~~END~~


UPDATE #t1_intermediate SET c = c + 1000 WHERE a > 5;
go
~~ROW COUNT: 4~~


SELECT * FROM #t1_intermediate WHERE a > 5 ORDER BY a;
go
~~START~~
int#!#int#!#int
7#!#8#!#1009
10#!#20#!#1030
11#!#22#!#1033
100#!#200#!#1300
~~END~~


UPDATE #t1_intermediate SET a = 111 WHERE a = 100;
go
~~ROW COUNT: 1~~


SELECT * FROM #t1_intermediate ORDER BY a;
go
~~START~~
int#!#int#!#int
1#!#999#!#3
4#!#5#!#6
7#!#8#!#1009
10#!#20#!#1030
11#!#22#!#1033
111#!#200#!#1300
~~END~~


DELETE FROM #t1_intermediate WHERE a = 4;
go
~~ROW COUNT: 1~~


SELECT * FROM #t1_intermediate ORDER BY a;
go
~~START~~
int#!#int#!#int
1#!#999#!#3
7#!#8#!#1009
10#!#20#!#1030
11#!#22#!#1033
111#!#200#!#1300
~~END~~


DELETE FROM #t1_intermediate WHERE c > 1000;
go
~~ROW COUNT: 4~~


SELECT * FROM #t1_intermediate ORDER BY a;
go
~~START~~
int#!#int#!#int
1#!#999#!#3
~~END~~


INSERT INTO #t1_intermediate VALUES (50, 60, 70), (80, 90, 100);
go
~~ROW COUNT: 2~~


SELECT * FROM #t1_intermediate ORDER BY a;
go
~~START~~
int#!#int#!#int
1#!#999#!#3
50#!#60#!#70
80#!#90#!#100
~~END~~


SELECT a, b FROM #t1_intermediate WHERE c < 100 ORDER BY b DESC;
go
~~START~~
int#!#int
1#!#999
50#!#60
~~END~~


SELECT COUNT(*) FROM #t1_intermediate;
go
~~START~~
int
3
~~END~~


SELECT relname FROM sys.babelfish_get_enr_list() ORDER BY relname;
go
~~START~~
text
#idx1_intermediate#t1_intermedi3f930a87ab72166e910f7ddcf924df30
#idx3_intermediate#t1_intermedi2a0ee21d2d154e1dfcb71a94a8970097
#t
#t1
#t1_intermediate
#t2
~~END~~


DROP TABLE #t1_intermediate;
go

---------------------------------------------------------------------------
-- Drop Index Inside Transaction (ROLLBACK/COMMIT scenarios)
---------------------------------------------------------------------------
CREATE TABLE #t_drop_idx_txn(a int, b int, c int, d int);
GO

CREATE INDEX #idx_a ON #t_drop_idx_txn(a);
GO

CREATE INDEX #idx_b ON #t_drop_idx_txn(b);
GO

CREATE INDEX #idx_c ON #t_drop_idx_txn(c);
GO

INSERT INTO #t_drop_idx_txn VALUES (1, 10, 100, 1000), (2, 20, 200, 2000), (3, 30, 300, 3000);
GO
~~ROW COUNT: 3~~


SELECT relname FROM sys.babelfish_get_enr_list() ORDER BY relname;
GO
~~START~~
text
#idx_a#t_drop_idx_txnda644fa620ab90bd561714e2e99ce2c6
#idx_b#t_drop_idx_txn0f8363570e9de8ec902e0ced60eaf64e
#idx_c#t_drop_idx_txn26e61d92e1f02e7f721f184f0f4207c4
#t
#t1
#t2
#t_drop_idx_txn
~~END~~


-- Drop single index and ROLLBACK
BEGIN TRAN
    DROP INDEX #idx_a ON #t_drop_idx_txn
    INSERT INTO #t_drop_idx_txn VALUES (4, 40, 400, 4000)
    SELECT relname FROM sys.babelfish_get_enr_list() ORDER BY relname;
ROLLBACK
GO
~~ROW COUNT: 1~~

~~START~~
text
#idx_b#t_drop_idx_txn0f8363570e9de8ec902e0ced60eaf64e
#idx_c#t_drop_idx_txn26e61d92e1f02e7f721f184f0f4207c4
#t
#t1
#t2
#t_drop_idx_txn
~~END~~


SELECT * FROM #t_drop_idx_txn ORDER BY a;
GO
~~START~~
int#!#int#!#int#!#int
1#!#10#!#100#!#1000
2#!#20#!#200#!#2000
3#!#30#!#300#!#3000
~~END~~


SELECT relname FROM sys.babelfish_get_enr_list() ORDER BY relname;
GO
~~START~~
text
#idx_a#t_drop_idx_txnda644fa620ab90bd561714e2e99ce2c6
#idx_b#t_drop_idx_txn0f8363570e9de8ec902e0ced60eaf64e
#idx_c#t_drop_idx_txn26e61d92e1f02e7f721f184f0f4207c4
#t
#t1
#t2
#t_drop_idx_txn
~~END~~


-- Drop single index and COMMIT
BEGIN TRAN
    DROP INDEX #idx_a ON #t_drop_idx_txn
    INSERT INTO #t_drop_idx_txn VALUES (4, 40, 400, 4000)
    SELECT relname FROM sys.babelfish_get_enr_list() ORDER BY relname;
COMMIT
GO
~~ROW COUNT: 1~~

~~START~~
text
#idx_b#t_drop_idx_txn0f8363570e9de8ec902e0ced60eaf64e
#idx_c#t_drop_idx_txn26e61d92e1f02e7f721f184f0f4207c4
#t
#t1
#t2
#t_drop_idx_txn
~~END~~


SELECT * FROM #t_drop_idx_txn ORDER BY a;
GO
~~START~~
int#!#int#!#int#!#int
1#!#10#!#100#!#1000
2#!#20#!#200#!#2000
3#!#30#!#300#!#3000
4#!#40#!#400#!#4000
~~END~~


SELECT relname FROM sys.babelfish_get_enr_list() ORDER BY relname;
GO
~~START~~
text
#idx_b#t_drop_idx_txn0f8363570e9de8ec902e0ced60eaf64e
#idx_c#t_drop_idx_txn26e61d92e1f02e7f721f184f0f4207c4
#t
#t1
#t2
#t_drop_idx_txn
~~END~~


-- Drop multiple indexes and ROLLBACK
BEGIN TRAN
    DROP INDEX #idx_b ON #t_drop_idx_txn
    DROP INDEX #idx_c ON #t_drop_idx_txn
    UPDATE #t_drop_idx_txn SET b = 999 WHERE a = 1
    SELECT relname FROM sys.babelfish_get_enr_list() ORDER BY relname;
ROLLBACK
GO
~~ROW COUNT: 1~~

~~START~~
text
#t
#t1
#t2
#t_drop_idx_txn
~~END~~


SELECT * FROM #t_drop_idx_txn ORDER BY a;
GO
~~START~~
int#!#int#!#int#!#int
1#!#10#!#100#!#1000
2#!#20#!#200#!#2000
3#!#30#!#300#!#3000
4#!#40#!#400#!#4000
~~END~~


SELECT relname FROM sys.babelfish_get_enr_list() ORDER BY relname;
GO
~~START~~
text
#idx_b#t_drop_idx_txn0f8363570e9de8ec902e0ced60eaf64e
#idx_c#t_drop_idx_txn26e61d92e1f02e7f721f184f0f4207c4
#t
#t1
#t2
#t_drop_idx_txn
~~END~~


-- Drop multiple indexes and COMMIT
BEGIN TRAN
    DROP INDEX #idx_b ON #t_drop_idx_txn
    DROP INDEX #idx_c ON #t_drop_idx_txn
    SELECT relname FROM sys.babelfish_get_enr_list() ORDER BY relname;
COMMIT
GO
~~START~~
text
#t
#t1
#t2
#t_drop_idx_txn
~~END~~


SELECT relname FROM sys.babelfish_get_enr_list() ORDER BY relname;
GO
~~START~~
text
#t
#t1
#t2
#t_drop_idx_txn
~~END~~


DROP TABLE #t_drop_idx_txn;
GO

SELECT relname FROM sys.babelfish_get_enr_list() ORDER BY relname;
GO
~~START~~
text
#t
#t1
#t2
~~END~~


---------------------------------------------------------------------------
-- Create Index Inside Transaction (ROLLBACK/COMMIT scenarios)
---------------------------------------------------------------------------
CREATE TABLE #t_create_idx_txn(a int, b int, c int);
GO

INSERT INTO #t_create_idx_txn VALUES (1, 10, 100), (2, 20, 200), (3, 30, 300);
GO
~~ROW COUNT: 3~~


SELECT relname FROM sys.babelfish_get_enr_list() ORDER BY relname;
GO
~~START~~
text
#t
#t1
#t2
#t_create_idx_txn
~~END~~


-- Create single index and ROLLBACK
BEGIN TRAN
    CREATE INDEX #idx_create_a ON #t_create_idx_txn(a)
    INSERT INTO #t_create_idx_txn VALUES (4, 40, 400)
    SELECT relname FROM sys.babelfish_get_enr_list() ORDER BY relname;
ROLLBACK
GO
~~ROW COUNT: 1~~

~~START~~
text
#idx_create_a#t_create_idx_txna9f36699e06dfdc2e84a4a66febe3712
#t
#t1
#t2
#t_create_idx_txn
~~END~~


SELECT * FROM #t_create_idx_txn ORDER BY a;
GO
~~START~~
int#!#int#!#int
1#!#10#!#100
2#!#20#!#200
3#!#30#!#300
~~END~~


SELECT relname FROM sys.babelfish_get_enr_list() ORDER BY relname;
GO
~~START~~
text
#t
#t1
#t2
#t_create_idx_txn
~~END~~


-- Create index and COMMIT
BEGIN TRAN
    CREATE INDEX #idx_create_a ON #t_create_idx_txn(a)
    INSERT INTO #t_create_idx_txn VALUES (4, 40, 400)
    SELECT relname FROM sys.babelfish_get_enr_list() ORDER BY relname;
COMMIT
GO
~~ROW COUNT: 1~~

~~START~~
text
#idx_create_a#t_create_idx_txna9f36699e06dfdc2e84a4a66febe3712
#t
#t1
#t2
#t_create_idx_txn
~~END~~


SELECT * FROM #t_create_idx_txn ORDER BY a;
GO
~~START~~
int#!#int#!#int
1#!#10#!#100
2#!#20#!#200
3#!#30#!#300
4#!#40#!#400
~~END~~


SELECT relname FROM sys.babelfish_get_enr_list() ORDER BY relname;
GO
~~START~~
text
#idx_create_a#t_create_idx_txna9f36699e06dfdc2e84a4a66febe3712
#t
#t1
#t2
#t_create_idx_txn
~~END~~


DROP TABLE #t_create_idx_txn;
GO

SELECT relname FROM sys.babelfish_get_enr_list() ORDER BY relname;
GO
~~START~~
text
#t
#t1
#t2
~~END~~


---------------------------------------------------------------------------
-- Create and Drop Index Combinations in Transactions
---------------------------------------------------------------------------
CREATE TABLE #t_idx_combo(a int, b int, c int);
GO

INSERT INTO #t_idx_combo VALUES (1, 10, 100), (2, 20, 200), (3, 30, 300);
GO
~~ROW COUNT: 3~~


CREATE INDEX #idx_combo_b ON #t_idx_combo(b);
GO

SELECT relname FROM sys.babelfish_get_enr_list() ORDER BY relname;
GO
~~START~~
text
#idx_combo_b#t_idx_comboa3187008f5b4c7656ad5c6712d601a1d
#t
#t1
#t2
#t_idx_combo
~~END~~


-- Drop existing index, create new one, ROLLBACK
BEGIN TRAN
    DROP INDEX #idx_combo_b ON #t_idx_combo
    CREATE INDEX #idx_combo_c ON #t_idx_combo(c)
    INSERT INTO #t_idx_combo VALUES (4, 40, 400)
    SELECT relname FROM sys.babelfish_get_enr_list() ORDER BY relname;
ROLLBACK
GO
~~ROW COUNT: 1~~

~~START~~
text
#idx_combo_c#t_idx_combo2d9a538a5e214b5ac1479e25b370ea9b
#t
#t1
#t2
#t_idx_combo
~~END~~


SELECT * FROM #t_idx_combo ORDER BY a;
GO
~~START~~
int#!#int#!#int
1#!#10#!#100
2#!#20#!#200
3#!#30#!#300
~~END~~


SELECT relname FROM sys.babelfish_get_enr_list() ORDER BY relname;
GO
~~START~~
text
#idx_combo_b#t_idx_comboa3187008f5b4c7656ad5c6712d601a1d
#t
#t1
#t2
#t_idx_combo
~~END~~


-- Drop existing index, create new one, COMMIT
BEGIN TRAN
    DROP INDEX #idx_combo_b ON #t_idx_combo
    CREATE INDEX #idx_combo_c ON #t_idx_combo(c)
    INSERT INTO #t_idx_combo VALUES (4, 40, 400)
    SELECT relname FROM sys.babelfish_get_enr_list() ORDER BY relname;
COMMIT
GO
~~ROW COUNT: 1~~

~~START~~
text
#idx_combo_c#t_idx_combo2d9a538a5e214b5ac1479e25b370ea9b
#t
#t1
#t2
#t_idx_combo
~~END~~


SELECT * FROM #t_idx_combo ORDER BY a;
GO
~~START~~
int#!#int#!#int
1#!#10#!#100
2#!#20#!#200
3#!#30#!#300
4#!#40#!#400
~~END~~


SELECT relname FROM sys.babelfish_get_enr_list() ORDER BY relname;
GO
~~START~~
text
#idx_combo_c#t_idx_combo2d9a538a5e214b5ac1479e25b370ea9b
#t
#t1
#t2
#t_idx_combo
~~END~~


DROP TABLE #t_idx_combo;
GO

SELECT relname FROM sys.babelfish_get_enr_list() ORDER BY relname;
GO
~~START~~
text
#t
#t1
#t2
~~END~~


---------------------------------------------------------------------------
-- Drop Index with DML Operations in Transaction
---------------------------------------------------------------------------
CREATE TABLE #t_idx_dml(a int, b int, c int);
GO

CREATE INDEX #idx_dml_a ON #t_idx_dml(a);
GO

INSERT INTO #t_idx_dml VALUES (1, 10, 100), (2, 20, 200), (3, 30, 300);
GO
~~ROW COUNT: 3~~


SELECT relname FROM sys.babelfish_get_enr_list() ORDER BY relname;
GO
~~START~~
text
#idx_dml_a#t_idx_dml44625b82b2534f5ea590f32a08fbcee5
#t
#t1
#t2
#t_idx_dml
~~END~~


-- Drop index with DML and ROLLBACK
BEGIN TRAN
    DROP INDEX #idx_dml_a ON #t_idx_dml
    INSERT INTO #t_idx_dml VALUES (4, 40, 400)
    UPDATE #t_idx_dml SET c = 999 WHERE a = 1
    DELETE FROM #t_idx_dml WHERE a = 2
    SELECT relname FROM sys.babelfish_get_enr_list() ORDER BY relname;
ROLLBACK
GO
~~ROW COUNT: 1~~

~~ROW COUNT: 1~~

~~ROW COUNT: 1~~

~~START~~
text
#t
#t1
#t2
#t_idx_dml
~~END~~


SELECT * FROM #t_idx_dml ORDER BY a;
GO
~~START~~
int#!#int#!#int
1#!#10#!#100
2#!#20#!#200
3#!#30#!#300
~~END~~


SELECT relname FROM sys.babelfish_get_enr_list() ORDER BY relname;
GO
~~START~~
text
#idx_dml_a#t_idx_dml44625b82b2534f5ea590f32a08fbcee5
#t
#t1
#t2
#t_idx_dml
~~END~~


-- Drop index with DML and COMMIT
BEGIN TRAN
    DROP INDEX #idx_dml_a ON #t_idx_dml
    INSERT INTO #t_idx_dml VALUES (4, 40, 400)
    UPDATE #t_idx_dml SET c = 999 WHERE a = 1
    DELETE FROM #t_idx_dml WHERE a = 2
    SELECT relname FROM sys.babelfish_get_enr_list() ORDER BY relname;
COMMIT
GO
~~ROW COUNT: 1~~

~~ROW COUNT: 1~~

~~ROW COUNT: 1~~

~~START~~
text
#t
#t1
#t2
#t_idx_dml
~~END~~


SELECT * FROM #t_idx_dml ORDER BY a;
GO
~~START~~
int#!#int#!#int
1#!#10#!#999
3#!#30#!#300
4#!#40#!#400
~~END~~


SELECT relname FROM sys.babelfish_get_enr_list() ORDER BY relname;
GO
~~START~~
text
#t
#t1
#t2
#t_idx_dml
~~END~~


DROP TABLE #t_idx_dml;
GO

SELECT relname FROM sys.babelfish_get_enr_list() ORDER BY relname;
GO
~~START~~
text
#t
#t1
#t2
~~END~~


---------------------------------------------------------------------------
-- Subtransaction Rollback with Index Operations
---------------------------------------------------------------------------
CREATE TABLE #t_idx_subtxn(a int, b int, c int);
GO

INSERT INTO #t_idx_subtxn VALUES (1, 10, 100), (2, 20, 200);
GO
~~ROW COUNT: 2~~


SELECT relname FROM sys.babelfish_get_enr_list() ORDER BY relname;
GO
~~START~~
text
#t
#t1
#t2
#t_idx_subtxn
~~END~~


-- Nested savepoints with index operations
BEGIN TRAN
    CREATE INDEX #idx_subtxn_a ON #t_idx_subtxn(a)
    SELECT relname FROM sys.babelfish_get_enr_list() ORDER BY relname;
    
    SAVE TRANSACTION sp1
    
    CREATE INDEX #idx_subtxn_b ON #t_idx_subtxn(b)
    INSERT INTO #t_idx_subtxn VALUES (3, 30, 300)
    SELECT relname FROM sys.babelfish_get_enr_list() ORDER BY relname;
    
    ROLLBACK TRANSACTION sp1
    
    SELECT relname FROM sys.babelfish_get_enr_list() ORDER BY relname;
    
    INSERT INTO #t_idx_subtxn VALUES (4, 40, 400)
COMMIT
GO
~~START~~
text
#idx_subtxn_a#t_idx_subtxn5407cedfc62bb5d13b7b98608e325b5f
#t
#t1
#t2
#t_idx_subtxn
~~END~~

~~ROW COUNT: 1~~

~~START~~
text
#idx_subtxn_a#t_idx_subtxn5407cedfc62bb5d13b7b98608e325b5f
#idx_subtxn_b#t_idx_subtxn64977253700b3c53e4f63f345b297733
#t
#t1
#t2
#t_idx_subtxn
~~END~~

~~START~~
text
#idx_subtxn_a#t_idx_subtxn5407cedfc62bb5d13b7b98608e325b5f
#t
#t1
#t2
#t_idx_subtxn
~~END~~

~~ROW COUNT: 1~~


SELECT * FROM #t_idx_subtxn ORDER BY a;
GO
~~START~~
int#!#int#!#int
1#!#10#!#100
2#!#20#!#200
4#!#40#!#400
~~END~~


SELECT relname FROM sys.babelfish_get_enr_list() ORDER BY relname;
GO
~~START~~
text
#idx_subtxn_a#t_idx_subtxn5407cedfc62bb5d13b7b98608e325b5f
#t
#t1
#t2
#t_idx_subtxn
~~END~~


DROP TABLE #t_idx_subtxn;
GO

SELECT relname FROM sys.babelfish_get_enr_list() ORDER BY relname;
GO
~~START~~
text
#t
#t1
#t2
~~END~~



---------------------------------------------------------------------------
-- FUNCTION: Read from Temp Table After Dropping Intermediate Index
-- Note: DDL not allowed inside functions, drop happens outside
---------------------------------------------------------------------------
CREATE TABLE #t_func_idx(a int, b int, c int);
GO

CREATE INDEX #idx_f1 ON #t_func_idx(a);
GO

CREATE INDEX #idx_f2 ON #t_func_idx(b);
GO

CREATE INDEX #idx_f3 ON #t_func_idx(c);
GO

INSERT INTO #t_func_idx VALUES (1, 10, 100), (2, 20, 200), (3, 30, 300);
GO
~~ROW COUNT: 3~~


SELECT relname FROM sys.babelfish_get_enr_list() ORDER BY relname;
GO
~~START~~
text
#idx_f1#t_func_idx0bbd575c999a1ddc80e7e43987214950
#idx_f2#t_func_idx451c5d6f49c20554c8a50bc360e82cdb
#idx_f3#t_func_idxa50aaca8b110081369b6577bbf87260f
#t
#t1
#t2
#t_func_idx
~~END~~


SELECT func_get_sum_temp(3) AS sum_before;
GO
~~START~~
int
600
~~END~~


SELECT func_get_count_temp(10) AS count_before;
GO
~~START~~
int
3
~~END~~


SELECT func_get_min_max_temp('a') AS minmax_a_before;
GO
~~START~~
int
2
~~END~~


SELECT func_get_min_max_temp('c') AS minmax_c_before;
GO
~~START~~
int
200
~~END~~


DROP INDEX #idx_f2 ON #t_func_idx;
GO

SELECT relname FROM sys.babelfish_get_enr_list() ORDER BY relname;
GO
~~START~~
text
#idx_f1#t_func_idx0bbd575c999a1ddc80e7e43987214950
#idx_f3#t_func_idxa50aaca8b110081369b6577bbf87260f
#t
#t1
#t2
#t_func_idx
~~END~~


SELECT func_get_sum_temp(3) AS sum_after;
GO
~~START~~
int
600
~~END~~


SELECT func_get_count_temp(10) AS count_after;
GO
~~START~~
int
3
~~END~~


SELECT func_get_min_max_temp('a') AS minmax_a_after;
GO
~~START~~
int
2
~~END~~


SELECT func_get_min_max_temp('c') AS minmax_c_after;
GO
~~START~~
int
200
~~END~~


INSERT INTO #t_func_idx VALUES (4, 40, 400);
GO
~~ROW COUNT: 1~~


SELECT func_get_sum_temp(4) AS sum_final;
GO
~~START~~
int
1000
~~END~~


SELECT func_get_count_temp(20) AS count_final;
GO
~~START~~
int
3
~~END~~


SELECT func_get_min_max_temp('a') AS minmax_a_final;
GO
~~START~~
int
3
~~END~~


SELECT func_get_min_max_temp('c') AS minmax_c_final;
GO
~~START~~
int
300
~~END~~


SELECT * FROM #t_func_idx ORDER BY a;
GO
~~START~~
int#!#int#!#int
1#!#10#!#100
2#!#20#!#200
3#!#30#!#300
4#!#40#!#400
~~END~~


DROP TABLE #t_func_idx;
GO

SELECT relname FROM sys.babelfish_get_enr_list() ORDER BY relname;
GO
~~START~~
text
#t
#t1
#t2
~~END~~


---------------------------------------------------------------------------
-- PROCEDURE: Create temp table with indexes and drop intermediate index
---------------------------------------------------------------------------
EXEC test_temp_table_drop_intermediate_idx;
GO
~~START~~
text
#idx1#t_procedure411a39ff59713316af44ae7ea8681f2f
#idx2#t_procedurea5ba3973e494f7551d8312ae8010d9e0
#t
#t1
#t2
#t_procedure
#t_procedure_pkey
~~END~~

~~ROW COUNT: 1~~

~~START~~
int#!#bigint#!#int
4#!#100#!#2
~~END~~


SELECT relname FROM sys.babelfish_get_enr_list() ORDER BY relname;
GO
~~START~~
text
#t
#t1
#t2
~~END~~



---------------------------------------------------------------------------
-- Temp Tables with multiple defaults
---------------------------------------------------------------------------
CREATE TABLE #test1_defaults (
col1 INT DEFAULT 10,
col2 INT DEFAULT 20,
col3 INT DEFAULT 30,
col4 INT DEFAULT 40 );
go

INSERT INTO #test1_defaults (col1) VALUES (1);
go
~~ROW COUNT: 1~~


SELECT * FROM #test1_defaults;
go
~~START~~
int#!#int#!#int#!#int
1#!#20#!#30#!#40
~~END~~


INSERT INTO #test1_defaults DEFAULT VALUES;
go
~~ROW COUNT: 1~~


SELECT * FROM #test1_defaults;
go
~~START~~
int#!#int#!#int#!#int
1#!#20#!#30#!#40
10#!#20#!#30#!#40
~~END~~


INSERT INTO #test1_defaults (col1, col3) VALUES (100, 300);
go
~~ROW COUNT: 1~~


INSERT INTO #test1_defaults (col2, col4) VALUES (200, 400);
go
~~ROW COUNT: 1~~


SELECT * FROM #test1_defaults ORDER BY col1;
go
~~START~~
int#!#int#!#int#!#int
1#!#20#!#30#!#40
10#!#20#!#30#!#40
10#!#200#!#30#!#400
100#!#20#!#300#!#40
~~END~~


INSERT INTO #test1_defaults (col1) VALUES (5), (6), (7);
go
~~ROW COUNT: 3~~


SELECT * FROM #test1_defaults ORDER BY col1;
go
~~START~~
int#!#int#!#int#!#int
1#!#20#!#30#!#40
5#!#20#!#30#!#40
6#!#20#!#30#!#40
7#!#20#!#30#!#40
10#!#200#!#30#!#400
10#!#20#!#30#!#40
100#!#20#!#300#!#40
~~END~~


SELECT relname FROM sys.babelfish_get_enr_list() ORDER BY relname;
go
~~START~~
text
#t
#t1
#t2
#test1_defaults
~~END~~


ALTER TABLE #test1_defaults ADD DEFAULT NULL FOR col2;
go

INSERT INTO #test1_defaults (col1) VALUES (2);
go
~~ROW COUNT: 1~~


SELECT * FROM #test1_defaults WHERE col1 = 2;
go
~~START~~
int#!#int#!#int#!#int
2#!#<NULL>#!#30#!#40
~~END~~


INSERT INTO #test1_defaults (col1, col2) VALUES (3, 3);
go
~~ROW COUNT: 1~~


SELECT * FROM #test1_defaults ORDER BY col1;
go
~~START~~
int#!#int#!#int#!#int
1#!#20#!#30#!#40
2#!#<NULL>#!#30#!#40
3#!#3#!#30#!#40
5#!#20#!#30#!#40
6#!#20#!#30#!#40
7#!#20#!#30#!#40
10#!#200#!#30#!#400
10#!#20#!#30#!#40
100#!#20#!#300#!#40
~~END~~


SELECT * FROM #test1_defaults WHERE col2 IS NULL;
go
~~START~~
int#!#int#!#int#!#int
2#!#<NULL>#!#30#!#40
~~END~~


SELECT * FROM #test1_defaults WHERE col2 = 20;
go
~~START~~
int#!#int#!#int#!#int
1#!#20#!#30#!#40
10#!#20#!#30#!#40
100#!#20#!#300#!#40
5#!#20#!#30#!#40
6#!#20#!#30#!#40
7#!#20#!#30#!#40
~~END~~


SELECT COUNT(*) AS total_rows FROM #test1_defaults;
go
~~START~~
int
9
~~END~~


SELECT col1, col2, col3, col4 FROM #test1_defaults ORDER BY col1 DESC;
go
~~START~~
int#!#int#!#int#!#int
100#!#20#!#300#!#40
10#!#20#!#30#!#40
10#!#200#!#30#!#400
7#!#20#!#30#!#40
6#!#20#!#30#!#40
5#!#20#!#30#!#40
3#!#3#!#30#!#40
2#!#<NULL>#!#30#!#40
1#!#20#!#30#!#40
~~END~~


SELECT 
    SUM(col1) AS sum_col1, 
    AVG(col2) AS avg_col2, 
    MIN(col3) AS min_col3, 
    MAX(col4) AS max_col4 
FROM #test1_defaults;
go
~~START~~
int#!#int#!#int#!#int
144#!#40#!#30#!#400
~~END~~


UPDATE #test1_defaults SET col2 = 999 WHERE col1 = 1;
go
~~ROW COUNT: 1~~


SELECT * FROM #test1_defaults WHERE col1 = 1;
go
~~START~~
int#!#int#!#int#!#int
1#!#999#!#30#!#40
~~END~~


UPDATE #test1_defaults SET col3 = col3 + 1000 WHERE col2 IS NOT NULL;
go
~~ROW COUNT: 8~~


SELECT * FROM #test1_defaults ORDER BY col1;
go
~~START~~
int#!#int#!#int#!#int
1#!#999#!#1030#!#40
2#!#<NULL>#!#30#!#40
3#!#3#!#1030#!#40
5#!#20#!#1030#!#40
6#!#20#!#1030#!#40
7#!#20#!#1030#!#40
10#!#200#!#1030#!#400
10#!#20#!#1030#!#40
100#!#20#!#1300#!#40
~~END~~


UPDATE #test1_defaults SET col4 = NULL WHERE col1 = 5;
go
~~ROW COUNT: 1~~


SELECT * FROM #test1_defaults WHERE col1 = 5;
go
~~START~~
int#!#int#!#int#!#int
5#!#20#!#1030#!#<NULL>
~~END~~


DELETE FROM #test1_defaults WHERE col1 = 6;
go
~~ROW COUNT: 1~~


SELECT COUNT(*) AS rows_after_delete FROM #test1_defaults;
go
~~START~~
int
8
~~END~~


DELETE FROM #test1_defaults WHERE col2 IS NULL;
go
~~ROW COUNT: 1~~


SELECT * FROM #test1_defaults ORDER BY col1;
go
~~START~~
int#!#int#!#int#!#int
1#!#999#!#1030#!#40
3#!#3#!#1030#!#40
5#!#20#!#1030#!#<NULL>
7#!#20#!#1030#!#40
10#!#20#!#1030#!#40
10#!#200#!#1030#!#400
100#!#20#!#1300#!#40
~~END~~


INSERT INTO #test1_defaults (col1) VALUES (1000);
go
~~ROW COUNT: 1~~


INSERT INTO #test1_defaults DEFAULT VALUES;
go
~~ROW COUNT: 1~~


SELECT * FROM #test1_defaults ORDER BY col1;
go
~~START~~
int#!#int#!#int#!#int
1#!#999#!#1030#!#40
3#!#3#!#1030#!#40
5#!#20#!#1030#!#<NULL>
7#!#20#!#1030#!#40
10#!#<NULL>#!#30#!#40
10#!#200#!#1030#!#400
10#!#20#!#1030#!#40
100#!#20#!#1300#!#40
1000#!#<NULL>#!#30#!#40
~~END~~


SELECT relname FROM sys.babelfish_get_enr_list() ORDER BY relname;
go
~~START~~
text
#t
#t1
#t2
#test1_defaults
~~END~~


ALTER TABLE #test1_defaults ADD DEFAULT 999 FOR col3;
go

INSERT INTO #test1_defaults (col1, col2) VALUES (2000, 2000);
go
~~ROW COUNT: 1~~


SELECT * FROM #test1_defaults WHERE col1 = 2000;
go
~~START~~
int#!#int#!#int#!#int
2000#!#2000#!#999#!#40
~~END~~


SELECT * FROM #test1_defaults ORDER BY col1;
go
~~START~~
int#!#int#!#int#!#int
1#!#999#!#1030#!#40
3#!#3#!#1030#!#40
5#!#20#!#1030#!#<NULL>
7#!#20#!#1030#!#40
10#!#20#!#1030#!#40
10#!#200#!#1030#!#400
10#!#<NULL>#!#30#!#40
100#!#20#!#1300#!#40
1000#!#<NULL>#!#30#!#40
2000#!#2000#!#999#!#40
~~END~~


SELECT COUNT(*) AS final_count FROM #test1_defaults;
go
~~START~~
int
10
~~END~~


DROP TABLE #test1_defaults;
go

---------------------------------------------------------------------------
-- ALTER TABLE ADD COLUMN with INDEX operations in transaction (cache lookup fix)
---------------------------------------------------------------------------
CREATE TABLE #t_alter_idx(id int, name varchar(100))
GO

INSERT INTO #t_alter_idx (id, name) VALUES (1, 'test1')
GO
~~ROW COUNT: 1~~


-- ALTER TABLE ADD COLUMN + multiple CREATE INDEX + SELECT in transaction
BEGIN TRANSACTION
    ALTER TABLE #t_alter_idx ADD col_def int DEFAULT 4
    UPDATE #t_alter_idx SET name = 'updated' WHERE id IS NOT NULL
    SELECT * FROM #t_alter_idx
    CREATE INDEX idx_alter1 ON #t_alter_idx (id)
    CREATE INDEX idx_alter2 ON #t_alter_idx (id)
COMMIT TRANSACTION
GO
~~ROW COUNT: 1~~

~~START~~
int#!#varchar#!#int
1#!#updated#!#4
~~END~~


SELECT * FROM #t_alter_idx
GO
~~START~~
int#!#varchar#!#int
1#!#updated#!#4
~~END~~


SELECT * FROM enr_view ORDER BY relname
GO
~~START~~
text
#pg_toast_#oid_masked#
#pg_toast_#oid_masked#_index
#t
#t1
#t2
#t_alter_idx
idx_alter1#t_alter_idxef1284eda20f7217c292b0b1f74479d7
idx_alter2#t_alter_idx817c13ab631b36df3820eff2777e31cf
~~END~~


-- TRUNCATE after index creation should work
TRUNCATE TABLE #t_alter_idx
GO

SELECT * FROM #t_alter_idx
GO
~~START~~
int#!#varchar#!#int
~~END~~


DROP TABLE #t_alter_idx
GO

SELECT * FROM enr_view ORDER BY relname
GO
~~START~~
text
#t
#t1
#t2
~~END~~


---------------------------------------------------------------------------
-- ALTER TABLE ADD COLUMN + INDEX + TRUNCATE with ROLLBACK
---------------------------------------------------------------------------
CREATE TABLE #t_alter_idx_rollback(id int, name varchar(100))
GO

INSERT INTO #t_alter_idx_rollback (id, name) VALUES (1, 'original')
GO
~~ROW COUNT: 1~~


BEGIN TRANSACTION
    ALTER TABLE #t_alter_idx_rollback ADD new_col int DEFAULT 10
    CREATE INDEX idx_rb1 ON #t_alter_idx_rollback (id)
    CREATE INDEX idx_rb2 ON #t_alter_idx_rollback (name)
    UPDATE #t_alter_idx_rollback SET name = 'modified'
    SELECT * FROM #t_alter_idx_rollback
ROLLBACK
GO
~~ROW COUNT: 1~~

~~START~~
int#!#varchar#!#int
1#!#modified#!#10
~~END~~


-- Should have original data, no new column, no indexes
SELECT * FROM #t_alter_idx_rollback
GO
~~START~~
int#!#varchar
1#!#original
~~END~~


SELECT * FROM enr_view ORDER BY relname
GO
~~START~~
text
#pg_toast_#oid_masked#
#pg_toast_#oid_masked#_index
#t
#t1
#t2
#t_alter_idx_rollback
~~END~~


-- Operations should work after rollback
INSERT INTO #t_alter_idx_rollback VALUES (2, 'second')
GO
~~ROW COUNT: 1~~


SELECT * FROM #t_alter_idx_rollback ORDER BY id
GO
~~START~~
int#!#varchar
1#!#original
2#!#second
~~END~~


DROP TABLE #t_alter_idx_rollback
GO

---------------------------------------------------------------------------
-- Multiple ALTER TABLE + INDEX operations in single transaction
---------------------------------------------------------------------------
CREATE TABLE #t_multi_alter(a int, b int)
GO

INSERT INTO #t_multi_alter VALUES (1, 10), (2, 20)
GO
~~ROW COUNT: 2~~


BEGIN TRANSACTION
    ALTER TABLE #t_multi_alter ADD c int DEFAULT 100
    ALTER TABLE #t_multi_alter ADD d varchar(50) DEFAULT 'default'
    CREATE INDEX idx_ma1 ON #t_multi_alter (a)
    CREATE INDEX idx_ma2 ON #t_multi_alter (b)
    CREATE INDEX idx_ma3 ON #t_multi_alter (c)
    INSERT INTO #t_multi_alter VALUES (3, 30, 300, 'inserted')
    SELECT * FROM #t_multi_alter ORDER BY a
COMMIT
GO
~~ROW COUNT: 1~~

~~START~~
int#!#int#!#int#!#varchar
1#!#10#!#100#!#default
2#!#20#!#100#!#default
3#!#30#!#300#!#inserted
~~END~~


SELECT * FROM #t_multi_alter ORDER BY a
GO
~~START~~
int#!#int#!#int#!#varchar
1#!#10#!#100#!#default
2#!#20#!#100#!#default
3#!#30#!#300#!#inserted
~~END~~


SELECT * FROM enr_view ORDER BY relname
GO
~~START~~
text
#pg_toast_#oid_masked#
#pg_toast_#oid_masked#_index
#t
#t1
#t2
#t_multi_alter
idx_ma1#t_multi_alterc20f6dce64e4acc115c92bc1ec2f4ca7
idx_ma2#t_multi_alter85222b3f0a11abb9273a384d9d6c51d4
idx_ma3#t_multi_alter9bdc2dda2f46d1d53c60b1872aae1a7e
~~END~~


-- TRUNCATE should work with all the indexes
TRUNCATE TABLE #t_multi_alter
GO

SELECT * FROM #t_multi_alter
GO
~~START~~
int#!#int#!#int#!#varchar
~~END~~


-- Insert after truncate should work
INSERT INTO #t_multi_alter VALUES (5, 50, 500, 'after_truncate')
GO
~~ROW COUNT: 1~~


SELECT * FROM #t_multi_alter
GO
~~START~~
int#!#int#!#int#!#varchar
5#!#50#!#500#!#after_truncate
~~END~~


DROP TABLE #t_multi_alter
GO

---------------------------------------------------------------------------
-- ALTER TABLE + INDEX + DML operations with implicit rollback
---------------------------------------------------------------------------
SET XACT_ABORT ON
GO

CREATE TABLE #t_xact_abort(id int PRIMARY KEY, val varchar(50))
GO

INSERT INTO #t_xact_abort VALUES (1, 'one')
GO
~~ROW COUNT: 1~~


-- This should cause implicit rollback due to duplicate key
BEGIN TRANSACTION
    ALTER TABLE #t_xact_abort ADD extra_col int DEFAULT 5
    CREATE INDEX idx_xa1 ON #t_xact_abort (val)
    INSERT INTO #t_xact_abort (id, val, extra_col) VALUES (2, 'two', 10)
    INSERT INTO #t_xact_abort (id, val, extra_col) VALUES (1, 'duplicate', 20) -- Should fail - duplicate key
COMMIT
GO
~~ROW COUNT: 1~~

~~ERROR (Code: 2627)~~

~~ERROR (Message: duplicate key value violates unique constraint "#t_xact_abort_pkey")~~


-- Table should be in original state (only the first row with default extra_col)
SELECT * FROM #t_xact_abort
GO
~~START~~
int#!#varchar
1#!#one
~~END~~


SELECT * FROM enr_view ORDER BY relname
GO
~~START~~
text
#pg_toast_#oid_masked#
#pg_toast_#oid_masked#_index
#t
#t1
#t2
#t_xact_abort
#t_xact_abort_pkey
~~END~~


SET XACT_ABORT OFF
GO

DROP TABLE #t_xact_abort
GO

---------------------------------------------------------------------------
-- ALTER TABLE ADD COLUMN + INDEX + TRUNCATE in nested transactions
---------------------------------------------------------------------------
CREATE TABLE #t_nested_alter(x int, y int)
GO

INSERT INTO #t_nested_alter VALUES (1, 100)
GO
~~ROW COUNT: 1~~


BEGIN TRAN
    ALTER TABLE #t_nested_alter ADD z int DEFAULT 999
    CREATE INDEX idx_nested1 ON #t_nested_alter (x)
    
    SAVE TRANSACTION sp1
    
    CREATE INDEX idx_nested2 ON #t_nested_alter (y)
    INSERT INTO #t_nested_alter VALUES (2, 200, 2000)
    SELECT * FROM #t_nested_alter ORDER BY x
    
    ROLLBACK TRANSACTION sp1
    
    SELECT * FROM #t_nested_alter ORDER BY x
    INSERT INTO #t_nested_alter VALUES (3, 300, 3000)
COMMIT
GO
~~ROW COUNT: 1~~

~~START~~
int#!#int#!#int
1#!#100#!#999
2#!#200#!#2000
~~END~~

~~START~~
int#!#int#!#int
1#!#100#!#999
~~END~~

~~ROW COUNT: 1~~


SELECT * FROM #t_nested_alter ORDER BY x
GO
~~START~~
int#!#int#!#int
1#!#100#!#999
3#!#300#!#3000
~~END~~


SELECT * FROM enr_view ORDER BY relname
GO
~~START~~
text
#t
#t1
#t2
#t_nested_alter
idx_nested1#t_nested_alter873dd07a348b565a0d59a1a57fcec8f3
~~END~~


TRUNCATE TABLE #t_nested_alter
GO

SELECT * FROM #t_nested_alter
GO
~~START~~
int#!#int#!#int
~~END~~


DROP TABLE #t_nested_alter
GO

---------------------------------------------------------------------------
-- Repeated ALTER + INDEX + TRUNCATE cycles
---------------------------------------------------------------------------
CREATE TABLE #t_cycle(id int)
GO

-- Cycle 1
BEGIN TRANSACTION
    ALTER TABLE #t_cycle ADD col1 int DEFAULT 1
    CREATE INDEX idx_cyc1 ON #t_cycle (id)
    INSERT INTO #t_cycle VALUES (1, 10)
COMMIT
GO
~~ROW COUNT: 1~~


SELECT * FROM #t_cycle
GO
~~START~~
int#!#int
1#!#10
~~END~~


TRUNCATE TABLE #t_cycle
GO

-- Cycle 2
BEGIN TRANSACTION
    ALTER TABLE #t_cycle ADD col2 int DEFAULT 2
    CREATE INDEX idx_cyc2 ON #t_cycle (col1)
    INSERT INTO #t_cycle VALUES (2, 20, 200)
COMMIT
GO
~~ROW COUNT: 1~~


SELECT * FROM #t_cycle
GO
~~START~~
int#!#int#!#int
2#!#20#!#200
~~END~~


TRUNCATE TABLE #t_cycle
GO

-- Cycle 3
BEGIN TRANSACTION
    ALTER TABLE #t_cycle ADD col3 int DEFAULT 3
    CREATE INDEX idx_cyc3 ON #t_cycle (col2)
    INSERT INTO #t_cycle VALUES (3, 30, 300, 3000)
COMMIT
GO
~~ROW COUNT: 1~~


SELECT * FROM #t_cycle
GO
~~START~~
int#!#int#!#int#!#int
3#!#30#!#300#!#3000
~~END~~


SELECT * FROM enr_view ORDER BY relname
GO
~~START~~
text
#t
#t1
#t2
#t_cycle
idx_cyc1#t_cycle290b8ccea1c823954eaee37ad6b681e9
idx_cyc2#t_cycledab3f944fb2bfdf7309126c68154d3f8
idx_cyc3#t_cycle4d802eedc445503c089ae400e7140408
~~END~~


DROP TABLE #t_cycle
GO

SELECT * FROM enr_view ORDER BY relname
GO
~~START~~
text
#t
#t1
#t2
~~END~~


---------------------------------------------------------------------------
-- ALTER TABLE with collation + INDEX + TRUNCATE
---------------------------------------------------------------------------
CREATE TABLE #t_collation(id int, name varchar(100) COLLATE Latin1_General_CI_AS)
GO

INSERT INTO #t_collation VALUES (1, 'TestName')
GO
~~ROW COUNT: 1~~


BEGIN TRANSACTION
    ALTER TABLE #t_collation ADD extra int DEFAULT 42
    UPDATE #t_collation SET name = 'UpdatedName' WHERE id IS NOT NULL
    SELECT * FROM #t_collation
    CREATE INDEX idx_coll1 ON #t_collation (id)
    CREATE INDEX idx_coll2 ON #t_collation (name)
COMMIT TRANSACTION
GO
~~ROW COUNT: 1~~

~~START~~
int#!#varchar#!#int
1#!#UpdatedName#!#42
~~END~~


SELECT * FROM #t_collation
GO
~~START~~
int#!#varchar#!#int
1#!#UpdatedName#!#42
~~END~~


TRUNCATE TABLE #t_collation
GO

INSERT INTO #t_collation VALUES (2, 'AfterTruncate', 100)
GO
~~ROW COUNT: 1~~


SELECT * FROM #t_collation
GO
~~START~~
int#!#varchar#!#int
2#!#AfterTruncate#!#100
~~END~~


DROP TABLE #t_collation
GO

SELECT * FROM enr_view ORDER BY relname
GO
~~START~~
text
#t
#t1
#t2
~~END~~



---------------------------------------------------------------------------
-- PROCEDURE: Test ALTER TABLE + INDEX + TRUNCATE (cache lookup fix)
---------------------------------------------------------------------------
EXEC test_alter_index_truncate_cache_fix
GO
~~ROW COUNT: 1~~

~~ROW COUNT: 1~~

~~START~~
int#!#varchar#!#int
1282566819#!#slukgofiuazhigik#!#4
~~END~~

~~START~~
int#!#varchar#!#int
~~END~~


SELECT * FROM enr_view ORDER BY relname
GO
~~START~~
text
#t
#t1
#t2
~~END~~



---------------------------------------------------------------------------
-- Cross-QueryEnv ENR Tests - Procedure Drop Table Fix (BABEL-6268)
---------------------------------------------------------------------------
-- Test 1: Basic procedure drop table scenario
CREATE TABLE #test(a int) 
GO

EXEC p_drop
GO

CREATE TABLE #test(a int)         -- should not crash
GO

DROP TABLE #test
GO

-- Test 2: Multiple procedure calls with same temp table name
CREATE TABLE #temp_proc_test(id int, name varchar(50)) 
INSERT INTO #temp_proc_test VALUES (1, 'test1') 
GO
~~ROW COUNT: 1~~


EXEC p_drop_multi
GO

CREATE TABLE #temp_proc_test(id int, data varchar(100)) 
INSERT INTO #temp_proc_test VALUES (2, 'test2') 
SELECT * FROM #temp_proc_test 
GO
~~ROW COUNT: 1~~

~~START~~
int#!#varchar
2#!#test2
~~END~~


DROP TABLE #temp_proc_test
GO

-- Test 3: Nested procedure calls
CREATE TABLE #nested_test(val int)
INSERT INTO #nested_test VALUES (100)
GO
~~ROW COUNT: 1~~


EXEC p_outer
GO

CREATE TABLE #nested_test(val int, descr varchar(20)) 
INSERT INTO #nested_test VALUES (200, 'after fix') 
SELECT * FROM #nested_test 
GO
~~ROW COUNT: 1~~

~~START~~
int#!#varchar
200#!#after fix
~~END~~


DROP TABLE #nested_test
GO

-- Test 4: Procedure with transaction and temp table drop
CREATE TABLE #trans_test(a int, b varchar(10)) 
INSERT INTO #trans_test VALUES (1, 'before') 
GO
~~ROW COUNT: 1~~


EXEC p_trans_drop
GO
~~ROW COUNT: 1~~


CREATE TABLE #trans_test(c int) 
INSERT INTO #trans_test VALUES (999)  
SELECT * FROM #trans_test  
GO
~~ROW COUNT: 1~~

~~START~~
int
999
~~END~~


DROP TABLE #trans_test
GO

-- Test 5: Execute CREATE and INSERT operations
EXEC p_create_insert
GO
~~ROW COUNT: 1~~

~~ROW COUNT: 1~~

~~START~~
int#!#varchar
1#!#first
2#!#second
~~END~~


-- Test 6: Execute UPDATE and DELETE operations
CREATE TABLE #update_delete_test(id int, status varchar(20), value int)
INSERT INTO #update_delete_test VALUES (1, 'active', 100)
INSERT INTO #update_delete_test VALUES (2, 'inactive', 200)
INSERT INTO #update_delete_test VALUES (3, 'pending', 300)
GO
~~ROW COUNT: 1~~

~~ROW COUNT: 1~~

~~ROW COUNT: 1~~


EXEC p_update_delete
GO
~~ROW COUNT: 1~~

~~ROW COUNT: 1~~

~~ROW COUNT: 1~~


SELECT * FROM #update_delete_test
GO
~~START~~
int#!#varchar#!#int
2#!#inactive#!#200
1#!#processed#!#100
4#!#new#!#150
~~END~~


DROP TABLE #update_delete_test
GO

-- Test 7: Execute nested procedures with mixed operations
CREATE TABLE #nested_ops_test(id int, data varchar(50))
INSERT INTO #nested_ops_test VALUES (1, 'initial')
GO
~~ROW COUNT: 1~~


EXEC p_nested_outer
GO
~~ROW COUNT: 1~~

~~ROW COUNT: 1~~

~~ROW COUNT: 1~~

~~ROW COUNT: 1~~


SELECT * FROM #nested_ops_test
GO
~~START~~
int#!#varchar
1#!#updated by inner
3#!#from outer
~~END~~


DROP TABLE #nested_ops_test
GO

-- Test 8: Execute transaction rollback and operations
CREATE TABLE #rollback_ops_test(id int, amount decimal(10,2))
INSERT INTO #rollback_ops_test VALUES (1, 100.00)
GO
~~ROW COUNT: 1~~


EXEC p_rollback_ops
GO
~~ROW COUNT: 1~~

~~ROW COUNT: 2~~

~~ROW COUNT: 1~~

~~ROW COUNT: 1~~

~~START~~
varchar
Inside transaction:
~~END~~

~~START~~
int#!#numeric
2#!#400.00
3#!#300.00
~~END~~

~~START~~
varchar
After rollback:
~~END~~


SELECT * FROM #rollback_ops_test
GO
~~START~~
int#!#numeric
1#!#100.00
2#!#200.00
~~END~~


DROP TABLE #rollback_ops_test
GO

-- Test 9: Execute multiple temp tables with cross-operations
EXEC p_multi_temp_ops
GO
~~ROW COUNT: 1~~

~~ROW COUNT: 1~~

~~ROW COUNT: 1~~

~~ROW COUNT: 1~~

~~ROW COUNT: 1~~

~~ROW COUNT: 1~~

~~START~~
varchar
Temp1:
~~END~~

~~START~~
int#!#varchar
2#!#second
1#!#updated first
~~END~~

~~START~~
varchar
Temp2:
~~END~~

~~START~~
int#!#int#!#varchar
10#!#1#!#ref to first
~~END~~


-- Test 10: Execute error handling and operations
CREATE TABLE #error_ops_test(id int primary key, data varchar(20))
INSERT INTO #error_ops_test VALUES (1, 'original')
GO
~~ROW COUNT: 1~~


EXEC p_error_ops
GO
~~ROW COUNT: 1~~

~~ROW COUNT: 1~~

~~ROW COUNT: 1~~

~~START~~
nvarchar
Error caught: duplicate key value violates unique constraint "#error_ops_test_pkey"
~~END~~


SELECT * FROM #error_ops_test
GO
~~START~~
int#!#varchar
2#!#valid insert
1#!#updated
3#!#error handled
~~END~~


DROP TABLE #error_ops_test
GO

-- Test 11: Execute TRUNCATE operation
CREATE TABLE #truncate_test(id int identity(1,1), data varchar(20))
INSERT INTO #truncate_test VALUES ('first')
INSERT INTO #truncate_test VALUES ('second')
INSERT INTO #truncate_test VALUES ('third')
GO
~~ROW COUNT: 1~~

~~ROW COUNT: 1~~

~~ROW COUNT: 1~~


EXEC p_truncate_ops
GO
~~START~~
varchar
Before truncate:
~~END~~

~~START~~
int#!#varchar
1#!#first
2#!#second
3#!#third
~~END~~

~~ROW COUNT: 1~~

~~START~~
varchar
After truncate:
~~END~~


SELECT * FROM #truncate_test
GO
~~START~~
int#!#varchar
1#!#after truncate
~~END~~


DROP TABLE #truncate_test
GO

-- Test 12: Execute conditional operations
CREATE TABLE #conditional_test(id int, status varchar(10), value int)
INSERT INTO #conditional_test VALUES (1, 'active', 50)
INSERT INTO #conditional_test VALUES (2, 'inactive', 150)
INSERT INTO #conditional_test VALUES (3, 'pending', 75)
GO
~~ROW COUNT: 1~~

~~ROW COUNT: 1~~

~~ROW COUNT: 1~~


EXEC p_conditional_ops
GO
~~ROW COUNT: 1~~

~~ROW COUNT: 1~~


SELECT * FROM #conditional_test
GO
~~START~~
int#!#varchar#!#int
1#!#active#!#50
3#!#pending#!#75
2#!#high_value#!#150
4#!#new_high#!#200
~~END~~


DROP TABLE #conditional_test
GO

-- INSERT INTO EXEC Tests
-- Test 13: Basic INSERT INTO EXEC with temp table
CREATE TABLE #insert_exec_target(id int, name varchar(30))
GO

INSERT INTO #insert_exec_target EXEC p_insert_exec_basic
GO
~~ROW COUNT: 2~~


SELECT * FROM #insert_exec_target ORDER BY id
GO
~~START~~
int#!#varchar
1#!#first
2#!#second
~~END~~


DROP TABLE #insert_exec_target
GO

-- Test 14: INSERT INTO EXEC with nested procedure calls
CREATE TABLE #insert_exec_nested(id int, data varchar(50))
GO

INSERT INTO #insert_exec_nested EXEC p_insert_exec_nested_outer
GO
~~ERROR (Code: 33557097)~~

~~ERROR (Message: nested INSERT ... EXECUTE statements are not allowed)~~


SELECT * FROM #insert_exec_nested
GO
~~START~~
int#!#varchar
~~END~~


DROP TABLE #insert_exec_nested
GO

-- Test 15: INSERT INTO EXEC with temp table operations inside procedure
CREATE TABLE #insert_exec_ops(id int, status varchar(20), value int)
GO

INSERT INTO #insert_exec_ops EXEC p_insert_exec_temp_ops
GO
~~ROW COUNT: 2~~


SELECT * FROM #insert_exec_ops
GO
~~START~~
int#!#varchar#!#int
2#!#pending#!#200
1#!#processed#!#100
~~END~~


DROP TABLE #insert_exec_ops
GO

-- Test 16: INSERT INTO EXEC with transaction and rollback
CREATE TABLE #insert_exec_trans(id int, amount decimal(10,2))
GO

INSERT INTO #insert_exec_trans EXEC p_insert_exec_transaction
GO
~~ERROR (Code: 33557097)~~

~~ERROR (Message: Cannot use the ROLLBACK statement within an INSERT-EXEC statement.)~~


SELECT * FROM #insert_exec_trans
GO
~~START~~
int#!#numeric
~~END~~


DROP TABLE #insert_exec_trans
GO

-- Test 17: INSERT INTO EXEC with multiple result sets (only first is inserted)
CREATE TABLE #insert_exec_multi(id int, info varchar(30))
GO

INSERT INTO #insert_exec_multi EXEC p_insert_exec_multi_results
GO
~~ROW COUNT: 3~~


SELECT * FROM #insert_exec_multi
GO
~~START~~
int#!#varchar
1#!#first result
2#!#second result
3#!#third result
~~END~~


DROP TABLE #insert_exec_multi
GO

-- Test 18: INSERT INTO EXEC with error handling
CREATE TABLE #insert_exec_error(id int, data varchar(20))
GO

INSERT INTO #insert_exec_error EXEC p_insert_exec_error_handling
GO
~~ROW COUNT: 2~~


SELECT * FROM #insert_exec_error
GO
~~START~~
int#!#varchar
1#!#original
2#!#error handled
~~END~~


DROP TABLE #insert_exec_error
GO

-- Test 19: INSERT INTO EXEC with table variable in procedure
CREATE TABLE #insert_exec_tv(id int, tv_data varchar(30))
GO

INSERT INTO #insert_exec_tv EXEC p_insert_exec_table_var
GO
~~ROW COUNT: 2~~


SELECT * FROM #insert_exec_tv
GO
~~START~~
int#!#varchar
1#!#from table var
2#!#tv data
~~END~~


DROP TABLE #insert_exec_tv
GO

-- Test 20: INSERT INTO EXEC where procedure attempts to drop the target table
CREATE TABLE #insert_exec_drop_target(id int, data varchar(30))
INSERT INTO #insert_exec_drop_target VALUES (1, 'initial data')
GO
~~ROW COUNT: 1~~


-- Should fail
INSERT INTO #insert_exec_drop_target EXEC p_insert_exec_drop_table
GO
~~ERROR (Code: 556)~~

~~ERROR (Message: cannot DROP TABLE "#insert_exec_drop_target" because it is being used by active queries in this session)~~


-- Table should still exist with original data since DROP failed
SELECT * FROM #insert_exec_drop_target
GO
~~START~~
int#!#varchar
1#!#initial data
~~END~~


DROP TABLE #insert_exec_drop_target
GO

DROP TABLE #t
DROP TABLE #t1
DROP TABLE #t2
GO


---------------------------------------------------------------------------
-- DROP TABLE IF EXISTS + CREATE TABLE in procedures (BABEL-6097)
---------------------------------------------------------------------------
-- Basic DROP IF EXISTS + CREATE pattern
CREATE TABLE #t(a int)
GO

EXEC p_drop_if_exists_create
GO
~~ROW COUNT: 1~~

~~START~~
int
1
~~END~~


CREATE TABLE #t(a int)  -- Should not crash
GO

DROP TABLE #t
GO

-- Multiple DROP IF EXISTS + CREATE cycles
CREATE TABLE #t(x varchar(10))
INSERT INTO #t VALUES ('original')
GO
~~ROW COUNT: 1~~


EXEC p_multi_drop_create
GO
~~ROW COUNT: 1~~

~~ROW COUNT: 1~~

~~START~~
int#!#varchar
2#!#second
~~END~~


CREATE TABLE #t(c int)
INSERT INTO #t VALUES (999)
SELECT * FROM #t
GO
~~ROW COUNT: 1~~

~~START~~
int
999
~~END~~


DROP TABLE #t
GO

-- DROP IF EXISTS + CREATE with different schemas
EXEC p_drop_create_schema_change
GO
~~ROW COUNT: 1~~

~~ROW COUNT: 1~~

~~START~~
int#!#int#!#varchar
10#!#20#!#changed schema
~~END~~


CREATE TABLE #t(final_col int)
INSERT INTO #t VALUES (777)
SELECT * FROM #t
GO
~~ROW COUNT: 1~~

~~START~~
int
777
~~END~~


DROP TABLE #t
GO

-- DROP IF EXISTS + CREATE in transaction
EXEC p_trans_drop_create
GO
~~ROW COUNT: 1~~

~~START~~
int#!#varchar
1#!#in transaction
~~END~~


-- DROP IF EXISTS + CREATE with rollback
EXEC p_rollback_drop_create
GO
~~ROW COUNT: 1~~

~~ROW COUNT: 1~~

~~START~~
int
100
~~END~~


-- Multiple temp tables with DROP IF EXISTS + CREATE
EXEC p_multi_tables_drop_create
GO
~~ROW COUNT: 1~~

~~ROW COUNT: 1~~

~~ROW COUNT: 1~~

~~START~~
int#!#int
10#!#20
~~END~~

~~START~~
varchar
test
~~END~~


-- DROP IF EXISTS + CREATE with indexes
EXEC p_drop_create_with_index
GO
~~ROW COUNT: 1~~

~~START~~
int#!#varchar
1#!#indexed
~~END~~


-- DROP IF EXISTS + CREATE with constraints
EXEC p_drop_create_constraints
GO
~~ROW COUNT: 1~~

~~ROW COUNT: 1~~

~~START~~
int#!#int
1#!#100
2#!#200
~~END~~


-- DROP IF EXISTS + CREATE with ALTER TABLE
EXEC p_drop_create_alter
GO
~~ROW COUNT: 1~~

~~ROW COUNT: 1~~

~~START~~
int#!#varchar
1#!#altered
~~END~~


-- Conditional DROP IF EXISTS + CREATE
EXEC p_conditional_drop_create
GO
~~ROW COUNT: 1~~

~~START~~
int
100
~~END~~


-- DROP IF EXISTS + CREATE with TRUNCATE
EXEC p_drop_create_truncate
GO
~~ROW COUNT: 1~~

~~ROW COUNT: 1~~

~~ROW COUNT: 1~~

~~START~~
int#!#varchar
3#!#after truncate
~~END~~


-- Error handling with DROP IF EXISTS + CREATE
EXEC p_error_drop_create
GO
~~ROW COUNT: 1~~

~~START~~
nvarchar
Error: duplicate key value violates unique constraint "#err_t_pkey"
~~END~~

~~START~~
int
1
~~END~~


-- Repeated calls to same procedure
CREATE TABLE #t(a int)
GO

EXEC p_drop_if_exists_create
GO
~~ROW COUNT: 1~~

~~START~~
int
1
~~END~~


EXEC p_drop_if_exists_create  -- Second call
GO
~~ROW COUNT: 1~~

~~START~~
int
1
~~END~~


EXEC p_drop_if_exists_create  -- Third call
GO
~~ROW COUNT: 1~~

~~START~~
int
1
~~END~~


CREATE TABLE #t(final int)  -- Should not crash
GO

DROP TABLE #t
GO

-- Interleaved procedure calls
CREATE TABLE #t(a int)
CREATE TABLE #t1(a int)
GO

EXEC p_drop_if_exists_create
GO
~~ROW COUNT: 1~~

~~START~~
int
1
~~END~~


EXEC p_multi_tables_drop_create
GO
~~ROW COUNT: 1~~

~~ROW COUNT: 1~~

~~ROW COUNT: 1~~

~~START~~
int#!#int
10#!#20
~~END~~

~~START~~
varchar
test
~~END~~


CREATE TABLE #t(x int)
CREATE TABLE #t1(y int)
GO

DROP TABLE #t
DROP TABLE #t1
GO
DROP VIEW enr_view
GO

DROP TYPE temp_table_type
GO

DROP PROCEDURE test_rollback_in_proc
GO

DROP PROCEDURE implicit_rollback_in_proc
GO

DROP PROCEDURE tv_base_rollback
GO

DROP PROCEDURE tv_tt_no_error
GO

DROP PROCEDURE tv_mapped_error
GO

DROP PROCEDURE tv_unmapped_error
GO

DROP FUNCTION func_get_sum_temp
GO

DROP FUNCTION func_get_count_temp
GO

DROP FUNCTION func_get_min_max_temp
GO

DROP PROCEDURE test_temp_table_drop_intermediate_idx
GO

DROP PROCEDURE test_alter_index_truncate_cache_fix
GO


DROP PROC p_drop
GO

DROP PROC p_drop_multi
GO

DROP PROC p_outer
GO

DROP PROC p_inner
GO

DROP PROC p_trans_drop
GO

DROP PROC p_create_insert
GO

DROP PROC p_update_delete
GO

DROP PROC p_nested_inner
GO

DROP PROC p_nested_outer
GO

DROP PROC p_rollback_ops
GO

DROP PROC p_multi_temp_ops
GO

DROP PROC p_error_ops
GO

DROP PROC p_truncate_ops
GO

DROP PROC p_conditional_ops
GO

DROP PROC p_insert_exec_basic
GO

DROP PROC p_insert_exec_nested_inner
GO

DROP PROC p_insert_exec_nested_outer
GO

DROP PROC p_insert_exec_temp_ops
GO

DROP PROC p_insert_exec_transaction
GO

DROP PROC p_insert_exec_multi_results
GO

DROP PROC p_insert_exec_error_handling
GO

DROP PROC p_insert_exec_table_var
GO

DROP PROC p_insert_exec_drop_table
GO

DROP PROC p_drop_if_exists_create
GO

DROP PROC p_multi_drop_create
GO

DROP PROC p_drop_create_schema_change
GO

DROP PROC p_trans_drop_create
GO

DROP PROC p_rollback_drop_create
GO

DROP PROC p_multi_tables_drop_create
GO

DROP PROC p_drop_create_with_index
GO

DROP PROC p_drop_create_constraints
GO

DROP PROC p_drop_create_alter
GO

DROP PROC p_conditional_drop_create
GO

DROP PROC p_drop_create_truncate
GO

DROP PROC p_error_drop_create
GO
