
/*
 * ===================================================================================================================
 *                                              1. Basic Output clause test
 * ===================================================================================================================
 */
-- Test Case 1: INSERT with OUTPUT
INSERT INTO OutputTest (ID, Name, Value) 
OUTPUT inserted.ID, inserted.Name, inserted.Value
VALUES (4, 'NewTest', 400);
GO
~~START~~
int#!#nvarchar#!#int
4#!#NewTest#!#400
~~END~~


-- Test Case 2: UPDATE with OUTPUT
UPDATE OutputTest 
SET Value = OutputTest.Value + 50
OUTPUT deleted.Name, deleted.Value as OldValue, inserted.Value as NewValue
WHERE ID = 1;
GO
~~START~~
nvarchar#!#int#!#int
Test1#!#100#!#150
~~END~~


-- Test Case 3: DELETE with OUTPUT
DELETE FROM OutputTest
OUTPUT deleted.ID, deleted.Name, deleted.Value
WHERE ID = 2;
GO
~~START~~
int#!#nvarchar#!#int
2#!#Test2#!#200
~~END~~







-- -- Test Case 4: INSERT with OUTPUT INTO
-- INSERT INTO OutputTest (ID, Name, Value)
-- OUTPUT 1, 'INSERT', inserted.ID, inserted.Name, inserted.Value INTO OutputLog (LogID, Operation, ID, Name, Value)
-- VALUES (5, 'LoggedTest', 500);
-- GO
-- -- Test Case 5: UPDATE with OUTPUT INTO
-- UPDATE OutputTest
-- SET Status = 'Updated'
-- OUTPUT 2, 'UPDATE', inserted.ID, inserted.Name, inserted.Value INTO OutputLog (LogID, Operation, ID, Name, Value)
-- WHERE ID = 3;
-- GO
-- -- Test Case 6: DELETE with OUTPUT INTO
-- DELETE FROM OutputTest
-- OUTPUT 3, 'DELETE', deleted.ID, deleted.Name, deleted.Value INTO OutputLog (LogID, Operation, ID, Name, Value)
-- WHERE Name = 'LoggedTest';
-- GO
-- -- Test Case 7: Multiple row UPDATE with OUTPUT
-- UPDATE OutputTest
-- SET Value = OutputTest.Value * 2
-- OUTPUT deleted.ID, deleted.Value as Before, inserted.Value as After
-- WHERE OutputTest.Value > 100;
-- GO
-- -- Test Case 8: OUTPUT with computed columns
-- INSERT INTO OutputTest (ID, Name, Value)
-- OUTPUT inserted.ID, inserted.Name, inserted.Value, inserted.Value * 2 as DoubleValue
-- VALUES (6, 'Computed', 250);
-- GO
-- Test Case 9: OUTPUT with dependent object (view)
INSERT INTO OutputTest (ID, Name, Value, Status)
OUTPUT inserted.ID, inserted.Name, inserted.Status
VALUES (7, 'ViewTest', 600, 'Active');
GO
~~START~~
int#!#nvarchar#!#nvarchar
7#!#ViewTest#!#Active
~~END~~


-- Test Case 10: UPDATE base table with OUTPUT (view test)
UPDATE OutputTest
SET Value = 999
OUTPUT deleted.Name, deleted.Value as OldValue, inserted.Value as NewValue
WHERE Name = 'ViewTest' AND Status = 'Active';
GO
~~START~~
nvarchar#!#int#!#int
ViewTest#!#600#!#999
~~END~~


-- Test Case 11: INSERT with OUTPUT and trigger interaction
INSERT INTO OutputTest (ID, Name, Value)
OUTPUT inserted.ID, inserted.Name, 'TRIGGER_TEST' as TestType
VALUES (8, 'TriggerTest1', 700);
GO
~~START~~
int#!#nvarchar#!#varchar
8#!#TriggerTest1#!#TRIGGER_TEST
~~END~~


-- Test Case 12: UPDATE with OUTPUT and trigger interaction
UPDATE OutputTest
SET Value = OutputTest.Value + 100, Status = 'Modified'
OUTPUT deleted.Status as OldStatus, inserted.Status as NewStatus, inserted.ID
WHERE Name = 'TriggerTest1';
GO
~~START~~
nvarchar#!#nvarchar#!#int
Active#!#Modified#!#8
~~END~~


-- Test Case 13: DELETE with OUTPUT and trigger interaction
DELETE FROM OutputTest
OUTPUT deleted.ID, deleted.Name, 'DELETED_BY_TRIGGER_TEST' as Note
WHERE Name = 'TriggerTest1';
GO
~~START~~
int#!#nvarchar#!#varchar
8#!#TriggerTest1#!#DELETED_BY_TRIGGER_TEST
~~END~~









































































