

-- This file adds tests for these functions: STDimension, STDisjoint, STIntersects, STIsClosed, STIsEmpty, STIsValid
-- STIntersects
DECLARE @point1 geometry, @point2 geometry;
SET @point1 = geometry::STPointFromText('POINT(-122.354657658684900 47.658678768678100)', 4326);
SET @point2 = geometry::STPointFromText('POINT(-122.354657658684900 47.658678768678100)', 4326);
SELECT @point1.STIntersects(@point2) AS Intersecting;
go
~~START~~
bit
1
~~END~~


DECLARE @point1 geography, @point2 geography;
SET @point1 = geography::STGeomFromText('POINT(-122.34900 47.65100)', 4326);
SET @point2 = geography::STGeomFromText('POINT(-122.34900 47.65100)', 4326);
SELECT @point1.STIntersects(@point2) AS Intersecting;
go
~~START~~
bit
1
~~END~~


DECLARE @point1 geometry, @point2 geometry;
SET @point1 = geometry::STPointFromText('POINT(-122.354657658684900 47.658678768678100)', 4326);
SET @point2 = geometry::STPointFromText('POINT(-122.354657658684900 47.658678768678100)', 0);
SELECT @point1.STIntersects(@point2) AS Intersecting;
go
~~START~~
bit
<NULL>
~~END~~


DECLARE @point1 geography, @point2 geography;
SET @point1 = geography::STGeomFromText('POINT(-122.34900 47.65100)', 4326);
SET @point2 = geography::STGeomFromText('POINT(-122.34900 47.65100)', 4120);
SELECT @point1 . STIntersects(@point2) AS Intersecting;
go
~~START~~
bit
<NULL>
~~END~~


-- Verifying with precision
DECLARE @point1 geometry, @point2 geometry;
SET @point1 = geometry::STPointFromText('POINT(-122.354657658684900 47.658678768678100)', 999999);
SET @point2 = geometry::STPointFromText('POINT(-122.354657658684900 47.658678768678100)', 999999);
SELECT STIntersects(@point1, @point2);
go
~~START~~
bit
1
~~END~~


DECLARE @point1 geography, @point2 geography;
SET @point1 = geography::STGeomFromText('POINT(-122.354657658684900 47.658678768678100)', 4120);
SET @point2 = geography::STGeomFromText('POINT(-122.354657658684900 47.658678768678100)', 4120);
SELECT @point1.STIntersects(@point2) AS Intersecting;
go
~~START~~
bit
1
~~END~~


DECLARE @point1 geometry, @point2 geometry;
SET @point1 = geometry::STPointFromText('POINT(-122.354657658684900 47.658678768678100)', 0);
SET @point2 = geometry::STPointFromText('POINT(-122.354657658684000 47.658678768678100)', 0);
SELECT STIntersects(@point1, @point2);
go
~~START~~
bit
0
~~END~~


DECLARE @point1 geometry, @point2 geometry;
SET @point1 = geometry::STPointFromText('POINT(-122.354657658684900 47.658678768678100)', 4326);
SET @point2 = geometry::STPointFromText('POINT(-122.354657658684900 47.658678768678100)', 4326);
SELECT @point1 . STIntersects ( @point2 );
go
~~START~~
bit
1
~~END~~


-- Use in an ORDER BY Clause
SELECT PointColumn1.STIntersects(PointColumn2) AS Intersects FROM  TestGeospatialMethods_YourTable2Temp ORDER BY PointColumn1.STX;
go
~~START~~
bit
1
~~END~~


DECLARE @point1 geometry = geometry::Point(1.0, 2.0, 4326);
SELECT PointColumn1.STIntersects(@point1) AS Intersects FROM  TestGeospatialMethods_YourTable2Temp ORDER BY PointColumn1.STX;
go
~~START~~
bit
0
~~END~~


DECLARE @point1 geometry = geometry::Point(1.0, 2.0, 4326);
SELECT @point1.STIntersects(PointColumn2) AS Intersects FROM  TestGeospatialMethods_YourTable2Temp ORDER BY PointColumn1.STX;
go
~~START~~
bit
0
~~END~~


SELECT ID, PointColumn1.STIntersects(PointColumn2) AS Intersecting_points FROM  TestGeospatialMethods_YourTable2Temp ORDER BY PointColumn1.STX;
go
~~START~~
int#!#bit
1#!#1
~~END~~


DECLARE @referencePoint geometry = geometry::Point(0.0, 0.0, 4326);
SELECT ID, PointColumn.STIntersects(@referencePoint) AS Intersection FROM TestGeospatialMethods_DB.dbo.TestGeospatialMethods_YourTable1Temp ORDER BY PointColumn.STX;
go
~~START~~
int#!#bit
4#!#<NULL>
1#!#0
3#!#<NULL>
2#!#0
~~END~~


-- Use in a WHERE Clause
DECLARE @referencePoint geometry = geometry::Point(0.0, 0.0, 4326);
DECLARE @doesintersect BIT = 0;
SELECT PointColumn.STSrid FROM  TestGeospatialMethods_YourTableTemp WHERE PointColumn.STIntersects(@referencePoint) = @doesintersect ORDER BY PointColumn.STSrid;
go
~~START~~
int
4326
4326
~~END~~


-- Use in a CTE (Common Table Expression)
DECLARE @referencePoint geometry = geometry::Point(0.0, 0.0, 4326);
WITH IntersectCTE AS ( SELECT ID, PointColumn.STIntersects(@referencePoint) AS Intersection FROM  TestGeospatialMethods_YourTableTemp)
SELECT * FROM IntersectCTE WHERE Intersection = 1 ORDER BY Intersection;
go
~~START~~
int#!#bit
~~END~~


DECLARE @referencePoint geometry = geometry::Point(0.0, 0.0, 4326);
WITH IntersectCTE AS ( SELECT ID, PointColumn.STIntersects(@referencePoint) AS Intersections FROM  TestGeospatialMethods_YourTableTemp ORDER BY PointColumn.STX)
SELECT * FROM IntersectCTE WHERE Intersections = 1.0 ORDER BY Intersections;
GO
~~START~~
int#!#bit
~~END~~


DECLARE @referencePoint geometry = geometry::Point(0.0, 0.0, 4326);
WITH IntersectCTE AS ( SELECT ID, @referencePoint.STIntersects(PointColumn) AS Intersections FROM  TestGeospatialMethods_YourTableTemp ORDER BY PointColumn.STX)
SELECT * FROM IntersectCTE WHERE Intersections != 1.0 ORDER BY Intersections;
GO
~~START~~
int#!#bit
1#!#0
2#!#0
~~END~~


-- Use in a JOIN Operation
SELECT PointA.STAsText(),PointB.STAsText() FROM  TestGeospatialMethods_TableATemp JOIN  TestGeospatialMethods_TableBTemp ON PointA.STIntersects(TestGeospatialMethods_TableBTemp.PointB) != 1 ORDER BY PointA.STX;
go
~~START~~
nvarchar#!#nvarchar
POINT(1 2)#!#POINT(3 4)
~~END~~


DECLARE @referencePoint geometry = geometry::Point(0.0, 0.0, 4326);
SELECT PointA.STAsText(),PointB.STAsText() FROM  TestGeospatialMethods_TableATemp JOIN  TestGeospatialMethods_TableBTemp ON @referencePoint.STIntersects(TestGeospatialMethods_TableBTemp.PointB) = 1 ORDER BY PointA.STX;
go
~~START~~
nvarchar#!#nvarchar
~~END~~


DECLARE @referencePoint geometry = geometry::Point(0.0, 0.0, 4326);
SELECT PointA.STAsText(),PointB.STAsText() FROM  TestGeospatialMethods_TableATemp JOIN  TestGeospatialMethods_TableBTemp ON PointA.STIntersects(@referencePoint) != 1 ORDER BY PointA.STX;
go
~~START~~
nvarchar#!#nvarchar
POINT(1 2)#!#POINT(3 4)
~~END~~


-- Use in a CASE Statement
DECLARE @doesintersect BIT = 1;
SELECT ID, PointColumn1.STIntersects(PointColumn2) AS doesintersect,
CASE WHEN PointColumn1.STIntersects(PointColumn2) = @doesintersect THEN 'yes' ELSE 'no'
END AS doesintersect
FROM  TestGeospatialMethods_YourTable2Temp ORDER BY PointColumn1.STX;
go
~~START~~
int#!#bit#!#varchar
1#!#1#!#yes
~~END~~


-- Use in a Conditional Statement
DECLARE @referencePoint geometry = geometry::Point(0.0, 0.0, 4326);
DECLARE @doesintersect BIT = 1;
SELECT ID, PointColumn.STIntersects(@referencePoint) AS IntersectingReferancePoint,
CASE WHEN PointColumn.STIntersects(@referencePoint) = @doesintersect THEN 'Close'
ELSE 'Far'
END AS Proximity
FROM  TestGeospatialMethods_YourTableTemp ORDER BY PointColumn.STX;
go
~~START~~
int#!#bit#!#varchar
1#!#0#!#Far
3#!#<NULL>#!#Far
2#!#0#!#Far
~~END~~


DECLARE @referencePoint geometry = geometry::Point(0.0, 0.0, 4326);
SELECT ID, @referencePoint.STIntersects(PointColumn) AS IntersectingReferancePoint,
CASE WHEN @referencePoint.STIntersects(PointColumn) = @referencePoint.STY THEN 'Close'
ELSE 'Far'
END AS Proximity
FROM  TestGeospatialMethods_YourTableTemp ORDER BY PointColumn.STX;
go
~~START~~
int#!#bit#!#varchar
1#!#0#!#Close
3#!#<NULL>#!#Far
2#!#0#!#Close
~~END~~


-- Use in a Pivot Query
DECLARE @Ranges TABLE (MinDistance float, MaxDistance float);
INSERT INTO @Ranges VALUES (0, 5), (5, 10), (10, 15);
SELECT * FROM ( SELECT ID,
CASE WHEN PointColumn1.STIntersects(PointColumn2) BETWEEN 0 AND 1 THEN 'yes'
ELSE 'no'
END AS Range
FROM  TestGeospatialMethods_YourTable2Temp ORDER BY PointColumn1.STX
) AS Source
PIVOT ( COUNT(ID) FOR Range IN ([0-5], [5.1-10], [10.1-15], [15.1+])) AS PivotTable;
go
~~ROW COUNT: 3~~

~~START~~
int#!#int#!#int#!#int
0#!#0#!#0#!#0
~~END~~


-- Use in a JSON Output
DECLARE @referencePoint geometry = geometry::Point(0.0, 0.0, 4326);
SELECT ID, PointColumn.STIntersects(@referencePoint) AS Intersections,
JSON_QUERY('{"Intersections":' + CAST(PointColumn.STIntersects(@referencePoint) AS NVARCHAR(MAX)) + '}') AS Json
FROM  TestGeospatialMethods_YourTableTemp ORDER BY PointColumn.STX;
go
~~START~~
int#!#bit#!#nvarchar
1#!#0#!#{"Intersections": 0}
3#!#<NULL>#!#<NULL>
2#!#0#!#{"Intersections": 0}
~~END~~


DECLARE @referencePoint geometry = geometry::Point(0.0, 0.0, 4326);
SELECT ID, @referencePoint.STIntersects(PointColumn) AS Intersections,
JSON_QUERY('{"Intersections":' + CAST(@referencePoint.STIntersects(PointColumn) AS NVARCHAR(MAX)) + '}') Json
FROM  TestGeospatialMethods_YourTableTemp ORDER BY PointColumn.STX;
go
~~START~~
int#!#bit#!#nvarchar
1#!#0#!#{"Intersections": 0}
3#!#<NULL>#!#<NULL>
2#!#0#!#{"Intersections": 0}
~~END~~


-- Using Square brackets '[]' identifier
SELECT [PointColumn1].STIntersects([PointColumn2]) AS Intersection FROM  TestGeospatialMethods_YourTable2Temp ORDER BY PointColumn1.STX;
go
~~START~~
bit
1
~~END~~


-- Use in Prepared Statement
DECLARE @referencePoint geometry = geometry::Point(0.0, 0.0, 4326);
DECLARE @doesintersect BIT = 1;
DECLARE @sql NVARCHAR(MAX);
DECLARE @params NVARCHAR(MAX);
SET @sql = N'
SELECT ID, PointColumn.STIntersects(@referencePoint) AS IntersectingReferancePoint,
CASE WHEN PointColumn.STIntersects(@referencePoint) = @doesintersect THEN ''Close''
ELSE ''Far''
END AS Proximity
FROM  TestGeospatialMethods_YourTableTemp
WHERE PointColumn.STIntersects(@referencePoint) = @doesintersect;';
SET @params = N'@referencePoint geometry, @doesintersect float';
EXEC sp_executesql @sql, @params, @referencePoint, @doesintersect;
go
~~START~~
int#!#bit#!#varchar
~~END~~


-- Use in Multi-Part column name Statements
DECLARE @referencePoint geometry = geometry::Point(0.0, 0.0, 4326);
SELECT PointColumn.STIntersects(@referencePoint) AS Intersection FROM  TestGeospatialMethods_YourTableTemp ORDER BY PointColumn.STX;
SELECT TestGeospatialMethods_YourTableTemp.PointColumn.STIntersects(@referencePoint) AS Intersection FROM  TestGeospatialMethods_YourTableTemp ORDER BY PointColumn.STX;
SELECT TestGeospatialMethods_YourTableTemp.PointColumn.STIntersects(@referencePoint) AS Intersection FROM  TestGeospatialMethods_YourTableTemp ORDER BY PointColumn.STX;
go
~~START~~
bit
0
<NULL>
0
~~END~~

~~START~~
bit
0
<NULL>
0
~~END~~

~~START~~
bit
0
<NULL>
0
~~END~~


-- Use in function.STIntersects(@point) Statements
DECLARE @pnt geometry;
SET @pnt = geometry::STGeomFromText('POINT(-122.34900 47.65100)', 4326);
select geometry::Point(@pnt.STY, @pnt.STX, 4326).STIntersects(@pnt)
go
~~START~~
bit
0
~~END~~


-- Use in a Group By Clause
DECLARE @referencePoint geometry = geometry::Point(0.0, 0.0, 4326);
DECLARE @intersection_points INT = 1;
SELECT ROUND(PointColumn.STIntersects(@referencePoint) / @intersection_points, 0) * @intersection_points AS Intersectinggroup,
COUNT(*) AS PointCount
FROM  TestGeospatialMethods_YourTableTemp
GROUP BY ROUND(PointColumn.STIntersects(@referencePoint) / @intersection_points, 0) * @intersection_points
ORDER BY Intersectinggroup;
go
~~START~~
int#!#int
<NULL>#!#1
0#!#2
~~END~~


DECLARE @referencePoint geometry = geometry::Point(1.0, 0.0, 4326);
SELECT ROUND(PointColumn.STIntersects(@referencePoint) / @referencePoint.STX, 0) * @referencePoint.STX AS Intersectinggroup,
COUNT(*) AS PointCount
FROM  TestGeospatialMethods_YourTableTemp
GROUP BY ROUND(PointColumn.STIntersects(@referencePoint) / @referencePoint.STX, 0) * @referencePoint.STX
ORDER BY Intersectinggroup;
go
~~START~~
float#!#int
<NULL>#!#1
0.0#!#2
~~END~~


-- Use in a Window Function
DECLARE @referencePoint geometry = geometry::Point(0.0, 0.0, 4326);
SELECT ID, PointColumn1.STIntersects(PointColumn2) AS intersection_points,
cast(PointColumn1.STIntersects(@referencePoint) as int) - LAG(PointColumn1.STIntersects(PointColumn2)) OVER (ORDER BY ID) AS Intersectinggroup 
FROM  TestGeospatialMethods_YourTable2Temp ORDER BY PointColumn1.STX;
go
~~START~~
int#!#bit#!#int
1#!#1#!#<NULL>
~~END~~


DECLARE @referencePoint geometry = geometry::Point(0.0, 0.0, 4326);
SELECT ID, PointColumn.STIntersects(@referencePoint) AS intersection_points,
cast(@referencePoint.STDisjoint(PointColumn) as int) - LAG(@referencePoint.STX) OVER (ORDER BY ID) AS Intersectinggroup
FROM  TestGeospatialMethods_YourTableTemp ORDER BY PointColumn.STX;
go
~~START~~
int#!#bit#!#float
1#!#0#!#<NULL>
3#!#<NULL>#!#<NULL>
2#!#0#!#1.0
~~END~~


-- Use in an UPDATE Statement
DECLARE @referencePoint geometry = geometry::Point(0.0, 0.0, 4326); 
UPDATE  TestGeospatialMethods_YourTableTemp SET PointColumn = @referencePoint
WHERE @referencePoint.STIntersects(PointColumn) = 1;
go

DECLARE @referencePoint geometry = geometry::Point(0.0, 0.0, 4326); 
UPDATE  TestGeospatialMethods_YourTableTemp SET PointColumn = @referencePoint
WHERE PointColumn.STIntersects(@referencePoint) != 1;
go
~~ROW COUNT: 2~~


-- Cross-database query to retrieve intersects
DECLARE @referencePoint geometry = geometry::Point(0.0, 0.0, 4326);
SELECT ID, PointColumn.STIntersects(@referencePoint) AS Intersects FROM TestGeospatialMethods_DB.dbo.TestGeospatialMethods_YourTable1Temp;
go
~~START~~
int#!#bit
1#!#0
2#!#0
3#!#<NULL>
4#!#<NULL>
~~END~~


DECLARE @referencePoint geography = geography::Point(0.0, 0.0, 4326);
SELECT ID, PointColumn.STIntersects(@referencePoint) AS Intersects FROM TestGeospatialMethods_DB.dbo.TestGeospatialMethods_YourTable3Temp;
go
~~START~~
int#!#bit
1#!#0
2#!#<NULL>
3#!#<NULL>
4#!#<NULL>
~~END~~


SELECT 
    a.id AS id1, 
    b.id AS id2, 
    a.PointColumn.STIntersects(b.PointColumn) AS intersects
FROM 
    TestGeospatialMethods_DB.dbo.TestGeospatialMethods_YourTable1Temp a,
    dbo.TestGeospatialMethods_YourTableTemp b;
go
~~START~~
int#!#int#!#bit
1#!#3#!#<NULL>
1#!#1#!#0
1#!#2#!#0
2#!#3#!#<NULL>
2#!#1#!#0
2#!#2#!#0
3#!#3#!#1
3#!#1#!#<NULL>
3#!#2#!#<NULL>
4#!#3#!#<NULL>
4#!#1#!#<NULL>
4#!#2#!#<NULL>
~~END~~


-- 4-part names
SELECT dbo.TestGeospatialMethods_YourTableTemp.PointColumn.STIntersects(@referencePoint) AS INTERSECTING FROM TestGeospatialMethods_YourTableTemp ORDER BY PointColumn.STX;
go
~~ERROR (Code: 33557097)~~

~~ERROR (Message: Remote procedure/function reference with 4-part object name is not currently supported in Babelfish)~~



-- STDisjoint
DECLARE @point1 geography, @point2 geography;
SET @point1 = geography::STGeomFromText('POINT(-122.34900 47.65100)', 4326);
SET @point2 = geography::STGeomFromText('POINT(-122.34900 47.65100)', 4326);
SELECT @point1.STDisjoint(@point2) AS disjoint;
go
~~START~~
bit
0
~~END~~


DECLARE @point1 geography, @point2 geography;
SET @point1 = geography::STGeomFromText('POINT(-122.34900 47.65100)', 4204);
SET @point2 = geography::STGeomFromText('POINT(-122.34900 47.65100)', 4204);
SELECT @point1 . STDisjoint(@point2) AS disjoint;
go
~~START~~
bit
0
~~END~~


-- Verifying with precision
DECLARE @point1 geometry, @point2 geometry;
SET @point1 = geometry::STPointFromText('POINT(-122.354657658684900 47.658678768678100)', 4326);
SET @point2 = geometry::STPointFromText('POINT(-122.354657658684900 47.658678768678100)', 4326);
SELECT STDisjoint(@point1, @point2);
go
~~START~~
bit
0
~~END~~


DECLARE @point1 geography, @point2 geography;
SET @point1 = geography::STPointFromText('POINT(-122.354657658684900 47.658678768678100)', 4326);
SET @point2 = geography::STPointFromText('POINT(-122.354657658684000 47.658678768678100)', 4326);
SELECT STDisjoint(@point1, @point2);
go
~~START~~
bit
1
~~END~~


DECLARE @point1 geometry, @point2 geometry;
SET @point1 = geometry::STPointFromText('POINT(-122.354657658684900 47.658678768678100)', 0);
SET @point2 = geometry::STPointFromText('POINT(-122.354657658684900 47.658678768678100)', 0);
SELECT @point1 . STDisjoint ( @point2 );
go
~~START~~
bit
0
~~END~~


DECLARE @point1 geography, @point2 geography;
SET @point1 = geography::STGeomFromText('POINT(-122.354657658684900 47.658678768678100)', 4326);
SET @point2 = geography::STGeomFromText('POINT(-122.354657658684900 47.658678768678100)', 4326);
SELECT @point1.STDisjoint(@point2);
go
~~START~~
bit
0
~~END~~


-- Use in an ORDER BY Clause
SELECT ID, PointColumn1.STDisjoint(PointColumn2) AS disjoint FROM  TestGeospatialMethods_YourTable2Temp ORDER BY PointColumn1.STX;
go
~~START~~
int#!#bit
1#!#0
~~END~~


DECLARE @point1 geometry = geometry::Point(1.0, 2.0, 4326);
SELECT ID, PointColumn1.STDisjoint(@point1) AS disjoint FROM  TestGeospatialMethods_YourTable2Temp ORDER BY PointColumn1.STX;
go
~~START~~
int#!#bit
1#!#1
~~END~~


DECLARE @point1 geometry = geometry::Point(1.0, 2.0, 4326);
SELECT ID, @point1.STDisjoint(PointColumn2) AS disjoint FROM  TestGeospatialMethods_YourTable2Temp ORDER BY PointColumn1.STX;
go
~~START~~
int#!#bit
1#!#1
~~END~~


-- Use in a WHERE Clause
DECLARE @referencePoint geometry = geometry::Point(0.0, 0.0, 4326);
DECLARE @disjoint BIT = 1;
SELECT PointColumn.STAsText() FROM  TestGeospatialMethods_YourTableTemp WHERE PointColumn.STDisjoint(@referencePoint) = @disjoint ORDER BY PointColumn.STX;
go
~~START~~
nvarchar
~~END~~


DECLARE @referencePoint geometry = geometry::Point(0.0, 0.0, 4326);
SELECT PointColumn.STAsText() FROM  TestGeospatialMethods_YourTableTemp WHERE @referencePoint.STDisjoint(PointColumn) = @referencePoint.STX ORDER BY PointColumn.STX;
go
~~START~~
nvarchar
POINT(0 0)
POINT(0 0)
~~END~~


SELECT ID, PointColumn1.STDisjoint(PointColumn2) AS disjoint FROM  TestGeospatialMethods_YourTable2Temp ORDER BY PointColumn1.STX;
go
~~START~~
int#!#bit
1#!#0
~~END~~


DECLARE @referencePoint geometry = geometry::Point(0.0, 0.0, 4326);
SELECT PointColumn.STAsText() FROM  TestGeospatialMethods_YourTableTemp WHERE PointColumn.STDisjoint(@referencePoint) != @referencePoint.STX ORDER BY PointColumn.STX;
go
~~START~~
nvarchar
~~END~~


-- Use in a JOIN Operation
SELECT PointA.STAsText(),PointB.STAsText() FROM  TestGeospatialMethods_TableATemp JOIN  TestGeospatialMethods_TableBTemp ON PointA.STDisjoint(TestGeospatialMethods_TableBTemp.PointB) = 1 ORDER BY TestGeospatialMethods_TableBTemp.PointB.STX;
go
~~START~~
nvarchar#!#nvarchar
POINT(1 2)#!#POINT(3 4)
~~END~~


DECLARE @referencePoint geometry = geometry::Point(0.0, 0.0, 4326);
SELECT PointA.STAsText(),PointB.STAsText() FROM  TestGeospatialMethods_TableATemp JOIN  TestGeospatialMethods_TableBTemp ON @referencePoint.STDisjoint(TestGeospatialMethods_TableBTemp.PointB) = 1 ORDER BY TestGeospatialMethods_TableBTemp.PointB.STX;
go
~~START~~
nvarchar#!#nvarchar
POINT(1 2)#!#POINT(3 4)
~~END~~


DECLARE @referencePoint geometry = geometry::Point(0.0, 0.0, 4326);
SELECT PointA.STAsText(),PointB.STAsText() FROM  TestGeospatialMethods_TableATemp JOIN  TestGeospatialMethods_TableBTemp ON PointA.STDisjoint(@referencePoint) = 1 ORDER BY TestGeospatialMethods_TableBTemp.PointB.STX;
go
~~START~~
nvarchar#!#nvarchar
POINT(1 2)#!#POINT(3 4)
~~END~~


DECLARE @referencePoint geometry = geometry::Point(0.0, 0.0, 4326);
SELECT PointA.STAsText(),PointB.STAsText() FROM  TestGeospatialMethods_TableATemp JOIN  TestGeospatialMethods_TableBTemp ON TestGeospatialMethods_TableBTemp.PointB.STDisjoint(@referencePoint) = 0 ORDER BY PointB.STX;
go
~~START~~
nvarchar#!#nvarchar
~~END~~


-- Use in a CASE Statement
DECLARE @disjoints BIT = 1 ;
SELECT ID, PointColumn1.STDisjoint(PointColumn2) AS dodisjoint,
CASE WHEN PointColumn1.STDisjoint(PointColumn2) = @disjoints THEN 'Disjoints' ELSE 'Are_not_disjoint'
END AS Proximity
FROM  TestGeospatialMethods_YourTable2Temp ORDER BY PointColumn1.STX;
go
~~START~~
int#!#bit#!#varchar
1#!#0#!#Are_not_disjoint
~~END~~


DECLARE @referencePoint geometry = geometry::Point(0.0, 0.0, 4326);
SELECT ID, PointColumn1.STDisjoint(@referencePoint) AS disjoint,
CASE WHEN @referencePoint.STDisjoint(PointColumn2) = @referencePoint.STX THEN 'Disjoints' ELSE 'Are_not_disjoint'
END AS Proximity
FROM  TestGeospatialMethods_YourTable2Temp ORDER BY PointColumn1.STX;
go
~~START~~
int#!#bit#!#varchar
1#!#1#!#Are_not_disjoint
~~END~~


-- Use in a CTE (Common Table Expression)
DECLARE @referencePoint geometry = geometry::Point(0.0, 0.0, 4326);
WITH CTE AS ( SELECT ID, PointColumn.STDisjoint(@referencePoint) AS disjoint FROM  TestGeospatialMethods_YourTableTemp ORDER BY PointColumn.STX)
SELECT * FROM CTE WHERE disjoint = 1 ORDER BY disjoint;
go
~~START~~
int#!#bit
~~END~~


DECLARE @referencePoint geometry = geometry::Point(0.0, 0.0, 4326);
WITH CTE AS ( SELECT ID, @referencePoint.STDisjoint(PointColumn) AS disjoint FROM  TestGeospatialMethods_YourTableTemp ORDER BY PointColumn.STX)
SELECT * FROM CTE WHERE disjoint = 1 ORDER BY disjoint;
go
~~START~~
int#!#bit
~~END~~


-- Use in a Conditional Statement
DECLARE @referencePoint geometry = geometry::Point(0.0, 0.0, 4326);
DECLARE @disjoints BIT = 1;
SELECT ID, PointColumn.STDisjoint(@referencePoint) AS ReferencePoint,
CASE WHEN PointColumn.STDisjoint(@referencePoint) = @disjoints THEN 'disjoint'
ELSE 'are_not_disjoint'
END AS Proximity
FROM  TestGeospatialMethods_YourTableTemp ORDER BY PointColumn.STX;
go
~~START~~
int#!#bit#!#varchar
1#!#0#!#are_not_disjoint
2#!#0#!#are_not_disjoint
3#!#<NULL>#!#are_not_disjoint
~~END~~


DECLARE @referencePoint geometry = geometry::Point(0.0, 0.0, 4326);
SELECT ID, @referencePoint.STDisjoint(PointColumn) AS ReferencePoint,
CASE WHEN @referencePoint.STDisjoint(PointColumn) = @referencePoint.STY THEN 'disjoint'
ELSE 'are_not_disjoint'
END AS Proximity
FROM  TestGeospatialMethods_YourTableTemp ORDER BY PointColumn.STX;
go
~~START~~
int#!#bit#!#varchar
1#!#0#!#disjoint
2#!#0#!#disjoint
3#!#<NULL>#!#are_not_disjoint
~~END~~


-- Use in a Pivot Query
DECLARE @Ranges TABLE (MinDistance float, MaxDistance float);
INSERT INTO @Ranges VALUES (0, 5), (5, 10), (10, 15);
SELECT * FROM ( SELECT ID,
CASE WHEN PointColumn1.STDisjoint(PointColumn2) BETWEEN 0 AND 1 THEN 'disjoint'
ELSE 'do_not_disjoint'
END AS Range
FROM  TestGeospatialMethods_YourTable2Temp ORDER BY PointColumn1.STX
) AS Source
PIVOT ( COUNT(ID) FOR Range IN ([0-5], [5.1-10], [10.1-15], [15.1+])) AS PivotTable;
go
~~ROW COUNT: 3~~

~~START~~
int#!#int#!#int#!#int
0#!#0#!#0#!#0
~~END~~


DECLARE @referencePoint geometry = geometry::Point(0.0, 0.0, 4326);
SELECT ID, PointColumn.STDisjoint(@referencePoint) AS disjoint FROM TestGeospatialMethods_DB.dbo.TestGeospatialMethods_YourTable1Temp ORDER BY PointColumn.STX;
go
~~START~~
int#!#bit
4#!#<NULL>
1#!#1
3#!#<NULL>
2#!#1
~~END~~


-- Use in a JSON Output
DECLARE @referencePoint geometry = geometry::Point(0.0, 0.0, 4326);
SELECT ID, PointColumn.STDisjoint(@referencePoint) AS disjoint,
JSON_QUERY('{"Disjoint":' + CAST(PointColumn.STDisjoint(@referencePoint) AS NVARCHAR(MAX)) + '}') AS Json
FROM  TestGeospatialMethods_YourTableTemp ORDER BY PointColumn.STX;
go
~~START~~
int#!#bit#!#nvarchar
1#!#0#!#{"Disjoint": 0}
2#!#0#!#{"Disjoint": 0}
3#!#<NULL>#!#<NULL>
~~END~~


DECLARE @referencePoint geometry = geometry::Point(0.0, 0.0, 4326);
SELECT ID, @referencePoint.STDisjoint(PointColumn) AS disjoint,
JSON_QUERY('{"Disjoint":' + CAST(@referencePoint.STDisjoint(PointColumn) AS NVARCHAR(MAX)) + '}') Json
FROM  TestGeospatialMethods_YourTableTemp ORDER BY PointColumn.STX;
go
~~START~~
int#!#bit#!#nvarchar
1#!#0#!#{"Disjoint": 0}
2#!#0#!#{"Disjoint": 0}
3#!#<NULL>#!#<NULL>
~~END~~


-- Using Square brackets '[]' identifier
SELECT [PointColumn1].STDisjoint([PointColumn2]) AS disjoint FROM  TestGeospatialMethods_YourTable2Temp ORDER BY PointColumn1.STX;
go
~~START~~
bit
0
~~END~~


-- Use in Prepared Statement
DECLARE @referencePoint geometry = geometry::Point(0.0, 0.0, 4326);
DECLARE @disjoints BIT = 1;
DECLARE @sql NVARCHAR(MAX);
DECLARE @params NVARCHAR(MAX);
SET @sql = N'
SELECT ID, PointColumn.STDisjoint(@referencePoint) AS IntersectingReferancePoint,
CASE WHEN PointColumn.STDisjoint(@referencePoint) = @disjoints THEN ''disjoints''
ELSE ''do_not_disjoint''
END AS Proximity
FROM  TestGeospatialMethods_YourTableTemp
WHERE PointColumn.STDisjoint(@referencePoint) = @disjoints;';
SET @params = N'@referencePoint geometry, @disjoints float';
EXEC sp_executesql @sql, @params, @referencePoint, @disjoints;
go
~~START~~
int#!#bit#!#varchar
~~END~~


-- Use in Multi-Part column name Statements
DECLARE @referencePoint geometry = geometry::Point(0.0, 0.0, 4326);
SELECT PointColumn.STDisjoint(@referencePoint) AS disjoint FROM  TestGeospatialMethods_YourTableTemp ORDER BY PointColumn.STX;
SELECT TestGeospatialMethods_YourTableTemp.PointColumn.STDisjoint(@referencePoint) AS disjoint FROM  TestGeospatialMethods_YourTableTemp ORDER BY PointColumn.STX;
SELECT TestGeospatialMethods_YourTableTemp.PointColumn.STDisjoint(@referencePoint) AS disjoint FROM  TestGeospatialMethods_YourTableTemp ORDER BY PointColumn.STX;
go
~~START~~
bit
0
0
<NULL>
~~END~~

~~START~~
bit
0
0
<NULL>
~~END~~

~~START~~
bit
0
0
<NULL>
~~END~~



-- Use in function.STDisjoint(@point) Statements
DECLARE @pnt geometry;
SET @pnt = geometry::STGeomFromText('POINT(-122.34900 47.65100)', 4326);
select geometry::Point(@pnt.STY, @pnt.STX, 4326).STDisjoint(@pnt)
-- Use in a Group By Clause
DECLARE @referencePoint geometry = geometry::Point(0.0, 0.0, 4326);
DECLARE @disjoints INT = 1;
SELECT ROUND(PointColumn.STDisjoint(@referencePoint) / @disjoints, 0) * @disjoints AS Grp,
COUNT(*) AS PointCount
FROM  TestGeospatialMethods_YourTableTemp
GROUP BY ROUND(PointColumn.STDisjoint(@referencePoint) / @disjoints, 0) * @disjoints
ORDER BY Grp;
go
~~START~~
bit
1
~~END~~

~~START~~
int#!#int
<NULL>#!#1
0#!#2
~~END~~


DECLARE @referencePoint geometry = geometry::Point(1.0, 0.0, 4326);
SELECT ROUND(PointColumn.STDisjoint(@referencePoint) / @referencePoint.STX, 0) * @referencePoint.STX AS GRP,
COUNT(*) AS PointCount
FROM  TestGeospatialMethods_YourTableTemp
GROUP BY ROUND(PointColumn.STDisjoint(@referencePoint) / @referencePoint.STX, 0) * @referencePoint.STX
ORDER BY Grp;
go
~~START~~
float#!#int
<NULL>#!#1
1.0#!#2
~~END~~


-- Use in a Window Function
DECLARE @referencePoint geometry = geometry::Point(0.0, 0.0, 4326);
SELECT ID, PointColumn1.STDisjoint(PointColumn2) AS disjoint,
cast(PointColumn1.STDisjoint(@referencePoint) as int) - LAG(PointColumn1.STDisjoint(PointColumn2)) OVER (ORDER BY ID) AS Difference 
FROM  TestGeospatialMethods_YourTable2Temp ORDER BY PointColumn1.STX;
go
~~START~~
int#!#bit#!#int
1#!#0#!#<NULL>
~~END~~


DECLARE @referencePoint geometry = geometry::Point(0.0, 0.0, 4326);
SELECT ID, PointColumn.STDisjoint(@referencePoint) AS disjoint,
cast(@referencePoint.STDisjoint(PointColumn) as int) - LAG(@referencePoint.STX) OVER (ORDER BY ID) AS Difference
FROM  TestGeospatialMethods_YourTableTemp ORDER BY PointColumn.STX;
go
~~START~~
int#!#bit#!#float
1#!#0#!#<NULL>
2#!#0#!#0.0
3#!#<NULL>#!#<NULL>
~~END~~


-- Use in an UPDATE Statement
DECLARE @referencePoint geometry = geometry::Point(0.0, 0.0, 4326); 
UPDATE  TestGeospatialMethods_YourTableTemp SET PointColumn = @referencePoint
WHERE @referencePoint.STDisjoint(PointColumn) = 1;
go

DECLARE @referencePoint geometry = geometry::Point(0.0, 0.0, 4326); 
UPDATE  TestGeospatialMethods_YourTableTemp SET PointColumn = @referencePoint
WHERE PointColumn.STDisjoint(@referencePoint) != 1;
go
~~ROW COUNT: 2~~



-- Cross-database query to retrieve disjoints
SELECT 
    a.id AS id1, 
    b.id AS id2, 
    a.PointColumn.STDisjoint(b.PointColumn) AS disjoints
FROM 
    TestGeospatialMethods_DB.dbo.TestGeospatialMethods_YourTable1Temp a,
    dbo.TestGeospatialMethods_YourTableTemp b;
go
~~START~~
int#!#int#!#bit
1#!#3#!#<NULL>
1#!#1#!#1
1#!#2#!#1
2#!#3#!#<NULL>
2#!#1#!#1
2#!#2#!#1
3#!#3#!#0
3#!#1#!#<NULL>
3#!#2#!#<NULL>
4#!#3#!#<NULL>
4#!#1#!#<NULL>
4#!#2#!#<NULL>
~~END~~


DECLARE @referencePoint geometry = geometry::Point(0.0, 0.0, 4326);
SELECT ID, PointColumn.STDisjoint(@referencePoint) AS Disjoint FROM TestGeospatialMethods_DB.dbo.TestGeospatialMethods_YourTable1Temp;
go
~~START~~
int#!#bit
1#!#1
2#!#1
3#!#<NULL>
4#!#<NULL>
~~END~~


DECLARE @referencePoint geography = geography::Point(0.0, 0.0, 4326);
SELECT ID, PointColumn.STDisjoint(@referencePoint) AS Disjoint FROM TestGeospatialMethods_DB.dbo.TestGeospatialMethods_YourTable3Temp;
go
~~START~~
int#!#bit
1#!#1
2#!#<NULL>
3#!#<NULL>
4#!#<NULL>
~~END~~


-- 4-part names
SELECT dbo.TestGeospatialMethods_YourTableTemp.PointColumn.STDisjoint(@referencePoint) AS DISJOINTS FROM TestGeospatialMethods_YourTableTemp ORDER BY PointColumn.STX;
go
~~ERROR (Code: 33557097)~~

~~ERROR (Message: Remote procedure/function reference with 4-part object name is not currently supported in Babelfish)~~


-- Tests with different set of SRIDs
DECLARE @point1 geometry, @point2 geometry;
SET @point1 = geometry::STPointFromText('POINT(-122.354657658684900 47.658678768678100)', 4326);
SET @point2 = geometry::STPointFromText('POINT(-122.354657658684900 47.658678768678100)', 3857);
SELECT @point1.STIntersects(@point2) AS Intersecting;
go
~~START~~
bit
<NULL>
~~END~~


DECLARE @point1 geometry, @point2 geometry;
SET @point1 = geometry::STPointFromText('POINT(-122.354657658684900 47.658678768678100)', 4326);
SET @point2 = geometry::STPointFromText('POINT(-122.354657658684900 47.658678768678100)', 3857);
SELECT @point1.STDisjoint(@point2) AS Disjoints;
go
~~START~~
bit
<NULL>
~~END~~


-- Negative test for Geospatial functions
DECLARE @point1 geometry, @point2 varchar(50), @point3 int;
SET @point1 = geometry::Point(22.34900, -47.65100, 4326);
SET @point2 = 'Test_String';
SELECT @point1.STIntersects(@point2);
SELECT @point1.STDisjoint(@point2);
go
~~START~~
bit
~~ERROR (Code: 33557097)~~

~~ERROR (Message: Invalid geometry)~~


DECLARE @point1 geography, @point2 varchar(50), @point3 int;
SET @point1 = geography::Point(22.34900, -47.65100, 4326);
SET @point2 = 'Test_String';
SELECT @point1.STIntersects(@point2);
SELECT @point1.STDisjoint(@point2);
go
~~START~~
bit
~~ERROR (Code: 33557097)~~

~~ERROR (Message: Invalid geometry)~~


-- Null test for Geospatial functions
DECLARE @point1 geography, @point2 geography, @point3 geography;
SET @point1 = geography::STPointFromText(null, 4326);
SET @point2 = geography::STGeomFromText(null, 4326);
SET @point3 = geography::Point(22.34900, -47.65100, 4326);
SELECT @point1.STIntersects(@point2);
SELECT @point3.STIntersects(@point2);
SELECT @point1.STIntersects(@point3);
SELECT @point1.STDisjoint(@point2);
SELECT @point3.STDisjoint(@point2);
SELECT @point1.STDisjoint(@point3);
go
~~START~~
bit
<NULL>
~~END~~

~~START~~
bit
<NULL>
~~END~~

~~START~~
bit
<NULL>
~~END~~

~~START~~
bit
<NULL>
~~END~~

~~START~~
bit
<NULL>
~~END~~

~~START~~
bit
<NULL>
~~END~~


-- not compatible with sql server as well
-- Combining geometry and geography in a single query
DECLARE @point1 geometry, @point2 geography;
SET @point1 = geometry::STPointFromText('POINT(-122.354657658684900 47.658678768678100)', 4326);
SET @point2 = geography::STGeomFromText('POINT(-122.34900 47.65100)', 4326);
SELECT @point1.STDisjoint(@point2);
go
~~ERROR (Code: 206)~~

~~ERROR (Message: The function stdisjoint is found but cannot be used. Possibly due to datatype mismatch and implicit casting is not allowed.)~~


DECLARE @point1 geometry, @point2 geography;
SET @point1 = geometry::STPointFromText('POINT(-122.354657658684900 47.658678768678100)', 4326);
SET @point2 = geography::STGeomFromText('POINT(-122.34900 47.65100)', 4326);
SELECT @point2.STDisjoint(@point1);
go
~~ERROR (Code: 206)~~

~~ERROR (Message: The function stdisjoint is found but cannot be used. Possibly due to datatype mismatch and implicit casting is not allowed.)~~


DECLARE @point1 geometry, @point2 geography;
SET @point1 = geometry::STPointFromText('POINT(-122.354657658684900 47.658678768678100)', 4326);
SET @point2 = geography::STGeomFromText('POINT(-122.34900 47.65100)', 4326);
SELECT @point1.STIntersects(@point2);
go
~~ERROR (Code: 206)~~

~~ERROR (Message: The function stintersects is found but cannot be used. Possibly due to datatype mismatch and implicit casting is not allowed.)~~


DECLARE @point1 geometry, @point2 geography;
SET @point1 = geometry::STPointFromText('POINT(-122.354657658684900 47.658678768678100)', 4326);
SET @point2 = geography::STGeomFromText('POINT(-122.34900 47.65100)', 4326);
SELECT @point2.STIntersects(@point1);
go
~~ERROR (Code: 206)~~

~~ERROR (Message: The function stintersects is found but cannot be used. Possibly due to datatype mismatch and implicit casting is not allowed.)~~



-- STDimension
DECLARE @g geometry; 
SELECT @g.STDimension(); 
go
~~START~~
int
<NULL>
~~END~~


DECLARE @point geometry;
SET @point = geometry::STPointFromText('POINT(-122.34900 47.65100)', 4326);
SELECT STDimension(@point);
go
~~START~~
int
0
~~END~~


DECLARE @point geometry;
SET @point = geometry::STPointFromText('POINT(-122.34900 47.65100)', 0);
SELECT STDimension(@point);
go
~~START~~
int
0
~~END~~


DECLARE @point geometry;
SET @point = geometry::STPointFromText('POINT(-122.34900 47.65100)', 999999);
SELECT STDimension(@point);
go
~~START~~
int
0
~~END~~



DECLARE @point geography;
SET @point = geography::STPointFromText('POINT(-122.34900 47.65100)', 4204);
SELECT STDimension(@point);
go
~~START~~
int
0
~~END~~


DECLARE @point geometry;
SET @point = geometry::STPointFromText('POINT(-122.34900 47.65100)', 4326);
SELECT @point.STDimension();
go
~~START~~
int
0
~~END~~


DECLARE @point geography;
SET @point = geography::STPointFromText('POINT(-122.34900 47.65100)', 4326);
SELECT @point.STDimension();
go
~~START~~
int
0
~~END~~


DECLARE @point geometry;
SET @point = geometry::POINT(22.34900, -47.65100, 4326);
SELECT @point . STDimension ( );
go
~~START~~
int
0
~~END~~


DECLARE @point geography;
SET @point = geography::POINT(22.34900, -47.65100, 4326);
SELECT @point . STDimension ( );
go
~~START~~
int
0
~~END~~


SELECT location.STDimension() from  TestGeospatialMethods_SPATIALPOINTGEOM_dttemp ORDER BY location.STX;
go
~~START~~
int
0
0
0
0
0
~~END~~


SELECT location.STDimension() from  TestGeospatialMethods_SPATIALPOINTGEOG_dttemp ORDER BY location.Lat;
go
~~START~~
int
0
0
0
0
~~END~~


DECLARE @point geometry;
SET @point = geometry::STGeomFromText('POINT(-122.34900 47.65100)', 4326);
SELECT STDimension(@point);
SELECT @point.STDimension();
go
~~START~~
int
0
~~END~~

~~START~~
int
0
~~END~~


DECLARE @point geography;
SET @point = geography::STGeomFromText('POINT(-122.34900 47.65100)', 4326);
SELECT STDimension(@point);
SELECT @point.STDimension();
go
~~START~~
int
0
~~END~~

~~START~~
int
0
~~END~~



-- STIsEmpty
DECLARE @g geometry;  
SET @g = geometry::STGeomFromText('POINT EMPTY', 0);  
SELECT @g.STIsEmpty();
go
~~START~~
bit
1
~~END~~


DECLARE @point geometry;
SET @point = geometry::STPointFromText('POINT(-122.34900 47.65100)', 0);
SELECT STIsEmpty(@point);
go
~~START~~
bit
0
~~END~~


DECLARE @point geometry;
SET @point = geometry::STPointFromText('POINT(-122.34900 47.65100)', 999999);
SELECT STIsEmpty(@point);
go
~~START~~
bit
0
~~END~~


DECLARE @point geometry;
SET @point = geometry::STPointFromText('POINT(-122.34900 47.65100)', 4326);
SELECT STIsEmpty(@point);
go
~~START~~
bit
0
~~END~~


DECLARE @point geography;
SET @point = geography::STPointFromText('POINT(-122.34900 47.65100)', 4204);
SELECT STIsEmpty(@point);
go
~~START~~
bit
0
~~END~~


DECLARE @point geometry;
SET @point = geometry::STPointFromText('POINT(-122.34900 47.65100)', 4326);
SELECT @point.STIsEmpty();
go
~~START~~
bit
0
~~END~~


DECLARE @point geography;
SET @point = geography::STPointFromText('POINT(-122.34900 47.65100)', 4326);
SELECT @point.STIsEmpty();
go
~~START~~
bit
0
~~END~~


DECLARE @point geometry;
SET @point = geometry::POINT(22.34900, -47.65100, 4326);
SELECT @point . STIsEmpty ( );
go
~~START~~
bit
0
~~END~~


DECLARE @point geography;
SET @point = geography::POINT(22.34900, -47.65100, 4326);
SELECT @point . STIsEmpty ( );
go
~~START~~
bit
0
~~END~~


SELECT location.STIsEmpty() from  TestGeospatialMethods_SPATIALPOINTGEOM_dttemp ORDER BY location.STX;
go
~~START~~
bit
0
0
0
0
0
~~END~~


SELECT location.STIsEmpty() from  TestGeospatialMethods_SPATIALPOINTGEOG_dttemp ORDER BY location.Lat;
go
~~START~~
bit
0
0
0
0
~~END~~


DECLARE @point geometry;
SET @point = geometry::STGeomFromText('POINT(-122.34900 47.65100)', 4326);
SELECT STIsEmpty(@point);
SELECT @point.STIsEmpty();
go
~~START~~
bit
0
~~END~~

~~START~~
bit
0
~~END~~


DECLARE @point geography;
SET @point = geography::Point(22.34900, -47.65100, 4326);
SELECT STIsEmpty(@point);
SELECT @point.STIsEmpty();
go
~~START~~
bit
0
~~END~~

~~START~~
bit
0
~~END~~



-- STIsValid
DECLARE @point geometry;
SET @point = geometry::STPointFromText('POINT(-122.34900 47.65100)', 4204);
SELECT STIsValid(@point);
go
~~START~~
bit
1
~~END~~


DECLARE @point geometry;
SET @point = geometry::STPointFromText('POINT(-122.34900 47.65100)', 0);
SELECT STIsValid(@point);
go
~~START~~
bit
1
~~END~~


DECLARE @point geometry;
SET @point = geometry::STPointFromText('POINT(-122.34900 47.65100)', 999999);
SELECT STIsValid(@point);
go
~~START~~
bit
1
~~END~~


DECLARE @point geography;
SET @point = geography::STPointFromText('POINT(-122.34900 47.65100)', 4204);
SELECT STIsValid(@point);
go
~~START~~
bit
1
~~END~~


DECLARE @point geometry;
SET @point = geometry::STPointFromText('POINT(-122.34900 47.65100)', 4326);
SELECT @point.STIsValid();
go
~~START~~
bit
1
~~END~~


DECLARE @point geography;
SET @point = geography::STPointFromText('POINT(-122.34900 47.65100)', 4326);
SELECT @point.STIsValid();
go
~~START~~
bit
1
~~END~~


DECLARE @point geometry;
SET @point = geometry::POINT(22.34900, -47.65100, 4326);
SELECT @point . STIsValid ( );
go
~~START~~
bit
1
~~END~~


DECLARE @point geography;
SET @point = geography::POINT(22.34900, -47.65100, 4326);
SELECT @point . STIsValid ( );
go
~~START~~
bit
1
~~END~~


SELECT location.STIsValid() FROM TestGeospatialMethods_SPATIALPOINTGEOM_dttemp ORDER BY location.STX;
go
~~START~~
bit
1
1
1
1
1
~~END~~


SELECT location.STIsValid() from  TestGeospatialMethods_SPATIALPOINTGEOG_dttemp ORDER BY location.Lat;
go
~~START~~
bit
1
1
1
1
~~END~~


DECLARE @point geometry;
SET @point = geometry::STGeomFromText('POINT(-122.34900 47.65100)', 4326);
SELECT STIsValid(@point);
SELECT @point.STIsValid();
go
~~START~~
bit
1
~~END~~

~~START~~
bit
1
~~END~~


DECLARE @point geography;
SET @point = geography::Point(22.34900, -47.65100, 4326);
SELECT STIsValid(@point);
SELECT @point.STIsValid();
go
~~START~~
bit
1
~~END~~

~~START~~
bit
1
~~END~~



-- STIsClosed
DECLARE @point geometry;
SET @point = geometry::STPointFromText('POINT(-122.34900 47.65100)', 4326);
SELECT STIsClosed(@point);
go
~~START~~
bit
0
~~END~~


DECLARE @point geometry;
SET @point = geometry::STPointFromText('POINT(-122.34900 47.65100)', 0);
SELECT STIsClosed(@point);
go
~~START~~
bit
0
~~END~~


DECLARE @point geometry;
SET @point = geometry::STPointFromText('POINT(-122.34900 47.65100)', 999999);
SELECT STIsClosed(@point);
go
~~START~~
bit
0
~~END~~


DECLARE @point geography;
SET @point = geography::STPointFromText('POINT(-122.34900 47.65100)', 4204);
SELECT STIsClosed(@point);
go
~~START~~
bit
0
~~END~~


DECLARE @point geometry;
SET @point = geometry::STPointFromText('POINT(-122.34900 47.65100)', 4326);
SELECT @point.STIsClosed();
go
~~START~~
bit
0
~~END~~


DECLARE @point geography;
SET @point = geography::STPointFromText('POINT(-122.34900 47.65100)', 4326);
SELECT @point.STIsClosed();
go
~~START~~
bit
0
~~END~~


DECLARE @point geometry;
SET @point = geometry::POINT(22.34900, -47.65100, 4326);
SELECT @point . STIsClosed ( );
go
~~START~~
bit
0
~~END~~


DECLARE @point geography;
SET @point = geography::POINT(22.34900, -47.65100, 4326);
SELECT @point . STIsClosed ( );
go
~~START~~
bit
0
~~END~~


SELECT location.STIsClosed() from  TestGeospatialMethods_SPATIALPOINTGEOM_dttemp ORDER BY location.STX;
go
~~START~~
bit
0
0
0
0
0
~~END~~


SELECT location.STIsClosed() from  TestGeospatialMethods_SPATIALPOINTGEOG_dttemp ORDER BY location.Lat;
go
~~START~~
bit
0
0
0
0
~~END~~


DECLARE @point geometry;
SET @point = geometry::STGeomFromText('POINT(-122.34900 47.65100)', 4326);
SELECT STIsClosed(@point);
SELECT @point.STIsClosed();
go
~~START~~
bit
0
~~END~~

~~START~~
bit
0
~~END~~


DECLARE @point geography;
SET @point = geography::Point(22.34900, -47.65100, 4326);
SELECT STIsClosed(@point);
SELECT @point.STIsClosed();
go
~~START~~
bit
0
~~END~~

~~START~~
bit
0
~~END~~




-- Check for NULL conditions
DECLARE @nullGeom geometry;
DECLARE @validGeom geometry = geometry::STGeomFromText('POINT(0 0)', 0);
-- Tests
SELECT 'STDimension' AS Test, @nullGeom.STDimension() AS Result;
SELECT 'STDisjoint' AS Test, @nullGeom.STDisjoint(@validGeom) AS Result;
SELECT 'STIntersects' AS Test, @nullGeom.STIntersects(@validGeom) AS Result;
SELECT 'STIsClosed' AS Test, @nullGeom.STIsClosed() AS Result;
SELECT 'STIsEmpty' AS Test, @nullGeom.STIsEmpty() AS Result;
SELECT 'STIsValid' AS Test, @nullGeom.STIsValid() AS Result;
-- Test with null as second argument for binary operations
SELECT 'STDisjoint (null second)' AS Test, @validGeom.STDisjoint(@nullGeom) AS Result;
SELECT 'STIntersects (null second)' AS Test, @validGeom.STIntersects(@nullGeom) AS Result;
go
~~START~~
varchar#!#int
STDimension#!#<NULL>
~~END~~

~~START~~
varchar#!#bit
STDisjoint#!#<NULL>
~~END~~

~~START~~
varchar#!#bit
STIntersects#!#<NULL>
~~END~~

~~START~~
varchar#!#bit
STIsClosed#!#<NULL>
~~END~~

~~START~~
varchar#!#bit
STIsEmpty#!#<NULL>
~~END~~

~~START~~
varchar#!#bit
STIsValid#!#<NULL>
~~END~~

~~START~~
varchar#!#bit
STDisjoint (null second)#!#<NULL>
~~END~~

~~START~~
varchar#!#bit
STIntersects (null second)#!#<NULL>
~~END~~




DECLARE @nullGeom geography;
DECLARE @validGeom geography = geography::STGeomFromText('POINT(0 0)', 4326);
-- Tests
SELECT 'STDimension' AS Test, @nullGeom.STDimension() AS Result;
SELECT 'STDisjoint' AS Test, @nullGeom.STDisjoint(@validGeom) AS Result;
SELECT 'STIntersects' AS Test, @nullGeom.STIntersects(@validGeom) AS Result;
SELECT 'STIsClosed' AS Test, @nullGeom.STIsClosed() AS Result;
SELECT 'STIsEmpty' AS Test, @nullGeom.STIsEmpty() AS Result;
SELECT 'STIsValid' AS Test, @nullGeom.STIsValid() AS Result;
-- Test with null as second argument for binary operations
SELECT 'STDisjoint (null second)' AS Test, @validGeom.STDisjoint(@nullGeom) AS Result;
SELECT 'STIntersects (null second)' AS Test, @validGeom.STIntersects(@nullGeom) AS Result;
go
~~START~~
varchar#!#int
STDimension#!#<NULL>
~~END~~

~~START~~
varchar#!#bit
STDisjoint#!#<NULL>
~~END~~

~~START~~
varchar#!#bit
STIntersects#!#<NULL>
~~END~~

~~START~~
varchar#!#bit
STIsClosed#!#<NULL>
~~END~~

~~START~~
varchar#!#bit
STIsEmpty#!#<NULL>
~~END~~

~~START~~
varchar#!#bit
STIsValid#!#<NULL>
~~END~~

~~START~~
varchar#!#bit
STDisjoint (null second)#!#<NULL>
~~END~~

~~START~~
varchar#!#bit
STIntersects (null second)#!#<NULL>
~~END~~


-- Nested Functions
SELECT ID, PointColumn1.STDisjoint(PointColumn2).STIsEmpty() AS disjoint FROM  TestGeospatialMethods_YourTable2Temp ORDER BY PointColumn1.STX;
go
~~ERROR (Code: 206)~~

~~ERROR (Message: The function stisempty is found but cannot be used. Possibly due to datatype mismatch and implicit casting is not allowed.)~~


SELECT ID, PointColumn1.STDisjoint(PointColumn2).STIsValid() AS disjoint FROM  TestGeospatialMethods_YourTable2Temp ORDER BY PointColumn1.STX;
go
~~ERROR (Code: 206)~~

~~ERROR (Message: The function stisvalid is found but cannot be used. Possibly due to datatype mismatch and implicit casting is not allowed.)~~


SELECT ID, PointColumn1.STDisjoint(PointColumn2).STIsClosed() AS disjoint FROM  TestGeospatialMethods_YourTable2Temp ORDER BY PointColumn1.STX;
go
~~ERROR (Code: 206)~~

~~ERROR (Message: The function stisclosed is found but cannot be used. Possibly due to datatype mismatch and implicit casting is not allowed.)~~


SELECT ID, PointColumn1.STIntersects(PointColumn2).STIsEmpty() AS Intersects FROM  TestGeospatialMethods_YourTable2Temp ORDER BY PointColumn1.STX;
go
~~ERROR (Code: 206)~~

~~ERROR (Message: The function stisempty is found but cannot be used. Possibly due to datatype mismatch and implicit casting is not allowed.)~~


SELECT ID, PointColumn1.STIntersects(PointColumn2).STIsValid() AS Intersects FROM  TestGeospatialMethods_YourTable2Temp ORDER BY PointColumn1.STX;
go
~~ERROR (Code: 206)~~

~~ERROR (Message: The function stisvalid is found but cannot be used. Possibly due to datatype mismatch and implicit casting is not allowed.)~~


SELECT ID, PointColumn1.STIntersects(PointColumn2).STIsClosed() AS Intersects FROM  TestGeospatialMethods_YourTable2Temp ORDER BY PointColumn1.STX;
go
~~ERROR (Code: 206)~~

~~ERROR (Message: The function stisclosed is found but cannot be used. Possibly due to datatype mismatch and implicit casting is not allowed.)~~


-- EMPTY Cases
DECLARE @g geometry;  
SET @g = geometry::STGeomFromText('POINT EMPTY', 0);  
SELECT @g.STIsValid();
go
~~START~~
bit
1
~~END~~


DECLARE @g geometry;  
SET @g = geometry::STGeomFromText('POINT EMPTY', 0);  
SELECT @g.STIsClosed();
go
~~START~~
bit
0
~~END~~


DECLARE @g geometry;  
SET @g = geometry::STGeomFromText('POINT EMPTY', 0);  
SELECT @g.STDimension();
go
~~START~~
int
-1
~~END~~


DECLARE @g geometry;  
SET @g = geometry::STGeomFromText('POINT EMPTY', 0);  
SELECT @g.STIsEmpty();
go
~~START~~
bit
1
~~END~~


DECLARE @g1 geometry, @g2 geometry;
SET @g1 = geometry::STGeomFromText('POINT EMPTY', 0);  
SET @g2 = geometry::STGeomFromText('POINT EMPTY', 0);  
SELECT @g1.STIntersects(@g2) AS Intersecting;
go
~~START~~
bit
0
~~END~~


DECLARE @g1 geometry, @g2 geometry;
SET @g1 = geometry::STGeomFromText('POINT EMPTY', 0);  
SET @g2 = geometry::STGeomFromText('POINT EMPTY', 0);  
SELECT @g1.STDisjoint(@g2) AS Disjoint;
go
~~START~~
bit
1
~~END~~


DECLARE @g geography;  
SET @g = geography::STGeomFromText('POINT EMPTY', 4326);  
SELECT @g.STIsValid();
go
~~START~~
bit
1
~~END~~


DECLARE @g geography;  
SET @g = geography::STGeomFromText('POINT EMPTY', 4326);  
SELECT @g.STIsClosed();
go
~~START~~
bit
0
~~END~~


DECLARE @g geography;  
SET @g = geography::STGeomFromText('POINT EMPTY', 4326);  
SELECT @g.STDimension();
go
~~START~~
int
-1
~~END~~


DECLARE @g geography;  
SET @g = geography::STGeomFromText('POINT EMPTY', 4326);  
SELECT @g.STIsEmpty();
go
~~START~~
bit
1
~~END~~


DECLARE @g1 geography, @g2 geography;
SET @g1 = geography::STGeomFromText('POINT EMPTY', 4326);  
SET @g2 = geography::STGeomFromText('POINT EMPTY', 4326);  
SELECT @g1.STIntersects(@g2) AS Intersecting;
go
~~START~~
bit
0
~~END~~


DECLARE @g1 geography, @g2 geography;
SET @g1 = geography::STGeomFromText('POINT EMPTY', 4326);  
SET @g2 = geography::STGeomFromText('POINT EMPTY', 4326);  
SELECT @g1.STDisjoint(@g2) AS Disjoint;
go
~~START~~
bit
1
~~END~~


DECLARE @point geography;
SET @point = geography::STPointFromText('POINT EMPTY', 4326);
SELECT STIsClosed(@point);
go
~~START~~
bit
0
~~END~~



-- Tests for CAST from CHAR/VARCHAR with EMPTY instances
Select CAST(CAST('POINT EMPTY' as varchar(100)) AS geography).STAsText();
go
~~START~~
nvarchar
POINT EMPTY
~~END~~


Select CAST(CAST('POINT EMPTY' as char(100)) AS geography).STAsText();
go
~~START~~
nvarchar
POINT EMPTY
~~END~~




--TestCases for the functions STLength 
------- STLength tests------------------
DECLARE @line geometry;
SET @line = geometry::STGeomFromText('LINESTRING(0 0, 3 4)', 0);
SELECT @line.STLength() AS Length;
go
~~START~~
float
5.0
~~END~~


DECLARE @line geometry;
SET @line = geometry::STGeomFromText('LINESTRING(0 0 7, 3 4 7 6)', 0);
SELECT @line.STLength() AS Length;
go
~~START~~
float
5.0
~~END~~


DECLARE @line geography;
SET @line = geography::STGeomFromText('LINESTRING(-122.34900 47.65100, -122.34950 47.65150)', 4326);
SELECT CAST(ROUND(@line.STLength(), 2) AS FLOAT) AS Length;
go
~~START~~
float
67.09
~~END~~


DECLARE @point geometry;
SET @point = geometry::STPointFromText('POINT(1 1)', 0);
SELECT @point.STLength();
go
~~START~~
float
0.0
~~END~~


DECLARE @polygon geometry;
SET @polygon = geometry::STGeomFromText('POLYGON((0 0, 1 0, 1 1, 0 0))', 0);
SELECT CAST(ROUND(@polygon.STLength(), 2) AS FLOAT);
go
~~START~~
float
3.41
~~END~~


DECLARE @polygon geometry;
SET @polygon = geometry::STGeomFromText('POLYGON((0 0, 0 2, 2 2, 2 0, 0 0))', 0);
SELECT @polygon.STLength();
go
~~START~~
float
8.0
~~END~~


DECLARE @g geometry;
SET @g = geometry::STGeomFromText('LINESTRING EMPTY', 0);
SELECT @g.STLength();
go
~~START~~
float
0.0
~~END~~


DECLARE @g geography;
SET @g = geography::STGeomFromText('LINESTRING EMPTY', 4326);
SELECT @g.STLength();
go
~~START~~
float
0.0
~~END~~


DECLARE @g geometry;
SET @g = geometry::STGeomFromText('POINT EMPTY', 0);
SELECT @g.STLength();
go
~~START~~
float
0.0
~~END~~


DECLARE @polygon geometry;
SET @polygon = geometry::STGeomFromText('POLYGON EMPTY', 0);
SELECT @polygon.STLength();
go
~~START~~
float
0.0
~~END~~


DECLARE @nullGeom geometry;
SELECT @nullGeom.STLength();
go
~~START~~
float
<NULL>
~~END~~


DECLARE @nullGeog geography;
SELECT @nullGeog.STLength();
go
~~START~~
float
<NULL>
~~END~~


DECLARE @line geometry;
SET @line = geometry::STGeomFromText('LINESTRING(0 0, 3 4)', 4326);
SELECT @line.STLength();
go
~~START~~
float
5.0
~~END~~


DECLARE @line geometry;
SET @line = geometry::STGeomFromText('LINESTRING(0 0, 3 4)', 999999);
SELECT @line.STLength();
go
~~START~~
float
5.0
~~END~~


SELECT
    ID,
    GeomColumn.STLength() AS Len,
    GeomColumn.STLength()
        - LAG(GeomColumn.STLength()) OVER (ORDER BY ID) AS Diff
FROM TestGeospatialMethods_GeomTableTemp;
go
~~START~~
int#!#float#!#float
1#!#3.0#!#<NULL>
2#!#5.0#!#2.0
3#!#10.0#!#5.0
4#!#5.656854249492381#!#-4.343145750507619
5#!#40.0#!#34.34314575050762
6#!#5.0#!#-35.0
7#!#3.0#!#-2.0
8#!#3.0#!#0.0
9#!#2.8284271247461903#!#-0.1715728752538097
10#!#3.0#!#0.1715728752538097
11#!#40.0#!#37.0
12#!#20.0#!#-20.0
13#!#120.0#!#100.0
14#!#12.0#!#-108.0
15#!#5.0#!#-7.0
16#!#5.0#!#0.0
17#!#16.0#!#11.0
~~END~~


SELECT
    ID,
    PointColumn.STLength()
FROM TestGeospatialMethods_DB.dbo.TestGeospatialMethods_YourTable1Temp;
go
~~START~~
int#!#float
1#!#0.0
2#!#0.0
3#!#0.0
4#!#0.0
~~END~~


SELECT
    ROUND(GeomColumn.STLength(), 0) AS LengthGroup,
    COUNT(*)
FROM TestGeospatialMethods_GeomTableTemp
GROUP BY ROUND(GeomColumn.STLength(), 0)
ORDER BY LengthGroup;
go
~~START~~
float#!#int
3.0#!#5
5.0#!#4
6.0#!#1
10.0#!#1
12.0#!#1
16.0#!#1
20.0#!#1
40.0#!#2
120.0#!#1
~~END~~

 
DECLARE @threshold float = 5;
SELECT ID,
CASE
    WHEN GeomColumn.STLength() > @threshold THEN 'Long'
    ELSE 'Short'
END AS LengthCategory
FROM TestGeospatialMethods_GeomTableTemp
ORDER BY ID;
go
~~START~~
int#!#varchar
1#!#Short
2#!#Short
3#!#Long
4#!#Long
5#!#Long
6#!#Short
7#!#Short
8#!#Short
9#!#Short
10#!#Short
11#!#Long
12#!#Long
13#!#Long
14#!#Long
15#!#Short
16#!#Short
17#!#Long
~~END~~


DECLARE @scale float = 2.0;
SELECT
    ID,
    GeomColumn.STLength() * @scale AS ScaledLength
FROM TestGeospatialMethods_GeomTableTemp
ORDER BY ID;
go
~~START~~
int#!#float
1#!#6.0
2#!#10.0
3#!#20.0
4#!#11.313708498984761
5#!#80.0
6#!#10.0
7#!#6.0
8#!#6.0
9#!#5.656854249492381
10#!#6.0
11#!#80.0
12#!#40.0
13#!#240.0
14#!#24.0
15#!#10.0
16#!#10.0
17#!#32.0
~~END~~


SELECT 
    ID,
    GeomColumn.STLength() AS Perimeter
FROM TestGeospatialMethods_GeomTableTemp
WHERE ID > 10
ORDER BY ID;
go
~~START~~
int#!#float
11#!#40.0
12#!#20.0
13#!#120.0
14#!#12.0
15#!#5.0
16#!#5.0
17#!#16.0
~~END~~


SELECT * FROM TestGeospatialMethods_lengthTemp;
go
~~START~~
float
3.0
5.0
10.0
5.66
40.0
5.0
3.0
3.0
2.83
3.0
40.0
20.0
120.0
12.0
5.0
5.0
16.0
~~END~~


SELECT ID, GeomColumn.STLength() AS Length
FROM TestGeospatialMethods_GeomTableTemp
WHERE GeomColumn.STLength() > 5
ORDER BY ID;
go
~~START~~
int#!#float
3#!#10.0
4#!#5.656854249492381
5#!#40.0
11#!#40.0
12#!#20.0
13#!#120.0
14#!#12.0
17#!#16.0
~~END~~


SELECT 
    CAST(GeomColumn.STLength() AS INT) AS LengthGroup,
    COUNT(*) AS Cnt
FROM TestGeospatialMethods_GeomTableTemp
GROUP BY CAST(GeomColumn.STLength() AS INT)
HAVING COUNT(*) > 1;
go
~~START~~
int#!#int
40#!#2
3#!#4
5#!#5
~~END~~


SELECT ID, GeomColumn.STLength() AS Length
FROM TestGeospatialMethods_GeomTableTemp
ORDER BY GeomColumn.STLength() DESC;
go
~~START~~
int#!#float
13#!#120.0
5#!#40.0
11#!#40.0
12#!#20.0
17#!#16.0
14#!#12.0
3#!#10.0
4#!#5.656854249492381
2#!#5.0
6#!#5.0
15#!#5.0
16#!#5.0
1#!#3.0
7#!#3.0
8#!#3.0
10#!#3.0
9#!#2.8284271247461903
~~END~~


SELECT * FROM (
    SELECT ID, GeomColumn.STLength() AS Len
    FROM TestGeospatialMethods_GeomTableTemp
) AS sub
WHERE Len > 3;
go
~~START~~
int#!#float
2#!#5.0
3#!#10.0
4#!#5.656854249492381
5#!#40.0
6#!#5.0
11#!#40.0
12#!#20.0
13#!#120.0
14#!#12.0
15#!#5.0
16#!#5.0
17#!#16.0
~~END~~


WITH LengthCTE AS (
    SELECT ID, GeomColumn.STLength() AS Length
    FROM TestGeospatialMethods_GeomTableTemp
)
SELECT * FROM LengthCTE WHERE Length > 5;
go
~~START~~
int#!#float
3#!#10.0
4#!#5.656854249492381
5#!#40.0
11#!#40.0
12#!#20.0
13#!#120.0
14#!#12.0
17#!#16.0
~~END~~


DECLARE @line geometry;
SET @line = geometry::STGeomFromText('LINESTRING(-5 -5, -2 -1)', 0);
SELECT @line.STLength() AS NegativeCoordLength;
go
~~START~~
float
5.0
~~END~~


DECLARE @large geometry;
SET @large = geometry::STGeomFromText('LINESTRING(0 0, 1000000 1000000)', 0);
SELECT CAST(ROUND(@large.STLength(), 2) AS FLOAT) AS LargeLength;
go
~~START~~
float
1414213.56
~~END~~


DECLARE @small geometry;
SET @small = geometry::STGeomFromText('LINESTRING(0 0, 0.0001 0.0001)', 0);
SELECT CAST(ROUND(@small.STLength(), 2) AS FLOAT) AS SmallLength;
go
~~START~~
float
0.0
~~END~~


SELECT g1.ID, g1.GeomColumn.STLength() AS Len1, g2.GeomColumn.STLength() AS Len2
FROM TestGeospatialMethods_GeomTableTemp g1
JOIN TestGeospatialMethods_GeomTableTemp g2 ON g1.ID = g2.ID - 1
WHERE g1.ID < 5;
go
~~START~~
int#!#float#!#float
1#!#3.0#!#5.0
2#!#5.0#!#10.0
3#!#10.0#!#5.656854249492381
4#!#5.656854249492381#!#40.0
~~END~~


DECLARE @tempTable TABLE (ID INT, Geom geometry);
INSERT INTO @tempTable VALUES (1, geometry::STGeomFromText('LINESTRING(0 0, 5 0)', 0));
SELECT ID, Geom.STLength() FROM @tempTable;
go
~~ROW COUNT: 1~~

~~START~~
int#!#float
1#!#5.0
~~END~~


DECLARE @line3D geometry;
SET @line3D = geometry::STGeomFromText('LINESTRING(0 0 0, 3 4 5)', 0);
SELECT @line3D.STLength() AS Length3D;
go
~~START~~
float
5.0
~~END~~


DECLARE @lineZ geometry;
SET @lineZ = geometry::STGeomFromText('LINESTRING(0 0 0, 10 0 0)', 0);
SELECT @lineZ.STLength() AS LengthZHorizontal;
go
~~START~~
float
10.0
~~END~~


DECLARE @lineZVertical geometry;
SET @lineZVertical = geometry::STGeomFromText('LINESTRING(0 0 0, 0 0 10)', 0);
SELECT @lineZVertical.STLength() AS LengthZVertical;
go
~~START~~
float
0.0
~~END~~


DECLARE @line2D geometry;
DECLARE @line3DCompare geometry;
SET @line2D = geometry::STGeomFromText('LINESTRING(0 0, 3 4)', 0);
SET @line3DCompare = geometry::STGeomFromText('LINESTRING(0 0 0, 3 4 100)', 0);
SELECT 
    @line2D.STLength() AS Length2D,
    @line3DCompare.STLength() AS Length3D;
go
~~START~~
float#!#float
5.0#!#5.0
~~END~~


DECLARE @lineZM geometry;
SET @lineZM = geometry::STGeomFromText('LINESTRING(0 0 0 0, 3 4 5 10)', 0);
SELECT @lineZM.STLength() AS LengthZM;
go
~~START~~
float
5.0
~~END~~


DECLARE @noM geometry;
DECLARE @withM geometry;
SET @noM = geometry::STGeomFromText('LINESTRING(0 0, 5 0)', 0);
SET @withM = geometry::STGeomFromText('LINESTRING(0 0 0 0, 5 0 0 100)', 0);
SELECT 
    @noM.STLength() AS LengthNoM,
    @withM.STLength() AS LengthWithM;
go
~~START~~
float#!#float
5.0#!#5.0
~~END~~


DECLARE @geogPoly geography;
SET @geogPoly = geography::STGeomFromText('POLYGON((-122.358 47.653, -122.348 47.653, -122.348 47.649, -122.358 47.649, -122.358 47.653))', 4326);
SELECT ROUND(@geogPoly.STLength(), 2) AS GeographyPolygonPerimeter;
go
~~START~~
float
2392.01
~~END~~


DECLARE @multiPointLine geometry;
SET @multiPointLine = geometry::STGeomFromText('LINESTRING(0 0, 1 0, 2 0, 3 0, 4 0, 5 0)', 0);
SELECT @multiPointLine.STLength() AS MultiPointLineLength;
go
~~START~~
float
5.0
~~END~~


SELECT * FROM TestGeospatialMethods_lengthGeogTemp;
go
~~START~~
float
67.09
0.0
~~END~~

