DECLARE @point1 geometry, @point2 geometry;
SET @point1 = geometry::STPointFromText('POINT(-122.354657658684900 47.658678768678100)', 4326);
SET @point2 = geometry::STPointFromText('POINT(-122.354657658684900 47.658678768678100)', 4326);
SELECT @point1.STEquals(@point2) AS Equal;
go
~~START~~
bit
1
~~END~~


DECLARE @point1 geography, @point2 geography;
SET @point1 = geography::STGeomFromText('POINT(-122.34900 47.65100)', 4326);
SET @point2 = geography::STGeomFromText('POINT(-122.34900 47.65100)', 4326);
SELECT @point1.STEquals(@point2) AS Equal;
go
~~START~~
bit
1
~~END~~


DECLARE @point1 geography, @point2 geography;
SET @point1 = geography::STGeomFromText('POINT(-122.34900 47.65100)', 4326);
SET @point2 = geography::STGeomFromText('POINT(-122.34900 47.65100)', 4326);
SELECT @point1.STContains(@point2) AS isIN;
go
~~START~~
bit
1
~~END~~


DECLARE @point1 geometry, @point2 geometry;
SET @point1 = geometry::STPointFromText('POINT(-122.354657658684900 47.658678768678100)', 4326);
SET @point2 = geometry::STPointFromText('POINT(-122.354657658684900 47.658678768678100)', 0);
SELECT @point1.STEquals(@point2) AS Equal;
go
~~START~~
bit
<NULL>
~~END~~


DECLARE @point1 geography, @point2 geography;
SET @point1 = geography::STGeomFromText('POINT(-122.34900 47.65100)', 4326);
SET @point2 = geography::STGeomFromText('POINT(-122.34900 47.65100)', 4326);
SELECT @point1 . STEquals(@point2) AS Equal;
go
~~START~~
bit
1
~~END~~


DECLARE @point1 geography, @point2 geography;
SET @point1 = geography::STGeomFromText('POINT(-122.34900 47.65100)', 4326);
SET @point2 = geography::STGeomFromText('POINT(-122.34900 47.65100)', 4326);
SELECT @point1 . STContains(@point2) AS isIN;
go
~~START~~
bit
1
~~END~~


DECLARE @point1 geography;
SET @point1 = geography::STGeomFromText('POINT(-122.34900 47.65100)', 4326);
SELECT @point1.STSrid;
Go
~~START~~
int
4326
~~END~~


-- Verifying with precision
DECLARE @point1 geometry, @point2 geometry;
SET @point1 = geometry::STPointFromText('POINT(-122.354657658684900 47.658678768678100)', 4326);
SET @point2 = geometry::STPointFromText('POINT(-122.354657658684900 47.658678768678100)', 4326);
SELECT STEquals(@point1, @point2);
go
~~START~~
bit
1
~~END~~


DECLARE @point1 geography, @point2 geography;
SET @point1 = geography::STGeomFromText('POINT(-122.354657658684900 47.658678768678100)', 4326);
SET @point2 = geography::STGeomFromText('POINT(-122.354657658684900 47.658678768678100)', 4326);
SELECT @point1.STEquals(@point2) AS Equal;
go
~~START~~
bit
1
~~END~~


DECLARE @point1 geometry, @point2 geometry;
SET @point1 = geometry::STPointFromText('POINT(-122.354657658684900 47.658678768678100)', 4326);
SET @point2 = geometry::STPointFromText('POINT(-122.354657658684000 47.658678768678100)', 4326);
SELECT STEquals(@point1, @point2);
go
~~START~~
bit
0
~~END~~


DECLARE @point1 geometry, @point2 geometry;
SET @point1 = geometry::STPointFromText('POINT(-122.354657658684900 47.658678768678100)', 4326);
SET @point2 = geometry::STPointFromText('POINT(-122.354657658684900 47.658678768678100)', 4326);
SELECT @point1 . STEquals ( @point2 );
go
~~START~~
bit
1
~~END~~


SELECT PointColumn1.STEquals(PointColumn2) AS Equals FROM TestSpatialFunction_YourTableTemp2 ORDER BY PointColumn1.STX;
go
~~START~~
bit
1
~~END~~


DECLARE @point1 geometry = geometry::Point(1.0, 2.0, 4326);
SELECT PointColumn1.STEquals(@point1) AS Equals FROM TestSpatialFunction_YourTableTemp2 ORDER BY PointColumn1.STX;
go
~~START~~
bit
0
~~END~~


DECLARE @point1 geometry = geometry::Point(1.0, 2.0, 4326);
SELECT @point1.STEquals(PointColumn2) AS Equals FROM TestSpatialFunction_YourTableTemp2 ORDER BY PointColumn1.STX;
go
~~START~~
bit
0
~~END~~


DECLARE @referencePoint geometry = geometry::Point(0.0, 0.0, 4326);
DECLARE @isEqual BIT = 0;
SELECT PointColumn.STSrid FROM TestSpatialFunction_YourTableTemp WHERE PointColumn.STEquals(@referencePoint) = @isEqual ORDER BY PointColumn.STSrid;
go
~~START~~
int
4326
4326
~~END~~


SELECT ID, PointColumn1.STEquals(PointColumn2) AS Equal_points FROM TestSpatialFunction_YourTableTemp2 ORDER BY PointColumn1.STX;
go
~~START~~
int#!#bit
1#!#1
~~END~~


SELECT PointA.STAsText(),PointB.STAsText() FROM TestSpatialFunction_TableATemp JOIN TestSpatialFunction_TableBTemp ON PointA.STEquals(TestSpatialFunction_TableBTemp.PointB) != 1 ORDER BY PointA.STX;
go
~~START~~
text#!#text
POINT(1 2)#!#POINT(3 4)
~~END~~


DECLARE @referencePoint geometry = geometry::Point(0.0, 0.0, 4326);
SELECT PointA.STAsText(),PointB.STAsText() FROM TestSpatialFunction_TableATemp JOIN TestSpatialFunction_TableBTemp ON @referencePoint.STEquals(TestSpatialFunction_TableBTemp.PointB) = 1 ORDER BY PointA.STX;
go
~~START~~
text#!#text
~~END~~


DECLARE @referencePoint geometry = geometry::Point(0.0, 0.0, 4326);
SELECT PointA.STAsText(),PointB.STAsText() FROM TestSpatialFunction_TableATemp JOIN TestSpatialFunction_TableBTemp ON PointA.STEquals(@referencePoint) != 1 ORDER BY PointA.STX;
go
~~START~~
text#!#text
POINT(1 2)#!#POINT(3 4)
~~END~~


DECLARE @referencePoint geometry = geometry::Point(0.0, 0.0, 4326);
SELECT PointColumn.STSrid FROM TestSpatialFunction_YourTableTemp ORDER BY PointColumn.STSrid;
go
~~START~~
int
0
4326
4326
~~END~~


DECLARE @referencePoint geometry = geometry::Point(0.0, 0.0, 4326);
SELECT PointColumn.STSrid FROM TestSpatialFunction_YourTableTemp ORDER BY PointColumn.STSrid;
go
~~START~~
int
0
4326
4326
~~END~~


SELECT PointColumn1.STAsText() FROM TestSpatialFunction_YourTableTemp2 ORDER BY PointColumn1.STX;
go
~~START~~
text
POINT(3 4)
~~END~~


DECLARE @isEqual BIT = 1;
SELECT ID, PointColumn1.STEquals(PointColumn2) AS isEqual,
CASE WHEN PointColumn1.STEquals(PointColumn2) = @isEqual THEN 'yes' ELSE 'no'
END AS isEqual
FROM TestSpatialFunction_YourTableTemp2 ORDER BY PointColumn1.STX;
go
~~START~~
int#!#bit#!#varchar
1#!#1#!#yes
~~END~~


DECLARE @referencePoint geometry = geometry::Point(0.0, 0.0, 4326);
WITH EqualCTE AS ( SELECT ID, PointColumn.STEquals(@referencePoint) AS Equality FROM TestSpatialFunction_YourTableTemp)
SELECT * FROM EqualCTE WHERE Equality = 1 ORDER BY Equality;
go
~~START~~
int#!#bit
~~END~~


DECLARE @referencePoint geometry = geometry::Point(0.0, 0.0, 4326);
WITH EqualCTE AS ( SELECT ID, PointColumn.STEquals(@referencePoint) AS Equal FROM TestSpatialFunction_YourTableTemp ORDER BY PointColumn.STX)
SELECT * FROM EqualCTE WHERE Equal = 1.0 ORDER BY Equal;
GO
~~START~~
int#!#bit
~~END~~


DECLARE @referencePoint geometry = geometry::Point(0.0, 0.0, 4326);
WITH EqualCTE AS ( SELECT ID, @referencePoint.STEquals(PointColumn) AS Equal FROM TestSpatialFunction_YourTableTemp ORDER BY PointColumn.STX)
SELECT * FROM EqualCTE WHERE Equal != 1.0 ORDER BY Equal;
GO
~~START~~
int#!#bit
1#!#0
2#!#0
~~END~~


DECLARE @referencePoint geometry = geometry::Point(0.0, 0.0, 4326);
DECLARE @isEqual BIT = 1;
SELECT ID, PointColumn.STEquals(@referencePoint) AS EqualityReferencePoint,
CASE WHEN PointColumn.STEquals(@referencePoint) = @isEqual THEN 'Close'
ELSE 'Far'
END AS Proximity
FROM TestSpatialFunction_YourTableTemp ORDER BY PointColumn.STX;
go
~~START~~
int#!#bit#!#varchar
1#!#0#!#Far
3#!#<NULL>#!#Far
2#!#0#!#Far
~~END~~


DECLARE @referencePoint geometry = geometry::Point(0.0, 0.0, 4326);
SELECT ID, @referencePoint.STEquals(PointColumn) AS EqualityReferencePoint,
CASE WHEN @referencePoint.STEquals(PointColumn) = @referencePoint.STY THEN 'Close'
ELSE 'Far'
END AS Proximity
FROM TestSpatialFunction_YourTableTemp ORDER BY PointColumn.STX;
go
~~START~~
int#!#bit#!#varchar
1#!#0#!#Close
3#!#<NULL>#!#Far
2#!#0#!#Close
~~END~~


DECLARE @Ranges TABLE (MinDistance float, MaxDistance float);
INSERT INTO @Ranges VALUES (0, 5), (5, 10), (10, 15);
SELECT * FROM ( SELECT ID,
CASE WHEN PointColumn1.STEquals(PointColumn2) BETWEEN 0 AND 1 THEN 'yes'
ELSE 'no'
END AS Range
FROM TestSpatialFunction_YourTableTemp2 ORDER BY PointColumn1.STX
) AS Source
PIVOT ( COUNT(ID) FOR Range IN ([0-5], [5.1-10], [10.1-15], [15.1+])) AS PivotTable;
go
~~ROW COUNT: 3~~

~~START~~
int#!#int#!#int#!#int
0#!#0#!#0#!#0
~~END~~


DECLARE @referencePoint geometry = geometry::Point(0.0, 0.0, 4326);
SELECT ID, PointColumn.STEquals(@referencePoint) AS Equality FROM TestSpatialFunction_DB.dbo.TestSpatialFunction_YourTable1Temp ORDER BY PointColumn.STX;
go
~~START~~
int#!#bit
1#!#0
3#!#<NULL>
2#!#0
~~END~~


DECLARE @referencePoint geometry = geometry::Point(0.0, 0.0, 4326);
SELECT ID, PointColumn.STEquals(@referencePoint) AS Equal,
JSON_QUERY('{"Equal":' + CAST(PointColumn.STEquals(@referencePoint) AS NVARCHAR(MAX)) + '}') AS Json
FROM TestSpatialFunction_YourTableTemp ORDER BY PointColumn.STX;
go
~~START~~
int#!#bit#!#nvarchar
1#!#0#!#{"Equal": 0}
3#!#<NULL>#!#<NULL>
2#!#0#!#{"Equal": 0}
~~END~~


DECLARE @referencePoint geometry = geometry::Point(0.0, 0.0, 4326);
SELECT ID, @referencePoint.STEquals(PointColumn) AS Equal,
JSON_QUERY('{"Equal":' + CAST(@referencePoint.STEquals(PointColumn) AS NVARCHAR(MAX)) + '}') Json
FROM TestSpatialFunction_YourTableTemp ORDER BY PointColumn.STX;
go
~~START~~
int#!#bit#!#nvarchar
1#!#0#!#{"Equal": 0}
3#!#<NULL>#!#<NULL>
2#!#0#!#{"Equal": 0}
~~END~~


SELECT [PointColumn1].STEquals([PointColumn2]) AS Equality FROM [TestSpatialFunction_YourTableTemp2] ORDER BY PointColumn1.STX;
go
~~START~~
bit
1
~~END~~


DECLARE @referencePoint geometry = geometry::Point(0.0, 0.0, 4326);
DECLARE @isEqual BIT = 1;
DECLARE @sql NVARCHAR(MAX);
DECLARE @params NVARCHAR(MAX);
SET @sql = N'
SELECT ID, PointColumn.STEquals(@referencePoint) AS EqualityReferencePoint,
CASE WHEN PointColumn.STEquals(@referencePoint) = @isEqual THEN ''Close''
ELSE ''Far''
END AS Proximity
FROM TestSpatialFunction_YourTableTemp
WHERE PointColumn.STEquals(@referencePoint) = @isEqual;';
SET @params = N'@referencePoint geometry, @isEqual float';
EXEC sp_executesql @sql, @params, @referencePoint, @isEqual;
go
~~START~~
int#!#bit#!#varchar
~~END~~


DECLARE @referencePoint geometry = geometry::Point(0.0, 0.0, 4326);
SELECT PointColumn.STEquals(@referencePoint) AS Equality FROM TestSpatialFunction_YourTableTemp ORDER BY PointColumn.STX;
SELECT TestSpatialFunction_YourTableTemp.PointColumn.STEquals(@referencePoint) AS Equality FROM TestSpatialFunction_YourTableTemp ORDER BY PointColumn.STX;
SELECT dbo.TestSpatialFunction_YourTableTemp.PointColumn.STEquals(@referencePoint) AS Equality FROM TestSpatialFunction_YourTableTemp ORDER BY PointColumn.STX;
go
~~ERROR (Code: 33557097)~~

~~ERROR (Message: Remote procedure/function reference with 4-part object name is not currently supported in Babelfish)~~


DECLARE @pnt geometry;
SET @pnt = geometry::STGeomFromText('POINT(-122.34900 47.65100)', 4326);
select geometry::Point(@pnt.STY, @pnt.STX, 4326).STEquals(@pnt)
go
~~START~~
bit
0
~~END~~


DECLARE @referencePoint geometry = geometry::Point(0.0, 0.0, 4326);
DECLARE @equal BIT = 1;
SELECT ROUND(PointColumn.STEquals(@referencePoint) / @equal, 0) * @equal AS Equalitygroup,
COUNT(*) AS PointCount
FROM TestSpatialFunction_YourTableTemp
GROUP BY ROUND(PointColumn.STEquals(@referencePoint) / @equal, 0) * @equal
ORDER BY Equalitygroup;
GO
~~START~~
numeric#!#int
<NULL>#!#1
0E-8#!#2
~~END~~


DECLARE @referencePoint geometry = geometry::Point(1.0, 0.0, 4326);
SELECT ROUND(PointColumn.STEquals(@referencePoint) / @referencePoint.STX, 0) * @referencePoint.STX AS Equalitygroup,
COUNT(*) AS PointCount
FROM TestSpatialFunction_YourTableTemp
GROUP BY ROUND(PointColumn.STEquals(@referencePoint) / @referencePoint.STX, 0) * @referencePoint.STX
ORDER BY Equalitygroup;
GO
~~START~~
float#!#int
<NULL>#!#1
0.0#!#2
~~END~~


DECLARE @referencePoint geometry = geometry::Point(0.0, 0.0, 4326);
SELECT ID, PointColumn1.STEquals(PointColumn2) AS equal,
cast(PointColumn1.STEquals(@referencePoint) as int) - LAG(PointColumn1.STEquals(PointColumn2)) OVER (ORDER BY ID) AS Equalitygroup 
FROM TestSpatialFunction_YourTableTemp2 ORDER BY PointColumn1.STX;
GO
~~START~~
int#!#bit#!#int
1#!#1#!#<NULL>
~~END~~


DECLARE @referencePoint geometry = geometry::Point(0.0, 0.0, 4326);
SELECT ID, PointColumn.STEquals(@referencePoint) AS equal,
cast(@referencePoint.STContains(PointColumn) as int) - LAG(@referencePoint.STX) OVER (ORDER BY ID) AS Equalitygroup
FROM TestSpatialFunction_YourTableTemp ORDER BY PointColumn.STX;
GO
~~START~~
int#!#bit#!#float
1#!#0#!#<NULL>
3#!#<NULL>#!#<NULL>
2#!#0#!#0.0
~~END~~


-- Verifying with precision
DECLARE @point1 geometry, @point2 geometry;
SET @point1 = geometry::STPointFromText('POINT(-122.354657658684900 47.658678768678100)', 4326);
SET @point2 = geometry::STPointFromText('POINT(-122.354657658684900 47.658678768678100)', 4326);
SELECT STContains(@point1, @point2);
go
~~START~~
bit
1
~~END~~


DECLARE @point1 geography, @point2 geography;
SET @point1 = geography::STGeomFromText('POINT(-122.354657658684900 47.658678768678100)', 4326);
SET @point2 = geography::STGeomFromText('POINT(-122.354657658684900 47.658678768678100)', 4326);
SELECT @point1.STContains(@point2) AS isIN;
go
~~START~~
bit
1
~~END~~


DECLARE @point1 geometry, @point2 geometry;
SET @point1 = geometry::STPointFromText('POINT(-122.354657658684900 47.658678768678100)', 4326);
SET @point2 = geometry::STPointFromText('POINT(-122.354657658684000 47.658678768678100)', 4326);
SELECT STContains(@point1, @point2);
go
~~START~~
bit
0
~~END~~


DECLARE @point1 geometry, @point2 geometry;
SET @point1 = geometry::STPointFromText('POINT(-122.354657658684900 47.658678768678100)', 4326);
SET @point2 = geometry::STPointFromText('POINT(-122.354657658684900 47.658678768678100)', 4326);
SELECT @point1.STContains(@point2);
go
~~START~~
bit
1
~~END~~


DECLARE @point1 geometry, @point2 geometry;
SET @point1 = geometry::STPointFromText('POINT(-122.354657658684900 47.658678768678100)', 4326);
SET @point2 = geometry::STPointFromText('POINT(-122.354657658684900 47.658678768678100)', 4326);
SELECT @point1 . STContains ( @point2 );
Go
~~START~~
bit
1
~~END~~


SELECT ID, PointColumn1.STContains(PointColumn2) AS contain FROM TestSpatialFunction_YourTableTemp2 ORDER BY PointColumn1.STX;
GO
~~START~~
int#!#bit
1#!#1
~~END~~


DECLARE @point1 geometry = geometry::Point(1.0, 2.0, 4326);
SELECT ID, PointColumn1.STContains(@point1) AS contain FROM TestSpatialFunction_YourTableTemp2 ORDER BY PointColumn1.STX;
GO
~~START~~
int#!#bit
1#!#0
~~END~~


DECLARE @point1 geometry = geometry::Point(1.0, 2.0, 4326);
SELECT ID, @point1.STContains(PointColumn2) AS contain FROM TestSpatialFunction_YourTableTemp2 ORDER BY PointColumn1.STX;
GO
~~START~~
int#!#bit
1#!#0
~~END~~


DECLARE @referencePoint geometry = geometry::Point(0.0, 0.0, 4326);
DECLARE @contain BIT = 1;
SELECT PointColumn.STAsText() FROM TestSpatialFunction_YourTableTemp WHERE PointColumn.STContains(@referencePoint) = @contain ORDER BY PointColumn.STX;
GO
~~START~~
text
~~END~~


DECLARE @referencePoint geometry = geometry::Point(0.0, 0.0, 4326);
SELECT PointColumn.STAsText() FROM TestSpatialFunction_YourTableTemp WHERE @referencePoint.STContains(PointColumn) = @referencePoint.STX ORDER BY PointColumn.STX;
GO
~~START~~
text
POINT(3 4)
POINT(5 6)
~~END~~


SELECT ID, PointColumn1.STContains(PointColumn2) AS contain FROM TestSpatialFunction_YourTableTemp2 ORDER BY PointColumn1.STX;
go
~~START~~
int#!#bit
1#!#1
~~END~~


DECLARE @referencePoint geometry = geometry::Point(0.0, 0.0, 4326);
SELECT PointColumn.STAsText() FROM TestSpatialFunction_YourTableTemp WHERE PointColumn.STContains(@referencePoint) != @referencePoint.STX ORDER BY PointColumn.STX;
GO
~~START~~
text
~~END~~


SELECT PointA.STAsText(),PointB.STAsText() FROM TestSpatialFunction_TableATemp JOIN TestSpatialFunction_TableBTemp ON PointA.STContains(TestSpatialFunction_TableBTemp.PointB) = 1 ORDER BY TestSpatialFunction_TableBTemp.PointB.STX;
GO
~~START~~
text#!#text
~~END~~


DECLARE @referencePoint geometry = geometry::Point(0.0, 0.0, 4326);
SELECT PointA.STAsText(),PointB.STAsText() FROM TestSpatialFunction_TableATemp JOIN TestSpatialFunction_TableBTemp ON @referencePoint.STContains(TestSpatialFunction_TableBTemp.PointB) = 1 ORDER BY TestSpatialFunction_TableBTemp.PointB.STX;
GO
~~START~~
text#!#text
~~END~~


DECLARE @referencePoint geometry = geometry::Point(0.0, 0.0, 4326);
SELECT PointA.STAsText(),PointB.STAsText() FROM TestSpatialFunction_TableATemp JOIN TestSpatialFunction_TableBTemp ON PointA.STContains(@referencePoint) = 1 ORDER BY TestSpatialFunction_TableBTemp.PointB.STX;
GO
~~START~~
text#!#text
~~END~~


DECLARE @referencePoint geometry = geometry::Point(0.0, 0.0, 4326);
SELECT PointA.STAsText(),PointB.STAsText() FROM TestSpatialFunction_TableATemp JOIN TestSpatialFunction_TableBTemp ON TestSpatialFunction_TableBTemp.PointB.STContains(@referencePoint) = 0 ORDER BY TestSpatialFunction_TableBTemp.PointB.STX;
GO
~~START~~
text#!#text
POINT(1 2)#!#POINT(3 4)
~~END~~


SELECT PointColumn1.STAsText() FROM TestSpatialFunction_YourTableTemp2 ORDER BY PointColumn1.STX;
GO
~~START~~
text
POINT(3 4)
~~END~~


DECLARE @referencePoint geometry = geometry::Point(0.0, 0.0, 4326);
SELECT PointColumn.STAsText() FROM TestSpatialFunction_YourTableTemp ORDER BY PointColumn.STX;
GO
~~START~~
text
POINT(3 4)
POINT(3 4)
POINT(5 6)
~~END~~


DECLARE @referencePoint geometry = geometry::Point(0.0, 0.0, 4326);
SELECT PointColumn.STAsText() FROM TestSpatialFunction_YourTableTemp ORDER BY PointColumn.STX;
GO
~~START~~
text
POINT(3 4)
POINT(3 4)
POINT(5 6)
~~END~~


DECLARE @contains BIT = 1 ;
SELECT ID, PointColumn1.STContains(PointColumn2) AS doContain,
CASE WHEN PointColumn1.STContains(PointColumn2) = @contains THEN 'Contains' ELSE 'Do_not_contain'
END AS Proximity
FROM TestSpatialFunction_YourTableTemp2 ORDER BY PointColumn1.STX;
GO
~~START~~
int#!#bit#!#varchar
1#!#1#!#Contains
~~END~~


DECLARE @referencePoint geometry = geometry::Point(0.0, 0.0, 4326);
SELECT ID, PointColumn1.STContains(@referencePoint) AS contain,
CASE WHEN @referencePoint.STContains(PointColumn2) = @referencePoint.STX THEN 'Contains' ELSE 'Do_not_contain'
END AS Proximity
FROM TestSpatialFunction_YourTableTemp2 ORDER BY PointColumn1.STX;
GO
~~START~~
int#!#bit#!#varchar
1#!#0#!#Contains
~~END~~


DECLARE @referencePoint geometry = geometry::Point(0.0, 0.0, 4326);
WITH CTE AS ( SELECT ID, PointColumn.STContains(@referencePoint) AS contain FROM TestSpatialFunction_YourTableTemp ORDER BY PointColumn.STX)
SELECT * FROM CTE WHERE contain = 1 ORDER BY contain;
GO
~~START~~
int#!#bit
~~END~~


DECLARE @referencePoint geometry = geometry::Point(0.0, 0.0, 4326);
WITH CTE AS ( SELECT ID, @referencePoint.STContains(PointColumn) AS contain FROM TestSpatialFunction_YourTableTemp ORDER BY PointColumn.STX)
SELECT * FROM CTE WHERE contain = 1 ORDER BY contain;
GO
~~START~~
int#!#bit
~~END~~


DECLARE @referencePoint geometry = geometry::Point(0.0, 0.0, 4326);
DECLARE @contains BIT = 1;
SELECT ID, PointColumn.STContains(@referencePoint) AS ReferencePoint,
CASE WHEN PointColumn.STContains(@referencePoint) = @contains THEN 'contain'
ELSE 'do_not_contain'
END AS Proximity
FROM TestSpatialFunction_YourTableTemp ORDER BY PointColumn.STX;
go
~~START~~
int#!#bit#!#varchar
1#!#0#!#do_not_contain
3#!#<NULL>#!#do_not_contain
2#!#0#!#do_not_contain
~~END~~


DECLARE @referencePoint geometry = geometry::Point(0.0, 0.0, 4326);
SELECT ID, @referencePoint.STContains(PointColumn) AS ReferencePoint,
CASE WHEN @referencePoint.STContains(PointColumn) = @referencePoint.STY THEN 'contain'
ELSE 'do_not_contain'
END AS Proximity
FROM TestSpatialFunction_YourTableTemp ORDER BY PointColumn.STX;
go
~~START~~
int#!#bit#!#varchar
1#!#0#!#contain
3#!#<NULL>#!#do_not_contain
2#!#0#!#contain
~~END~~


DECLARE @Ranges TABLE (MinDistance float, MaxDistance float);
INSERT INTO @Ranges VALUES (0, 5), (5, 10), (10, 15);
SELECT * FROM ( SELECT ID,
CASE WHEN PointColumn1.STContains(PointColumn2) BETWEEN 0 AND 1 THEN 'contain'
ELSE 'do_not_contain'
END AS Range
FROM TestSpatialFunction_YourTableTemp2 ORDER BY PointColumn1.STX
) AS Source
PIVOT ( COUNT(ID) FOR Range IN ([0-5], [5.1-10], [10.1-15], [15.1+])) AS PivotTable;
go
~~ROW COUNT: 3~~

~~START~~
int#!#int#!#int#!#int
0#!#0#!#0#!#0
~~END~~


DECLARE @referencePoint geometry = geometry::Point(0.0, 0.0, 4326);
SELECT ID, PointColumn.STContains(@referencePoint) AS contain FROM TestSpatialFunction_DB.dbo.TestSpatialFunction_YourTable1Temp ORDER BY PointColumn.STX;
go
~~START~~
int#!#bit
1#!#0
3#!#<NULL>
2#!#0
~~END~~


DECLARE @referencePoint geometry = geometry::Point(0.0, 0.0, 4326);
SELECT ID, PointColumn.STContains(@referencePoint) AS contain,
JSON_QUERY('{"Contain":' + CAST(PointColumn.STContains(@referencePoint) AS NVARCHAR(MAX)) + '}') AS Json
FROM TestSpatialFunction_YourTableTemp ORDER BY PointColumn.STX;
go
~~START~~
int#!#bit#!#nvarchar
1#!#0#!#{"Contain": 0}
3#!#<NULL>#!#<NULL>
2#!#0#!#{"Contain": 0}
~~END~~


DECLARE @referencePoint geometry = geometry::Point(0.0, 0.0, 4326);
SELECT ID, @referencePoint.STContains(PointColumn) AS contain,
JSON_QUERY('{"Contain":' + CAST(@referencePoint.STContains(PointColumn) AS NVARCHAR(MAX)) + '}') Json
FROM TestSpatialFunction_YourTableTemp ORDER BY PointColumn.STX;
go
~~START~~
int#!#bit#!#nvarchar
1#!#0#!#{"Contain": 0}
3#!#<NULL>#!#<NULL>
2#!#0#!#{"Contain": 0}
~~END~~


SELECT [PointColumn1].STContains([PointColumn2]) AS contain FROM [TestSpatialFunction_YourTableTemp2] ORDER BY PointColumn1.STX;
go
~~START~~
bit
1
~~END~~


DECLARE @referencePoint geometry = geometry::Point(0.0, 0.0, 4326);
DECLARE @contains BIT = 1;
DECLARE @sql NVARCHAR(MAX);
DECLARE @params NVARCHAR(MAX);
SET @sql = N'
SELECT ID, PointColumn.STContains(@referencePoint) AS EqualityReferencePoint,
CASE WHEN PointColumn.STContains(@referencePoint) = @contains THEN ''contains''
ELSE ''do_not_contain''
END AS Proximity
FROM TestSpatialFunction_YourTableTemp
WHERE PointColumn.STContains(@referencePoint) = @contains;';
SET @params = N'@referencePoint geometry, @contains float';
EXEC sp_executesql @sql, @params, @referencePoint, @contains;
go
~~START~~
int#!#bit#!#varchar
~~END~~


DECLARE @referencePoint geometry = geometry::Point(0.0, 0.0, 4326);
SELECT PointColumn.STContains(@referencePoint) AS contain FROM TestSpatialFunction_YourTableTemp ORDER BY PointColumn.STX;
SELECT TestSpatialFunction_YourTableTemp.PointColumn.STContains(@referencePoint) AS contain FROM TestSpatialFunction_YourTableTemp ORDER BY PointColumn.STX;
SELECT dbo.TestSpatialFunction_YourTableTemp.PointColumn.STContains(@referencePoint) AS contain FROM TestSpatialFunction_YourTableTemp ORDER BY PointColumn.STX;
go
~~ERROR (Code: 33557097)~~

~~ERROR (Message: Remote procedure/function reference with 4-part object name is not currently supported in Babelfish)~~



DECLARE @pnt geometry;
SET @pnt = geometry::STGeomFromText('POINT(-122.34900 47.65100)', 4326);
select geometry::Point(@pnt.STY, @pnt.STX, 4326).STContains(@pnt)
DECLARE @referencePoint geometry = geometry::Point(0.0, 0.0, 4326);
DECLARE @contains BIT = 1;
SELECT ROUND(PointColumn.STContains(@referencePoint) / @contains, 0) * @contains AS Grp,
COUNT(*) AS PointCount
FROM TestSpatialFunction_YourTableTemp
GROUP BY ROUND(PointColumn.STContains(@referencePoint) / @contains, 0) * @contains
ORDER BY Grp;
GO
~~START~~
bit
0
~~END~~

~~START~~
numeric#!#int
<NULL>#!#1
0E-8#!#2
~~END~~


DECLARE @referencePoint geometry = geometry::Point(1.0, 0.0, 4326);
SELECT ROUND(PointColumn.STContains(@referencePoint) / @referencePoint.STX, 0) * @referencePoint.STX AS GRP,
COUNT(*) AS PointCount
FROM TestSpatialFunction_YourTableTemp
GROUP BY ROUND(PointColumn.STContains(@referencePoint) / @referencePoint.STX, 0) * @referencePoint.STX
ORDER BY Grp;
GO
~~START~~
float#!#int
<NULL>#!#1
0.0#!#2
~~END~~


DECLARE @referencePoint geometry = geometry::Point(0.0, 0.0, 4326);
SELECT ID, PointColumn1.STContains(PointColumn2) AS contain,
cast(PointColumn1.STContains(@referencePoint) as int) - LAG(PointColumn1.STContains(PointColumn2)) OVER (ORDER BY ID) AS Difference 
FROM TestSpatialFunction_YourTableTemp2 ORDER BY PointColumn1.STX;
GO
~~START~~
int#!#bit#!#int
1#!#1#!#<NULL>
~~END~~


DECLARE @referencePoint geometry = geometry::Point(0.0, 0.0, 4326);
SELECT ID, PointColumn.STContains(@referencePoint) AS contain,
cast(@referencePoint.STContains(PointColumn) as int) - LAG(@referencePoint.STX) OVER (ORDER BY ID) AS Difference
FROM TestSpatialFunction_YourTableTemp ORDER BY PointColumn.STX;
GO
~~START~~
int#!#bit#!#float
1#!#0#!#<NULL>
3#!#<NULL>#!#<NULL>
2#!#0#!#0.0
~~END~~


DECLARE @point geometry;
SET @point = geometry::STPointFromText('POINT(-122.34900 47.65100)', 4326);
SELECT STArea(@point);
go
~~START~~
float
0.0
~~END~~


DECLARE @point geography;
SET @point = geography::STPointFromText('POINT(-122.34900 47.65100)', 4326);
SELECT STArea(@point);
go
~~START~~
float
0.0
~~END~~


DECLARE @point geometry;
SET @point = geometry::STPointFromText('POINT(-122.34900 47.65100)', 4326);
SELECT @point.STArea();
Go
~~START~~
float
0.0
~~END~~


DECLARE @point geography;
SET @point = geography::STPointFromText('POINT(-122.34900 47.65100)', 4326);
SELECT @point.STArea();
Go
~~START~~
float
0.0
~~END~~


DECLARE @point geometry;
SET @point = geometry::POINT(22.34900, -47.65100, 4326);
SELECT @point . STArea ( );
Go
~~START~~
float
0.0
~~END~~


DECLARE @point geography;
SET @point = geography::POINT(22.34900, -47.65100, 4326);
SELECT @point . STArea ( );
Go
~~START~~
float
0.0
~~END~~


SELECT location.STArea() from TestSpatialFunction_SPATIALPOINTGEOM_dttemp ORDER BY location.STX;
GO
~~START~~
float
0.0
0.0
0.0
0.0
0.0
0.0
0.0
0.0
0.0
0.0
~~END~~


SELECT location.STArea() from TestSpatialFunction_SPATIALPOINTGEOG_dttemp ORDER BY location.Lat;
GO
~~START~~
float
0.0
0.0
0.0
0.0
0.0
0.0
0.0
0.0
0.0
0.0
~~END~~


DECLARE @point geography;
SET @point = geography::STGeomFromText('POINT(-122.34900 47.65100)', 4326);
SELECT STArea(@point);
SELECT @point.STArea();
Go
~~START~~
float
0.0
~~END~~

~~START~~
float
0.0
~~END~~


DECLARE @point geography;
SET @point = geography::Point(22.34900, -47.65100, 4326);
SELECT STArea(@point);
SELECT @point.STArea();
Go
~~START~~
float
0.0
~~END~~

~~START~~
float
0.0
~~END~~


DECLARE @point1 geometry, @point2 geometry, @point3 geometry;
SET @point1 = geometry::STPointFromText(null, 4326);
SET @point2 = geometry::STGeomFromText(null, 4326);
SET @point3 = geometry::Point(22.34900, -47.65100, 4326);
SELECT @point1.STEquals(@point2);
SELECT @point3.STEquals(@point2);
SELECT @point1.STEquals(@point3);
SELECT @point1.STContains(@point2);
SELECT @point3.STContains(@point2);
SELECT @point1.STContains(@point3);
go
~~START~~
bit
<NULL>
~~END~~

~~START~~
bit
<NULL>
~~END~~

~~START~~
bit
<NULL>
~~END~~

~~START~~
bit
<NULL>
~~END~~

~~START~~
bit
<NULL>
~~END~~

~~START~~
bit
<NULL>
~~END~~


-- Negative test for Geospatial functions
DECLARE @point1 geometry, @point2 varchar(50), @point3 int;
SET @point1 = geometry::Point(22.34900, -47.65100, 4326);
SET @point2 = 'Test_String';
SELECT @point1.STEquals(@point2);
SELECT @point1.STContains(@point2);
go
~~START~~
bit
~~ERROR (Code: 33557097)~~

~~ERROR (Message: parse error - invalid geometry)~~


DECLARE @point1 geography, @point2 varchar(50), @point3 int;
SET @point1 = geography::Point(22.34900, -47.65100, 4326);
SET @point2 = 'Test_String';
SELECT @point1.STEquals(@point2);
SELECT @point1.STContains(@point2);
go
~~START~~
bit
~~ERROR (Code: 33557097)~~

~~ERROR (Message: parse error - invalid geometry)~~


-- Null test for Geospatial functions
DECLARE @point1 geography, @point2 geography, @point3 geography;
SET @point1 = geography::STPointFromText(null, 4326);
SET @point2 = geography::STGeomFromText(null, 4326);
SET @point3 = geography::Point(22.34900, -47.65100, 4326);
SELECT @point1.STEquals(@point2);
SELECT @point3.STEquals(@point2);
SELECT @point1.STEquals(@point3);
SELECT @point1.STContains(@point2);
SELECT @point3.STContains(@point2);
SELECT @point1.STContains(@point3);
go
~~START~~
bit
<NULL>
~~END~~

~~START~~
bit
<NULL>
~~END~~

~~START~~
bit
<NULL>
~~END~~

~~START~~
bit
<NULL>
~~END~~

~~START~~
bit
<NULL>
~~END~~

~~START~~
bit
<NULL>
~~END~~


DECLARE @g geometry; 
SELECT @g.STArea(); 
go
~~START~~
float
<NULL>
~~END~~


SELECT location.STArea() from TestSpatialFunction_SPATIALPOINTGEOG_dttemp ORDER BY location.Lat;
GO
~~START~~
float
0.0
0.0
0.0
0.0
0.0
0.0
0.0
0.0
0.0
0.0
~~END~~


-- Combining geometry and geography in a single query
DECLARE @point1 geometry, @point2 geography;
SET @point1 = geometry::STPointFromText('POINT(-122.354657658684900 47.658678768678100)', 4326);
SET @point2 = geography::STGeomFromText('POINT(-122.34900 47.65100)', 4326);
SELECT @point1.STContains(@point2);
go
~~ERROR (Code: 206)~~

~~ERROR (Message: The function stcontains is found but cannot be used. Possibly due to datatype mismatch and implicit casting is not allowed.)~~


DECLARE @point1 geometry, @point2 geography;
SET @point1 = geometry::STPointFromText('POINT(-122.354657658684900 47.658678768678100)', 4326);
SET @point2 = geography::STGeomFromText('POINT(-122.34900 47.65100)', 4326);
SELECT @point2.STContains(@point1);
go
~~ERROR (Code: 206)~~

~~ERROR (Message: The function stcontains is found but cannot be used. Possibly due to datatype mismatch and implicit casting is not allowed.)~~


DECLARE @point1 geometry, @point2 geography;
SET @point1 = geometry::STPointFromText('POINT(-122.354657658684900 47.658678768678100)', 4326);
SET @point2 = geography::STGeomFromText('POINT(-122.34900 47.65100)', 4326);
SELECT @point1.STEquals(@point2);
go
~~ERROR (Code: 206)~~

~~ERROR (Message: The function stequals is found but cannot be used. Possibly due to datatype mismatch and implicit casting is not allowed.)~~


DECLARE @point1 geometry, @point2 geography;
SET @point1 = geometry::STPointFromText('POINT(-122.354657658684900 47.658678768678100)', 4326);
SET @point2 = geography::STGeomFromText('POINT(-122.34900 47.65100)', 4326);
SELECT @point2.STEquals(@point1);
go
~~ERROR (Code: 206)~~

~~ERROR (Message: The function stequals is found but cannot be used. Possibly due to datatype mismatch and implicit casting is not allowed.)~~


DECLARE @point1 geometry, @point2 geometry;
SET @point1 = geometry::Point(22.34900, -47.65100, 4326);
SET @point2 = geometry::STGeomFromText('POINT(1 1)', 0);
SELECT @point1.STEquals(@point2);
go
~~START~~
bit
<NULL>
~~END~~


DECLARE @point1 geometry, @point2 geometry;
SET @point1 = geometry::Point(22.34900, -47.65100, 4326);
SET @point2 = geometry::STGeomFromText('POINT(1 1)', 0);
SELECT @point1.STContains(@point2);
go
~~START~~
bit
<NULL>
~~END~~


DECLARE @point1 geometry;
SET @point1 = geometry::Point(3.0, 4.0, 4326);
SELECT PointColumn.STAsText() from TestSpatialFunction_YourTableTemp where PointColumn <> @point1;
GO
~~START~~
text
POINT(5 6)
POINT(3 4)
~~END~~


DECLARE @point1 geometry;
SET @point1 = geometry::Point(3.0, 4.0, 4326);
SELECT PointColumn.STAsText() from TestSpatialFunction_YourTableTemp where PointColumn = @point1;
GO
~~START~~
text
POINT(3 4)
~~END~~


SELECT PointColumn.STSrid from TestSpatialFunction_YourTableTemp ORDER BY PointColumn.STSrid;
GO
~~START~~
int
0
4326
4326
~~END~~


SELECT [PointColumn].[STSrid] from TestSpatialFunction_YourTableTemp ORDER BY PointColumn.STX;
GO
~~START~~
int
4326
0
4326
~~END~~


SELECT location.STSrid from TestSpatialFunction_SPATIALPOINTGEOG_dttemp ORDER BY location.STSrid;
GO
~~START~~
int
4326
4326
4326
4326
4326
4326
4326
4326
4326
4326
~~END~~


SELECT [location].[STSrid] from TestSpatialFunction_SPATIALPOINTGEOG_dttemp ORDER BY location.Lat;
GO
~~START~~
int
4326
4326
4326
4326
4326
4326
4326
4326
4326
4326
~~END~~


DECLARE @point geometry; 
SET @point = geometry::Point(1.0, 2.0, 4326); 
SELECT @point.STSrid AS Srid;
GO
~~START~~
int
4326
~~END~~


DECLARE @point geometry = geometry::Point(1.0, 2.0, 4326);
SELECT PointColumn.STSrid FROM TestSpatialFunction_YourTableTemp WHERE PointColumn.STSrid = @point.STSrid ORDER BY PointColumn.STSrid;
GO
~~START~~
int
4326
4326
~~END~~


DECLARE @point geography = geography::Point(1.0, 2.0, 4326);
SELECT location.STSrid FROM TestSpatialFunction_SPATIALPOINTGEOG_dttemp WHERE location.STSrid = @point.STSrid ORDER BY location.STSrid;
GO
~~START~~
int
4326
4326
4326
4326
4326
4326
4326
4326
4326
4326
~~END~~


SELECT * FROM TestSpatialFunction_TableATemp JOIN TestSpatialFunction_TableBTemp ON TestSpatialFunction_TableATemp.PointA.STSrid = TestSpatialFunction_TableBTemp.PointB.STSrid ORDER BY TestSpatialFunction_TableBTemp.PointB.STSrid;
GO
~~START~~
int#!#geometry#!#int#!#geometry
1#!#E6100000010C000000000000F03F0000000000000040#!#1#!#E6100000010C00000000000008400000000000001040
~~END~~


DECLARE @point geometry = geometry::Point(1.0, 2.0, 4326);
SELECT * FROM TestSpatialFunction_TableATemp JOIN TestSpatialFunction_TableBTemp ON TestSpatialFunction_TableATemp.PointA.STSrid = @point.STSrid ORDER BY TestSpatialFunction_TableBTemp.PointB.STSrid;
GO
~~START~~
int#!#geometry#!#int#!#geometry
1#!#E6100000010C000000000000F03F0000000000000040#!#1#!#E6100000010C00000000000008400000000000001040
~~END~~


SELECT PointColumn.STSrid FROM TestSpatialFunction_YourTableTemp ORDER BY PointColumn.STSrid;
GO
~~START~~
int
0
4326
4326
~~END~~


DECLARE @point geometry = geometry::Point(1.0, 2.0, 4326);
SELECT PointColumn.STSrid FROM TestSpatialFunction_YourTableTemp ORDER BY @point.STSrid;
GO
~~START~~
int
4326
4326
0
~~END~~


SELECT PointColumn.STSrid AS SRID FROM TestSpatialFunction_YourTableTemp ORDER BY PointColumn.STSrid;
GO
~~START~~
int
0
4326
4326
~~END~~


SELECT TestSpatialFunction_YourTableTemp.PointColumn.STSrid AS SRID FROM TestSpatialFunction_YourTableTemp ORDER BY PointColumn.STSrid;
GO
~~START~~
int
0
4326
4326
~~END~~


SELECT dbo.YourTable.PointColumn.STSrid AS SRID FROM TestSpatialFunction_YourTableTemp ORDER BY PointColumn.STSrid;
GO
~~ERROR (Code: 33557097)~~

~~ERROR (Message: The multi-part identifier "dbo.YourTable.PointColumn.STSrid" could not be bound.)~~


SELECT ID, PointColumn.STSrid AS SRID,
JSON_QUERY('{"SRID":' + CAST(PointColumn.STSrid AS NVARCHAR(MAX)) + '}') AS SRIDJson 
FROM TestSpatialFunction_YourTableTemp ORDER BY PointColumn.STSrid;
GO
~~START~~
int#!#int#!#nvarchar
3#!#0#!#{"SRID": 0}
1#!#4326#!#{"SRID": 4326}
2#!#4326#!#{"SRID": 4326}
~~END~~


SELECT TestSpatialFunction_YourTable1Temp.ID, TestSpatialFunction_YourTable1Temp.PointColumn.STSrid AS SRID 
FROM TestSpatialFunction_DB.dbo.TestSpatialFunction_YourTable1Temp;
GO
~~START~~
int#!#int
1#!#4326
2#!#4326
3#!#0
~~END~~


DECLARE @point geometry = geometry::Point(1.0, 2.0, 4326);
SELECT PointColumn.STSrid AS SRID, COUNT(*) AS PointCount 
FROM TestSpatialFunction_YourTableTemp GROUP BY PointColumn.STSrid ORDER BY PointCount;
GO
~~START~~
int#!#int
0#!#1
4326#!#2
~~END~~


SELECT ID, PointColumn.STSrid AS XCoordinate, 
CASE WHEN PointColumn.STSrid = 0 THEN 'Zero SRID'
ELSE 'Positive SRID' END AS SRID FROM TestSpatialFunction_YourTableTemp ORDER BY PointColumn.STSrid;
GO
~~START~~
int#!#int#!#varchar
3#!#0#!#Zero SRID
1#!#4326#!#Positive SRID
2#!#4326#!#Positive SRID
~~END~~


DECLARE @referencePoint geometry = geometry::Point(0.0, 0.0, 4326); 
UPDATE TestSpatialFunction_YourTableTemp SET PointColumn = @referencePoint
WHERE PointColumn.STSrid = @referencePoint.STSrid;
GO
~~ROW COUNT: 2~~


DECLARE @referencePoint geometry = geometry::Point(0.0, 0.0, 4326); 
UPDATE TestSpatialFunction_YourTableTemp SET PointColumn = @referencePoint
WHERE PointColumn.STEquals(@referencePoint) != 1;
go

DECLARE @referencePoint geometry = geometry::Point(0.0, 0.0, 4326); 
UPDATE TestSpatialFunction_YourTableTemp SET PointColumn = @referencePoint
WHERE @referencePoint.STEquals(PointColumn) = 1;
go
~~ROW COUNT: 2~~




--STIntersects
DECLARE @point1 geometry, @point2 geometry;
SET @point1 = geometry::STPointFromText('POINT(-122.354657658684900 47.658678768678100)', 4326);
SET @point2 = geometry::STPointFromText('POINT(-122.354657658684900 47.658678768678100)', 4326);
SELECT @point1.STIntersects(@point2) AS Intersecting;
go
~~START~~
bit
1
~~END~~


DECLARE @point1 geography, @point2 geography;
SET @point1 = geography::STGeomFromText('POINT(-122.34900 47.65100)', 4326);
SET @point2 = geography::STGeomFromText('POINT(-122.34900 47.65100)', 4326);
SELECT @point1.STIntersects(@point2) AS Intersecting;
go
~~START~~
bit
1
~~END~~


DECLARE @point1 geometry, @point2 geometry;
SET @point1 = geometry::STPointFromText('POINT(-122.354657658684900 47.658678768678100)', 4326);
SET @point2 = geometry::STPointFromText('POINT(-122.354657658684900 47.658678768678100)', 0);
SELECT @point1.STIntersects(@point2) AS Intersecting;
go
~~START~~
bit
<NULL>
~~END~~


DECLARE @point1 geography, @point2 geography;
SET @point1 = geography::STGeomFromText('POINT(-122.34900 47.65100)', 4326);
SET @point2 = geography::STGeomFromText('POINT(-122.34900 47.65100)', 4326);
SELECT @point1 . STIntersects(@point2) AS Intersecting;
go
~~START~~
bit
1
~~END~~


-- Verifying with precision
DECLARE @point1 geometry, @point2 geometry;
SET @point1 = geometry::STPointFromText('POINT(-122.354657658684900 47.658678768678100)', 4326);
SET @point2 = geometry::STPointFromText('POINT(-122.354657658684900 47.658678768678100)', 4326);
SELECT STIntersects(@point1, @point2);
go
~~START~~
bit
1
~~END~~


DECLARE @point1 geography, @point2 geography;
SET @point1 = geography::STGeomFromText('POINT(-122.354657658684900 47.658678768678100)', 4326);
SET @point2 = geography::STGeomFromText('POINT(-122.354657658684900 47.658678768678100)', 4326);
SELECT @point1.STIntersects(@point2) AS Intersecting;
go
~~START~~
bit
1
~~END~~


DECLARE @point1 geometry, @point2 geometry;
SET @point1 = geometry::STPointFromText('POINT(-122.354657658684900 47.658678768678100)', 4326);
SET @point2 = geometry::STPointFromText('POINT(-122.354657658684000 47.658678768678100)', 4326);
SELECT STIntersects(@point1, @point2);
go
~~START~~
bit
0
~~END~~


DECLARE @point1 geometry, @point2 geometry;
SET @point1 = geometry::STPointFromText('POINT(-122.354657658684900 47.658678768678100)', 4326);
SET @point2 = geometry::STPointFromText('POINT(-122.354657658684900 47.658678768678100)', 4326);
SELECT @point1 . STIntersects ( @point2 );
go
~~START~~
bit
1
~~END~~


--Use in an ORDER BY Clause
SELECT PointColumn1.STIntersects(PointColumn2) AS Intersects FROM TestSpatialFunction_YourTable2Temp ORDER BY PointColumn1.STX;
go
~~START~~
bit
1
~~END~~


DECLARE @point1 geometry = geometry::Point(1.0, 2.0, 4326);
SELECT PointColumn1.STIntersects(@point1) AS Intersects FROM TestSpatialFunction_YourTable2Temp ORDER BY PointColumn1.STX;
go
~~START~~
bit
0
~~END~~


DECLARE @point1 geometry = geometry::Point(1.0, 2.0, 4326);
SELECT @point1.STIntersects(PointColumn2) AS Intersects FROM TestSpatialFunction_YourTable2Temp ORDER BY PointColumn1.STX;
go
~~START~~
bit
0
~~END~~


SELECT ID, PointColumn1.STIntersects(PointColumn2) AS Intersecting_points FROM TestSpatialFunction_YourTable2Temp ORDER BY PointColumn1.STX;
go
~~START~~
int#!#bit
1#!#1
~~END~~


DECLARE @referencePoint geometry = geometry::Point(0.0, 0.0, 4326);
SELECT ID, PointColumn.STIntersects(@referencePoint) AS Intersection FROM TestSpatialFunction_DB.dbo.TestSpatialFunction_YourTable1Temp ORDER BY PointColumn.STX;
go
~~START~~
int#!#bit
1#!#0
3#!#<NULL>
2#!#0
~~END~~


--Use in a WHERE Clause
DECLARE @referencePoint geometry = geometry::Point(0.0, 0.0, 4326);
DECLARE @doesintersect BIT = 0;
SELECT PointColumn.STSrid FROM TestSpatialFunction_YourTableTemp WHERE PointColumn.STIntersects(@referencePoint) = @doesintersect ORDER BY PointColumn.STSrid;
go
~~START~~
int
~~END~~


--Use in a CTE (Common Table Expression)
DECLARE @referencePoint geometry = geometry::Point(0.0, 0.0, 4326);
WITH IntersectCTE AS ( SELECT ID, PointColumn.STIntersects(@referencePoint) AS Intersection FROM TestSpatialFunction_YourTableTemp)
SELECT * FROM IntersectCTE WHERE Intersection = 1 ORDER BY Intersection;
go
~~START~~
int#!#bit
1#!#1
2#!#1
~~END~~


DECLARE @referencePoint geometry = geometry::Point(0.0, 0.0, 4326);
WITH IntersectCTE AS ( SELECT ID, PointColumn.STIntersects(@referencePoint) AS Intersections FROM TestSpatialFunction_YourTableTemp ORDER BY PointColumn.STX)
SELECT * FROM IntersectCTE WHERE Intersections = 1.0 ORDER BY Intersections;
GO
~~START~~
int#!#bit
1#!#1
2#!#1
~~END~~


DECLARE @referencePoint geometry = geometry::Point(0.0, 0.0, 4326);
WITH IntersectCTE AS ( SELECT ID, @referencePoint.STIntersects(PointColumn) AS Intersections FROM TestSpatialFunction_YourTableTemp ORDER BY PointColumn.STX)
SELECT * FROM IntersectCTE WHERE Intersections != 1.0 ORDER BY Intersections;
GO
~~START~~
int#!#bit
~~END~~


-- Use in a JOIN Operation
SELECT PointA.STAsText(),PointB.STAsText() FROM TestSpatialFunction_TableATemp JOIN TestSpatialFunction_TableBTemp ON PointA.STIntersects(TestSpatialFunction_TableBTemp.PointB) != 1 ORDER BY PointA.STX;
go
~~START~~
text#!#text
POINT(1 2)#!#POINT(3 4)
~~END~~


DECLARE @referencePoint geometry = geometry::Point(0.0, 0.0, 4326);
SELECT PointA.STAsText(),PointB.STAsText() FROM TestSpatialFunction_TableATemp JOIN TestSpatialFunction_TableBTemp ON @referencePoint.STIntersects(TestSpatialFunction_TableBTemp.PointB) = 1 ORDER BY PointA.STX;
go
~~START~~
text#!#text
~~END~~


DECLARE @referencePoint geometry = geometry::Point(0.0, 0.0, 4326);
SELECT PointA.STAsText(),PointB.STAsText() FROM TestSpatialFunction_TableATemp JOIN TestSpatialFunction_TableBTemp ON PointA.STIntersects(@referencePoint) != 1 ORDER BY PointA.STX;
go
~~START~~
text#!#text
POINT(1 2)#!#POINT(3 4)
~~END~~


--Use in a CASE Statement
DECLARE @doesintersect BIT = 1;
SELECT ID, PointColumn1.STIntersects(PointColumn2) AS doesintersect,
CASE WHEN PointColumn1.STIntersects(PointColumn2) = @doesintersect THEN 'yes' ELSE 'no'
END AS doesintersect
FROM TestSpatialFunction_YourTable2Temp ORDER BY PointColumn1.STX;
go
~~START~~
int#!#bit#!#varchar
1#!#1#!#yes
~~END~~


--Use in a Conditional Statement
DECLARE @referencePoint geometry = geometry::Point(0.0, 0.0, 4326);
DECLARE @doesintersect BIT = 1;
SELECT ID, PointColumn.STIntersects(@referencePoint) AS IntersectingReferancePoint,
CASE WHEN PointColumn.STIntersects(@referencePoint) = @doesintersect THEN 'Close'
ELSE 'Far'
END AS Proximity
FROM TestSpatialFunction_YourTableTemp ORDER BY PointColumn.STX;
go
~~START~~
int#!#bit#!#varchar
1#!#1#!#Close
2#!#1#!#Close
3#!#<NULL>#!#Far
~~END~~


DECLARE @referencePoint geometry = geometry::Point(0.0, 0.0, 4326);
SELECT ID, @referencePoint.STIntersects(PointColumn) AS IntersectingReferancePoint,
CASE WHEN @referencePoint.STIntersects(PointColumn) = @referencePoint.STY THEN 'Close'
ELSE 'Far'
END AS Proximity
FROM TestSpatialFunction_YourTableTemp ORDER BY PointColumn.STX;
go
~~START~~
int#!#bit#!#varchar
1#!#1#!#Far
2#!#1#!#Far
3#!#<NULL>#!#Far
~~END~~


--Use in a Pivot Query
DECLARE @Ranges TABLE (MinDistance float, MaxDistance float);
INSERT INTO @Ranges VALUES (0, 5), (5, 10), (10, 15);
SELECT * FROM ( SELECT ID,
CASE WHEN PointColumn1.STIntersects(PointColumn2) BETWEEN 0 AND 1 THEN 'yes'
ELSE 'no'
END AS Range
FROM TestSpatialFunction_YourTable2Temp ORDER BY PointColumn1.STX
) AS Source
PIVOT ( COUNT(ID) FOR Range IN ([0-5], [5.1-10], [10.1-15], [15.1+])) AS PivotTable;
go
~~ROW COUNT: 3~~

~~START~~
int#!#int#!#int#!#int
0#!#0#!#0#!#0
~~END~~


--Use in a JSON Output
DECLARE @referencePoint geometry = geometry::Point(0.0, 0.0, 4326);
SELECT ID, PointColumn.STIntersects(@referencePoint) AS Intersections,
JSON_QUERY('{"Intersections":' + CAST(PointColumn.STIntersects(@referencePoint) AS NVARCHAR(MAX)) + '}') AS Json
FROM TestSpatialFunction_YourTableTemp ORDER BY PointColumn.STX;
go
~~START~~
int#!#bit#!#nvarchar
1#!#1#!#{"Intersections": 1}
2#!#1#!#{"Intersections": 1}
3#!#<NULL>#!#<NULL>
~~END~~


DECLARE @referencePoint geometry = geometry::Point(0.0, 0.0, 4326);
SELECT ID, @referencePoint.STIntersects(PointColumn) AS Intersections,
JSON_QUERY('{"Intersections":' + CAST(@referencePoint.STIntersects(PointColumn) AS NVARCHAR(MAX)) + '}') Json
FROM TestSpatialFunction_YourTableTemp ORDER BY PointColumn.STX;
go
~~START~~
int#!#bit#!#nvarchar
1#!#1#!#{"Intersections": 1}
2#!#1#!#{"Intersections": 1}
3#!#<NULL>#!#<NULL>
~~END~~


--Using Square brackets '[]' identifier
SELECT [PointColumn1].STIntersects([PointColumn2]) AS Intersection FROM TestSpatialFunction_YourTable2Temp ORDER BY PointColumn1.STX;
go
~~START~~
bit
1
~~END~~


--Use in Prepared Statement
DECLARE @referencePoint geometry = geometry::Point(0.0, 0.0, 4326);
DECLARE @doesintersect BIT = 1;
DECLARE @sql NVARCHAR(MAX);
DECLARE @params NVARCHAR(MAX);
SET @sql = N'
SELECT ID, PointColumn.STIntersects(@referencePoint) AS IntersectingReferancePoint,
CASE WHEN PointColumn.STIntersects(@referencePoint) = @doesintersect THEN ''Close''
ELSE ''Far''
END AS Proximity
FROM TestSpatialFunction_YourTableTemp
WHERE PointColumn.STIntersects(@referencePoint) = @doesintersect;';
SET @params = N'@referencePoint geometry, @doesintersect float';
EXEC sp_executesql @sql, @params, @referencePoint, @doesintersect;
go
~~START~~
int#!#bit#!#varchar
1#!#1#!#Close
2#!#1#!#Close
~~END~~


--Use in Multi-Part column name Statements
DECLARE @referencePoint geometry = geometry::Point(0.0, 0.0, 4326);
SELECT PointColumn.STIntersects(@referencePoint) AS Intersection FROM TestSpatialFunction_YourTableTemp ORDER BY PointColumn.STX;
SELECT TestSpatialFunction_YourTableTemp.PointColumn.STIntersects(@referencePoint) AS Intersection FROM TestSpatialFunction_YourTableTemp ORDER BY PointColumn.STX;
SELECT TestSpatialFunction_YourTableTemp.PointColumn.STIntersects(@referencePoint) AS Intersection FROM TestSpatialFunction_YourTableTemp ORDER BY PointColumn.STX;
go
~~START~~
bit
1
1
<NULL>
~~END~~

~~START~~
bit
1
1
<NULL>
~~END~~

~~START~~
bit
1
1
<NULL>
~~END~~


--Use in function.STIntersects(@point) Statements
DECLARE @pnt geometry;
SET @pnt = geometry::STGeomFromText('POINT(-122.34900 47.65100)', 4326);
select geometry::Point(@pnt.STY, @pnt.STX, 4326).STIntersects(@pnt)
go
~~START~~
bit
0
~~END~~


--Use in a Group By Clause
DECLARE @referencePoint geometry = geometry::Point(0.0, 0.0, 4326);
DECLARE @intersection_points BIT = 1;
SELECT ROUND(PointColumn.STIntersects(@referencePoint) / @intersection_points, 0) * @intersection_points AS Intersectinggroup,
COUNT(*) AS PointCount
FROM TestSpatialFunction_YourTableTemp
GROUP BY ROUND(PointColumn.STIntersects(@referencePoint) / @intersection_points, 0) * @intersection_points
ORDER BY Intersectinggroup;
go
~~START~~
numeric#!#int
<NULL>#!#1
1.00000000#!#2
~~END~~


DECLARE @referencePoint geometry = geometry::Point(1.0, 0.0, 4326);
SELECT ROUND(PointColumn.STIntersects(@referencePoint) / @referencePoint.STX, 0) * @referencePoint.STX AS Intersectinggroup,
COUNT(*) AS PointCount
FROM TestSpatialFunction_YourTableTemp
GROUP BY ROUND(PointColumn.STIntersects(@referencePoint) / @referencePoint.STX, 0) * @referencePoint.STX
ORDER BY Intersectinggroup;
go
~~START~~
float#!#int
<NULL>#!#1
0.0#!#2
~~END~~


-- Use in a Window Function
DECLARE @referencePoint geometry = geometry::Point(0.0, 0.0, 4326);
SELECT ID, PointColumn1.STIntersects(PointColumn2) AS intersection_points,
cast(PointColumn1.STIntersects(@referencePoint) as int) - LAG(PointColumn1.STIntersects(PointColumn2)) OVER (ORDER BY ID) AS Intersectinggroup 
FROM TestSpatialFunction_YourTable2Temp ORDER BY PointColumn1.STX;
go
~~START~~
int#!#bit#!#int
1#!#1#!#<NULL>
~~END~~


DECLARE @referencePoint geometry = geometry::Point(0.0, 0.0, 4326);
SELECT ID, PointColumn.STIntersects(@referencePoint) AS intersection_points,
cast(@referencePoint.STDisjoint(PointColumn) as int) - LAG(@referencePoint.STX) OVER (ORDER BY ID) AS Intersectinggroup
FROM TestSpatialFunction_YourTableTemp ORDER BY PointColumn.STX;
go
~~START~~
int#!#bit#!#float
1#!#1#!#<NULL>
2#!#1#!#0.0
3#!#<NULL>#!#<NULL>
~~END~~


--Use in an UPDATE Statement
DECLARE @referencePoint geometry = geometry::Point(0.0, 0.0, 4326); 
UPDATE TestSpatialFunction_YourTableTemp SET PointColumn = @referencePoint
WHERE @referencePoint.STIntersects(PointColumn) = 1;
go
~~ROW COUNT: 2~~


DECLARE @referencePoint geometry = geometry::Point(0.0, 0.0, 4326); 
UPDATE TestSpatialFunction_YourTableTemp SET PointColumn = @referencePoint
WHERE PointColumn.STIntersects(@referencePoint) != 1;
go

--Cross-database query to retrieve intersects
DECLARE @referencePoint geometry = geometry::Point(0.0, 0.0, 4326);
SELECT ID, PointColumn.STIntersects(@referencePoint) AS Disjoint FROM TestSpatialFunction_DB.dbo.TestSpatialFunction_YourTable1Temp;
go
~~START~~
int#!#bit
1#!#0
2#!#0
3#!#<NULL>
~~END~~



--STDisjoint
DECLARE @point1 geography, @point2 geography;
SET @point1 = geography::STGeomFromText('POINT(-122.34900 47.65100)', 4326);
SET @point2 = geography::STGeomFromText('POINT(-122.34900 47.65100)', 4326);
SELECT @point1.STDisjoint(@point2) AS disjoint;
go
~~START~~
bit
0
~~END~~


DECLARE @point1 geography, @point2 geography;
SET @point1 = geography::STGeomFromText('POINT(-122.34900 47.65100)', 4326);
SET @point2 = geography::STGeomFromText('POINT(-122.34900 47.65100)', 4326);
SELECT @point1 . STDisjoint(@point2) AS disjoint;
go
~~START~~
bit
0
~~END~~


-- Verifying with precision
DECLARE @point1 geometry, @point2 geometry;
SET @point1 = geometry::STPointFromText('POINT(-122.354657658684900 47.658678768678100)', 4326);
SET @point2 = geometry::STPointFromText('POINT(-122.354657658684900 47.658678768678100)', 4326);
SELECT STDisjoint(@point1, @point2);
go
~~START~~
bit
0
~~END~~


DECLARE @point1 geography, @point2 geography;
SET @point1 = geography::STPointFromText('POINT(-122.354657658684900 47.658678768678100)', 4326);
SET @point2 = geography::STPointFromText('POINT(-122.354657658684000 47.658678768678100)', 4326);
SELECT STDisjoint(@point1, @point2);
go
~~START~~
bit
1
~~END~~


DECLARE @point1 geometry, @point2 geometry;
SET @point1 = geometry::STPointFromText('POINT(-122.354657658684900 47.658678768678100)', 4326);
SET @point2 = geometry::STPointFromText('POINT(-122.354657658684900 47.658678768678100)', 4326);
SELECT @point1 . STDisjoint ( @point2 );
go
~~START~~
bit
0
~~END~~


DECLARE @point1 geography, @point2 geography;
SET @point1 = geography::STGeomFromText('POINT(-122.354657658684900 47.658678768678100)', 4326);
SET @point2 = geography::STGeomFromText('POINT(-122.354657658684900 47.658678768678100)', 4326);
SELECT @point1.STDisjoint(@point2);
go
~~START~~
bit
0
~~END~~


--Use in an ORDER BY Clause
SELECT ID, PointColumn1.STDisjoint(PointColumn2) AS disjoint FROM TestSpatialFunction_YourTable2Temp ORDER BY PointColumn1.STX;
go
~~START~~
int#!#bit
1#!#0
~~END~~


DECLARE @point1 geometry = geometry::Point(1.0, 2.0, 4326);
SELECT ID, PointColumn1.STDisjoint(@point1) AS disjoint FROM TestSpatialFunction_YourTable2Temp ORDER BY PointColumn1.STX;
go
~~START~~
int#!#bit
1#!#1
~~END~~


DECLARE @point1 geometry = geometry::Point(1.0, 2.0, 4326);
SELECT ID, @point1.STDisjoint(PointColumn2) AS disjoint FROM TestSpatialFunction_YourTable2Temp ORDER BY PointColumn1.STX;
go
~~START~~
int#!#bit
1#!#1
~~END~~


--Use in a WHERE Clause
DECLARE @referencePoint geometry = geometry::Point(0.0, 0.0, 4326);
DECLARE @disjoint BIT = 1;
SELECT PointColumn.STAsText() FROM TestSpatialFunction_YourTableTemp WHERE PointColumn.STDisjoint(@referencePoint) = @disjoint ORDER BY PointColumn.STX;
go
~~START~~
text
~~END~~


DECLARE @referencePoint geometry = geometry::Point(0.0, 0.0, 4326);
SELECT PointColumn.STAsText() FROM TestSpatialFunction_YourTableTemp WHERE @referencePoint.STDisjoint(PointColumn) = @referencePoint.STX ORDER BY PointColumn.STX;
go
~~START~~
text
POINT(0 0)
POINT(0 0)
~~END~~


SELECT ID, PointColumn1.STDisjoint(PointColumn2) AS disjoint FROM TestSpatialFunction_YourTable2Temp ORDER BY PointColumn1.STX;
go
~~START~~
int#!#bit
1#!#0
~~END~~


DECLARE @referencePoint geometry = geometry::Point(0.0, 0.0, 4326);
SELECT PointColumn.STAsText() FROM TestSpatialFunction_YourTableTemp WHERE PointColumn.STDisjoint(@referencePoint) != @referencePoint.STX ORDER BY PointColumn.STX;
go
~~START~~
text
~~END~~


--Use in a JOIN Operation
SELECT PointA.STAsText(),PointB.STAsText() FROM TestSpatialFunction_TableATemp JOIN TestSpatialFunction_TableBTemp ON PointA.STDisjoint(TestSpatialFunction_TableBTemp.PointB) = 1 ORDER BY TestSpatialFunction_TableBTemp.PointB.STX;
go
~~START~~
text#!#text
POINT(1 2)#!#POINT(3 4)
~~END~~


DECLARE @referencePoint geometry = geometry::Point(0.0, 0.0, 4326);
SELECT PointA.STAsText(),PointB.STAsText() FROM TestSpatialFunction_TableATemp JOIN TestSpatialFunction_TableBTemp ON @referencePoint.STDisjoint(TestSpatialFunction_TableBTemp.PointB) = 1 ORDER BY TestSpatialFunction_TableBTemp.PointB.STX;
go
~~START~~
text#!#text
POINT(1 2)#!#POINT(3 4)
~~END~~


DECLARE @referencePoint geometry = geometry::Point(0.0, 0.0, 4326);
SELECT PointA.STAsText(),PointB.STAsText() FROM TestSpatialFunction_TableATemp JOIN TestSpatialFunction_TableBTemp ON PointA.STDisjoint(@referencePoint) = 1 ORDER BY TestSpatialFunction_TableBTemp.PointB.STX;
go
~~START~~
text#!#text
POINT(1 2)#!#POINT(3 4)
~~END~~


DECLARE @referencePoint geometry = geometry::Point(0.0, 0.0, 4326);
SELECT PointA.STAsText(),PointB.STAsText() FROM TestSpatialFunction_TableATemp JOIN TestSpatialFunction_TableBTemp ON TestSpatialFunction_TableBTemp.PointB.STDisjoint(@referencePoint) = 0 ORDER BY PointB.STX;
go
~~START~~
text#!#text
~~END~~


-- Use in a CASE Statement
DECLARE @disjoints BIT = 1 ;
SELECT ID, PointColumn1.STDisjoint(PointColumn2) AS dodisjoint,
CASE WHEN PointColumn1.STDisjoint(PointColumn2) = @disjoints THEN 'Disjoints' ELSE 'Are_not_disjoint'
END AS Proximity
FROM TestSpatialFunction_YourTable2Temp ORDER BY PointColumn1.STX;
go
~~START~~
int#!#bit#!#varchar
1#!#0#!#Are_not_disjoint
~~END~~


DECLARE @referencePoint geometry = geometry::Point(0.0, 0.0, 4326);
SELECT ID, PointColumn1.STDisjoint(@referencePoint) AS disjoint,
CASE WHEN @referencePoint.STDisjoint(PointColumn2) = @referencePoint.STX THEN 'Disjoints' ELSE 'Are_not_disjoint'
END AS Proximity
FROM TestSpatialFunction_YourTable2Temp ORDER BY PointColumn1.STX;
go
~~START~~
int#!#bit#!#varchar
1#!#1#!#Are_not_disjoint
~~END~~


--Use in a CTE (Common Table Expression)
DECLARE @referencePoint geometry = geometry::Point(0.0, 0.0, 4326);
WITH CTE AS ( SELECT ID, PointColumn.STDisjoint(@referencePoint) AS disjoint FROM TestSpatialFunction_YourTableTemp ORDER BY PointColumn.STX)
SELECT * FROM CTE WHERE disjoint = 1 ORDER BY disjoint;
go
~~START~~
int#!#bit
~~END~~


DECLARE @referencePoint geometry = geometry::Point(0.0, 0.0, 4326);
WITH CTE AS ( SELECT ID, @referencePoint.STDisjoint(PointColumn) AS disjoint FROM TestSpatialFunction_YourTableTemp ORDER BY PointColumn.STX)
SELECT * FROM CTE WHERE disjoint = 1 ORDER BY disjoint;
go
~~START~~
int#!#bit
~~END~~


--Use in a Conditional Statement
DECLARE @referencePoint geometry = geometry::Point(0.0, 0.0, 4326);
DECLARE @disjoints BIT = 1;
SELECT ID, PointColumn.STDisjoint(@referencePoint) AS ReferencePoint,
CASE WHEN PointColumn.STDisjoint(@referencePoint) = @disjoints THEN 'disjoint'
ELSE 'are_not_disjoint'
END AS Proximity
FROM TestSpatialFunction_YourTableTemp ORDER BY PointColumn.STX;
go
~~START~~
int#!#bit#!#varchar
1#!#0#!#are_not_disjoint
2#!#0#!#are_not_disjoint
3#!#<NULL>#!#are_not_disjoint
~~END~~


DECLARE @referencePoint geometry = geometry::Point(0.0, 0.0, 4326);
SELECT ID, @referencePoint.STDisjoint(PointColumn) AS ReferencePoint,
CASE WHEN @referencePoint.STDisjoint(PointColumn) = @referencePoint.STY THEN 'disjoint'
ELSE 'are_not_disjoint'
END AS Proximity
FROM TestSpatialFunction_YourTableTemp ORDER BY PointColumn.STX;
go
~~START~~
int#!#bit#!#varchar
1#!#0#!#disjoint
2#!#0#!#disjoint
3#!#<NULL>#!#are_not_disjoint
~~END~~


--Use in a Pivot Query
DECLARE @Ranges TABLE (MinDistance float, MaxDistance float);
INSERT INTO @Ranges VALUES (0, 5), (5, 10), (10, 15);
SELECT * FROM ( SELECT ID,
CASE WHEN PointColumn1.STDisjoint(PointColumn2) BETWEEN 0 AND 1 THEN 'disjoint'
ELSE 'do_not_disjoint'
END AS Range
FROM TestSpatialFunction_YourTable2Temp ORDER BY PointColumn1.STX
) AS Source
PIVOT ( COUNT(ID) FOR Range IN ([0-5], [5.1-10], [10.1-15], [15.1+])) AS PivotTable;
go
~~ROW COUNT: 3~~

~~START~~
int#!#int#!#int#!#int
0#!#0#!#0#!#0
~~END~~


DECLARE @referencePoint geometry = geometry::Point(0.0, 0.0, 4326);
SELECT ID, PointColumn.STDisjoint(@referencePoint) AS disjoint FROM TestSpatialFunction_DB.dbo.TestSpatialFunction_YourTable1Temp ORDER BY PointColumn.STX;
go
~~START~~
int#!#bit
1#!#1
3#!#<NULL>
2#!#1
~~END~~


--Use in a JSON Output
DECLARE @referencePoint geometry = geometry::Point(0.0, 0.0, 4326);
SELECT ID, PointColumn.STDisjoint(@referencePoint) AS disjoint,
JSON_QUERY('{"Disjoint":' + CAST(PointColumn.STDisjoint(@referencePoint) AS NVARCHAR(MAX)) + '}') AS Json
FROM TestSpatialFunction_YourTableTemp ORDER BY PointColumn.STX;
go
~~START~~
int#!#bit#!#nvarchar
1#!#0#!#{"Disjoint": 0}
2#!#0#!#{"Disjoint": 0}
3#!#<NULL>#!#<NULL>
~~END~~


DECLARE @referencePoint geometry = geometry::Point(0.0, 0.0, 4326);
SELECT ID, @referencePoint.STDisjoint(PointColumn) AS disjoint,
JSON_QUERY('{"Disjoint":' + CAST(@referencePoint.STDisjoint(PointColumn) AS NVARCHAR(MAX)) + '}') Json
FROM TestSpatialFunction_YourTableTemp ORDER BY PointColumn.STX;
go
~~START~~
int#!#bit#!#nvarchar
1#!#0#!#{"Disjoint": 0}
2#!#0#!#{"Disjoint": 0}
3#!#<NULL>#!#<NULL>
~~END~~


-- Using Square brackets '[]' identifier
SELECT [PointColumn1].STDisjoint([PointColumn2]) AS disjoint FROM TestSpatialFunction_YourTable2Temp ORDER BY PointColumn1.STX;
go
~~START~~
bit
0
~~END~~


--Use in Prepared Statement
DECLARE @referencePoint geometry = geometry::Point(0.0, 0.0, 4326);
DECLARE @disjoints BIT = 1;
DECLARE @sql NVARCHAR(MAX);
DECLARE @params NVARCHAR(MAX);
SET @sql = N'
SELECT ID, PointColumn.STDisjoint(@referencePoint) AS IntersectingReferancePoint,
CASE WHEN PointColumn.STDisjoint(@referencePoint) = @disjoints THEN ''disjoints''
ELSE ''do_not_disjoint''
END AS Proximity
FROM TestSpatialFunction_YourTableTemp
WHERE PointColumn.STDisjoint(@referencePoint) = @disjoints;';
SET @params = N'@referencePoint geometry, @disjoints float';
EXEC sp_executesql @sql, @params, @referencePoint, @disjoints;
go
~~START~~
int#!#bit#!#varchar
~~END~~


--Use in Multi-Part column name Statements
DECLARE @referencePoint geometry = geometry::Point(0.0, 0.0, 4326);
SELECT PointColumn.STDisjoint(@referencePoint) AS disjoint FROM TestSpatialFunction_YourTableTemp ORDER BY PointColumn.STX;
SELECT TestSpatialFunction_YourTableTemp.PointColumn.STDisjoint(@referencePoint) AS disjoint FROM TestSpatialFunction_YourTableTemp ORDER BY PointColumn.STX;
SELECT TestSpatialFunction_YourTableTemp.PointColumn.STDisjoint(@referencePoint) AS disjoint FROM TestSpatialFunction_YourTableTemp ORDER BY PointColumn.STX;
go
~~START~~
bit
0
0
<NULL>
~~END~~

~~START~~
bit
0
0
<NULL>
~~END~~

~~START~~
bit
0
0
<NULL>
~~END~~



--Use in function.STDisjoint(@point) Statements
DECLARE @pnt geometry;
SET @pnt = geometry::STGeomFromText('POINT(-122.34900 47.65100)', 4326);
select geometry::Point(@pnt.STY, @pnt.STX, 4326).STDisjoint(@pnt)
--Use in a Group By Clause
DECLARE @referencePoint geometry = geometry::Point(0.0, 0.0, 4326);
DECLARE @disjoints BIT = 1;
SELECT ROUND(PointColumn.STDisjoint(@referencePoint) / @disjoints, 0) * @disjoints AS Grp,
COUNT(*) AS PointCount
FROM TestSpatialFunction_YourTableTemp
GROUP BY ROUND(PointColumn.STDisjoint(@referencePoint) / @disjoints, 0) * @disjoints
ORDER BY Grp;
go
~~START~~
bit
1
~~END~~

~~START~~
numeric#!#int
<NULL>#!#1
0E-8#!#2
~~END~~


DECLARE @referencePoint geometry = geometry::Point(1.0, 0.0, 4326);
SELECT ROUND(PointColumn.STDisjoint(@referencePoint) / @referencePoint.STX, 0) * @referencePoint.STX AS GRP,
COUNT(*) AS PointCount
FROM TestSpatialFunction_YourTableTemp
GROUP BY ROUND(PointColumn.STDisjoint(@referencePoint) / @referencePoint.STX, 0) * @referencePoint.STX
ORDER BY Grp;
go
~~START~~
float#!#int
<NULL>#!#1
1.0#!#2
~~END~~


--Use in a Window Function
DECLARE @referencePoint geometry = geometry::Point(0.0, 0.0, 4326);
SELECT ID, PointColumn1.STDisjoint(PointColumn2) AS disjoint,
cast(PointColumn1.STDisjoint(@referencePoint) as int) - LAG(PointColumn1.STDisjoint(PointColumn2)) OVER (ORDER BY ID) AS Difference 
FROM TestSpatialFunction_YourTable2Temp ORDER BY PointColumn1.STX;
go
~~START~~
int#!#bit#!#int
1#!#0#!#<NULL>
~~END~~


DECLARE @referencePoint geometry = geometry::Point(0.0, 0.0, 4326);
SELECT ID, PointColumn.STDisjoint(@referencePoint) AS disjoint,
cast(@referencePoint.STDisjoint(PointColumn) as int) - LAG(@referencePoint.STX) OVER (ORDER BY ID) AS Difference
FROM TestSpatialFunction_YourTableTemp ORDER BY PointColumn.STX;
go
~~START~~
int#!#bit#!#float
1#!#0#!#<NULL>
2#!#0#!#0.0
3#!#<NULL>#!#<NULL>
~~END~~


--Use in an UPDATE Statement
DECLARE @referencePoint geometry = geometry::Point(0.0, 0.0, 4326); 
UPDATE TestSpatialFunction_YourTableTemp SET PointColumn = @referencePoint
WHERE @referencePoint.STDisjoint(PointColumn) = 1;
go

DECLARE @referencePoint geometry = geometry::Point(0.0, 0.0, 4326); 
UPDATE TestSpatialFunction_YourTableTemp SET PointColumn = @referencePoint
WHERE PointColumn.STDisjoint(@referencePoint) != 1;
go
~~ROW COUNT: 2~~


--Cross-database query to retrieve disjoints
DECLARE @referencePoint geometry = geometry::Point(0.0, 0.0, 4326);
SELECT ID, PointColumn.STDisjoint(@referencePoint) AS Disjoint FROM TestSpatialFunction_DB.dbo.TestSpatialFunction_YourTable1Temp;
go
~~START~~
int#!#bit
1#!#1
2#!#1
3#!#<NULL>
~~END~~


--Negative test for Geospatial functions
DECLARE @point1 geometry, @point2 varchar(50), @point3 int;
SET @point1 = geometry::Point(22.34900, -47.65100, 4326);
SET @point2 = 'Test_String';
SELECT @point1.STIntersects(@point2);
SELECT @point1.STDisjoint(@point2);
go
~~START~~
bit
~~ERROR (Code: 33557097)~~

~~ERROR (Message: parse error - invalid geometry)~~


DECLARE @point1 geography, @point2 varchar(50), @point3 int;
SET @point1 = geography::Point(22.34900, -47.65100, 4326);
SET @point2 = 'Test_String';
SELECT @point1.STIntersects(@point2);
SELECT @point1.STDisjoint(@point2);
go
~~START~~
bit
~~ERROR (Code: 33557097)~~

~~ERROR (Message: parse error - invalid geometry)~~


-- Null test for Geospatial functions
DECLARE @point1 geography, @point2 geography, @point3 geography;
SET @point1 = geography::STPointFromText(null, 4326);
SET @point2 = geography::STGeomFromText(null, 4326);
SET @point3 = geography::Point(22.34900, -47.65100, 4326);
SELECT @point1.STIntersects(@point2);
SELECT @point3.STIntersects(@point2);
SELECT @point1.STIntersects(@point3);
SELECT @point1.STDisjoint(@point2);
SELECT @point3.STDisjoint(@point2);
SELECT @point1.STDisjoint(@point3);
go
~~START~~
bit
<NULL>
~~END~~

~~START~~
bit
<NULL>
~~END~~

~~START~~
bit
<NULL>
~~END~~

~~START~~
bit
<NULL>
~~END~~

~~START~~
bit
<NULL>
~~END~~

~~START~~
bit
<NULL>
~~END~~


--not compatible with sql server as well
--Combining geometry and geography in a single query
DECLARE @point1 geometry, @point2 geography;
SET @point1 = geometry::STPointFromText('POINT(-122.354657658684900 47.658678768678100)', 4326);
SET @point2 = geography::STGeomFromText('POINT(-122.34900 47.65100)', 4326);
SELECT @point1.STDisjoint(@point2);
go
~~ERROR (Code: 206)~~

~~ERROR (Message: The function stdisjoint is found but cannot be used. Possibly due to datatype mismatch and implicit casting is not allowed.)~~


DECLARE @point1 geometry, @point2 geography;
SET @point1 = geometry::STPointFromText('POINT(-122.354657658684900 47.658678768678100)', 4326);
SET @point2 = geography::STGeomFromText('POINT(-122.34900 47.65100)', 4326);
SELECT @point2.STDisjoint(@point1);
go
~~ERROR (Code: 206)~~

~~ERROR (Message: The function stdisjoint is found but cannot be used. Possibly due to datatype mismatch and implicit casting is not allowed.)~~


DECLARE @point1 geometry, @point2 geography;
SET @point1 = geometry::STPointFromText('POINT(-122.354657658684900 47.658678768678100)', 4326);
SET @point2 = geography::STGeomFromText('POINT(-122.34900 47.65100)', 4326);
SELECT @point1.STIntersects(@point2);
go
~~ERROR (Code: 206)~~

~~ERROR (Message: The function stintersects is found but cannot be used. Possibly due to datatype mismatch and implicit casting is not allowed.)~~


DECLARE @point1 geometry, @point2 geography;
SET @point1 = geometry::STPointFromText('POINT(-122.354657658684900 47.658678768678100)', 4326);
SET @point2 = geography::STGeomFromText('POINT(-122.34900 47.65100)', 4326);
SELECT @point2.STIntersects(@point1);
go
~~ERROR (Code: 206)~~

~~ERROR (Message: The function stintersects is found but cannot be used. Possibly due to datatype mismatch and implicit casting is not allowed.)~~



--STDimension
DECLARE @g geometry; 
SELECT @g.STDimension(); 
go
~~START~~
int
<NULL>
~~END~~


DECLARE @point geometry;
SET @point = geometry::STPointFromText('POINT(-122.34900 47.65100)', 4326);
SELECT STDimension(@point);
go
~~START~~
int
0
~~END~~


DECLARE @point geography;
SET @point = geography::STPointFromText('POINT(-122.34900 47.65100)', 4326);
SELECT STDimension(@point);
go
~~START~~
int
0
~~END~~


DECLARE @point geometry;
SET @point = geometry::STPointFromText('POINT(-122.34900 47.65100)', 4326);
SELECT @point.STDimension();
go
~~START~~
int
0
~~END~~


DECLARE @point geography;
SET @point = geography::STPointFromText('POINT(-122.34900 47.65100)', 4326);
SELECT @point.STDimension();
go
~~START~~
int
0
~~END~~


DECLARE @point geometry;
SET @point = geometry::POINT(22.34900, -47.65100, 4326);
SELECT @point . STDimension ( );
go
~~START~~
int
0
~~END~~


DECLARE @point geography;
SET @point = geography::POINT(22.34900, -47.65100, 4326);
SELECT @point . STDimension ( );
go
~~START~~
int
0
~~END~~


SELECT location.STDimension() from TestSpatialFunction_SPATIALPOINTGEOM_dttemp ORDER BY location.STX;
go
~~START~~
int
0
0
0
0
0
0
0
0
0
0
~~END~~


SELECT location.STDimension() from TestSpatialFunction_SPATIALPOINTGEOG_dttemp ORDER BY location.Lat;
go
~~START~~
int
0
0
0
0
0
0
0
0
0
0
~~END~~


DECLARE @point geometry;
SET @point = geometry::STGeomFromText('POINT(-122.34900 47.65100)', 4326);
SELECT STDimension(@point);
SELECT @point.STDimension();
go
~~START~~
int
0
~~END~~

~~START~~
int
0
~~END~~


DECLARE @point geography;
SET @point = geography::STGeomFromText('POINT(-122.34900 47.65100)', 4326);
SELECT STDimension(@point);
SELECT @point.STDimension();
go
~~START~~
int
0
~~END~~

~~START~~
int
0
~~END~~




--STIsEmpty
DECLARE @g geometry;  
SET @g = geometry::STGeomFromText('POINT EMPTY', 0);  
SELECT @g.STIsEmpty();
DECLARE @point geometry;
SET @point = geometry::STPointFromText('POINT(-122.34900 47.65100)', 4326);
SELECT STIsEmpty(@point);
go
~~START~~
bit
1
~~END~~

~~START~~
bit
0
~~END~~


DECLARE @point geography;
SET @point = geography::STPointFromText('POINT(-122.34900 47.65100)', 4326);
SELECT STIsEmpty(@point);
go
~~START~~
bit
0
~~END~~


DECLARE @point geometry;
SET @point = geometry::STPointFromText('POINT(-122.34900 47.65100)', 4326);
SELECT @point.STIsEmpty();
go
~~START~~
bit
0
~~END~~


DECLARE @point geography;
SET @point = geography::STPointFromText('POINT(-122.34900 47.65100)', 4326);
SELECT @point.STIsEmpty();
go
~~START~~
bit
0
~~END~~


DECLARE @point geometry;
SET @point = geometry::POINT(22.34900, -47.65100, 4326);
SELECT @point . STIsEmpty ( );
go
~~START~~
bit
0
~~END~~


DECLARE @point geography;
SET @point = geography::POINT(22.34900, -47.65100, 4326);
SELECT @point . STIsEmpty ( );
go
~~START~~
bit
0
~~END~~


SELECT location.STIsEmpty() from TestSpatialFunction_SPATIALPOINTGEOM_dttemp ORDER BY location.STX;
go
~~START~~
bit
0
0
0
0
0
0
0
0
0
0
~~END~~


SELECT location.STIsEmpty() from TestSpatialFunction_SPATIALPOINTGEOG_dttemp ORDER BY location.Lat;
go
~~START~~
bit
0
0
0
0
0
0
0
0
0
0
~~END~~


DECLARE @point geometry;
SET @point = geometry::STGeomFromText('POINT(-122.34900 47.65100)', 4326);
SELECT STIsEmpty(@point);
SELECT @point.STIsEmpty();
go
~~START~~
bit
0
~~END~~

~~START~~
bit
0
~~END~~


DECLARE @point geography;
SET @point = geography::Point(22.34900, -47.65100, 4326);
SELECT STIsEmpty(@point);
SELECT @point.STIsEmpty();
go
~~START~~
bit
0
~~END~~

~~START~~
bit
0
~~END~~



--STIsValid
DECLARE @point geometry;
SET @point = geometry::STPointFromText('POINT(-122.34900 47.65100)', 4326);
SELECT STIsValid(@point);
go
~~START~~
bit
1
~~END~~


DECLARE @point geography;
SET @point = geography::STPointFromText('POINT(-122.34900 47.65100)', 4326);
SELECT STIsValid(@point);
go
~~START~~
bit
1
~~END~~


DECLARE @point geometry;
SET @point = geometry::STPointFromText('POINT(-122.34900 47.65100)', 4326);
SELECT @point.STIsValid();
go
~~START~~
bit
1
~~END~~


DECLARE @point geography;
SET @point = geography::STPointFromText('POINT(-122.34900 47.65100)', 4326);
SELECT @point.STIsValid();
go
~~START~~
bit
1
~~END~~


DECLARE @point geometry;
SET @point = geometry::POINT(22.34900, -47.65100, 4326);
SELECT @point . STIsValid ( );
go
~~START~~
bit
1
~~END~~


DECLARE @point geography;
SET @point = geography::POINT(22.34900, -47.65100, 4326);
SELECT @point . STIsValid ( );
go
~~START~~
bit
1
~~END~~


SELECT location.STIsValid() from TestSpatialFunction_SPATIALPOINTGEOM_dttemp ORDER BY location.STX;
go
~~START~~
bit
1
1
1
1
1
1
1
1
1
1
~~END~~


SELECT location.STIsValid() from TestSpatialFunction_SPATIALPOINTGEOG_dttemp ORDER BY location.Lat;
go
~~START~~
bit
1
1
1
1
1
1
1
1
1
1
~~END~~


DECLARE @point geometry;
SET @point = geometry::STGeomFromText('POINT(-122.34900 47.65100)', 4326);
SELECT STIsValid(@point);
SELECT @point.STIsValid();
go
~~START~~
bit
1
~~END~~

~~START~~
bit
1
~~END~~


DECLARE @point geography;
SET @point = geography::Point(22.34900, -47.65100, 4326);
SELECT STIsValid(@point);
SELECT @point.STIsValid();
go
~~START~~
bit
1
~~END~~

~~START~~
bit
1
~~END~~



--STIsClosed
DECLARE @point geometry;
SET @point = geometry::STPointFromText('POINT(-122.34900 47.65100)', 4326);
SELECT STIsClosed(@point);
go
~~START~~
bit
0
~~END~~


DECLARE @point geography;
SET @point = geography::STPointFromText('POINT(-122.34900 47.65100)', 4326);
SELECT STIsClosed(@point);
go
~~START~~
bit
0
~~END~~


DECLARE @point geometry;
SET @point = geometry::STPointFromText('POINT(-122.34900 47.65100)', 4326);
SELECT @point.STIsClosed();
go
~~START~~
bit
0
~~END~~


DECLARE @point geography;
SET @point = geography::STPointFromText('POINT(-122.34900 47.65100)', 4326);
SELECT @point.STIsClosed();
go
~~START~~
bit
0
~~END~~


DECLARE @point geometry;
SET @point = geometry::POINT(22.34900, -47.65100, 4326);
SELECT @point . STIsClosed ( );
go
~~START~~
bit
0
~~END~~


DECLARE @point geography;
SET @point = geography::POINT(22.34900, -47.65100, 4326);
SELECT @point . STIsClosed ( );
go
~~START~~
bit
0
~~END~~


SELECT location.STIsClosed() from TestSpatialFunction_SPATIALPOINTGEOM_dttemp ORDER BY location.STX;
go
~~START~~
bit
0
0
0
0
0
0
0
0
0
0
~~END~~


SELECT location.STIsClosed() from TestSpatialFunction_SPATIALPOINTGEOG_dttemp ORDER BY location.Lat;
go
~~START~~
bit
0
0
0
0
0
0
0
0
0
0
~~END~~


DECLARE @point geometry;
SET @point = geometry::STGeomFromText('POINT(-122.34900 47.65100)', 4326);
SELECT STIsClosed(@point);
SELECT @point.STIsClosed();
go
~~START~~
bit
0
~~END~~

~~START~~
bit
0
~~END~~


DECLARE @point geography;
SET @point = geography::Point(22.34900, -47.65100, 4326);
SELECT STIsClosed(@point);
SELECT @point.STIsClosed();
go
~~START~~
bit
0
~~END~~

~~START~~
bit
0
~~END~~




-- Check for NULL conditions
DECLARE @nullGeom geometry;
DECLARE @validGeom geometry = geometry::STGeomFromText('POINT(0 0)', 0);
-- Tests
SELECT 'STDimension' AS Test, @nullGeom.STDimension() AS Result;
SELECT 'STDisjoint' AS Test, @nullGeom.STDisjoint(@validGeom) AS Result;
SELECT 'STIntersects' AS Test, @nullGeom.STIntersects(@validGeom) AS Result;
SELECT 'STIsClosed' AS Test, @nullGeom.STIsClosed() AS Result;
SELECT 'STIsEmpty' AS Test, @nullGeom.STIsEmpty() AS Result;
SELECT 'STIsValid' AS Test, @nullGeom.STIsValid() AS Result;
-- Test with null as second argument for binary operations
SELECT 'STDisjoint (null second)' AS Test, @validGeom.STDisjoint(@nullGeom) AS Result;
SELECT 'STIntersects (null second)' AS Test, @validGeom.STIntersects(@nullGeom) AS Result;
go
~~START~~
varchar#!#int
STDimension#!#<NULL>
~~END~~

~~START~~
varchar#!#bit
STDisjoint#!#<NULL>
~~END~~

~~START~~
varchar#!#bit
STIntersects#!#<NULL>
~~END~~

~~START~~
varchar#!#bit
STIsClosed#!#<NULL>
~~END~~

~~START~~
varchar#!#bit
STIsEmpty#!#<NULL>
~~END~~

~~START~~
varchar#!#bit
STIsValid#!#<NULL>
~~END~~

~~START~~
varchar#!#bit
STDisjoint (null second)#!#<NULL>
~~END~~

~~START~~
varchar#!#bit
STIntersects (null second)#!#<NULL>
~~END~~

