-- output from SQL Server :
-- 1900-01-02 00:00:00.000	1900-01-04 00:00:00.000	1900-01-03 12:00:00.000	1900-01-03 12:00:00.000	1900-01-03 12:00:00.000	1900-01-03 00:00:00.000	1900-01-03 00:00:00.000	1900-01-03 00:00:00.000	1900-01-03 00:00:00.000	1900-01-03 12:00:00.000	1900-01-03 12:00:00.000	1900-01-02 00:00:00.000	1899-12-29 00:00:00.000	1899-12-29 12:00:00.000	1899-12-29 12:00:00.000	1899-12-29 12:00:00.000	1899-12-30 00:00:00.000	1899-12-30 00:00:00.000	1899-12-30 00:00:00.000	1899-12-29 12:00:00.000	1899-12-29 12:00:00.000	null
SELECT * FROM Datetime_view1
GO
~~START~~
datetime#!#datetime#!#datetime#!#datetime#!#datetime#!#datetime#!#datetime#!#datetime#!#datetime#!#datetime#!#datetime#!#datetime#!#datetime#!#datetime#!#datetime#!#datetime#!#datetime#!#datetime#!#datetime#!#datetime#!#datetime#!#datetime
1900-01-02 00:00:00.0#!#1900-01-04 00:00:00.0#!#1900-01-03 12:00:00.0#!#1900-01-03 12:00:00.0#!#1900-01-03 12:00:00.0#!#1900-01-03 00:00:00.0#!#1900-01-03 00:00:00.0#!#1900-01-03 00:00:00.0#!#1900-01-03 00:00:00.0#!#1900-01-03 12:00:00.0#!#1900-01-03 12:00:00.0#!#1900-01-02 00:00:00.0#!#1899-12-29 00:00:00.0#!#1899-12-29 12:00:00.0#!#1899-12-29 12:00:00.0#!#1899-12-29 12:00:00.0#!#1899-12-30 00:00:00.0#!#1899-12-30 00:00:00.0#!#1899-12-30 00:00:00.0#!#1899-12-29 12:00:00.0#!#1899-12-29 12:00:00.0#!#<NULL>
~~END~~

DROP VIEW Datetime_view1
GO

-- output from SQL Server :
-- 1900-01-02 00:00	1900-01-04 00:00	1900-01-03 12:00	1900-01-03 12:00	1900-01-03 12:00	1900-01-03 00:00	1900-01-03 00:00	1900-01-03 00:00	1900-01-03 00:00	1900-01-03 12:00	1900-01-03 12:00	1900-01-02 00:00	null
SELECT * FROM Datetime_view2
GO
~~START~~
smalldatetime#!#smalldatetime#!#smalldatetime#!#smalldatetime#!#smalldatetime#!#smalldatetime#!#smalldatetime#!#smalldatetime#!#smalldatetime#!#smalldatetime#!#smalldatetime#!#smalldatetime#!#smalldatetime
1900-01-02 00:00:00.0#!#1900-01-04 00:00:00.0#!#1900-01-03 12:00:00.0#!#1900-01-03 12:00:00.0#!#1900-01-03 12:00:00.0#!#1900-01-03 00:00:00.0#!#1900-01-03 00:00:00.0#!#1900-01-03 00:00:00.0#!#1900-01-03 00:00:00.0#!#1900-01-03 12:00:00.0#!#1900-01-03 12:00:00.0#!#1900-01-02 00:00:00.0#!#<NULL>
~~END~~

DROP VIEW Datetime_view2
GO

-- output from SQL Server :
-- 0	2880	2160	2160	2160	1440	1440	1440	1440	2160	-5040	0	-2880	-2160	-2160	-2160	-1440	-1440	-1440	-2160	-2160
SELECT * FROM Datetime_view6
GO
~~START~~
int#!#int#!#int#!#int#!#int#!#int#!#int#!#int#!#int#!#int#!#int#!#int#!#int#!#int#!#int#!#int#!#int#!#int#!#int#!#int#!#int
0#!#2880#!#2160#!#2160#!#2160#!#1440#!#1440#!#1440#!#1440#!#2160#!#-5040#!#0#!#-2880#!#-2160#!#-2160#!#-2160#!#-1440#!#-1440#!#-1440#!#-2160#!#-2160
~~END~~

DROP VIEW Datetime_view6
GO

-- Operators
SELECT * FROM Datetime_Operators_tbl1 WHERE col = CAST(4 as BIT);
SELECT * FROM Datetime_Operators_tbl1 WHERE col > CAST(4 as BIT);
SELECT * FROM Datetime_Operators_tbl1 WHERE col >= CAST(4 as BIT);
SELECT * FROM Datetime_Operators_tbl1 WHERE col < CAST(4 as BIT);
SELECT * FROM Datetime_Operators_tbl1 WHERE col <= CAST(4 as BIT);
SELECT * FROM Datetime_Operators_tbl1 WHERE col != CAST(4 as BIT);
GO
~~START~~
datetime
1900-01-02 00:00:00.0
~~END~~

~~START~~
datetime
1900-01-05 00:00:00.0
1900-01-05 23:40:30.0
~~END~~

~~START~~
datetime
1900-01-05 00:00:00.0
1900-01-05 23:40:30.0
1900-01-02 00:00:00.0
~~END~~

~~START~~
datetime
1900-01-01 23:40:30.0
~~END~~

~~START~~
datetime
1900-01-01 23:40:30.0
1900-01-02 00:00:00.0
~~END~~

~~START~~
datetime
1900-01-05 00:00:00.0
1900-01-05 23:40:30.0
1900-01-01 23:40:30.0
~~END~~


SELECT * FROM Datetime_Operators_tbl1 WHERE col = CAST(4 as DECIMAL);
SELECT * FROM Datetime_Operators_tbl1 WHERE col > CAST(4 as DECIMAL);
SELECT * FROM Datetime_Operators_tbl1 WHERE col >= CAST(4 as DECIMAL);
SELECT * FROM Datetime_Operators_tbl1 WHERE col < CAST(4 as DECIMAL);
SELECT * FROM Datetime_Operators_tbl1 WHERE col <= CAST(4 as DECIMAL);
SELECT * FROM Datetime_Operators_tbl1 WHERE col != CAST(4 as DECIMAL);
GO
~~START~~
datetime
1900-01-05 00:00:00.0
~~END~~

~~START~~
datetime
1900-01-05 23:40:30.0
~~END~~

~~START~~
datetime
1900-01-05 00:00:00.0
1900-01-05 23:40:30.0
~~END~~

~~START~~
datetime
1900-01-01 23:40:30.0
1900-01-02 00:00:00.0
~~END~~

~~START~~
datetime
1900-01-05 00:00:00.0
1900-01-01 23:40:30.0
1900-01-02 00:00:00.0
~~END~~

~~START~~
datetime
1900-01-05 23:40:30.0
1900-01-01 23:40:30.0
1900-01-02 00:00:00.0
~~END~~


SELECT * FROM Datetime_Operators_tbl1 WHERE col = CAST(4 as NUMERIC);
SELECT * FROM Datetime_Operators_tbl1 WHERE col > CAST(4 as NUMERIC);
SELECT * FROM Datetime_Operators_tbl1 WHERE col >= CAST(4 as NUMERIC);
SELECT * FROM Datetime_Operators_tbl1 WHERE col < CAST(4 as NUMERIC);
SELECT * FROM Datetime_Operators_tbl1 WHERE col <= CAST(4 as NUMERIC);
SELECT * FROM Datetime_Operators_tbl1 WHERE col != CAST(4 as NUMERIC);
GO
~~START~~
datetime
1900-01-05 00:00:00.0
~~END~~

~~START~~
datetime
1900-01-05 23:40:30.0
~~END~~

~~START~~
datetime
1900-01-05 00:00:00.0
1900-01-05 23:40:30.0
~~END~~

~~START~~
datetime
1900-01-01 23:40:30.0
1900-01-02 00:00:00.0
~~END~~

~~START~~
datetime
1900-01-05 00:00:00.0
1900-01-01 23:40:30.0
1900-01-02 00:00:00.0
~~END~~

~~START~~
datetime
1900-01-05 23:40:30.0
1900-01-01 23:40:30.0
1900-01-02 00:00:00.0
~~END~~


SELECT * FROM Datetime_Operators_tbl1 WHERE col = CAST(4 as FLOAT);
SELECT * FROM Datetime_Operators_tbl1 WHERE col > CAST(4 as FLOAT);
SELECT * FROM Datetime_Operators_tbl1 WHERE col >= CAST(4 as FLOAT);
SELECT * FROM Datetime_Operators_tbl1 WHERE col < CAST(4 as FLOAT);
SELECT * FROM Datetime_Operators_tbl1 WHERE col <= CAST(4 as FLOAT);
SELECT * FROM Datetime_Operators_tbl1 WHERE col != CAST(4 as FLOAT);
GO
~~START~~
datetime
1900-01-05 00:00:00.0
~~END~~

~~START~~
datetime
1900-01-05 23:40:30.0
~~END~~

~~START~~
datetime
1900-01-05 00:00:00.0
1900-01-05 23:40:30.0
~~END~~

~~START~~
datetime
1900-01-01 23:40:30.0
1900-01-02 00:00:00.0
~~END~~

~~START~~
datetime
1900-01-05 00:00:00.0
1900-01-01 23:40:30.0
1900-01-02 00:00:00.0
~~END~~

~~START~~
datetime
1900-01-05 23:40:30.0
1900-01-01 23:40:30.0
1900-01-02 00:00:00.0
~~END~~


SELECT * FROM Datetime_Operators_tbl1 WHERE col = CAST(4 as REAL);
SELECT * FROM Datetime_Operators_tbl1 WHERE col > CAST(4 as REAL);
SELECT * FROM Datetime_Operators_tbl1 WHERE col >= CAST(4 as REAL);
SELECT * FROM Datetime_Operators_tbl1 WHERE col < CAST(4 as REAL);
SELECT * FROM Datetime_Operators_tbl1 WHERE col <= CAST(4 as REAL);
SELECT * FROM Datetime_Operators_tbl1 WHERE col != CAST(4 as REAL);
GO
~~START~~
datetime
1900-01-05 00:00:00.0
~~END~~

~~START~~
datetime
1900-01-05 23:40:30.0
~~END~~

~~START~~
datetime
1900-01-05 00:00:00.0
1900-01-05 23:40:30.0
~~END~~

~~START~~
datetime
1900-01-01 23:40:30.0
1900-01-02 00:00:00.0
~~END~~

~~START~~
datetime
1900-01-05 00:00:00.0
1900-01-01 23:40:30.0
1900-01-02 00:00:00.0
~~END~~

~~START~~
datetime
1900-01-05 23:40:30.0
1900-01-01 23:40:30.0
1900-01-02 00:00:00.0
~~END~~


SELECT * FROM Datetime_Operators_tbl1 WHERE col = CAST(4 as INT);
SELECT * FROM Datetime_Operators_tbl1 WHERE col > CAST(4 as INT);
SELECT * FROM Datetime_Operators_tbl1 WHERE col >= CAST(4 as INT);
SELECT * FROM Datetime_Operators_tbl1 WHERE col < CAST(4 as INT);
SELECT * FROM Datetime_Operators_tbl1 WHERE col <= CAST(4 as INT);
SELECT * FROM Datetime_Operators_tbl1 WHERE col != CAST(4 as INT);
GO
~~START~~
datetime
1900-01-05 00:00:00.0
~~END~~

~~START~~
datetime
1900-01-05 23:40:30.0
~~END~~

~~START~~
datetime
1900-01-05 00:00:00.0
1900-01-05 23:40:30.0
~~END~~

~~START~~
datetime
1900-01-01 23:40:30.0
1900-01-02 00:00:00.0
~~END~~

~~START~~
datetime
1900-01-05 00:00:00.0
1900-01-01 23:40:30.0
1900-01-02 00:00:00.0
~~END~~

~~START~~
datetime
1900-01-05 23:40:30.0
1900-01-01 23:40:30.0
1900-01-02 00:00:00.0
~~END~~


SELECT * FROM Datetime_Operators_tbl1 WHERE col = CAST(4 as BIGINT);
SELECT * FROM Datetime_Operators_tbl1 WHERE col > CAST(4 as BIGINT);
SELECT * FROM Datetime_Operators_tbl1 WHERE col >= CAST(4 as BIGINT);
SELECT * FROM Datetime_Operators_tbl1 WHERE col < CAST(4 as BIGINT);
SELECT * FROM Datetime_Operators_tbl1 WHERE col <= CAST(4 as BIGINT);
SELECT * FROM Datetime_Operators_tbl1 WHERE col != CAST(4 as BIGINT);
GO
~~START~~
datetime
1900-01-05 00:00:00.0
~~END~~

~~START~~
datetime
1900-01-05 23:40:30.0
~~END~~

~~START~~
datetime
1900-01-05 00:00:00.0
1900-01-05 23:40:30.0
~~END~~

~~START~~
datetime
1900-01-01 23:40:30.0
1900-01-02 00:00:00.0
~~END~~

~~START~~
datetime
1900-01-05 00:00:00.0
1900-01-01 23:40:30.0
1900-01-02 00:00:00.0
~~END~~

~~START~~
datetime
1900-01-05 23:40:30.0
1900-01-01 23:40:30.0
1900-01-02 00:00:00.0
~~END~~


SELECT * FROM Datetime_Operators_tbl1 WHERE col = CAST(4 as SMALLINT);
SELECT * FROM Datetime_Operators_tbl1 WHERE col > CAST(4 as SMALLINT);
SELECT * FROM Datetime_Operators_tbl1 WHERE col >= CAST(4 as SMALLINT);
SELECT * FROM Datetime_Operators_tbl1 WHERE col < CAST(4 as SMALLINT);
SELECT * FROM Datetime_Operators_tbl1 WHERE col <= CAST(4 as SMALLINT);
SELECT * FROM Datetime_Operators_tbl1 WHERE col != CAST(4 as SMALLINT);
GO
~~START~~
datetime
1900-01-05 00:00:00.0
~~END~~

~~START~~
datetime
1900-01-05 23:40:30.0
~~END~~

~~START~~
datetime
1900-01-05 00:00:00.0
1900-01-05 23:40:30.0
~~END~~

~~START~~
datetime
1900-01-01 23:40:30.0
1900-01-02 00:00:00.0
~~END~~

~~START~~
datetime
1900-01-05 00:00:00.0
1900-01-01 23:40:30.0
1900-01-02 00:00:00.0
~~END~~

~~START~~
datetime
1900-01-05 23:40:30.0
1900-01-01 23:40:30.0
1900-01-02 00:00:00.0
~~END~~


SELECT * FROM Datetime_Operators_tbl1 WHERE col = CAST(4 as TINYINT);
SELECT * FROM Datetime_Operators_tbl1 WHERE col > CAST(4 as TINYINT);
SELECT * FROM Datetime_Operators_tbl1 WHERE col >= CAST(4 as TINYINT);
SELECT * FROM Datetime_Operators_tbl1 WHERE col < CAST(4 as TINYINT);
SELECT * FROM Datetime_Operators_tbl1 WHERE col <= CAST(4 as TINYINT);
SELECT * FROM Datetime_Operators_tbl1 WHERE col != CAST(4 as TINYINT);
GO
~~START~~
datetime
1900-01-05 00:00:00.0
~~END~~

~~START~~
datetime
1900-01-05 23:40:30.0
~~END~~

~~START~~
datetime
1900-01-05 00:00:00.0
1900-01-05 23:40:30.0
~~END~~

~~START~~
datetime
1900-01-01 23:40:30.0
1900-01-02 00:00:00.0
~~END~~

~~START~~
datetime
1900-01-05 00:00:00.0
1900-01-01 23:40:30.0
1900-01-02 00:00:00.0
~~END~~

~~START~~
datetime
1900-01-05 23:40:30.0
1900-01-01 23:40:30.0
1900-01-02 00:00:00.0
~~END~~


SELECT * FROM Datetime_Operators_tbl1 WHERE col = CAST(4 as MONEY);
SELECT * FROM Datetime_Operators_tbl1 WHERE col > CAST(4 as MONEY);
SELECT * FROM Datetime_Operators_tbl1 WHERE col >= CAST(4 as MONEY);
SELECT * FROM Datetime_Operators_tbl1 WHERE col < CAST(4 as MONEY);
SELECT * FROM Datetime_Operators_tbl1 WHERE col <= CAST(4 as MONEY);
SELECT * FROM Datetime_Operators_tbl1 WHERE col != CAST(4 as MONEY);
GO
~~START~~
datetime
1900-01-05 00:00:00.0
~~END~~

~~START~~
datetime
1900-01-05 23:40:30.0
~~END~~

~~START~~
datetime
1900-01-05 00:00:00.0
1900-01-05 23:40:30.0
~~END~~

~~START~~
datetime
1900-01-01 23:40:30.0
1900-01-02 00:00:00.0
~~END~~

~~START~~
datetime
1900-01-05 00:00:00.0
1900-01-01 23:40:30.0
1900-01-02 00:00:00.0
~~END~~

~~START~~
datetime
1900-01-05 23:40:30.0
1900-01-01 23:40:30.0
1900-01-02 00:00:00.0
~~END~~


SELECT * FROM Datetime_Operators_tbl1 WHERE col = CAST(4 as SMALLMONEY);
SELECT * FROM Datetime_Operators_tbl1 WHERE col > CAST(4 as SMALLMONEY);
SELECT * FROM Datetime_Operators_tbl1 WHERE col >= CAST(4 as SMALLMONEY);
SELECT * FROM Datetime_Operators_tbl1 WHERE col < CAST(4 as SMALLMONEY);
SELECT * FROM Datetime_Operators_tbl1 WHERE col <= CAST(4 as SMALLMONEY);
SELECT * FROM Datetime_Operators_tbl1 WHERE col != CAST(4 as SMALLMONEY);
GO
~~START~~
datetime
1900-01-05 00:00:00.0
~~END~~

~~START~~
datetime
1900-01-05 23:40:30.0
~~END~~

~~START~~
datetime
1900-01-05 00:00:00.0
1900-01-05 23:40:30.0
~~END~~

~~START~~
datetime
1900-01-01 23:40:30.0
1900-01-02 00:00:00.0
~~END~~

~~START~~
datetime
1900-01-05 00:00:00.0
1900-01-01 23:40:30.0
1900-01-02 00:00:00.0
~~END~~

~~START~~
datetime
1900-01-05 23:40:30.0
1900-01-01 23:40:30.0
1900-01-02 00:00:00.0
~~END~~


SELECT * FROM Datetime_Operators_tbl1 WHERE col = NULL;
SELECT * FROM Datetime_Operators_tbl1 WHERE col > NULL;
SELECT * FROM Datetime_Operators_tbl1 WHERE col >= NULL;
SELECT * FROM Datetime_Operators_tbl1 WHERE col < NULL;
SELECT * FROM Datetime_Operators_tbl1 WHERE col <= NULL;
SELECT * FROM Datetime_Operators_tbl1 WHERE col != NULL;
GO
~~START~~
datetime
~~END~~

~~START~~
datetime
~~END~~

~~START~~
datetime
~~END~~

~~START~~
datetime
~~END~~

~~START~~
datetime
~~END~~

~~START~~
datetime
~~END~~


DROP TABLE Datetime_Operators_tbl1
GO

SELECT * FROM Datetime_Operators_tbl2 WHERE col = CAST(4 as BIT);
SELECT * FROM Datetime_Operators_tbl2 WHERE col > CAST(4 as BIT);
SELECT * FROM Datetime_Operators_tbl2 WHERE col >= CAST(4 as BIT);
SELECT * FROM Datetime_Operators_tbl2 WHERE col < CAST(4 as BIT);
SELECT * FROM Datetime_Operators_tbl2 WHERE col <= CAST(4 as BIT);
SELECT * FROM Datetime_Operators_tbl2 WHERE col != CAST(4 as BIT);
GO
~~START~~
smalldatetime
1900-01-02 00:00:00.0
~~END~~

~~START~~
smalldatetime
1900-01-05 00:00:00.0
1900-01-05 23:41:00.0
~~END~~

~~START~~
smalldatetime
1900-01-05 00:00:00.0
1900-01-05 23:41:00.0
1900-01-02 00:00:00.0
~~END~~

~~START~~
smalldatetime
1900-01-01 23:41:00.0
~~END~~

~~START~~
smalldatetime
1900-01-01 23:41:00.0
1900-01-02 00:00:00.0
~~END~~

~~START~~
smalldatetime
1900-01-05 00:00:00.0
1900-01-05 23:41:00.0
1900-01-01 23:41:00.0
~~END~~


SELECT * FROM Datetime_Operators_tbl2 WHERE col = CAST(4 as DECIMAL);
SELECT * FROM Datetime_Operators_tbl2 WHERE col > CAST(4 as DECIMAL);
SELECT * FROM Datetime_Operators_tbl2 WHERE col >= CAST(4 as DECIMAL);
SELECT * FROM Datetime_Operators_tbl2 WHERE col < CAST(4 as DECIMAL);
SELECT * FROM Datetime_Operators_tbl2 WHERE col <= CAST(4 as DECIMAL);
SELECT * FROM Datetime_Operators_tbl2 WHERE col != CAST(4 as DECIMAL);
GO
~~START~~
smalldatetime
1900-01-05 00:00:00.0
~~END~~

~~START~~
smalldatetime
1900-01-05 23:41:00.0
~~END~~

~~START~~
smalldatetime
1900-01-05 00:00:00.0
1900-01-05 23:41:00.0
~~END~~

~~START~~
smalldatetime
1900-01-01 23:41:00.0
1900-01-02 00:00:00.0
~~END~~

~~START~~
smalldatetime
1900-01-05 00:00:00.0
1900-01-01 23:41:00.0
1900-01-02 00:00:00.0
~~END~~

~~START~~
smalldatetime
1900-01-05 23:41:00.0
1900-01-01 23:41:00.0
1900-01-02 00:00:00.0
~~END~~


SELECT * FROM Datetime_Operators_tbl2 WHERE col = CAST(4 as NUMERIC);
SELECT * FROM Datetime_Operators_tbl2 WHERE col > CAST(4 as NUMERIC);
SELECT * FROM Datetime_Operators_tbl2 WHERE col >= CAST(4 as NUMERIC);
SELECT * FROM Datetime_Operators_tbl2 WHERE col < CAST(4 as NUMERIC);
SELECT * FROM Datetime_Operators_tbl2 WHERE col <= CAST(4 as NUMERIC);
SELECT * FROM Datetime_Operators_tbl2 WHERE col != CAST(4 as NUMERIC);
GO
~~START~~
smalldatetime
1900-01-05 00:00:00.0
~~END~~

~~START~~
smalldatetime
1900-01-05 23:41:00.0
~~END~~

~~START~~
smalldatetime
1900-01-05 00:00:00.0
1900-01-05 23:41:00.0
~~END~~

~~START~~
smalldatetime
1900-01-01 23:41:00.0
1900-01-02 00:00:00.0
~~END~~

~~START~~
smalldatetime
1900-01-05 00:00:00.0
1900-01-01 23:41:00.0
1900-01-02 00:00:00.0
~~END~~

~~START~~
smalldatetime
1900-01-05 23:41:00.0
1900-01-01 23:41:00.0
1900-01-02 00:00:00.0
~~END~~


SELECT * FROM Datetime_Operators_tbl2 WHERE col = CAST(4 as FLOAT);
SELECT * FROM Datetime_Operators_tbl2 WHERE col > CAST(4 as FLOAT);
SELECT * FROM Datetime_Operators_tbl2 WHERE col >= CAST(4 as FLOAT);
SELECT * FROM Datetime_Operators_tbl2 WHERE col < CAST(4 as FLOAT);
SELECT * FROM Datetime_Operators_tbl2 WHERE col <= CAST(4 as FLOAT);
SELECT * FROM Datetime_Operators_tbl2 WHERE col != CAST(4 as FLOAT);
GO
~~START~~
smalldatetime
1900-01-05 00:00:00.0
~~END~~

~~START~~
smalldatetime
1900-01-05 23:41:00.0
~~END~~

~~START~~
smalldatetime
1900-01-05 00:00:00.0
1900-01-05 23:41:00.0
~~END~~

~~START~~
smalldatetime
1900-01-01 23:41:00.0
1900-01-02 00:00:00.0
~~END~~

~~START~~
smalldatetime
1900-01-05 00:00:00.0
1900-01-01 23:41:00.0
1900-01-02 00:00:00.0
~~END~~

~~START~~
smalldatetime
1900-01-05 23:41:00.0
1900-01-01 23:41:00.0
1900-01-02 00:00:00.0
~~END~~


SELECT * FROM Datetime_Operators_tbl2 WHERE col = CAST(4 as REAL);
SELECT * FROM Datetime_Operators_tbl2 WHERE col > CAST(4 as REAL);
SELECT * FROM Datetime_Operators_tbl2 WHERE col >= CAST(4 as REAL);
SELECT * FROM Datetime_Operators_tbl2 WHERE col < CAST(4 as REAL);
SELECT * FROM Datetime_Operators_tbl2 WHERE col <= CAST(4 as REAL);
SELECT * FROM Datetime_Operators_tbl2 WHERE col != CAST(4 as REAL);
GO
~~START~~
smalldatetime
1900-01-05 00:00:00.0
~~END~~

~~START~~
smalldatetime
1900-01-05 23:41:00.0
~~END~~

~~START~~
smalldatetime
1900-01-05 00:00:00.0
1900-01-05 23:41:00.0
~~END~~

~~START~~
smalldatetime
1900-01-01 23:41:00.0
1900-01-02 00:00:00.0
~~END~~

~~START~~
smalldatetime
1900-01-05 00:00:00.0
1900-01-01 23:41:00.0
1900-01-02 00:00:00.0
~~END~~

~~START~~
smalldatetime
1900-01-05 23:41:00.0
1900-01-01 23:41:00.0
1900-01-02 00:00:00.0
~~END~~


SELECT * FROM Datetime_Operators_tbl2 WHERE col = CAST(4 as INT);
SELECT * FROM Datetime_Operators_tbl2 WHERE col > CAST(4 as INT);
SELECT * FROM Datetime_Operators_tbl2 WHERE col >= CAST(4 as INT);
SELECT * FROM Datetime_Operators_tbl2 WHERE col < CAST(4 as INT);
SELECT * FROM Datetime_Operators_tbl2 WHERE col <= CAST(4 as INT);
SELECT * FROM Datetime_Operators_tbl2 WHERE col != CAST(4 as INT);
GO
~~START~~
smalldatetime
1900-01-05 00:00:00.0
~~END~~

~~START~~
smalldatetime
1900-01-05 23:41:00.0
~~END~~

~~START~~
smalldatetime
1900-01-05 00:00:00.0
1900-01-05 23:41:00.0
~~END~~

~~START~~
smalldatetime
1900-01-01 23:41:00.0
1900-01-02 00:00:00.0
~~END~~

~~START~~
smalldatetime
1900-01-05 00:00:00.0
1900-01-01 23:41:00.0
1900-01-02 00:00:00.0
~~END~~

~~START~~
smalldatetime
1900-01-05 23:41:00.0
1900-01-01 23:41:00.0
1900-01-02 00:00:00.0
~~END~~


SELECT * FROM Datetime_Operators_tbl2 WHERE col = CAST(4 as BIGINT);
SELECT * FROM Datetime_Operators_tbl2 WHERE col > CAST(4 as BIGINT);
SELECT * FROM Datetime_Operators_tbl2 WHERE col >= CAST(4 as BIGINT);
SELECT * FROM Datetime_Operators_tbl2 WHERE col < CAST(4 as BIGINT);
SELECT * FROM Datetime_Operators_tbl2 WHERE col <= CAST(4 as BIGINT);
SELECT * FROM Datetime_Operators_tbl2 WHERE col != CAST(4 as BIGINT);
GO
~~START~~
smalldatetime
1900-01-05 00:00:00.0
~~END~~

~~START~~
smalldatetime
1900-01-05 23:41:00.0
~~END~~

~~START~~
smalldatetime
1900-01-05 00:00:00.0
1900-01-05 23:41:00.0
~~END~~

~~START~~
smalldatetime
1900-01-01 23:41:00.0
1900-01-02 00:00:00.0
~~END~~

~~START~~
smalldatetime
1900-01-05 00:00:00.0
1900-01-01 23:41:00.0
1900-01-02 00:00:00.0
~~END~~

~~START~~
smalldatetime
1900-01-05 23:41:00.0
1900-01-01 23:41:00.0
1900-01-02 00:00:00.0
~~END~~


SELECT * FROM Datetime_Operators_tbl2 WHERE col = CAST(4 as SMALLINT);
SELECT * FROM Datetime_Operators_tbl2 WHERE col > CAST(4 as SMALLINT);
SELECT * FROM Datetime_Operators_tbl2 WHERE col >= CAST(4 as SMALLINT);
SELECT * FROM Datetime_Operators_tbl2 WHERE col < CAST(4 as SMALLINT);
SELECT * FROM Datetime_Operators_tbl2 WHERE col <= CAST(4 as SMALLINT);
SELECT * FROM Datetime_Operators_tbl2 WHERE col != CAST(4 as SMALLINT);
GO
~~START~~
smalldatetime
1900-01-05 00:00:00.0
~~END~~

~~START~~
smalldatetime
1900-01-05 23:41:00.0
~~END~~

~~START~~
smalldatetime
1900-01-05 00:00:00.0
1900-01-05 23:41:00.0
~~END~~

~~START~~
smalldatetime
1900-01-01 23:41:00.0
1900-01-02 00:00:00.0
~~END~~

~~START~~
smalldatetime
1900-01-05 00:00:00.0
1900-01-01 23:41:00.0
1900-01-02 00:00:00.0
~~END~~

~~START~~
smalldatetime
1900-01-05 23:41:00.0
1900-01-01 23:41:00.0
1900-01-02 00:00:00.0
~~END~~


SELECT * FROM Datetime_Operators_tbl2 WHERE col = CAST(4 as TINYINT);
SELECT * FROM Datetime_Operators_tbl2 WHERE col > CAST(4 as TINYINT);
SELECT * FROM Datetime_Operators_tbl2 WHERE col >= CAST(4 as TINYINT);
SELECT * FROM Datetime_Operators_tbl2 WHERE col < CAST(4 as TINYINT);
SELECT * FROM Datetime_Operators_tbl2 WHERE col <= CAST(4 as TINYINT);
SELECT * FROM Datetime_Operators_tbl2 WHERE col != CAST(4 as TINYINT);
GO
~~START~~
smalldatetime
1900-01-05 00:00:00.0
~~END~~

~~START~~
smalldatetime
1900-01-05 23:41:00.0
~~END~~

~~START~~
smalldatetime
1900-01-05 00:00:00.0
1900-01-05 23:41:00.0
~~END~~

~~START~~
smalldatetime
1900-01-01 23:41:00.0
1900-01-02 00:00:00.0
~~END~~

~~START~~
smalldatetime
1900-01-05 00:00:00.0
1900-01-01 23:41:00.0
1900-01-02 00:00:00.0
~~END~~

~~START~~
smalldatetime
1900-01-05 23:41:00.0
1900-01-01 23:41:00.0
1900-01-02 00:00:00.0
~~END~~


SELECT * FROM Datetime_Operators_tbl2 WHERE col = CAST(4 as MONEY);
SELECT * FROM Datetime_Operators_tbl2 WHERE col > CAST(4 as MONEY);
SELECT * FROM Datetime_Operators_tbl2 WHERE col >= CAST(4 as MONEY);
SELECT * FROM Datetime_Operators_tbl2 WHERE col < CAST(4 as MONEY);
SELECT * FROM Datetime_Operators_tbl2 WHERE col <= CAST(4 as MONEY);
SELECT * FROM Datetime_Operators_tbl2 WHERE col != CAST(4 as MONEY);
GO
~~START~~
smalldatetime
1900-01-05 00:00:00.0
~~END~~

~~START~~
smalldatetime
1900-01-05 23:41:00.0
~~END~~

~~START~~
smalldatetime
1900-01-05 00:00:00.0
1900-01-05 23:41:00.0
~~END~~

~~START~~
smalldatetime
1900-01-01 23:41:00.0
1900-01-02 00:00:00.0
~~END~~

~~START~~
smalldatetime
1900-01-05 00:00:00.0
1900-01-01 23:41:00.0
1900-01-02 00:00:00.0
~~END~~

~~START~~
smalldatetime
1900-01-05 23:41:00.0
1900-01-01 23:41:00.0
1900-01-02 00:00:00.0
~~END~~


SELECT * FROM Datetime_Operators_tbl2 WHERE col = CAST(4 as SMALLMONEY);
SELECT * FROM Datetime_Operators_tbl2 WHERE col > CAST(4 as SMALLMONEY);
SELECT * FROM Datetime_Operators_tbl2 WHERE col >= CAST(4 as SMALLMONEY);
SELECT * FROM Datetime_Operators_tbl2 WHERE col < CAST(4 as SMALLMONEY);
SELECT * FROM Datetime_Operators_tbl2 WHERE col <= CAST(4 as SMALLMONEY);
SELECT * FROM Datetime_Operators_tbl2 WHERE col != CAST(4 as SMALLMONEY);
GO
~~START~~
smalldatetime
1900-01-05 00:00:00.0
~~END~~

~~START~~
smalldatetime
1900-01-05 23:41:00.0
~~END~~

~~START~~
smalldatetime
1900-01-05 00:00:00.0
1900-01-05 23:41:00.0
~~END~~

~~START~~
smalldatetime
1900-01-01 23:41:00.0
1900-01-02 00:00:00.0
~~END~~

~~START~~
smalldatetime
1900-01-05 00:00:00.0
1900-01-01 23:41:00.0
1900-01-02 00:00:00.0
~~END~~

~~START~~
smalldatetime
1900-01-05 23:41:00.0
1900-01-01 23:41:00.0
1900-01-02 00:00:00.0
~~END~~


SELECT * FROM Datetime_Operators_tbl2 WHERE col = NULL;
SELECT * FROM Datetime_Operators_tbl2 WHERE col > NULL;
SELECT * FROM Datetime_Operators_tbl2 WHERE col >= NULL;
SELECT * FROM Datetime_Operators_tbl2 WHERE col < NULL;
SELECT * FROM Datetime_Operators_tbl2 WHERE col <= NULL;
SELECT * FROM Datetime_Operators_tbl2 WHERE col != NULL;
GO
~~START~~
smalldatetime
~~END~~

~~START~~
smalldatetime
~~END~~

~~START~~
smalldatetime
~~END~~

~~START~~
smalldatetime
~~END~~

~~START~~
smalldatetime
~~END~~

~~START~~
smalldatetime
~~END~~


DROP TABLE Datetime_Operators_tbl2
GO

-- Tables
ALTER TABLE Datetime_tbl1 ADD CONSTRAINT Datetime_constraint1 DEFAULT CAST(0 as BIT) FOR c1
INSERT INTO Datetime_tbl1 VALUES(DEFAULT)
INSERT INTO Datetime_tbl1 VALUES(CAST(1.5 as BIT))
GO
~~ROW COUNT: 1~~

~~ROW COUNT: 1~~

SELECT * FROM Datetime_tbl1
GO
~~START~~
datetime#!#int
1900-01-01 00:00:00.0#!#0
1900-01-02 00:00:00.0#!#1
~~END~~

DELETE FROM Datetime_tbl1 WHERE c1 IS NOT NULL
GO
~~ROW COUNT: 2~~



ALTER TABLE Datetime_tbl1 ADD CONSTRAINT Datetime_constraint2 DEFAULT CAST(2 as DECIMAL) FOR c1
GO
INSERT INTO Datetime_tbl1 VALUES(DEFAULT)
INSERT INTO Datetime_tbl1 VALUES(CAST(1.5 as DECIMAL))
GO
~~ROW COUNT: 1~~

~~ROW COUNT: 1~~

SELECT * FROM Datetime_tbl1
GO
~~START~~
datetime#!#int
1900-01-03 00:00:00.0#!#2
1900-01-03 00:00:00.0#!#2
~~END~~

DELETE FROM Datetime_tbl1 WHERE c1 IS NOT NULL
GO
~~ROW COUNT: 2~~


ALTER TABLE Datetime_tbl1 ADD CONSTRAINT Datetime_constraint3 DEFAULT CAST(2 as NUMERIC) FOR c1
GO
INSERT INTO Datetime_tbl1 VALUES(DEFAULT)
INSERT INTO Datetime_tbl1 VALUES(CAST(1.5 as NUMERIC))
GO
~~ROW COUNT: 1~~

~~ROW COUNT: 1~~

SELECT * FROM Datetime_tbl1
GO
~~START~~
datetime#!#int
1900-01-03 00:00:00.0#!#2
1900-01-03 00:00:00.0#!#2
~~END~~

DELETE FROM Datetime_tbl1 WHERE c1 IS NOT NULL
GO
~~ROW COUNT: 2~~


ALTER TABLE Datetime_tbl1 ADD CONSTRAINT Datetime_constraint4 DEFAULT CAST(2 as FLOAT) FOR c1
GO
INSERT INTO Datetime_tbl1 VALUES(DEFAULT)
INSERT INTO Datetime_tbl1 VALUES(CAST(1.5 as FLOAT))
GO
~~ROW COUNT: 1~~

~~ROW COUNT: 1~~

SELECT * FROM Datetime_tbl1
GO
~~START~~
datetime#!#int
1900-01-03 00:00:00.0#!#2
1900-01-02 12:00:00.0#!#1
~~END~~

DELETE FROM Datetime_tbl1 WHERE c1 IS NOT NULL
GO
~~ROW COUNT: 2~~


ALTER TABLE Datetime_tbl1 ADD CONSTRAINT Datetime_constraint5 DEFAULT CAST(2 as REAL) FOR c1
GO
INSERT INTO Datetime_tbl1 VALUES(DEFAULT)
INSERT INTO Datetime_tbl1 VALUES(CAST(1.5 as REAL))
GO
~~ROW COUNT: 1~~

~~ROW COUNT: 1~~

SELECT * FROM Datetime_tbl1
GO
~~START~~
datetime#!#int
1900-01-03 00:00:00.0#!#2
1900-01-02 12:00:00.0#!#1
~~END~~

DELETE FROM Datetime_tbl1 WHERE c1 IS NOT NULL
GO
~~ROW COUNT: 2~~


ALTER TABLE Datetime_tbl1 ADD CONSTRAINT Datetime_constraint6 DEFAULT CAST(2 as INT) FOR c1
GO
INSERT INTO Datetime_tbl1 VALUES(DEFAULT)
INSERT INTO Datetime_tbl1 VALUES(CAST(1.5 as INT))
GO
~~ROW COUNT: 1~~

~~ROW COUNT: 1~~

SELECT * FROM Datetime_tbl1
GO
~~START~~
datetime#!#int
1900-01-03 00:00:00.0#!#2
1900-01-02 00:00:00.0#!#1
~~END~~

DELETE FROM Datetime_tbl1 WHERE c1 IS NOT NULL
GO
~~ROW COUNT: 2~~


ALTER TABLE Datetime_tbl1 ADD CONSTRAINT Datetime_constraint7 DEFAULT CAST(2 as BIGINT) FOR c1
GO
INSERT INTO Datetime_tbl1 VALUES(DEFAULT)
INSERT INTO Datetime_tbl1 VALUES(CAST(1.5 as BIGINT))
GO
~~ROW COUNT: 1~~

~~ROW COUNT: 1~~

SELECT * FROM Datetime_tbl1
GO
~~START~~
datetime#!#int
1900-01-03 00:00:00.0#!#2
1900-01-02 00:00:00.0#!#1
~~END~~

DELETE FROM Datetime_tbl1 WHERE c1 IS NOT NULL
GO
~~ROW COUNT: 2~~


ALTER TABLE Datetime_tbl1 ADD CONSTRAINT Datetime_constraint8 DEFAULT CAST(2 as SMALLINT) FOR c1
GO
INSERT INTO Datetime_tbl1 VALUES(DEFAULT)
INSERT INTO Datetime_tbl1 VALUES(CAST(1.5 as SMALLINT))
GO
~~ROW COUNT: 1~~

~~ROW COUNT: 1~~

SELECT * FROM Datetime_tbl1
GO
~~START~~
datetime#!#int
1900-01-03 00:00:00.0#!#2
1900-01-02 00:00:00.0#!#1
~~END~~

DELETE FROM Datetime_tbl1 WHERE c1 IS NOT NULL
GO
~~ROW COUNT: 2~~


ALTER TABLE Datetime_tbl1 ADD CONSTRAINT Datetime_constraint9 DEFAULT CAST(2 as TINYINT) FOR c1
GO
INSERT INTO Datetime_tbl1 VALUES(DEFAULT)
INSERT INTO Datetime_tbl1 VALUES(CAST(1.5 as TINYINT))
GO
~~ROW COUNT: 1~~

~~ROW COUNT: 1~~

SELECT * FROM Datetime_tbl1
GO
~~START~~
datetime#!#int
1900-01-03 00:00:00.0#!#2
1900-01-02 00:00:00.0#!#1
~~END~~

DELETE FROM Datetime_tbl1 WHERE c1 IS NOT NULL
GO
~~ROW COUNT: 2~~


ALTER TABLE Datetime_tbl1 ADD CONSTRAINT Datetime_constraint10 DEFAULT CAST(2 as MONEY) FOR c1
GO
INSERT INTO Datetime_tbl1 VALUES(DEFAULT)
INSERT INTO Datetime_tbl1 VALUES(CAST(1.5 as MONEY))
GO
~~ROW COUNT: 1~~

~~ROW COUNT: 1~~

SELECT * FROM Datetime_tbl1
GO
~~START~~
datetime#!#int
1900-01-03 00:00:00.0#!#2
1900-01-02 12:00:00.0#!#1
~~END~~

DELETE FROM Datetime_tbl1 WHERE c1 IS NOT NULL
GO
~~ROW COUNT: 2~~


ALTER TABLE Datetime_tbl1 ADD CONSTRAINT Datetime_constraint11 DEFAULT CAST(2 as SMALLMONEY) FOR c1
GO
INSERT INTO Datetime_tbl1 VALUES(DEFAULT)
INSERT INTO Datetime_tbl1 VALUES(CAST(1.5 as SMALLMONEY))
GO
~~ROW COUNT: 1~~

~~ROW COUNT: 1~~

SELECT * FROM Datetime_tbl1
GO
~~START~~
datetime#!#int
1900-01-03 00:00:00.0#!#2
1900-01-02 12:00:00.0#!#1
~~END~~

DELETE FROM Datetime_tbl1 WHERE c1 IS NOT NULL
GO
~~ROW COUNT: 2~~


ALTER TABLE Datetime_tbl1 ADD CONSTRAINT Datetime_constraint12 DEFAULT NULL FOR c1
GO
INSERT INTO Datetime_tbl1 VALUES(DEFAULT)
INSERT INTO Datetime_tbl1 VALUES(NULL)
GO
~~ROW COUNT: 1~~

~~ROW COUNT: 1~~

SELECT * FROM Datetime_tbl1
GO
~~START~~
datetime#!#int
<NULL>#!#<NULL>
<NULL>#!#<NULL>
~~END~~

DELETE FROM Datetime_tbl1 WHERE c1 IS NOT NULL
GO

DROP TABLE datetime_tbl1
GO

ALTER TABLE Datetime_tbl2 ADD CONSTRAINT Datetime_constraint13 DEFAULT CAST(0 as BIT) FOR c1
INSERT INTO Datetime_tbl2 VALUES(DEFAULT)
INSERT INTO Datetime_tbl2 VALUES(CAST(1.5 as BIT))
GO
~~ROW COUNT: 1~~

~~ROW COUNT: 1~~

SELECT * FROM Datetime_tbl2
GO
~~START~~
smalldatetime#!#int
1900-01-01 00:00:00.0#!#0
1900-01-02 00:00:00.0#!#1
~~END~~

DELETE FROM Datetime_tbl2 WHERE c1 IS NOT NULL
GO
~~ROW COUNT: 2~~



ALTER TABLE Datetime_tbl2 ADD CONSTRAINT Datetime_constraint14 DEFAULT CAST(2 as DECIMAL) FOR c1
GO
INSERT INTO Datetime_tbl2 VALUES(DEFAULT)
INSERT INTO Datetime_tbl2 VALUES(CAST(1.5 as DECIMAL))
GO
~~ROW COUNT: 1~~

~~ROW COUNT: 1~~

SELECT * FROM Datetime_tbl2
GO
~~START~~
smalldatetime#!#int
1900-01-03 00:00:00.0#!#2
1900-01-03 00:00:00.0#!#2
~~END~~

DELETE FROM Datetime_tbl2 WHERE c1 IS NOT NULL
GO
~~ROW COUNT: 2~~


ALTER TABLE Datetime_tbl2 ADD CONSTRAINT Datetime_constraint15 DEFAULT CAST(2 as NUMERIC) FOR c1
GO
INSERT INTO Datetime_tbl2 VALUES(DEFAULT)
INSERT INTO Datetime_tbl2 VALUES(CAST(1.5 as NUMERIC))
GO
~~ROW COUNT: 1~~

~~ROW COUNT: 1~~

SELECT * FROM Datetime_tbl2
GO
~~START~~
smalldatetime#!#int
1900-01-03 00:00:00.0#!#2
1900-01-03 00:00:00.0#!#2
~~END~~

DELETE FROM Datetime_tbl2 WHERE c1 IS NOT NULL
GO
~~ROW COUNT: 2~~


ALTER TABLE Datetime_tbl2 ADD CONSTRAINT Datetime_constrain16 DEFAULT CAST(2 as FLOAT) FOR c1
GO
INSERT INTO Datetime_tbl2 VALUES(DEFAULT)
INSERT INTO Datetime_tbl2 VALUES(CAST(1.5 as FLOAT))
GO
~~ROW COUNT: 1~~

~~ROW COUNT: 1~~

SELECT * FROM Datetime_tbl2
GO
~~START~~
smalldatetime#!#int
1900-01-03 00:00:00.0#!#2
1900-01-02 12:00:00.0#!#1
~~END~~

DELETE FROM Datetime_tbl2 WHERE c1 IS NOT NULL
GO
~~ROW COUNT: 2~~


ALTER TABLE Datetime_tbl2 ADD CONSTRAINT Datetime_constraint17 DEFAULT CAST(2 as REAL) FOR c1
GO
INSERT INTO Datetime_tbl2 VALUES(DEFAULT)
INSERT INTO Datetime_tbl2 VALUES(CAST(1.5 as REAL))
GO
~~ROW COUNT: 1~~

~~ROW COUNT: 1~~

SELECT * FROM Datetime_tbl2
GO
~~START~~
smalldatetime#!#int
1900-01-03 00:00:00.0#!#2
1900-01-02 12:00:00.0#!#1
~~END~~

DELETE FROM Datetime_tbl2 WHERE c1 IS NOT NULL
GO
~~ROW COUNT: 2~~


ALTER TABLE Datetime_tbl2 ADD CONSTRAINT Datetime_constraint18 DEFAULT CAST(2 as INT) FOR c1
GO
INSERT INTO Datetime_tbl2 VALUES(DEFAULT)
INSERT INTO Datetime_tbl2 VALUES(CAST(1.5 as INT))
GO
~~ROW COUNT: 1~~

~~ROW COUNT: 1~~

SELECT * FROM Datetime_tbl2
GO
~~START~~
smalldatetime#!#int
1900-01-03 00:00:00.0#!#2
1900-01-02 00:00:00.0#!#1
~~END~~

DELETE FROM Datetime_tbl2 WHERE c1 IS NOT NULL
GO
~~ROW COUNT: 2~~


ALTER TABLE Datetime_tbl2 ADD CONSTRAINT Datetime_constraint19 DEFAULT CAST(2 as BIGINT) FOR c1
GO
INSERT INTO Datetime_tbl2 VALUES(DEFAULT)
INSERT INTO Datetime_tbl2 VALUES(CAST(1.5 as BIGINT))
GO
~~ROW COUNT: 1~~

~~ROW COUNT: 1~~

SELECT * FROM Datetime_tbl2
GO
~~START~~
smalldatetime#!#int
1900-01-03 00:00:00.0#!#2
1900-01-02 00:00:00.0#!#1
~~END~~

DELETE FROM Datetime_tbl2 WHERE c1 IS NOT NULL
GO
~~ROW COUNT: 2~~


ALTER TABLE Datetime_tbl2 ADD CONSTRAINT Datetime_constraint20 DEFAULT CAST(2 as SMALLINT) FOR c1
GO
INSERT INTO Datetime_tbl2 VALUES(DEFAULT)
INSERT INTO Datetime_tbl2 VALUES(CAST(1.5 as SMALLINT))
GO
~~ROW COUNT: 1~~

~~ROW COUNT: 1~~

SELECT * FROM Datetime_tbl2
GO
~~START~~
smalldatetime#!#int
1900-01-03 00:00:00.0#!#2
1900-01-02 00:00:00.0#!#1
~~END~~

DELETE FROM Datetime_tbl2 WHERE c1 IS NOT NULL
GO
~~ROW COUNT: 2~~


ALTER TABLE Datetime_tbl2 ADD CONSTRAINT Datetime_constraint21 DEFAULT CAST(2 as TINYINT) FOR c1
GO
INSERT INTO Datetime_tbl2 VALUES(DEFAULT)
INSERT INTO Datetime_tbl2 VALUES(CAST(1.5 as TINYINT))
GO
~~ROW COUNT: 1~~

~~ROW COUNT: 1~~

SELECT * FROM Datetime_tbl2
GO
~~START~~
smalldatetime#!#int
1900-01-03 00:00:00.0#!#2
1900-01-02 00:00:00.0#!#1
~~END~~

DELETE FROM Datetime_tbl2 WHERE c1 IS NOT NULL
GO
~~ROW COUNT: 2~~


ALTER TABLE Datetime_tbl2 ADD CONSTRAINT Datetime_constraint22 DEFAULT CAST(2 as MONEY) FOR c1
GO
INSERT INTO Datetime_tbl2 VALUES(DEFAULT)
INSERT INTO Datetime_tbl2 VALUES(CAST(1.5 as MONEY))
GO
~~ROW COUNT: 1~~

~~ROW COUNT: 1~~

SELECT * FROM Datetime_tbl2
GO
~~START~~
smalldatetime#!#int
1900-01-03 00:00:00.0#!#2
1900-01-02 12:00:00.0#!#1
~~END~~

DELETE FROM Datetime_tbl2 WHERE c1 IS NOT NULL
GO
~~ROW COUNT: 2~~


ALTER TABLE Datetime_tbl2 ADD CONSTRAINT Datetime_constraint23 DEFAULT CAST(2 as SMALLMONEY) FOR c1
GO
INSERT INTO Datetime_tbl2 VALUES(DEFAULT)
INSERT INTO Datetime_tbl2 VALUES(CAST(1.5 as SMALLMONEY))
GO
~~ROW COUNT: 1~~

~~ROW COUNT: 1~~

SELECT * FROM Datetime_tbl2
GO
~~START~~
smalldatetime#!#int
1900-01-03 00:00:00.0#!#2
1900-01-02 12:00:00.0#!#1
~~END~~

DELETE FROM Datetime_tbl2 WHERE c1 IS NOT NULL
GO
~~ROW COUNT: 2~~


ALTER TABLE Datetime_tbl2 ADD CONSTRAINT Datetime_constraint24 DEFAULT NULL FOR c1
GO
INSERT INTO Datetime_tbl2 VALUES(DEFAULT)
INSERT INTO Datetime_tbl2 VALUES(NULL)
GO
~~ROW COUNT: 1~~

~~ROW COUNT: 1~~

SELECT * FROM Datetime_tbl2
GO
~~START~~
smalldatetime#!#int
<NULL>#!#<NULL>
<NULL>#!#<NULL>
~~END~~

DELETE FROM Datetime_tbl2 WHERE c1 IS NOT NULL
GO

DROP TABLE datetime_tbl2
GO

-- Procedures
EXEC Datetime_proc2 '1900-01-04 00:00:00', 3.1
GO
~~START~~
varchar
pass
~~END~~

EXEC Datetime_proc2 '1900-01-01 00:00:00', 0
GO
~~START~~
varchar
pass
~~END~~

EXEC Datetime_proc2 '1900-01-04 00:00:00', 2.5
GO
~~START~~
varchar
pass
~~END~~

EXEC Datetime_proc2 '1899-12-29 00:00:00', -2.5
GO
~~START~~
varchar
pass
~~END~~

DROP PROCEDURE Datetime_proc2
GO

EXEC Datetime_proc3 '1900-01-04 02:24:00', 3.1
GO
~~START~~
varchar
pass
~~END~~

EXEC Datetime_proc3 '1900-01-01 00:00:00', 0
GO
~~START~~
varchar
pass
~~END~~

EXEC Datetime_proc3 '1900-01-03 12:00:00', 2.5
GO
~~START~~
varchar
pass
~~END~~

EXEC Datetime_proc3 '1899-12-29 12:00:00', -2.5
GO
~~START~~
varchar
pass
~~END~~

DROP PROCEDURE Datetime_proc3
GO

EXEC Datetime_proc4 '1900-01-02 09:36:00', 1.4
GO
~~START~~
varchar
pass
~~END~~

EXEC Datetime_proc4 '1900-01-04 02:24:00', 3.1
GO
~~START~~
varchar
pass
~~END~~

EXEC Datetime_proc4 '1899-12-28 21:36:00', -3.1
GO
~~START~~
varchar
pass
~~END~~

DROP PROCEDURE Datetime_proc4
GO

EXEC Datetime_proc5 '1900-01-02 09:35:59.997', 1.4
GO
~~START~~
datetime
1900-01-02 09:35:59.997
~~END~~

~~START~~
datetime
1900-01-02 09:35:59.997
~~END~~

EXEC Datetime_proc5 '1900-01-04 02:23:59.99', 3.1
GO
~~START~~
datetime
1900-01-04 02:23:59.99
~~END~~

~~START~~
datetime
1900-01-04 02:23:59.99
~~END~~

EXEC Datetime_proc5 '1900-01-01 00:00:00.000', 0
GO
~~START~~
datetime
1900-01-01 00:00:00.0
~~END~~

~~START~~
datetime
1900-01-01 00:00:00.0
~~END~~

EXEC Datetime_proc5 '1900-01-02 00:00:00.000', 1
GO
~~START~~
datetime
1900-01-02 00:00:00.0
~~END~~

~~START~~
datetime
1900-01-02 00:00:00.0
~~END~~

EXEC Datetime_proc5 '1899-12-28 21:36:00.007', -3.1
GO
~~START~~
datetime
1899-12-28 21:36:00.007
~~END~~

~~START~~
datetime
1899-12-28 21:36:00.007
~~END~~

DROP PROCEDURE Datetime_proc5
GO

EXEC Datetime_proc6 '1900-01-02 00:00:00.000', 1.4
GO
~~START~~
varchar
pass
~~END~~

EXEC Datetime_proc6 '1900-01-04 00:00:00.000', 3.1
GO
~~START~~
varchar
pass
~~END~~

EXEC Datetime_proc6 '1899-12-30 00:00:00.000', -2.5
GO
~~START~~
varchar
pass
~~END~~

DROP PROCEDURE Datetime_proc6
GO

EXEC Datetime_proc7 '1900-01-02 00:00:00.000', 1.4
GO
~~START~~
varchar
pass
~~END~~

EXEC Datetime_proc7 '1900-01-04 00:00:00.000', 3.1
GO
~~START~~
varchar
pass
~~END~~

EXEC Datetime_proc7 '1899-12-30 00:00:00.000', -2.5
GO
~~START~~
varchar
pass
~~END~~

DROP PROCEDURE Datetime_proc7
GO

EXEC Datetime_proc8 '1900-01-02 00:00:00.000', 1.4
GO
~~START~~
varchar
pass
~~END~~

EXEC Datetime_proc8 '1989-09-18 00:00:00.000', 32767
GO
~~START~~
varchar
pass
~~END~~

EXEC Datetime_proc8 '1989-09-18 00:00:00.000', 32768
GO
~~ERROR (Code: 220)~~

~~ERROR (Message: smallint out of range)~~

DROP PROCEDURE Datetime_proc8
GO

EXEC Datetime_proc9 '1900-01-02 00:00:00.000', 1.4
GO
~~START~~
varchar
pass
~~END~~

EXEC Datetime_proc9 '1900-09-13 00:00:00.000', 255
GO
~~START~~
varchar
pass
~~END~~

EXEC Datetime_proc9 '1900-09-13 00:00:00.000', 256
GO
~~ERROR (Code: 220)~~

~~ERROR (Message: value for domain tinyint violates check constraint "tinyint_check")~~

DROP PROCEDURE Datetime_proc9
GO

EXEC Datetime_proc10 '1900-01-02 09:36:00.000', 1.4
GO
~~START~~
varchar
pass
~~END~~

EXEC Datetime_proc10 '1900-01-04 02:24:00.000', 3.1
GO
~~START~~
varchar
pass
~~END~~

EXEC Datetime_proc10 '1899-12-29 12:00:00.000', -2.5
GO
~~START~~
varchar
pass
~~END~~

DROP PROCEDURE Datetime_proc10
GO

EXEC Datetime_proc11 '1900-01-02 09:36:00.000', 1.4
GO
~~START~~
varchar
pass
~~END~~

EXEC Datetime_proc11 '1900-01-04 02:24:00.000', 3.1
GO
~~START~~
varchar
pass
~~END~~

EXEC Datetime_proc11 '1899-12-29 12:00:00.000', -2.5
GO
~~START~~
varchar
pass
~~END~~


EXEC Datetime_proc11 '1900-01-02 09:36:00.000', NULL
GO
~~START~~
varchar
fail
~~END~~

EXEC Datetime_proc11 '1900-01-04 02:24:00.000', NULL
GO
~~START~~
varchar
fail
~~END~~

DROP PROCEDURE Datetime_proc11
GO

EXEC SMALLDatetime_proc2 '1900-01-04 00:00:00', 3.1
GO
~~START~~
varchar
pass
~~END~~

EXEC SMALLDatetime_proc2 '1900-01-01 00:00:00', 0
GO
~~START~~
varchar
pass
~~END~~

EXEC SMALLDatetime_proc2 '1900-01-04 00:00:00', 2.5
GO
~~START~~
varchar
pass
~~END~~

EXEC SMALLDatetime_proc2 '1899-12-29 00:00:00', -2.5
GO
~~ERROR (Code: 33557097)~~

~~ERROR (Message: data out of range for smalldatetime)~~

DROP PROCEDURE SMALLDatetime_proc2
GO

EXEC SMALLDatetime_proc3 '1900-01-04 02:24:00', 3.1
GO
~~START~~
varchar
pass
~~END~~

EXEC SMALLDatetime_proc3 '1900-01-01 00:00:00', 0
GO
~~START~~
varchar
pass
~~END~~

EXEC SMALLDatetime_proc3 '1900-01-03 12:00:00', 2.5
GO
~~START~~
varchar
pass
~~END~~

DROP PROCEDURE SMALLDatetime_proc3
GO

-- Incorrect 
EXEC SMALLDatetime_proc4 '1900-01-02 09:36:00', 1.4
GO
~~START~~
varchar
fail
~~END~~

EXEC SMALLDatetime_proc4 '1900-01-04 02:24:00', 3.1
GO
~~START~~
varchar
pass
~~END~~

EXEC SMALLDatetime_proc4 '1899-12-28 21:36:00', -3.1
GO
~~ERROR (Code: 33557097)~~

~~ERROR (Message: data out of range for smalldatetime)~~

DROP PROCEDURE SMALLDatetime_proc4
GO

EXEC SMALLDatetime_proc5 '1900-01-02 09:35:59.997', 1.4
GO
~~START~~
smalldatetime
1900-01-02 09:36:00.0
~~END~~

~~START~~
smalldatetime
1900-01-02 09:36:00.0
~~END~~

EXEC SMALLDatetime_proc5 '1900-01-04 02:23:59.99', 3.1
GO
~~START~~
smalldatetime
1900-01-04 02:24:00.0
~~END~~

~~START~~
smalldatetime
1900-01-04 02:24:00.0
~~END~~

EXEC SMALLDatetime_proc5 '1900-01-01 00:00:00.000', 0
GO
~~START~~
smalldatetime
1900-01-01 00:00:00.0
~~END~~

~~START~~
smalldatetime
1900-01-01 00:00:00.0
~~END~~

EXEC SMALLDatetime_proc5 '1900-01-02 00:00:00.000', 1
GO
~~START~~
smalldatetime
1900-01-02 00:00:00.0
~~END~~

~~START~~
smalldatetime
1900-01-02 00:00:00.0
~~END~~

EXEC SMALLDatetime_proc5 '1899-12-28 21:36:00.007', -3.1
GO
~~ERROR (Code: 33557097)~~

~~ERROR (Message: data out of range for smalldatetime)~~

DROP PROCEDURE SMALLDatetime_proc5
GO

EXEC SMALLDatetime_proc6 '1900-01-02 00:00:00.000', 1.4
GO
~~START~~
varchar
pass
~~END~~

EXEC SMALLDatetime_proc6 '1900-01-04 00:00:00.000', 3.1
GO
~~START~~
varchar
pass
~~END~~

EXEC SMALLDatetime_proc6 '1899-12-30 00:00:00.000', -2.5
GO
~~ERROR (Code: 33557097)~~

~~ERROR (Message: data out of range for smalldatetime)~~

DROP PROCEDURE SMALLDatetime_proc6
GO

EXEC SMALLDatetime_proc7 '1900-01-02 00:00:00.000', 1.4
GO
~~START~~
varchar
pass
~~END~~

EXEC SMALLDatetime_proc7 '1900-01-04 00:00:00.000', 3.1
GO
~~START~~
varchar
pass
~~END~~

EXEC SMALLDatetime_proc7 '1899-12-30 00:00:00.000', -2.5
GO
~~ERROR (Code: 33557097)~~

~~ERROR (Message: data out of range for smalldatetime)~~

DROP PROCEDURE SMALLDatetime_proc7
GO

EXEC SMALLDatetime_proc8 '1900-01-02 00:00:00.000', 1.4
GO
~~START~~
varchar
pass
~~END~~

EXEC SMALLDatetime_proc8 '1989-09-18 00:00:00.000', 32767
GO
~~START~~
varchar
pass
~~END~~

EXEC SMALLDatetime_proc8 '1989-09-18 00:00:00.000', 32768
GO
~~ERROR (Code: 220)~~

~~ERROR (Message: smallint out of range)~~

DROP PROCEDURE SMALLDatetime_proc8
GO

EXEC SMALLDatetime_proc9 '1900-01-02 00:00:00.000', 1.4
GO
~~START~~
varchar
pass
~~END~~

EXEC SMALLDatetime_proc9 '1900-09-13 00:00:00.000', 255
GO
~~START~~
varchar
pass
~~END~~

EXEC SMALLDatetime_proc9 '1900-09-13 00:00:00.000', 256
GO
~~ERROR (Code: 220)~~

~~ERROR (Message: value for domain tinyint violates check constraint "tinyint_check")~~

DROP PROCEDURE SMALLDatetime_proc9
GO

-- Incorrect
EXEC SMALLDatetime_proc10 '1900-01-02 09:36:00.000', 1.4
GO
~~START~~
varchar
fail
~~END~~

EXEC SMALLDatetime_proc10 '1900-01-04 02:24:00.000', 3.1
GO
~~START~~
varchar
pass
~~END~~

EXEC SMALLDatetime_proc10 '1899-12-29 12:00:00.000', -2.5
GO
~~ERROR (Code: 33557097)~~

~~ERROR (Message: data out of range for smalldatetime)~~

DROP PROCEDURE SMALLDatetime_proc10
GO


--Incorrect
EXEC SMALLDatetime_proc11 '1900-01-02 09:36:00.000', 1.4
GO
~~START~~
varchar
fail
~~END~~

EXEC SMALLDatetime_proc11 '1900-01-04 02:24:00.000', 3.1
GO
~~START~~
varchar
pass
~~END~~

EXEC SMALLDatetime_proc11 '1899-12-29 12:00:00.000', -2.5
GO
~~ERROR (Code: 33557097)~~

~~ERROR (Message: data out of range for smalldatetime)~~


EXEC SMALLDatetime_proc11 '1900-01-02 09:36:00.000', NULL
GO
~~START~~
varchar
fail
~~END~~

EXEC SMALLDatetime_proc11 '1900-01-04 02:24:00.000', NULL
GO
~~START~~
varchar
fail
~~END~~

DROP PROCEDURE SMALLDatetime_proc11
GO

-- Union
SELECT datetimetype FROM Datetime_target_type_table UNION SELECT bittype FROM Datetime_source_type_table
GO
~~START~~
datetime
1900-01-01 00:00:00.0
2012-06-18 10:34:09.0
~~END~~


SELECT datetimetype FROM Datetime_target_type_table UNION SELECT decimaltype FROM Datetime_source_type_table
GO
~~START~~
datetime
2012-06-18 10:34:09.0
1900-01-03 00:00:00.0
~~END~~


SELECT datetimetype FROM Datetime_target_type_table UNION SELECT numerictype FROM Datetime_source_type_table
GO
~~START~~
datetime
2012-06-18 10:34:09.0
1900-01-03 00:00:00.0
~~END~~


SELECT datetimetype FROM Datetime_target_type_table UNION SELECT floattype FROM Datetime_source_type_table
GO
~~START~~
datetime
2012-06-18 10:34:09.0
1900-01-04 02:24:00.0
~~END~~


SELECT datetimetype FROM Datetime_target_type_table UNION SELECT realtype FROM Datetime_source_type_table
GO
~~START~~
datetime
2012-06-18 10:34:09.0
1900-01-05 04:47:59.983
~~END~~


SELECT datetimetype FROM Datetime_target_type_table UNION SELECT inttype FROM Datetime_source_type_table
GO
~~START~~
datetime
1900-01-06 00:00:00.0
2012-06-18 10:34:09.0
~~END~~


SELECT datetimetype FROM Datetime_target_type_table UNION SELECT biginttype FROM Datetime_source_type_table
GO
~~START~~
datetime
1900-01-07 00:00:00.0
2012-06-18 10:34:09.0
~~END~~


SELECT datetimetype FROM Datetime_target_type_table UNION SELECT smallinttype FROM Datetime_source_type_table
GO
~~START~~
datetime
1900-01-08 00:00:00.0
2012-06-18 10:34:09.0
~~END~~


SELECT datetimetype FROM Datetime_target_type_table UNION SELECT tinyinttype FROM Datetime_source_type_table
GO
~~START~~
datetime
1900-01-09 00:00:00.0
2012-06-18 10:34:09.0
~~END~~


SELECT datetimetype FROM Datetime_target_type_table UNION SELECT moneytype FROM Datetime_source_type_table
GO
~~START~~
datetime
1900-01-10 00:00:00.0
2012-06-18 10:34:09.0
~~END~~


SELECT datetimetype FROM Datetime_target_type_table UNION SELECT smallmonettype FROM Datetime_source_type_table
GO
~~START~~
datetime
1900-01-11 00:00:00.0
2012-06-18 10:34:09.0
~~END~~


SELECT datetimetype FROM Datetime_target_type_table UNION SELECT nulltype FROM Datetime_source_type_table
GO
~~START~~
datetime
<NULL>
2012-06-18 10:34:09.0
~~END~~


SELECT smalldatetimetype FROM Datetime_target_type_table UNION SELECT bittype FROM Datetime_source_type_table
GO
~~START~~
smalldatetime
1900-01-01 00:00:00.0
2018-07-24 06:31:00.0
~~END~~


SELECT smalldatetimetype FROM Datetime_target_type_table UNION SELECT decimaltype FROM Datetime_source_type_table
GO
~~START~~
smalldatetime
2018-07-24 06:31:00.0
1900-01-03 00:00:00.0
~~END~~


SELECT smalldatetimetype FROM Datetime_target_type_table UNION SELECT numerictype FROM Datetime_source_type_table
GO
~~START~~
smalldatetime
2018-07-24 06:31:00.0
1900-01-03 00:00:00.0
~~END~~


SELECT smalldatetimetype FROM Datetime_target_type_table UNION SELECT floattype FROM Datetime_source_type_table
GO
~~START~~
smalldatetime
2018-07-24 06:31:00.0
1900-01-04 02:24:00.0
~~END~~


SELECT smalldatetimetype FROM Datetime_target_type_table UNION SELECT realtype FROM Datetime_source_type_table
GO
~~START~~
smalldatetime
2018-07-24 06:31:00.0
1900-01-05 04:48:00.0
~~END~~


SELECT smalldatetimetype FROM Datetime_target_type_table UNION SELECT inttype FROM Datetime_source_type_table
GO
~~START~~
smalldatetime
1900-01-06 00:00:00.0
2018-07-24 06:31:00.0
~~END~~


SELECT smalldatetimetype FROM Datetime_target_type_table UNION SELECT biginttype FROM Datetime_source_type_table
GO
~~START~~
smalldatetime
1900-01-07 00:00:00.0
2018-07-24 06:31:00.0
~~END~~


SELECT smalldatetimetype FROM Datetime_target_type_table UNION SELECT smallinttype FROM Datetime_source_type_table
GO
~~START~~
smalldatetime
1900-01-08 00:00:00.0
2018-07-24 06:31:00.0
~~END~~


SELECT smalldatetimetype FROM Datetime_target_type_table UNION SELECT tinyinttype FROM Datetime_source_type_table
GO
~~START~~
smalldatetime
1900-01-09 00:00:00.0
2018-07-24 06:31:00.0
~~END~~


SELECT smalldatetimetype FROM Datetime_target_type_table UNION SELECT moneytype FROM Datetime_source_type_table
GO
~~START~~
smalldatetime
1900-01-10 00:00:00.0
2018-07-24 06:31:00.0
~~END~~


SELECT smalldatetimetype FROM Datetime_target_type_table UNION SELECT smallmonettype FROM Datetime_source_type_table
GO
~~START~~
smalldatetime
1900-01-11 00:00:00.0
2018-07-24 06:31:00.0
~~END~~


SELECT smalldatetimetype FROM Datetime_target_type_table UNION SELECT nulltype FROM Datetime_source_type_table
GO
~~START~~
smalldatetime
<NULL>
2018-07-24 06:31:00.0
~~END~~


DROP TABLE Datetime_target_type_table
GO

DROP TABLE Datetime_source_type_table
GO
