create table triggerTab1(c1 int, c2 varchar(30), check (c1 < 5))
go

create table triggerTab2(c1 int, check (c1 < 5))
go

create table triggerTab3(c1 int, check (c1 < 5))
go

insert into triggerTab1 values(1, 'first')
go
~~ROW COUNT: 1~~


insert into triggerTab2 values(1)
go
~~ROW COUNT: 1~~


insert into triggerTab3 values(1)
go
~~ROW COUNT: 1~~


create trigger txnTrig1 on triggerTab1 instead of insert as
begin tran;
update triggerTab2 set c1 = 2;
commit;
select * from triggerTab2 order by c1;
select * from inserted;
go

create trigger txnTrig2 on triggerTab2 instead of update as
save tran sp1;
save tran sp2;
delete from triggerTab3;
rollback tran sp1;
go

create trigger txnTrig3 on triggerTab3 instead of delete as
select * from triggerTab3 order by c1;
insert into triggerTab3 values(1);
select * from deleted;
rollback tran sp2;
go

insert into triggerTab1 values(2, 'second');
go
~~START~~
int
1
~~END~~

~~ROW COUNT: 1~~

~~START~~
int
1
~~END~~

~~START~~
int
1
~~END~~

~~START~~
int#!#varchar
2#!#second
~~END~~


begin tran;
go
insert into triggerTab1 values(3, 'third');
go
~~START~~
int
1
~~END~~

~~ROW COUNT: 1~~

~~START~~
int
1
~~END~~

~~START~~
int
1
~~END~~

~~START~~
int#!#varchar
3#!#third
~~END~~

commit;
go

update triggerTab2 set c1 = 6;
GO
~~START~~
int
1
~~END~~

~~ROW COUNT: 1~~

~~START~~
int
1
~~END~~


begin tran
go
update triggerTab2 set c1 = 6;
go
~~START~~
int
1
~~END~~

~~ROW COUNT: 1~~

~~START~~
int
1
~~END~~

if (@@trancount > 0) rollback;
go

begin tran
go
insert into triggerTab1 values(6, 'six');
go
~~START~~
int
1
~~END~~

~~ROW COUNT: 1~~

~~START~~
int
1
~~END~~

~~START~~
int
1
~~END~~

~~START~~
int#!#varchar
6#!#six
~~END~~

if (@@trancount > 0) rollback;
go

drop trigger txnTrig1;
go

create trigger txnTrig1 on triggerTab1 instead of insert as
begin tran;
update triggerTab2 set c1 = 6;
commit;
select * from triggerTab2 order by c1;
select * from inserted;
go

insert into triggerTab1 values(2, 'second');
go
~~START~~
int
1
~~END~~

~~ROW COUNT: 1~~

~~START~~
int
1
~~END~~

~~START~~
int
1
~~END~~

~~START~~
int#!#varchar
2#!#second
~~END~~


begin tran;
go
insert into triggerTab1 values(3, 'third');
go
~~START~~
int
1
~~END~~

~~ROW COUNT: 1~~

~~START~~
int
1
~~END~~

~~START~~
int
1
~~END~~

~~START~~
int#!#varchar
3#!#third
~~END~~

if (@@trancount > 0) rollback;
go

drop trigger txnTrig1;
go

drop trigger txnTrig3;
go

create trigger txnTrig1 on triggerTab1 instead of insert as
begin tran;
update triggerTab2 set c1 = 2;
commit;
select * from triggerTab2 order by c1;
select * from inserted;
go

create trigger txnTrig3 on triggerTab3 instead of delete as
select * from triggerTab3 order by c1;
insert into triggerTab3 values(6);
select * from deleted;
rollback tran sp2;
go

insert into triggerTab1 values(2, 'second');
go
~~START~~
int
1
~~END~~

~~ERROR (Code: 547)~~

~~ERROR (Message: new row for relation "triggertab3" violates check constraint "triggertab3_c1_check")~~


begin tran;
go
insert into triggerTab1 values(3, 'third');
go
~~START~~
int
1
~~END~~

~~ERROR (Code: 547)~~

~~ERROR (Message: new row for relation "triggertab3" violates check constraint "triggertab3_c1_check")~~

if (@@trancount > 0) rollback;
go

drop trigger txnTrig3;
go

create trigger txnTrig3 on triggerTab3 instead of delete as
select * from triggerTab3 order by c1;
insert into triggerTab3 values(1);
select * from deleted;
rollback tran sp2;
go

drop trigger txnTrig1;
go

create trigger txnTrig1 on triggerTab1 instead of insert as
commit;
update triggerTab2 set c1 = 2;
select * from triggerTab2 order by c1;
go

insert into triggerTab1 values(2, 'second');
go
~~START~~
int
1
~~END~~

~~ROW COUNT: 1~~

~~START~~
int
1
~~END~~

~~START~~
int
1
~~END~~

~~ERROR (Code: 3609)~~

~~ERROR (Message: The transaction ended in the trigger. The batch has been aborted.)~~


begin tran;
go

insert into triggerTab1 values(2, 'second');
go
~~START~~
int
1
~~END~~

~~ROW COUNT: 1~~

~~START~~
int
1
~~END~~

~~START~~
int
1
~~END~~

~~ERROR (Code: 3609)~~

~~ERROR (Message: The transaction ended in the trigger. The batch has been aborted.)~~


drop trigger txnTrig1;
go

create trigger txnTrig1 on triggerTab1 instead of insert as
rollback;
update triggerTab2 set c1 = 3;
select * from triggerTab2 order by c1;
go

insert into triggerTab1 values(2, 'second');
go
~~START~~
int
1
~~END~~

~~ROW COUNT: 1~~

~~START~~
int
1
~~END~~

~~START~~
int
1
~~END~~

~~ERROR (Code: 3609)~~

~~ERROR (Message: The transaction ended in the trigger. The batch has been aborted.)~~


begin tran;
go

insert into triggerTab1 values(2, 'second');
go
~~START~~
int
1
~~END~~

~~ROW COUNT: 1~~

~~START~~
int
1
~~END~~

~~START~~
int
1
~~END~~

~~ERROR (Code: 3609)~~

~~ERROR (Message: The transaction ended in the trigger. The batch has been aborted.)~~


create procedure triggerProc1 as
save tran sp1;
insert into triggerTab1 values(3, 'third');
rollback tran sp1;
go

create procedure triggerProc2 as
begin tran;
exec triggerProc1;
insert into triggerTab1 values(3, 'third');
commit;
go

exec triggerProc2;
go
~~START~~
int
1
~~END~~

~~ROW COUNT: 1~~

~~START~~
int
1
~~END~~

~~START~~
int
1
~~END~~

~~ERROR (Code: 3609)~~

~~ERROR (Message: The transaction ended in the trigger. The batch has been aborted.)~~


drop procedure triggerProc2;
go

drop trigger txnTrig1
go

create trigger txnTrig1 on triggerTab1 instead of insert as
commit;
update triggerTab2 set c1 = 6;
select * from triggerTab2 order by c1;
go

create procedure triggerProc2 as
begin tran;
exec triggerProc1;
insert into triggerTab1 values(6, 'six');
commit;
go

exec triggerProc2;
go
~~START~~
int
1
~~END~~

~~ROW COUNT: 1~~

~~START~~
int
1
~~END~~

~~START~~
int
1
~~END~~

~~ERROR (Code: 3609)~~

~~ERROR (Message: The transaction ended in the trigger. The batch has been aborted.)~~


if (@@trancount>0) commit;
go

drop trigger txnTrig1;
go

create trigger txnTrig1 on triggerTab1 instead of insert as
begin tran;
update triggerTab2 set c1 = 2;
commit;
select * from triggerTab2 order by c1;
select * from inserted;
go

drop procedure triggerProc1;
go
drop procedure triggerProc2;
go

create table tmp__1 (a int not null);
go

insert into tmp__1 values (1)
go
~~ROW COUNT: 1~~


create procedure triggerProc1 as
save tran sp1;
insert into tmp__1 values (null);
rollback tran sp1;
go

create procedure triggerProc2 as
begin tran;
exec triggerProc1;
insert into triggerTab1 values(3, 'third');
commit;
go

exec triggerProc2;
go
~~ERROR (Code: 515)~~

~~ERROR (Message: null value in column "a" of relation "tmp__1" violates not-null constraint)~~

~~START~~
int
1
~~END~~

~~ROW COUNT: 1~~

~~START~~
int
1
~~END~~

~~START~~
int
1
~~END~~

~~START~~
int#!#varchar
3#!#third
~~END~~


drop table tmp__1 
go

create table triggerErrorTab(c1 int not null);
go

create trigger triggerErr on triggerErrorTab instead of insert as
insert into triggerErrorTab values(NULL);
insert into invalidTab values(1);
go

insert into triggerErrorTab values(1);
go
~~ERROR (Code: 33557097)~~

~~ERROR (Message: relation "invalidtab" does not exist)~~



drop procedure triggerProc1;
go
drop procedure triggerProc2;
go
drop trigger txnTrig1
go


create procedure triggerProc1 as
commit;
go

create procedure triggerProc2 as
exec triggerProc1;
go

create trigger txnTrig1 on triggerTab1 instead of insert as
exec triggerProc2;
go

insert into triggerTab1 values(1, 'value1');
go
~~ERROR (Code: 3609)~~

~~ERROR (Message: The transaction ended in the trigger. The batch has been aborted.)~~


drop procedure triggerProc1;
go
drop procedure triggerProc2;
go
drop trigger txnTrig1
go


create procedure triggerProc1 as
rollback;
go

create procedure triggerProc2 as
exec triggerProc1;
go

create trigger txnTrig1 on triggerTab1 instead of insert as
exec triggerProc2;
go

insert into triggerTab1 values(1, 'value2');
go
~~ERROR (Code: 3609)~~

~~ERROR (Message: The transaction ended in the trigger. The batch has been aborted.)~~


drop procedure triggerProc1;
go
drop procedure triggerProc2;
go
drop trigger txnTrig1
go


create procedure triggerProc1 as
rollback tran sp1;
go

create procedure triggerProc2 as
exec triggerProc1;
go

create trigger txnTrig1 on triggerTab1 instead of insert as
save tran sp1;
exec triggerProc2;
go

insert into triggerTab1 values(1, 'value3');
go


drop procedure triggerProc1;
go
drop procedure triggerProc2;
go
drop table triggerTab1;
go
drop table triggerTab2;
go
drop table triggerTab3;
go
drop table triggerErrorTab
go

create table triggerTab1(c1 int, c2 varchar(30), check (c1 < 5))
go

create table triggerTab2(c1 int, check (c1 < 5))
go

create table triggerTab3(c1 int, check (c1 < 5))
go

insert into triggerTab1 values(1, 'first')
go
~~ROW COUNT: 1~~


insert into triggerTab2 values(1)
go
~~ROW COUNT: 1~~


insert into triggerTab3 values(1)
go
~~ROW COUNT: 1~~


create trigger txnTrig1 on triggerTab1 instead of insert as
insert into triggerTab2 values (2);
go

create trigger txnTrig2 on triggerTab2 instead of insert as
insert into triggerTab3 values (2);
go

create trigger txnTrig3 on triggerTab3 instead of insert as
select 'nest level 3'
go

insert into triggerTab1 values(2, 'two')
go
~~START~~
varchar
nest level 3
~~END~~


begin tran
go
insert into triggerTab1 values(6, 'six')
go
~~START~~
varchar
nest level 3
~~END~~

if (@@trancount > 0) rollback tran;
go

select * from triggerTab1;
GO
~~START~~
int#!#varchar
1#!#first
~~END~~


select * from triggerTab2;
GO
~~START~~
int
1
~~END~~


select * from triggerTab3;
GO
~~START~~
int
1
~~END~~


drop trigger txnTrig1;
go

create trigger txnTrig1 on triggerTab1 instead of insert as
insert into triggerTab2 values (6);
go

insert into triggerTab2 values(2)
go
~~START~~
varchar
nest level 3
~~END~~


begin tran
go
insert into triggerTab2 values(6)
go
~~START~~
varchar
nest level 3
~~END~~

if (@@trancount > 0) rollback tran;
go

begin tran
go
insert into triggerTab1 values(3, 'three')
go
~~START~~
varchar
nest level 3
~~END~~

if (@@trancount > 0) rollback tran;
go

select * from triggerTab1;
GO
~~START~~
int#!#varchar
1#!#first
~~END~~


select * from triggerTab2;
GO
~~START~~
int
1
~~END~~


select * from triggerTab3;
GO
~~START~~
int
1
~~END~~


drop trigger txnTrig1;
go
drop trigger txnTrig2;
go

create trigger txnTrig1 on triggerTab1 instead of insert as
insert into triggerTab2 values (2);
go

create trigger txnTrig2 on triggerTab2 instead of insert as
insert into triggerTab3 values (6);
go

insert into triggerTab3 values(2)
go
~~START~~
varchar
nest level 3
~~END~~


begin tran
go
insert into triggerTab3 values(6)
go
~~START~~
varchar
nest level 3
~~END~~

if (@@trancount > 0) rollback tran;
go

begin tran
go
insert into triggerTab1 values(3, 'three')
go
~~START~~
varchar
nest level 3
~~END~~

if (@@trancount > 0) rollback tran;
go

select * from triggerTab1;
GO
~~START~~
int#!#varchar
1#!#first
~~END~~

select * from triggerTab2;
GO
~~START~~
int
1
~~END~~

select * from triggerTab3;
GO
~~START~~
int
1
~~END~~


drop table triggerTab1;
go
drop table triggerTab2;
go
drop table triggerTab3;
go

create table triggerTab1(c1 int not null)
go

create table triggerTab2(c1 int not null)
go

create table triggerTab3(c1 int not null)
go

insert into triggerTab1 values(1)
go
~~ROW COUNT: 1~~


insert into triggerTab2 values(1)
go
~~ROW COUNT: 1~~


insert into triggerTab3 values(1)
go
~~ROW COUNT: 1~~


create trigger txnTrig1 on triggerTab1 instead of insert as
select 'nest level 1'
insert into triggerTab2 values (2);
go

create trigger txnTrig2 on triggerTab2 instead of insert as
select 'nest level 2'
insert into triggerTab3 values (null);
go

create trigger txnTrig3 on triggerTab3 instead of insert as
select 'nest level 3'
go

begin tran
go
insert into triggerTab1 values(2)
go
~~START~~
varchar
nest level 1
~~END~~

~~START~~
varchar
nest level 2
~~END~~

~~START~~
varchar
nest level 3
~~END~~

if (@@trancount > 0) rollback tran;
go

begin tran
go
insert into triggerTab1 values(NULL)
go
~~START~~
varchar
nest level 1
~~END~~

~~START~~
varchar
nest level 2
~~END~~

~~START~~
varchar
nest level 3
~~END~~

if (@@trancount > 0) rollback tran;
go

select * from triggerTab1;
go
~~START~~
int
1
~~END~~

select * from triggerTab2;
go
~~START~~
int
1
~~END~~

select * from triggerTab3;
go
~~START~~
int
1
~~END~~


drop trigger txnTrig1;
go

drop trigger txnTrig2;
go

create trigger txnTrig1 on triggerTab1 instead of insert as
select 'nest level 1'
insert into triggerTab2 values (NULL);
go

create trigger txnTrig2 on triggerTab2 instead of insert as
select 'nest level 2'
insert into triggerTab3 values (3);
go

begin tran
go
insert into triggerTab1 values(3)
go
~~START~~
varchar
nest level 1
~~END~~

~~START~~
varchar
nest level 2
~~END~~

~~START~~
varchar
nest level 3
~~END~~

if (@@trancount > 0) rollback tran;
go

select * from triggerTab1;
go
~~START~~
int
1
~~END~~

select * from triggerTab2;
go
~~START~~
int
1
~~END~~

select * from triggerTab3;
go
~~START~~
int
1
~~END~~


drop table triggerTab1;
go
drop table triggerTab2;
go
drop table triggerTab3;
go
