-- Empty string, should return default values
SELECT CONVERT(DATETIME, '')
GO
~~START~~
datetime
1900-01-01 00:00:00.0
~~END~~


SELECT CONVERT(DATETIME, '', 130)
GO
~~START~~
datetime
1900-01-01 00:00:00.0
~~END~~


-- -- Numeric: 
-- 1 or 2 digit number in a given datetime string literal is considered as either 
-- day, month or year based on session dateformat value.
-- [m]m<seperator>[d]d<seperator>([y]y|yyyy)
SELECT CONVERT(DATETIME, '3-2-4 14:30')
GO
~~START~~
datetime
2004-03-02 14:30:00.0
~~END~~


SELECT CONVERT(DATETIME, '3-12-4 14:30')
GO
~~START~~
datetime
2004-03-12 14:30:00.0
~~END~~


SELECT CONVERT(DATETIME, '3-12-24 14:30')
GO
~~START~~
datetime
2024-03-12 14:30:00.0
~~END~~


SELECT CONVERT(DATETIME, '3-12-2024 14:30')
GO
~~START~~
datetime
2024-03-12 14:30:00.0
~~END~~


SELECT CONVERT(DATETIME, '11-12-2024 14:30')
GO
~~START~~
datetime
2024-11-12 14:30:00.0
~~END~~


SELECT CONVERT(DATETIME, '3     -        12 -           2024 14:30')
GO
~~START~~
datetime
2024-03-12 14:30:00.0
~~END~~


SELECT CONVERT(DATETIME, '3.2.4 14:30')
GO
~~START~~
datetime
2004-03-02 14:30:00.0
~~END~~


SELECT CONVERT(DATETIME, '3.12.4 14:30')
GO
~~START~~
datetime
2004-03-12 14:30:00.0
~~END~~


SELECT CONVERT(DATETIME, '3.12.24 14:30')
GO
~~START~~
datetime
2024-03-12 14:30:00.0
~~END~~


SELECT CONVERT(DATETIME, '3.12.2024 14:30')
GO
~~START~~
datetime
2024-03-12 14:30:00.0
~~END~~


SELECT CONVERT(DATETIME, '11.12.2024 14:30')
GO
~~START~~
datetime
2024-11-12 14:30:00.0
~~END~~


SELECT CONVERT(DATETIME, '3     .        12 .           2024 14:30')
GO
~~START~~
datetime
2024-03-12 14:30:00.0
~~END~~


SELECT CONVERT(DATETIME, '3/2/4 14:30')
GO
~~START~~
datetime
2004-03-02 14:30:00.0
~~END~~


SELECT CONVERT(DATETIME, '3/12/4 14:30')
GO
~~START~~
datetime
2004-03-12 14:30:00.0
~~END~~


SELECT CONVERT(DATETIME, '3/12/24 14:30')
GO
~~START~~
datetime
2024-03-12 14:30:00.0
~~END~~


SELECT CONVERT(DATETIME, '3/12/2024 14:30')
GO
~~START~~
datetime
2024-03-12 14:30:00.0
~~END~~


SELECT CONVERT(DATETIME, '11/12/2024 14:30')
GO
~~START~~
datetime
2024-11-12 14:30:00.0
~~END~~


SELECT CONVERT(DATETIME, '3     /        12 /           2024 14:30')
GO
~~START~~
datetime
2024-03-12 14:30:00.0
~~END~~


-- [m]m<seperator>([y]y|yyyy)<seperator>[d]d
SELECT CONVERT(DATETIME, '3-4-2 14:30')
GO
~~START~~
datetime
2002-03-04 14:30:00.0
~~END~~


SELECT CONVERT(DATETIME, '3-4-12 14:30')
GO
~~START~~
datetime
2012-03-04 14:30:00.0
~~END~~


SELECT CONVERT(DATETIME, '3-24-12 14:30')
GO
~~START~~
datetime
2012-03-24 14:30:00.0
~~END~~


SELECT CONVERT(DATETIME, '3-2024-12 14:30')
GO
~~START~~
datetime
2024-03-12 14:30:00.0
~~END~~


SELECT CONVERT(DATETIME, '11-2024-12 14:30')
GO
~~START~~
datetime
2024-11-12 14:30:00.0
~~END~~


SELECT CONVERT(DATETIME, '3 -           2024     -        12 14:30')
GO
~~START~~
datetime
2024-03-12 14:30:00.0
~~END~~


SELECT CONVERT(DATETIME, '3.4.2 14:30')
GO
~~START~~
datetime
2002-03-04 14:30:00.0
~~END~~


SELECT CONVERT(DATETIME, '3.4.12 14:30')
GO
~~START~~
datetime
2012-03-04 14:30:00.0
~~END~~


SELECT CONVERT(DATETIME, '3.24.12 14:30')
GO
~~START~~
datetime
2012-03-24 14:30:00.0
~~END~~


SELECT CONVERT(DATETIME, '3.2024.12 14:30')
GO
~~START~~
datetime
2024-03-12 14:30:00.0
~~END~~


SELECT CONVERT(DATETIME, '11.2024.12 14:30')
GO
~~START~~
datetime
2024-11-12 14:30:00.0
~~END~~


SELECT CONVERT(DATETIME, '3 .           2024     .        12 14:30')
GO
~~START~~
datetime
2024-03-12 14:30:00.0
~~END~~


SELECT CONVERT(DATETIME, '3/4/2 14:30')
GO
~~START~~
datetime
2002-03-04 14:30:00.0
~~END~~


SELECT CONVERT(DATETIME, '3/4/12 14:30')
GO
~~START~~
datetime
2012-03-04 14:30:00.0
~~END~~


SELECT CONVERT(DATETIME, '3/24/12 14:30')
GO
~~START~~
datetime
2012-03-24 14:30:00.0
~~END~~


SELECT CONVERT(DATETIME, '3/2024/12 14:30')
GO
~~START~~
datetime
2024-03-12 14:30:00.0
~~END~~


SELECT CONVERT(DATETIME, '11/2024/12 14:30')
GO
~~START~~
datetime
2024-11-12 14:30:00.0
~~END~~


SELECT CONVERT(DATETIME, '3 /           2024     /        12 14:30')
GO
~~START~~
datetime
2024-03-12 14:30:00.0
~~END~~


-- [d]d<seperator>[m]m<seperator>([y]y|yyyy)
SELECT CONVERT(DATETIME, '2-3-4 14:30')
GO
~~START~~
datetime
2004-02-03 14:30:00.0
~~END~~


SELECT CONVERT(DATETIME, '12-3-4 14:30')
GO
~~START~~
datetime
2004-12-03 14:30:00.0
~~END~~


SELECT CONVERT(DATETIME, '12-3-24 14:30')
GO
~~START~~
datetime
2024-12-03 14:30:00.0
~~END~~


SELECT CONVERT(DATETIME, '12-3-2024 14:30')
GO
~~START~~
datetime
2024-12-03 14:30:00.0
~~END~~


SELECT CONVERT(DATETIME, '12-11-2024 14:30')
GO
~~START~~
datetime
2024-12-11 14:30:00.0
~~END~~


SELECT CONVERT(DATETIME, '12 -           3     -        2024 14:30')
GO
~~START~~
datetime
2024-12-03 14:30:00.0
~~END~~


SELECT CONVERT(DATETIME, '2.3.4 14:30')
GO
~~START~~
datetime
2004-02-03 14:30:00.0
~~END~~


SELECT CONVERT(DATETIME, '12.3.4 14:30')
GO
~~START~~
datetime
2004-12-03 14:30:00.0
~~END~~


SELECT CONVERT(DATETIME, '12.3.24 14:30')
GO
~~START~~
datetime
2024-12-03 14:30:00.0
~~END~~


SELECT CONVERT(DATETIME, '12.3.2024 14:30')
GO
~~START~~
datetime
2024-12-03 14:30:00.0
~~END~~


SELECT CONVERT(DATETIME, '12.11.2024 14:30')
GO
~~START~~
datetime
2024-12-11 14:30:00.0
~~END~~


SELECT CONVERT(DATETIME, '12 .           3     .        2024 14:30')
GO
~~START~~
datetime
2024-12-03 14:30:00.0
~~END~~


SELECT CONVERT(DATETIME, '2/3/4 14:30')
GO
~~START~~
datetime
2004-02-03 14:30:00.0
~~END~~


SELECT CONVERT(DATETIME, '12/3/4 14:30')
GO
~~START~~
datetime
2004-12-03 14:30:00.0
~~END~~


SELECT CONVERT(DATETIME, '12/3/24 14:30')
GO
~~START~~
datetime
2024-12-03 14:30:00.0
~~END~~


SELECT CONVERT(DATETIME, '12/3/2024 14:30')
GO
~~START~~
datetime
2024-12-03 14:30:00.0
~~END~~


SELECT CONVERT(DATETIME, '12/11/2024 14:30')
GO
~~START~~
datetime
2024-12-11 14:30:00.0
~~END~~


SELECT CONVERT(DATETIME, '12 /           3     /        2024 14:30')
GO
~~START~~
datetime
2024-12-03 14:30:00.0
~~END~~


-- [d]d<seperator>([y]y|yyyy)<seperator>[m]m
SELECT CONVERT(DATETIME, '2-4-3 14:30')
GO
~~START~~
datetime
2003-02-04 14:30:00.0
~~END~~


SELECT CONVERT(DATETIME, '12-4-3 14:30')
GO
~~START~~
datetime
2003-12-04 14:30:00.0
~~END~~


SELECT CONVERT(DATETIME, '12-24-3 14:30')
GO
~~START~~
datetime
2003-12-24 14:30:00.0
~~END~~


SELECT CONVERT(DATETIME, '12-2024-3 14:30')
GO
~~START~~
datetime
2024-12-03 14:30:00.0
~~END~~


SELECT CONVERT(DATETIME, '12-2024-11 14:30')
GO
~~START~~
datetime
2024-12-11 14:30:00.0
~~END~~


SELECT CONVERT(DATETIME, '12     -        2024 -           3 14:30')
GO
~~START~~
datetime
2024-12-03 14:30:00.0
~~END~~


SELECT CONVERT(DATETIME, '2.4.3 14:30')
GO
~~START~~
datetime
2003-02-04 14:30:00.0
~~END~~


SELECT CONVERT(DATETIME, '12.4.3 14:30')
GO
~~START~~
datetime
2003-12-04 14:30:00.0
~~END~~


SELECT CONVERT(DATETIME, '12.24.3 14:30')
GO
~~START~~
datetime
2003-12-24 14:30:00.0
~~END~~


SELECT CONVERT(DATETIME, '12.2024.3 14:30')
GO
~~START~~
datetime
2024-12-03 14:30:00.0
~~END~~


SELECT CONVERT(DATETIME, '12.2024.11 14:30')
GO
~~START~~
datetime
2024-12-11 14:30:00.0
~~END~~


SELECT CONVERT(DATETIME, '12     .        2024 .           3 14:30')
GO
~~START~~
datetime
2024-12-03 14:30:00.0
~~END~~


SELECT CONVERT(DATETIME, '2/4/3 14:30')
GO
~~START~~
datetime
2003-02-04 14:30:00.0
~~END~~


SELECT CONVERT(DATETIME, '12/4/3 14:30')
GO
~~START~~
datetime
2003-12-04 14:30:00.0
~~END~~


SELECT CONVERT(DATETIME, '12/24/3 14:30')
GO
~~START~~
datetime
2003-12-24 14:30:00.0
~~END~~


SELECT CONVERT(DATETIME, '12/2024/3 14:30')
GO
~~START~~
datetime
2024-12-03 14:30:00.0
~~END~~


SELECT CONVERT(DATETIME, '12/2024/11 14:30')
GO
~~START~~
datetime
2024-12-11 14:30:00.0
~~END~~


SELECT CONVERT(DATETIME, '12     /        2024 /           3 14:30')
GO
~~START~~
datetime
2024-12-03 14:30:00.0
~~END~~


-- ([y]y|yyyy)<seperator>[m]m<seperator>[d]d
SELECT CONVERT(DATETIME, '4-3-2 14:30')
GO
~~START~~
datetime
2002-04-03 14:30:00.0
~~END~~


SELECT CONVERT(DATETIME, '4-3-12 14:30')
GO
~~START~~
datetime
2012-04-03 14:30:00.0
~~END~~


SELECT CONVERT(DATETIME, '24-3-12 14:30')
GO
~~START~~
datetime
~~ERROR (Code: 33557097)~~

~~ERROR (Message: The conversion of a varchar data type to a datetime data type resulted in an out-of-range value.)~~


SELECT CONVERT(DATETIME, '2024-3-12 14:30')
GO
~~START~~
datetime
2024-03-12 14:30:00.0
~~END~~


SELECT CONVERT(DATETIME, '2024-11-12 14:30')
GO
~~START~~
datetime
2024-11-12 14:30:00.0
~~END~~


SELECT CONVERT(DATETIME, '2024     -        3 -           12 14:30')
GO
~~START~~
datetime
2024-03-12 14:30:00.0
~~END~~


SELECT CONVERT(DATETIME, '4.3.2 14:30')
GO
~~START~~
datetime
2002-04-03 14:30:00.0
~~END~~


SELECT CONVERT(DATETIME, '4.3.12 14:30')
GO
~~START~~
datetime
2012-04-03 14:30:00.0
~~END~~


SELECT CONVERT(DATETIME, '24.3.12 14:30')
GO
~~START~~
datetime
~~ERROR (Code: 33557097)~~

~~ERROR (Message: The conversion of a varchar data type to a datetime data type resulted in an out-of-range value.)~~


SELECT CONVERT(DATETIME, '2024.3.12 14:30')
GO
~~START~~
datetime
2024-03-12 14:30:00.0
~~END~~


SELECT CONVERT(DATETIME, '2024.11.12 14:30')
GO
~~START~~
datetime
2024-11-12 14:30:00.0
~~END~~


SELECT CONVERT(DATETIME, '2024     .        3 .           12 14:30')
GO
~~START~~
datetime
2024-03-12 14:30:00.0
~~END~~


SELECT CONVERT(DATETIME, '4/3/2 14:30')
GO
~~START~~
datetime
2002-04-03 14:30:00.0
~~END~~


SELECT CONVERT(DATETIME, '4/3/12 14:30')
GO
~~START~~
datetime
2012-04-03 14:30:00.0
~~END~~


SELECT CONVERT(DATETIME, '24/3/12 14:30')
GO
~~START~~
datetime
~~ERROR (Code: 33557097)~~

~~ERROR (Message: The conversion of a varchar data type to a datetime data type resulted in an out-of-range value.)~~


SELECT CONVERT(DATETIME, '2024/3/12 14:30')
GO
~~START~~
datetime
2024-03-12 14:30:00.0
~~END~~


SELECT CONVERT(DATETIME, '2024/11/12 14:30')
GO
~~START~~
datetime
2024-11-12 14:30:00.0
~~END~~


SELECT CONVERT(DATETIME, '2024     /        3 /           12 14:30')
GO
~~START~~
datetime
2024-03-12 14:30:00.0
~~END~~


-- combination of different seperator also works for DATETIME
SELECT CONVERT(DATETIME, '2024/11-12 14:30')
GO
~~START~~
datetime
2024-11-12 14:30:00.0
~~END~~


SELECT CONVERT(DATETIME, '2024-11/12 14:30')
GO
~~START~~
datetime
2024-11-12 14:30:00.0
~~END~~


SELECT CONVERT(DATETIME, '2024.11/12 14:30')
GO
~~START~~
datetime
2024-11-12 14:30:00.0
~~END~~


SELECT CONVERT(DATETIME, '2024.11-12 14:30')
GO
~~START~~
datetime
2024-11-12 14:30:00.0
~~END~~


-- invalid syntax
SELECT CONVERT(DATETIME, '3 12 2024')
GO
~~START~~
datetime
~~ERROR (Code: 33557097)~~

~~ERROR (Message: Conversion failed when converting date and/or time from character string.)~~


SELECT CONVERT(DATETIME, '3#12#2024')
GO
~~START~~
datetime
~~ERROR (Code: 33557097)~~

~~ERROR (Message: Conversion failed when converting date and/or time from character string.)~~


-- cut off year
SELECT CONVERT(DATETIME, '11-12-49')
GO
~~START~~
datetime
2049-11-12 00:00:00.0
~~END~~


SELECT CONVERT(DATETIME, '11-12-50')
GO
~~START~~
datetime
1950-11-12 00:00:00.0
~~END~~


-- Babelfish currently doesn't support setting DATEFORMAT, 
-- hence currently session language dateformat is used
SET DATEFORMAT 'MDY'
GO

SELECT CONVERT(DATETIME, '2-3-4')
GO
~~START~~
datetime
2004-02-03 00:00:00.0
~~END~~


SELECT CONVERT(DATETIME, '03-22-2024')
GO
~~START~~
datetime
2024-03-22 00:00:00.0
~~END~~


SET DATEFORMAT 'DMY'
GO

SELECT CONVERT(DATETIME, '2-3-4')
GO
~~START~~
datetime
2004-02-03 00:00:00.0
~~END~~


SELECT CONVERT(DATETIME, '22-03-2024')
GO
~~START~~
datetime
~~ERROR (Code: 33557097)~~

~~ERROR (Message: The conversion of a varchar data type to a datetime data type resulted in an out-of-range value.)~~


SET DATEFORMAT 'YMD'
GO

SELECT CONVERT(DATETIME, '2-3-4')
GO
~~START~~
datetime
2004-02-03 00:00:00.0
~~END~~


SELECT CONVERT(DATETIME, '2024-03-22')
GO
~~START~~
datetime
2024-03-22 00:00:00.0
~~END~~


SET DATEFORMAT 'MYD'
GO

SELECT CONVERT(DATETIME, '2-3-4')
GO
~~START~~
datetime
2004-02-03 00:00:00.0
~~END~~


SELECT CONVERT(DATETIME, '03-2024-22')
GO
~~START~~
datetime
2024-03-22 00:00:00.0
~~END~~


SET DATEFORMAT 'DYM'
GO

SELECT CONVERT(DATETIME, '2-3-4')
GO
~~START~~
datetime
2004-02-03 00:00:00.0
~~END~~


SELECT CONVERT(DATETIME, '22-2024-03')
GO
~~START~~
datetime
~~ERROR (Code: 33557097)~~

~~ERROR (Message: The conversion of a varchar data type to a datetime data type resulted in an out-of-range value.)~~


SET DATEFORMAT 'YDM'
GO

-- YDM DATE format is not supported when converting from this 
-- character string format to DATETIME, Hence following query should throw error
SELECT CONVERT(DATETIME, '2-3-4')
GO
~~START~~
datetime
2004-02-03 00:00:00.0
~~END~~


-- For DATE as follows, it will always be treated as YMD DATEFORMAT as YDM is not supported.
SELECT CONVERT(DATETIME, '2024-22-03')
GO
~~START~~
datetime
~~ERROR (Code: 33557097)~~

~~ERROR (Message: The conversion of a varchar data type to a datetime data type resulted in an out-of-range value.)~~


-- SET DATEFORMAT back to default
SET DATEFORMAT 'MDY'
GO

-- Alphabetical
--- mon [dd][,] yyyy
SELECT CONVERT(DATETIME, 'Apr 12,2000 14:30')
GO
~~START~~
datetime
2000-04-12 14:30:00.0
~~END~~


SELECT CONVERT(DATETIME, 'Apr 12 2000 14:30')
GO
~~START~~
datetime
2000-04-12 14:30:00.0
~~END~~


SELECT CONVERT(DATETIME, 'Apr 1,2000 14:30')
GO
~~START~~
datetime
2000-04-01 14:30:00.0
~~END~~


SELECT CONVERT(DATETIME, 'Apr 1 2000 14:30')
GO
~~START~~
datetime
2000-04-01 14:30:00.0
~~END~~


SELECT CONVERT(DATETIME, 'Apr,2000 14:30')
GO
~~START~~
datetime
2000-04-01 14:30:00.0
~~END~~


SELECT CONVERT(DATETIME, 'Apr 2000 14:30')
GO
~~START~~
datetime
2000-04-01 14:30:00.0
~~END~~


SELECT CONVERT(DATETIME, 'Apr12,2000 14:30')
GO
~~START~~
datetime
2000-04-12 14:30:00.0
~~END~~


SELECT CONVERT(DATETIME, 'Apr12 2000 14:30')
GO
~~START~~
datetime
2000-04-12 14:30:00.0
~~END~~


SELECT CONVERT(DATETIME, 'Apr1,2000 14:30')
GO
~~START~~
datetime
2000-04-01 14:30:00.0
~~END~~


SELECT CONVERT(DATETIME, 'Apr1 2000 14:30')
GO
~~START~~
datetime
2000-04-01 14:30:00.0
~~END~~


SELECT CONVERT(DATETIME, 'Apr,2000 14:30')
GO
~~START~~
datetime
2000-04-01 14:30:00.0
~~END~~


SELECT CONVERT(DATETIME, 'Apr2000 14:30')
GO
~~START~~
datetime
2000-04-01 14:30:00.0
~~END~~


-- For styles 130 and 131, the month name will be in hijri format
-- this is only applicable for datetime and smalldatetime, for other datatypes error will be thrown
SELECT CONVERT(DATETIME, N'محرم  12,2000  14:30', 130)
GO
~~START~~
datetime
2562-01-18 14:30:00.0
~~END~~


SELECT CONVERT(DATETIME, N'محرم  12 2000  14:30', 130)
GO
~~START~~
datetime
2562-01-18 14:30:00.0
~~END~~


SELECT CONVERT(DATETIME, N'محرم  1,2000  14:30', 130)
GO
~~START~~
datetime
2562-01-07 14:30:00.0
~~END~~


SELECT CONVERT(DATETIME, N'محرم  1 2000  14:30', 130)
GO
~~START~~
datetime
2562-01-07 14:30:00.0
~~END~~


SELECT CONVERT(DATETIME, N'محرم ,2000  14:30', 130)
GO
~~START~~
datetime
2562-01-07 14:30:00.0
~~END~~


SELECT CONVERT(DATETIME, N'محرم  2000  14:30', 130)
GO
~~START~~
datetime
2562-01-07 14:30:00.0
~~END~~


SELECT CONVERT(DATETIME, N'محرم 12,2000  14:30', 130)
GO
~~START~~
datetime
2562-01-18 14:30:00.0
~~END~~


SELECT CONVERT(DATETIME, N'محرم 12 2000  14:30', 130)
GO
~~START~~
datetime
2562-01-18 14:30:00.0
~~END~~


SELECT CONVERT(DATETIME, N'محرم 1,2000  14:30', 130)
GO
~~START~~
datetime
2562-01-07 14:30:00.0
~~END~~


SELECT CONVERT(DATETIME, N'محرم 1 2000  14:30', 130)
GO
~~START~~
datetime
2562-01-07 14:30:00.0
~~END~~


SELECT CONVERT(DATETIME, N'محرم ,2000  14:30', 130)
GO
~~START~~
datetime
2562-01-07 14:30:00.0
~~END~~


SELECT CONVERT(DATETIME, N'محرم 2000  14:30', 130)
GO
~~START~~
datetime
2562-01-07 14:30:00.0
~~END~~


--- mon [d]d[,] [yy]
SELECT CONVERT(DATETIME, 'Apr 12, 24 14:30')
GO
~~START~~
datetime
2024-04-12 14:30:00.0
~~END~~


SELECT CONVERT(DATETIME, 'Apr 12 24 14:30')
GO
~~START~~
datetime
2024-04-12 14:30:00.0
~~END~~


SELECT CONVERT(DATETIME, 'Apr 12, 4 14:30')
GO
~~START~~
datetime
2004-04-12 14:30:00.0
~~END~~


SELECT CONVERT(DATETIME, 'Apr 12 4 14:30')
GO
~~START~~
datetime
2004-04-12 14:30:00.0
~~END~~


SELECT CONVERT(DATETIME, 'Apr 12, 14:30')
GO
~~START~~
datetime
~~ERROR (Code: 33557097)~~

~~ERROR (Message: Conversion failed when converting date and/or time from character string.)~~


SELECT CONVERT(DATETIME, 'Apr 12 14:30')
GO
~~START~~
datetime
~~ERROR (Code: 33557097)~~

~~ERROR (Message: Conversion failed when converting date and/or time from character string.)~~


SELECT CONVERT(DATETIME, 'Apr 1, 24 14:30')
GO
~~START~~
datetime
2024-04-01 14:30:00.0
~~END~~


SELECT CONVERT(DATETIME, 'Apr 1 24 14:30')
GO
~~START~~
datetime
2024-04-01 14:30:00.0
~~END~~


SELECT CONVERT(DATETIME, 'Apr 1, 4 14:30')
GO
~~START~~
datetime
2004-04-01 14:30:00.0
~~END~~


SELECT CONVERT(DATETIME, 'Apr 1 4 14:30')
GO
~~START~~
datetime
2004-04-01 14:30:00.0
~~END~~


SELECT CONVERT(DATETIME, 'Apr 1, 14:30')
GO
~~START~~
datetime
~~ERROR (Code: 33557097)~~

~~ERROR (Message: Conversion failed when converting date and/or time from character string.)~~


SELECT CONVERT(DATETIME, 'Apr 1 14:30')
GO
~~START~~
datetime
~~ERROR (Code: 33557097)~~

~~ERROR (Message: Conversion failed when converting date and/or time from character string.)~~


SELECT CONVERT(DATETIME, 'Apr12, 24 14:30')
GO
~~START~~
datetime
2024-04-12 14:30:00.0
~~END~~


SELECT CONVERT(DATETIME, 'Apr12 24 14:30')
GO
~~START~~
datetime
2024-04-12 14:30:00.0
~~END~~


SELECT CONVERT(DATETIME, 'Apr12, 4 14:30')
GO
~~START~~
datetime
2004-04-12 14:30:00.0
~~END~~


SELECT CONVERT(DATETIME, 'Apr12 4 14:30')
GO
~~START~~
datetime
2004-04-12 14:30:00.0
~~END~~


SELECT CONVERT(DATETIME, 'Apr12, 14:30')
GO
~~START~~
datetime
~~ERROR (Code: 33557097)~~

~~ERROR (Message: Conversion failed when converting date and/or time from character string.)~~


SELECT CONVERT(DATETIME, 'Apr12 14:30')
GO
~~START~~
datetime
~~ERROR (Code: 33557097)~~

~~ERROR (Message: Conversion failed when converting date and/or time from character string.)~~


SELECT CONVERT(DATETIME, 'Apr1, 24 14:30')
GO
~~START~~
datetime
2024-04-01 14:30:00.0
~~END~~


SELECT CONVERT(DATETIME, 'Apr1 24 14:30')
GO
~~START~~
datetime
2024-04-01 14:30:00.0
~~END~~


SELECT CONVERT(DATETIME, 'Apr1, 4 14:30')
GO
~~START~~
datetime
2004-04-01 14:30:00.0
~~END~~


SELECT CONVERT(DATETIME, 'Apr1 4 14:30')
GO
~~START~~
datetime
2004-04-01 14:30:00.0
~~END~~


SELECT CONVERT(DATETIME, 'Apr1, 14:30')
GO
~~START~~
datetime
~~ERROR (Code: 33557097)~~

~~ERROR (Message: Conversion failed when converting date and/or time from character string.)~~


SELECT CONVERT(DATETIME, 'Apr1 14:30')
GO
~~START~~
datetime
~~ERROR (Code: 33557097)~~

~~ERROR (Message: Conversion failed when converting date and/or time from character string.)~~


-- For styles 130 and 131, the month name will be in hijri format
-- this is only applicable for datetime and smalldatetime, for other datatypes error will be thrown
SELECT CONVERT(DATETIME, N'محرم 12, 24  14:30', 130)
GO
~~START~~
datetime
~~ERROR (Code: 33557097)~~

~~ERROR (Message: The conversion of a varchar data type to a datetime data type resulted in an out-of-range value.)~~


SELECT CONVERT(DATETIME, N'محرم 12 24  14:30', 130)
GO
~~START~~
datetime
~~ERROR (Code: 33557097)~~

~~ERROR (Message: The conversion of a varchar data type to a datetime data type resulted in an out-of-range value.)~~


SELECT CONVERT(DATETIME, N'محرم 12, 4  14:30', 130)
GO
~~START~~
datetime
~~ERROR (Code: 33557097)~~

~~ERROR (Message: The conversion of a varchar data type to a datetime data type resulted in an out-of-range value.)~~


SELECT CONVERT(DATETIME, N'محرم 12 4  14:30', 130)
GO
~~START~~
datetime
~~ERROR (Code: 33557097)~~

~~ERROR (Message: The conversion of a varchar data type to a datetime data type resulted in an out-of-range value.)~~


SELECT CONVERT(DATETIME, N'محرم 12,  14:30', 130)
GO
~~START~~
datetime
~~ERROR (Code: 33557097)~~

~~ERROR (Message: Conversion failed when converting date and/or time from character string.)~~


SELECT CONVERT(DATETIME, N'محرم 12  14:30', 130)
GO
~~START~~
datetime
~~ERROR (Code: 33557097)~~

~~ERROR (Message: Conversion failed when converting date and/or time from character string.)~~


SELECT CONVERT(DATETIME, N'محرم 1, 24  14:30', 130)
GO
~~START~~
datetime
~~ERROR (Code: 33557097)~~

~~ERROR (Message: The conversion of a varchar data type to a datetime data type resulted in an out-of-range value.)~~


SELECT CONVERT(DATETIME, N'محرم 1 24  14:30', 130)
GO
~~START~~
datetime
~~ERROR (Code: 33557097)~~

~~ERROR (Message: The conversion of a varchar data type to a datetime data type resulted in an out-of-range value.)~~


SELECT CONVERT(DATETIME, N'محرم 1, 4  14:30', 130)
GO
~~START~~
datetime
~~ERROR (Code: 33557097)~~

~~ERROR (Message: The conversion of a varchar data type to a datetime data type resulted in an out-of-range value.)~~


SELECT CONVERT(DATETIME, N'محرم 1 4  14:30', 130)
GO
~~START~~
datetime
~~ERROR (Code: 33557097)~~

~~ERROR (Message: The conversion of a varchar data type to a datetime data type resulted in an out-of-range value.)~~


SELECT CONVERT(DATETIME, N'محرم 1,  14:30', 130)
GO
~~START~~
datetime
~~ERROR (Code: 33557097)~~

~~ERROR (Message: Conversion failed when converting date and/or time from character string.)~~


SELECT CONVERT(DATETIME, N'محرم 1  14:30', 130)
GO
~~START~~
datetime
~~ERROR (Code: 33557097)~~

~~ERROR (Message: Conversion failed when converting date and/or time from character string.)~~


SELECT CONVERT(DATETIME, N'محرم12, 24  14:30', 130)
GO
~~START~~
datetime
~~ERROR (Code: 33557097)~~

~~ERROR (Message: The conversion of a varchar data type to a datetime data type resulted in an out-of-range value.)~~


SELECT CONVERT(DATETIME, N'محرم12 24  14:30', 130)
GO
~~START~~
datetime
~~ERROR (Code: 33557097)~~

~~ERROR (Message: The conversion of a varchar data type to a datetime data type resulted in an out-of-range value.)~~


SELECT CONVERT(DATETIME, N'محرم12, 4  14:30', 130)
GO
~~START~~
datetime
~~ERROR (Code: 33557097)~~

~~ERROR (Message: The conversion of a varchar data type to a datetime data type resulted in an out-of-range value.)~~


SELECT CONVERT(DATETIME, N'محرم12 4  14:30', 130)
GO
~~START~~
datetime
~~ERROR (Code: 33557097)~~

~~ERROR (Message: The conversion of a varchar data type to a datetime data type resulted in an out-of-range value.)~~


SELECT CONVERT(DATETIME, N'محرم12,  14:30', 130)
GO
~~START~~
datetime
~~ERROR (Code: 33557097)~~

~~ERROR (Message: Conversion failed when converting date and/or time from character string.)~~


SELECT CONVERT(DATETIME, N'محرم12  14:30', 130)
GO
~~START~~
datetime
~~ERROR (Code: 33557097)~~

~~ERROR (Message: Conversion failed when converting date and/or time from character string.)~~


SELECT CONVERT(DATETIME, N'محرم1, 24  14:30', 130)
GO
~~START~~
datetime
~~ERROR (Code: 33557097)~~

~~ERROR (Message: The conversion of a varchar data type to a datetime data type resulted in an out-of-range value.)~~


SELECT CONVERT(DATETIME, N'محرم1 24  14:30', 130)
GO
~~START~~
datetime
~~ERROR (Code: 33557097)~~

~~ERROR (Message: The conversion of a varchar data type to a datetime data type resulted in an out-of-range value.)~~


SELECT CONVERT(DATETIME, N'محرم1, 4  14:30', 130)
GO
~~START~~
datetime
~~ERROR (Code: 33557097)~~

~~ERROR (Message: The conversion of a varchar data type to a datetime data type resulted in an out-of-range value.)~~


SELECT CONVERT(DATETIME, N'محرم1 4  14:30', 130)
GO
~~START~~
datetime
~~ERROR (Code: 33557097)~~

~~ERROR (Message: The conversion of a varchar data type to a datetime data type resulted in an out-of-range value.)~~


SELECT CONVERT(DATETIME, N'محرم1,  14:30', 130)
GO
~~START~~
datetime
~~ERROR (Code: 33557097)~~

~~ERROR (Message: Conversion failed when converting date and/or time from character string.)~~


SELECT CONVERT(DATETIME, N'محرم1  14:30', 130)
GO
~~START~~
datetime
~~ERROR (Code: 33557097)~~

~~ERROR (Message: Conversion failed when converting date and/or time from character string.)~~


--- mon yyyy [dd]
SELECT CONVERT(DATETIME, 'Apr 2024 22 14:30')
GO
~~START~~
datetime
2024-04-22 14:30:00.0
~~END~~


SELECT CONVERT(DATETIME, 'Apr 2024 2 14:30')
GO
~~START~~
datetime
2024-04-02 14:30:00.0
~~END~~


SELECT CONVERT(DATETIME, 'Apr 2024 14:30')
GO
~~START~~
datetime
2024-04-01 14:30:00.0
~~END~~


SELECT CONVERT(DATETIME, 'Apr2024 22 14:30')
GO
~~START~~
datetime
2024-04-22 14:30:00.0
~~END~~


SELECT CONVERT(DATETIME, 'Apr2024 2 14:30')
GO
~~START~~
datetime
2024-04-02 14:30:00.0
~~END~~


SELECT CONVERT(DATETIME, 'Apr2024 14:30')
GO
~~START~~
datetime
2024-04-01 14:30:00.0
~~END~~


-- For styles 130 and 131, the month name will be in hijri format
-- this is only applicable for datetime and smalldatetime, for other datatypes error will be thrown
SELECT CONVERT(DATETIME, N'محرم 2024 22  14:30', 130)
GO
~~START~~
datetime
2585-05-12 14:30:00.0
~~END~~


SELECT CONVERT(DATETIME, N'محرم 2024 2  14:30', 130)
GO
~~START~~
datetime
2585-04-22 14:30:00.0
~~END~~


SELECT CONVERT(DATETIME, N'محرم 2024  14:30', 130)
GO
~~START~~
datetime
2585-04-21 14:30:00.0
~~END~~


SELECT CONVERT(DATETIME, N'محرم2024 22  14:30', 130)
GO
~~START~~
datetime
2585-05-12 14:30:00.0
~~END~~


SELECT CONVERT(DATETIME, N'محرم2024 2  14:30', 130)
GO
~~START~~
datetime
2585-04-22 14:30:00.0
~~END~~


SELECT CONVERT(DATETIME, N'محرم2024  14:30', 130)
GO
~~START~~
datetime
2585-04-21 14:30:00.0
~~END~~


--- [dd] mon[,] yyyy
SELECT CONVERT(DATETIME, '24 Apr, 2024 14:30')
GO
~~START~~
datetime
2024-04-24 14:30:00.0
~~END~~


SELECT CONVERT(DATETIME, '24 Apr 2024 14:30')
GO
~~START~~
datetime
2024-04-24 14:30:00.0
~~END~~


SELECT CONVERT(DATETIME, '4 Apr, 2024 14:30')
GO
~~START~~
datetime
2024-04-04 14:30:00.0
~~END~~


SELECT CONVERT(DATETIME, '4 Apr 2024 14:30')
GO
~~START~~
datetime
2024-04-04 14:30:00.0
~~END~~


SELECT CONVERT(DATETIME, 'Apr, 2024 14:30')
GO
~~START~~
datetime
2024-04-01 14:30:00.0
~~END~~


SELECT CONVERT(DATETIME, 'Apr 2024 14:30')
GO
~~START~~
datetime
2024-04-01 14:30:00.0
~~END~~


SELECT CONVERT(DATETIME, '24Apr, 2024 14:30')
GO
~~START~~
datetime
2024-04-24 14:30:00.0
~~END~~


SELECT CONVERT(DATETIME, '24Apr2024 14:30')
GO
~~START~~
datetime
2024-04-24 14:30:00.0
~~END~~


SELECT CONVERT(DATETIME, '4Apr, 2024 14:30')
GO
~~START~~
datetime
2024-04-04 14:30:00.0
~~END~~


SELECT CONVERT(DATETIME, '4Apr2024 14:30')
GO
~~START~~
datetime
2024-04-04 14:30:00.0
~~END~~


SELECT CONVERT(DATETIME, 'Apr, 2024 14:30')
GO
~~START~~
datetime
2024-04-01 14:30:00.0
~~END~~


SELECT CONVERT(DATETIME, 'Apr2024 14:30')
GO
~~START~~
datetime
2024-04-01 14:30:00.0
~~END~~


-- For styles 130 and 131, the month name will be in hijri format, 
-- also these styles only support DATEFORMAT DMY, hence following queries should 
SELECT CONVERT(DATETIME, N'24 محرم, 2024  14:30', 130)
GO
~~START~~
datetime
2585-05-14 14:30:00.0
~~END~~


SELECT CONVERT(DATETIME, N'24 محرم 2024  14:30', 130)
GO
~~START~~
datetime
2585-05-14 14:30:00.0
~~END~~


SELECT CONVERT(DATETIME, N'4 محرم, 2024  14:30', 130)
GO
~~START~~
datetime
2585-04-24 14:30:00.0
~~END~~


SELECT CONVERT(DATETIME, N'4 محرم 2024  14:30', 130)
GO
~~START~~
datetime
2585-04-24 14:30:00.0
~~END~~


SELECT CONVERT(DATETIME, N'محرم, 2024  14:30', 130)
GO
~~START~~
datetime
2585-04-21 14:30:00.0
~~END~~


SELECT CONVERT(DATETIME, N'محرم 2024  14:30', 130)
GO
~~START~~
datetime
2585-04-21 14:30:00.0
~~END~~


SELECT CONVERT(DATETIME, N'24محرم, 2024  14:30', 130)
GO
~~START~~
datetime
2585-05-14 14:30:00.0
~~END~~


SELECT CONVERT(DATETIME, N'24محرم2024  14:30', 130)
GO
~~START~~
datetime
2585-05-14 14:30:00.0
~~END~~


SELECT CONVERT(DATETIME, N'4محرم, 2024  14:30', 130)
GO
~~START~~
datetime
2585-04-24 14:30:00.0
~~END~~


SELECT CONVERT(DATETIME, N'4محرم2024  14:30', 130)
GO
~~START~~
datetime
2585-04-24 14:30:00.0
~~END~~


SELECT CONVERT(DATETIME, N'محرم, 2024  14:30', 130)
GO
~~START~~
datetime
2585-04-21 14:30:00.0
~~END~~


SELECT CONVERT(DATETIME, N'محرم2024  14:30', 130)
GO
~~START~~
datetime
2585-04-21 14:30:00.0
~~END~~


--- dd mon[,][yy]yy
SELECT CONVERT(DATETIME, '12 Apr, 2024 14:30')
GO
~~START~~
datetime
2024-04-12 14:30:00.0
~~END~~


SELECT CONVERT(DATETIME, '12 Apr 2024 14:30')
GO
~~START~~
datetime
2024-04-12 14:30:00.0
~~END~~


SELECT CONVERT(DATETIME, '12 Apr, 24 14:30')
GO
~~START~~
datetime
2024-04-12 14:30:00.0
~~END~~


SELECT CONVERT(DATETIME, '12 Apr 24 14:30')
GO
~~START~~
datetime
2024-04-12 14:30:00.0
~~END~~


SELECT CONVERT(DATETIME, '12 Apr, 4 14:30')
GO
~~START~~
datetime
2004-04-12 14:30:00.0
~~END~~


SELECT CONVERT(DATETIME, '12 Apr 4 14:30')
GO
~~START~~
datetime
2004-04-12 14:30:00.0
~~END~~


SELECT CONVERT(DATETIME, '12 Apr, 14:30')
GO
~~START~~
datetime
~~ERROR (Code: 33557097)~~

~~ERROR (Message: Conversion failed when converting date and/or time from character string.)~~


SELECT CONVERT(DATETIME, '12 Apr 14:30')
GO
~~START~~
datetime
~~ERROR (Code: 33557097)~~

~~ERROR (Message: Conversion failed when converting date and/or time from character string.)~~


SELECT CONVERT(DATETIME, '12Apr, 2024 14:30')
GO
~~START~~
datetime
2024-04-12 14:30:00.0
~~END~~


SELECT CONVERT(DATETIME, '12Apr2024 14:30')
GO
~~START~~
datetime
2024-04-12 14:30:00.0
~~END~~


SELECT CONVERT(DATETIME, '12Apr, 24 14:30')
GO
~~START~~
datetime
2024-04-12 14:30:00.0
~~END~~


SELECT CONVERT(DATETIME, '12Apr24 14:30')
GO
~~START~~
datetime
2024-04-12 14:30:00.0
~~END~~


SELECT CONVERT(DATETIME, '12Apr, 4 14:30')
GO
~~START~~
datetime
2004-04-12 14:30:00.0
~~END~~


SELECT CONVERT(DATETIME, '12Apr4 14:30')
GO
~~START~~
datetime
2004-04-12 14:30:00.0
~~END~~


SELECT CONVERT(DATETIME, '12Apr, 14:30')
GO
~~START~~
datetime
~~ERROR (Code: 33557097)~~

~~ERROR (Message: Conversion failed when converting date and/or time from character string.)~~


SELECT CONVERT(DATETIME, '12Apr 14:30')
GO
~~START~~
datetime
~~ERROR (Code: 33557097)~~

~~ERROR (Message: Conversion failed when converting date and/or time from character string.)~~


-- For styles 130 and 131, the month name will be in hijri format, 
-- also these styles only support DATEFORMAT DMY, hence following queries should work
SELECT CONVERT(DATETIME, N'12 محرم, 2024  14:30', 130)
GO
~~START~~
datetime
2585-05-02 14:30:00.0
~~END~~


SELECT CONVERT(DATETIME, N'12 محرم 2024  14:30', 130)
GO
~~START~~
datetime
2585-05-02 14:30:00.0
~~END~~


SELECT CONVERT(DATETIME, N'12 محرم, 24  14:30', 130)
GO
~~START~~
datetime
~~ERROR (Code: 33557097)~~

~~ERROR (Message: The conversion of a varchar data type to a datetime data type resulted in an out-of-range value.)~~


SELECT CONVERT(DATETIME, N'12 محرم 24  14:30', 130)
GO
~~START~~
datetime
~~ERROR (Code: 33557097)~~

~~ERROR (Message: The conversion of a varchar data type to a datetime data type resulted in an out-of-range value.)~~


SELECT CONVERT(DATETIME, N'12 محرم, 4  14:30', 130)
GO
~~START~~
datetime
~~ERROR (Code: 33557097)~~

~~ERROR (Message: The conversion of a varchar data type to a datetime data type resulted in an out-of-range value.)~~


SELECT CONVERT(DATETIME, N'12 محرم 4  14:30', 130)
GO
~~START~~
datetime
~~ERROR (Code: 33557097)~~

~~ERROR (Message: The conversion of a varchar data type to a datetime data type resulted in an out-of-range value.)~~


SELECT CONVERT(DATETIME, N'12 محرم,  14:30', 130)
GO
~~START~~
datetime
~~ERROR (Code: 33557097)~~

~~ERROR (Message: Conversion failed when converting date and/or time from character string.)~~


SELECT CONVERT(DATETIME, N'12 محرم  14:30', 130)
GO
~~START~~
datetime
~~ERROR (Code: 33557097)~~

~~ERROR (Message: Conversion failed when converting date and/or time from character string.)~~


SELECT CONVERT(DATETIME, N'12محرم, 2024  14:30', 130)
GO
~~START~~
datetime
2585-05-02 14:30:00.0
~~END~~


SELECT CONVERT(DATETIME, N'12محرم2024  14:30', 130)
GO
~~START~~
datetime
2585-05-02 14:30:00.0
~~END~~


SELECT CONVERT(DATETIME, N'12محرم, 24  14:30', 130)
GO
~~START~~
datetime
~~ERROR (Code: 33557097)~~

~~ERROR (Message: The conversion of a varchar data type to a datetime data type resulted in an out-of-range value.)~~


SELECT CONVERT(DATETIME, N'12محرم24  14:30', 130)
GO
~~START~~
datetime
~~ERROR (Code: 33557097)~~

~~ERROR (Message: The conversion of a varchar data type to a datetime data type resulted in an out-of-range value.)~~


SELECT CONVERT(DATETIME, N'12محرم, 4  14:30', 130)
GO
~~START~~
datetime
~~ERROR (Code: 33557097)~~

~~ERROR (Message: The conversion of a varchar data type to a datetime data type resulted in an out-of-range value.)~~


SELECT CONVERT(DATETIME, N'12محرم4  14:30', 130)
GO
~~START~~
datetime
~~ERROR (Code: 33557097)~~

~~ERROR (Message: The conversion of a varchar data type to a datetime data type resulted in an out-of-range value.)~~


SELECT CONVERT(DATETIME, N'12محرم,  14:30', 130)
GO
~~START~~
datetime
~~ERROR (Code: 33557097)~~

~~ERROR (Message: Conversion failed when converting date and/or time from character string.)~~


SELECT CONVERT(DATETIME, N'12محرم  14:30', 130)
GO
~~START~~
datetime
~~ERROR (Code: 33557097)~~

~~ERROR (Message: Conversion failed when converting date and/or time from character string.)~~


--- dd [yy]yy mon
SELECT CONVERT(DATETIME, '12 2024 Apr 14:30')
GO
~~START~~
datetime
2024-04-12 14:30:00.0
~~END~~


SELECT CONVERT(DATETIME, '12 24 Apr 14:30')
GO
~~START~~
datetime
2024-04-12 14:30:00.0
~~END~~


SELECT CONVERT(DATETIME, '12 2024Apr 14:30')
GO
~~START~~
datetime
2024-04-12 14:30:00.0
~~END~~


SELECT CONVERT(DATETIME, '12 24Apr 14:30')
GO
~~START~~
datetime
2024-04-12 14:30:00.0
~~END~~


-- For styles 130 and 131, the month name will be in hijri format
-- this is only applicable for datetime and smalldatetime, for other datatypes error will be thrown
SELECT CONVERT(DATETIME, N'12 2024 محرم  14:30', 130)
GO
~~START~~
datetime
2585-05-02 14:30:00.0
~~END~~


SELECT CONVERT(DATETIME, N'12 24 محرم  14:30', 130)
GO
~~START~~
datetime
~~ERROR (Code: 33557097)~~

~~ERROR (Message: The conversion of a varchar data type to a datetime data type resulted in an out-of-range value.)~~


SELECT CONVERT(DATETIME, N'12 2024محرم  14:30', 130)
GO
~~START~~
datetime
2585-05-02 14:30:00.0
~~END~~


SELECT CONVERT(DATETIME, N'12 24محرم  14:30', 130)
GO
~~START~~
datetime
~~ERROR (Code: 33557097)~~

~~ERROR (Message: The conversion of a varchar data type to a datetime data type resulted in an out-of-range value.)~~


--- [dd] yyyy mon
SELECT CONVERT(DATETIME, '12 2024 Apr 14:30')
GO
~~START~~
datetime
2024-04-12 14:30:00.0
~~END~~


SELECT CONVERT(DATETIME, '2 2024 Apr 14:30')
GO
~~START~~
datetime
2024-04-02 14:30:00.0
~~END~~


SELECT CONVERT(DATETIME, '2024 Apr 14:30')
GO
~~START~~
datetime
2024-04-01 14:30:00.0
~~END~~


SELECT CONVERT(DATETIME, '12 2024Apr 14:30')
GO
~~START~~
datetime
2024-04-12 14:30:00.0
~~END~~


SELECT CONVERT(DATETIME, '2 2024Apr 14:30')
GO
~~START~~
datetime
2024-04-02 14:30:00.0
~~END~~


SELECT CONVERT(DATETIME, '2024Apr 14:30')
GO
~~START~~
datetime
2024-04-01 14:30:00.0
~~END~~


-- For styles 130 and 131, the month name will be in hijri format
-- this is only applicable for datetime and smalldatetime, for other datatypes error will be thrown
SELECT CONVERT(DATETIME, N'12 2024 محرم  14:30', 130)
GO
~~START~~
datetime
2585-05-02 14:30:00.0
~~END~~


SELECT CONVERT(DATETIME, N'2 2024 محرم  14:30', 130)
GO
~~START~~
datetime
2585-04-22 14:30:00.0
~~END~~


SELECT CONVERT(DATETIME, N'2024 محرم  14:30', 130)
GO
~~START~~
datetime
2585-04-21 14:30:00.0
~~END~~


SELECT CONVERT(DATETIME, N'12 2024محرم  14:30', 130)
GO
~~START~~
datetime
2585-05-02 14:30:00.0
~~END~~


SELECT CONVERT(DATETIME, N'2 2024محرم  14:30', 130)
GO
~~START~~
datetime
2585-04-22 14:30:00.0
~~END~~


SELECT CONVERT(DATETIME, N'2024محرم  14:30', 130)
GO
~~START~~
datetime
2585-04-21 14:30:00.0
~~END~~


--- yyyy mon [dd]
SELECT CONVERT(DATETIME, '2024 Apr 12 14:30')
GO
~~START~~
datetime
2024-04-12 14:30:00.0
~~END~~


SELECT CONVERT(DATETIME, '2024 Apr 2 14:30')
GO
~~START~~
datetime
2024-04-02 14:30:00.0
~~END~~


SELECT CONVERT(DATETIME, '2024 Apr 14:30')
GO
~~START~~
datetime
2024-04-01 14:30:00.0
~~END~~


SELECT CONVERT(DATETIME, '2024Apr12 14:30')
GO
~~START~~
datetime
2024-04-12 14:30:00.0
~~END~~


SELECT CONVERT(DATETIME, '2024Apr2 14:30')
GO
~~START~~
datetime
2024-04-02 14:30:00.0
~~END~~


SELECT CONVERT(DATETIME, '2024Apr 14:30')
GO
~~START~~
datetime
2024-04-01 14:30:00.0
~~END~~


-- For styles 130 and 131, the month name will be in hijri format
-- this is only applicable for datetime and smalldatetime, for other datatypes error will be thrown
SELECT CONVERT(DATETIME, N'2024 محرم 12  14:30', 130)
GO
~~START~~
datetime
2585-05-02 14:30:00.0
~~END~~


SELECT CONVERT(DATETIME, N'2024 محرم 2  14:30', 130)
GO
~~START~~
datetime
2585-04-22 14:30:00.0
~~END~~


SELECT CONVERT(DATETIME, N'2024 محرم  14:30', 130)
GO
~~START~~
datetime
2585-04-21 14:30:00.0
~~END~~


SELECT CONVERT(DATETIME, N'2024محرم12  14:30', 130)
GO
~~START~~
datetime
2585-05-02 14:30:00.0
~~END~~


SELECT CONVERT(DATETIME, N'2024محرم2  14:30', 130)
GO
~~START~~
datetime
2585-04-22 14:30:00.0
~~END~~


SELECT CONVERT(DATETIME, N'2024محرم  14:30', 130)
GO
~~START~~
datetime
2585-04-21 14:30:00.0
~~END~~


--- yyyy [dd] mon
SELECT CONVERT(DATETIME, '2024 12 Apr 14:30')
GO
~~START~~
datetime
2024-04-12 14:30:00.0
~~END~~


SELECT CONVERT(DATETIME, '2024 2 Apr 14:30')
GO
~~START~~
datetime
2024-04-02 14:30:00.0
~~END~~


SELECT CONVERT(DATETIME, '2024 Apr 14:30')
GO
~~START~~
datetime
2024-04-01 14:30:00.0
~~END~~


SELECT CONVERT(DATETIME, '2024 12Apr 14:30')
GO
~~START~~
datetime
2024-04-12 14:30:00.0
~~END~~


SELECT CONVERT(DATETIME, '2024 2Apr 14:30')
GO
~~START~~
datetime
2024-04-02 14:30:00.0
~~END~~


SELECT CONVERT(DATETIME, '2024Apr 14:30')
GO
~~START~~
datetime
2024-04-01 14:30:00.0
~~END~~


-- For styles 130 and 131, the month name will be in hijri format,
-- this is only applicable for datetime and smalldatetime, for other datatypes error will be thrown
SELECT CONVERT(DATETIME, N'2024 12 محرم  14:30', 130)
GO
~~START~~
datetime
2585-05-02 14:30:00.0
~~END~~


SELECT CONVERT(DATETIME, N'2024 2 محرم  14:30', 130)
GO
~~START~~
datetime
2585-04-22 14:30:00.0
~~END~~


SELECT CONVERT(DATETIME, N'2024 محرم  14:30', 130)
GO
~~START~~
datetime
2585-04-21 14:30:00.0
~~END~~


SELECT CONVERT(DATETIME, N'2024 12محرم  14:30', 130)
GO
~~START~~
datetime
2585-05-02 14:30:00.0
~~END~~


SELECT CONVERT(DATETIME, N'2024 2محرم  14:30', 130)
GO
~~START~~
datetime
2585-04-22 14:30:00.0
~~END~~


SELECT CONVERT(DATETIME, N'2024محرم  14:30', 130)
GO
~~START~~
datetime
2585-04-21 14:30:00.0
~~END~~


-- ISO 8601
SELECT CONVERT(DATETIME, '2022-10-22T13:34:12.123')
GO
~~START~~
datetime
2022-10-22 13:34:12.123
~~END~~


SELECT CONVERT(DATETIME, '2022-1-22T13:34:12.123')
GO
~~START~~
datetime
~~ERROR (Code: 33557097)~~

~~ERROR (Message: Conversion failed when converting date and/or time from character string.)~~


SELECT CONVERT(DATETIME, '2022-10-2T13:34:12.123')
GO
~~START~~
datetime
~~ERROR (Code: 33557097)~~

~~ERROR (Message: Conversion failed when converting date and/or time from character string.)~~


SELECT CONVERT(DATETIME, '2022-10-22T3:34:12.123')
GO
~~START~~
datetime
~~ERROR (Code: 33557097)~~

~~ERROR (Message: Conversion failed when converting date and/or time from character string.)~~


SELECT CONVERT(DATETIME, '2022-10-22T13:4:12.123')
GO
~~START~~
datetime
~~ERROR (Code: 33557097)~~

~~ERROR (Message: Conversion failed when converting date and/or time from character string.)~~


SELECT CONVERT(DATETIME, '2022-10-22T13:34:1.123')
GO
~~START~~
datetime
~~ERROR (Code: 33557097)~~

~~ERROR (Message: Conversion failed when converting date and/or time from character string.)~~


SELECT CONVERT(DATETIME, '2022-10-22T13:34:12.1')
GO
~~START~~
datetime
2022-10-22 13:34:12.1
~~END~~


SELECT CONVERT(DATETIME, '2022-10-22T13:34:12.12')
GO
~~START~~
datetime
2022-10-22 13:34:12.12
~~END~~


SELECT CONVERT(DATETIME, '2022-10-22T13:34:12.123')
GO
~~START~~
datetime
2022-10-22 13:34:12.123
~~END~~


SELECT CONVERT(DATETIME, '2022-10-22T13:34:12.1234')
GO
~~START~~
datetime
~~ERROR (Code: 33557097)~~

~~ERROR (Message: Conversion failed when converting date and/or time from character string.)~~


SELECT CONVERT(DATETIME, '2022-10-22T13:34:12.15')
GO
~~START~~
datetime
2022-10-22 13:34:12.15
~~END~~


-- -- spaces are not allowed between any two tokens for ISO 8601
SELECT CONVERT(DATETIME, '2022-10-22T13 :34:12.123')
GO
~~START~~
datetime
~~ERROR (Code: 33557097)~~

~~ERROR (Message: Conversion failed when converting date and/or time from character string.)~~


SELECT CONVERT(DATETIME, '2022-10 -22T13:34:12.123')
GO
~~START~~
datetime
~~ERROR (Code: 33557097)~~

~~ERROR (Message: Conversion failed when converting date and/or time from character string.)~~


SELECT CONVERT(DATETIME, '2022-10-22 T 13:34:12.123')
GO
~~START~~
datetime
~~ERROR (Code: 33557097)~~

~~ERROR (Message: Conversion failed when converting date and/or time from character string.)~~


-- Unseparated
SELECT CONVERT(DATETIME, '20240129')
GO
~~START~~
datetime
2024-01-29 00:00:00.0
~~END~~


SELECT CONVERT(DATETIME, '20241329')
GO
~~START~~
datetime
~~ERROR (Code: 33557097)~~

~~ERROR (Message: The conversion of a varchar data type to a datetime data type resulted in an out-of-range value.)~~


SELECT CONVERT(DATETIME, '240129')
GO
~~START~~
datetime
2024-01-29 00:00:00.0
~~END~~


SELECT CONVERT(DATETIME, '241329')
GO
~~START~~
datetime
~~ERROR (Code: 33557097)~~

~~ERROR (Message: The conversion of a varchar data type to a datetime data type resulted in an out-of-range value.)~~


SELECT CONVERT(DATETIME, '2001')
GO
~~START~~
datetime
2001-01-01 00:00:00.0
~~END~~


SELECT CONVERT(DATETIME, '0001')
GO
~~START~~
datetime
~~ERROR (Code: 33557097)~~

~~ERROR (Message: The conversion of a varchar data type to a datetime data type resulted in an out-of-range value.)~~


SELECT CONVERT(DATETIME, '20240129 03:00:00')
GO
~~START~~
datetime
2024-01-29 03:00:00.0
~~END~~


SELECT CONVERT(DATETIME, '20241329 03:00:00')
GO
~~START~~
datetime
~~ERROR (Code: 33557097)~~

~~ERROR (Message: The conversion of a varchar data type to a datetime data type resulted in an out-of-range value.)~~


SELECT CONVERT(DATETIME, '240129 03:00')
GO
~~START~~
datetime
2024-01-29 03:00:00.0
~~END~~


SELECT CONVERT(DATETIME, '241329 03:00')
GO
~~START~~
datetime
~~ERROR (Code: 33557097)~~

~~ERROR (Message: The conversion of a varchar data type to a datetime data type resulted in an out-of-range value.)~~


SELECT CONVERT(DATETIME, '2001 03:00:00.123')
GO
~~START~~
datetime
2001-01-01 03:00:00.123
~~END~~


SELECT CONVERT(DATETIME, '0001 03:00:00.421')
GO
~~START~~
datetime
~~ERROR (Code: 33557097)~~

~~ERROR (Message: The conversion of a varchar data type to a datetime data type resulted in an out-of-range value.)~~


-- -- invalid syntax
SELECT CONVERT(DATETIME, '0')
GO
~~START~~
datetime
~~ERROR (Code: 33557097)~~

~~ERROR (Message: Conversion failed when converting date and/or time from character string.)~~


SELECT CONVERT(DATETIME, '1')
GO
~~START~~
datetime
~~ERROR (Code: 33557097)~~

~~ERROR (Message: Conversion failed when converting date and/or time from character string.)~~


SELECT CONVERT(DATETIME, '11')
GO
~~START~~
datetime
~~ERROR (Code: 33557097)~~

~~ERROR (Message: Conversion failed when converting date and/or time from character string.)~~


SELECT CONVERT(DATETIME, '111')
GO
~~START~~
datetime
~~ERROR (Code: 33557097)~~

~~ERROR (Message: Conversion failed when converting date and/or time from character string.)~~


SELECT CONVERT(DATETIME, '11111')
GO
~~START~~
datetime
~~ERROR (Code: 33557097)~~

~~ERROR (Message: Conversion failed when converting date and/or time from character string.)~~


SELECT CONVERT(DATETIME, '1111111')
GO
~~START~~
datetime
~~ERROR (Code: 33557097)~~

~~ERROR (Message: Conversion failed when converting date and/or time from character string.)~~


-- should return default DATETIME
SELECT CONVERT(DATETIME, '16:23:51')
GO
~~START~~
datetime
1900-01-01 16:23:51.0
~~END~~


SELECT CONVERT(DATETIME, '4:12:12:123')
GO
~~START~~
datetime
1900-01-01 04:12:12.123
~~END~~


SELECT CONVERT(DATETIME, '4:12:12:1234')
GO
~~START~~
datetime
~~ERROR (Code: 33557097)~~

~~ERROR (Message: Conversion failed when converting date and/or time from character string.)~~


SELECT CONVERT(DATETIME, '4:12:12.1234')
GO
~~START~~
datetime
~~ERROR (Code: 33557097)~~

~~ERROR (Message: Conversion failed when converting date and/or time from character string.)~~


-- hijri
SELECT CONVERT(DATETIME, '20231229', 130)
GO
~~START~~
datetime
2585-04-19 00:00:00.0
~~END~~


SELECT CONVERT(DATETIME, '20231230', 130)
GO
~~START~~
datetime
2585-04-20 00:00:00.0
~~END~~


SELECT CONVERT(DATETIME, '20231129', 130)
GO
~~START~~
datetime
2585-03-20 00:00:00.0
~~END~~


SELECT CONVERT(DATETIME, '20231130', 130)
GO
~~START~~
datetime
2585-03-21 00:00:00.0
~~END~~


SELECT CONVERT(DATETIME, N'22 محرم 1440 1:39:17.090', 130)
GO
~~START~~
datetime
2018-10-02 01:39:17.09
~~END~~


SELECT CONVERT(DATETIME, N'22 محرم 1440 1:39:17.090', 131)
GO
~~START~~
datetime
2018-10-02 01:39:17.09
~~END~~


SELECT CONVERT(DATETIME, '22/12/1440 1:39:17.090PM', 130)
GO
~~START~~
datetime
2019-08-23 13:39:17.09
~~END~~


SELECT CONVERT(DATETIME, '22/12/1440 1:39:17.090PM', 131)
GO
~~START~~
datetime
2019-08-23 13:39:17.09
~~END~~


-- -- hijri leap year
SELECT CONVERT(DATETIME, '20241230', 130)
GO
~~START~~
datetime
~~ERROR (Code: 33557097)~~

~~ERROR (Message: The conversion of a varchar data type to a datetime data type resulted in an out-of-range value.)~~


-- rounding of DATETIME
SELECT CONVERT(DATETIME, '01/01/98 23:59:59.999')
GO
~~START~~
datetime
1998-01-02 00:00:00.0
~~END~~


SELECT CONVERT(DATETIME, '01/01/98 23:59:59.998')
GO
~~START~~
datetime
1998-01-01 23:59:59.997
~~END~~


SELECT CONVERT(DATETIME, '01/01/98 23:59:59.997')
GO
~~START~~
datetime
1998-01-01 23:59:59.997
~~END~~


SELECT CONVERT(DATETIME, '01/01/98 23:59:59.996')
GO
~~START~~
datetime
1998-01-01 23:59:59.997
~~END~~


SELECT CONVERT(DATETIME, '01/01/98 23:59:59.995')
GO
~~START~~
datetime
1998-01-01 23:59:59.997
~~END~~


SELECT CONVERT(DATETIME, '01/01/98 23:59:59.994')
GO
~~START~~
datetime
1998-01-01 23:59:59.993
~~END~~


SELECT CONVERT(DATETIME, '01/01/98 23:59:59.993')
GO
~~START~~
datetime
1998-01-01 23:59:59.993
~~END~~


SELECT CONVERT(DATETIME, '01/01/98 23:59:59.992')
GO
~~START~~
datetime
1998-01-01 23:59:59.993
~~END~~


SELECT CONVERT(DATETIME, '01/01/98 23:59:59.991')
GO
~~START~~
datetime
1998-01-01 23:59:59.99
~~END~~


SELECT CONVERT(DATETIME, '01/01/98 23:59:59.990')
GO
~~START~~
datetime
1998-01-01 23:59:59.99
~~END~~


-- DATETIME with typmod
SELECT CONVERT(DATETIME(1), '01/01/98 23:59:59.123')
GO
~~START~~
datetime
~~ERROR (Code: 33557097)~~

~~ERROR (Message: CAST or CONVERT: invalid attributes specified for type 'datetime')~~


SELECT CONVERT(DATETIME(2), '01/01/98 23:59:59.123')
GO
~~START~~
datetime
~~ERROR (Code: 33557097)~~

~~ERROR (Message: CAST or CONVERT: invalid attributes specified for type 'datetime')~~


SELECT CONVERT(DATETIME(3), '01/01/98 23:59:59.123')
GO
~~START~~
datetime
~~ERROR (Code: 33557097)~~

~~ERROR (Message: CAST or CONVERT: invalid attributes specified for type 'datetime')~~


-- boundary tests
SELECT CONVERT(DATETIME, '9999-12-31 23:59:59.999')
GO
~~START~~
datetime
~~ERROR (Code: 33557097)~~

~~ERROR (Message: The conversion of a varchar data type to a datetime data type resulted in an out-of-range value.)~~


SELECT CONVERT(DATETIME, '9999-12-31 23:59:59.998')
GO
~~START~~
datetime
9999-12-31 23:59:59.997
~~END~~


-- -- out of bound values
SELECT CONVERT(DATETIME,'2022-10-00 23:59:59.990')
GO
~~START~~
datetime
~~ERROR (Code: 33557097)~~

~~ERROR (Message: The conversion of a varchar data type to a datetime data type resulted in an out-of-range value.)~~


SELECT CONVERT(DATETIME,'0000-10-01 23:59:59.990')
GO
~~START~~
datetime
~~ERROR (Code: 33557097)~~

~~ERROR (Message: The conversion of a varchar data type to a datetime data type resulted in an out-of-range value.)~~


SELECT CONVERT(DATETIME,'2023-00-01 23:59:59.990')
GO
~~START~~
datetime
~~ERROR (Code: 33557097)~~

~~ERROR (Message: The conversion of a varchar data type to a datetime data type resulted in an out-of-range value.)~~


SELECT CONVERT(DATETIME,'0000-00-00 23:59:59.990')
GO
~~START~~
datetime
~~ERROR (Code: 33557097)~~

~~ERROR (Message: The conversion of a varchar data type to a datetime data type resulted in an out-of-range value.)~~


SELECT CONVERT(DATETIME,'1742-10-01 23:59:59.990')
GO
~~START~~
datetime
~~ERROR (Code: 33557097)~~

~~ERROR (Message: The conversion of a varchar data type to a datetime data type resulted in an out-of-range value.)~~


-- Different DATETIME formats with their corresponding styles
SELECT CONVERT(DATETIME, 'Apr 10 2021 11:12AM', 0)
GO
~~START~~
datetime
2021-04-10 11:12:00.0
~~END~~


SELECT CONVERT(DATETIME, '02/12/21', 1)
GO
~~START~~
datetime
2021-02-12 00:00:00.0
~~END~~


SELECT CONVERT(DATETIME, '21.02.12', 2)
GO
~~START~~
datetime
2021-02-12 00:00:00.0
~~END~~


SELECT CONVERT(DATETIME, '12/02/21', 3)
GO
~~START~~
datetime
2021-02-12 00:00:00.0
~~END~~


SELECT CONVERT(DATETIME, '12.02.21', 4)
GO
~~START~~
datetime
2021-02-12 00:00:00.0
~~END~~


SELECT CONVERT(DATETIME, '12-02-21', 5)
GO
~~START~~
datetime
2021-02-12 00:00:00.0
~~END~~


SELECT CONVERT(DATETIME, '12 Apr 21', 6)
GO
~~START~~
datetime
2021-04-12 00:00:00.0
~~END~~


SELECT CONVERT(DATETIME, 'Apr 12, 21', 7)
GO
~~START~~
datetime
2021-04-12 00:00:00.0
~~END~~


SELECT CONVERT(DATETIME, '10:13:14', 8)
GO
~~START~~
datetime
1900-01-01 10:13:14.0
~~END~~


SELECT CONVERT(DATETIME, '10:13:14', 24)
GO
~~START~~
datetime
1900-01-01 10:13:14.0
~~END~~


SELECT CONVERT(DATETIME, 'Apr 12 2021 10:13:14:123AM', 9)
GO
~~START~~
datetime
2021-04-12 10:13:14.123
~~END~~


SELECT CONVERT(DATETIME, '02-12-21', 10)
GO
~~START~~
datetime
2021-02-12 00:00:00.0
~~END~~


SELECT CONVERT(DATETIME, '21/02/12', 11)
GO
~~START~~
datetime
2021-02-12 00:00:00.0
~~END~~


SELECT CONVERT(DATETIME, '210212', 12)
GO
~~START~~
datetime
2021-02-12 00:00:00.0
~~END~~


SELECT CONVERT(DATETIME, '12 Apr 2021 15:13:14:123', 13)
GO
~~START~~
datetime
2021-04-12 15:13:14.123
~~END~~


SELECT CONVERT(DATETIME, '15:13:14:123', 14)
GO
~~START~~
datetime
1900-01-01 15:13:14.123
~~END~~


SELECT CONVERT(DATETIME, '2021-02-12 15:13:14', 20)
GO
~~START~~
datetime
2021-02-12 15:13:14.0
~~END~~


SELECT CONVERT(DATETIME, '2021-02-12 15:13:14.123', 21)
GO
~~START~~
datetime
2021-02-12 15:13:14.123
~~END~~


SELECT CONVERT(DATETIME, '02/12/21 15:13:14 PM', 22)
GO
~~START~~
datetime
~~ERROR (Code: 33557097)~~

~~ERROR (Message: Conversion failed when converting date and/or time from character string.)~~


SELECT CONVERT(DATETIME, '2021-02-12', 23)
GO
~~START~~
datetime
~~ERROR (Code: 33557097)~~

~~ERROR (Message: Conversion failed when converting date and/or time from character string.)~~


SELECT CONVERT(DATETIME, '2021-02-12 15:13:14.123', 25)
GO
~~START~~
datetime
~~ERROR (Code: 33557097)~~

~~ERROR (Message: Conversion failed when converting date and/or time from character string.)~~


SELECT CONVERT(DATETIME, 'Apr 10 2021 11:12AM', 100)
GO
~~START~~
datetime
2021-04-10 11:12:00.0
~~END~~


SELECT CONVERT(DATETIME, '02/12/2021', 101)
GO
~~START~~
datetime
2021-02-12 00:00:00.0
~~END~~


SELECT CONVERT(DATETIME, '2021.02.12', 102)
GO
~~START~~
datetime
2021-02-12 00:00:00.0
~~END~~


SELECT CONVERT(DATETIME, '12/02/2021', 103)
GO
~~START~~
datetime
2021-02-12 00:00:00.0
~~END~~


SELECT CONVERT(DATETIME, '12.02.2021', 104)
GO
~~START~~
datetime
2021-02-12 00:00:00.0
~~END~~


SELECT CONVERT(DATETIME, '12-02-2021', 105)
GO
~~START~~
datetime
2021-02-12 00:00:00.0
~~END~~


SELECT CONVERT(DATETIME, '12 Apr 2021', 106)
GO
~~START~~
datetime
2021-04-12 00:00:00.0
~~END~~


SELECT CONVERT(DATETIME, 'Apr 12, 2021', 107)
GO
~~START~~
datetime
2021-04-12 00:00:00.0
~~END~~


SELECT CONVERT(DATETIME, '10:13:14', 108)
GO
~~START~~
datetime
1900-01-01 10:13:14.0
~~END~~


SELECT CONVERT(DATETIME, 'Apr 12 2021 10:13:14:123AM', 109)
GO
~~START~~
datetime
2021-04-12 10:13:14.123
~~END~~


SELECT CONVERT(DATETIME, '02-12-2021', 110)
GO
~~START~~
datetime
2021-02-12 00:00:00.0
~~END~~


SELECT CONVERT(DATETIME, '2021/02/12', 111)
GO
~~START~~
datetime
2021-02-12 00:00:00.0
~~END~~


SELECT CONVERT(DATETIME, '20210212', 112)
GO
~~START~~
datetime
2021-02-12 00:00:00.0
~~END~~


SELECT CONVERT(DATETIME, '12 Apr 2021 15:13:14:123', 113)
GO
~~START~~
datetime
2021-04-12 15:13:14.123
~~END~~


SELECT CONVERT(DATETIME, '15:13:14:123', 114)
GO
~~START~~
datetime
1900-01-01 15:13:14.123
~~END~~


SELECT CONVERT(DATETIME, '2021-02-12 15:13:14', 120)
GO
~~START~~
datetime
2021-02-12 15:13:14.0
~~END~~


SELECT CONVERT(DATETIME, '2021-02-12 15:13:14.123', 121)
GO
~~START~~
datetime
2021-02-12 15:13:14.123
~~END~~


SELECT CONVERT(DATETIME, '2021-02-12T15:13:14.123', 126)
GO
~~START~~
datetime
2021-02-12 15:13:14.123
~~END~~


SELECT CONVERT(DATETIME, '2021-02-12T15:13:14.123', 127)
GO
~~START~~
datetime
2021-02-12 15:13:14.123
~~END~~


SELECT CONVERT(DATETIME, N'22 محرم 1440 1:39:17.090', 130)
GO
~~START~~
datetime
2018-10-02 01:39:17.09
~~END~~


SELECT CONVERT(DATETIME, '12/02/2021 15:13:14:123 PM', 131)
GO
~~START~~
datetime
2582-07-04 15:13:14.123
~~END~~


--- misc
SELECT CONVERT(DATETIME,'2022-10-29 20:01:00.000')
GO
~~START~~
datetime
2022-10-29 20:01:00.0
~~END~~


SELECT CONVERT(DATETIME, '2020')
GO
~~START~~
datetime
2020-01-01 00:00:00.0
~~END~~


SELECT CONVERT(DATETIME, '2000-04-22 16:23:51.7668c0')
GO
~~START~~
datetime
~~ERROR (Code: 33557097)~~

~~ERROR (Message: Conversion failed when converting date and/or time from character string.)~~


SELECT CONVERT(DATETIME, '2001-04-022 16:23:51.766890 +12:00')
GO
~~START~~
datetime
~~ERROR (Code: 33557097)~~

~~ERROR (Message: Conversion failed when converting date and/or time from character string.)~~



SELECT CONVERT(DATETIME, '02001-04-22 16:23:51.766890 +12:00') 
GO 
SELECT CONVERT(DATETIME, ' 2001- 04 - 22 16: 23: 51. 766890 +12:00')
GO
~~START~~
datetime
~~ERROR (Code: 33557097)~~

~~ERROR (Message: Conversion failed when converting date and/or time from character string.)~~


SELECT CONVERT(DATETIME, '02001-04-22 16:23:51')
GO
~~START~~
datetime
~~ERROR (Code: 33557097)~~

~~ERROR (Message: Conversion failed when converting date and/or time from character string.)~~


SELECT CONVERT(DATETIME, '1900-05-06 13:59:29.050 -8:00')
GO
~~START~~
datetime
~~ERROR (Code: 33557097)~~

~~ERROR (Message: Conversion failed when converting date and/or time from character string.)~~


SELECT CONVERT(DATETIME, '2011-08-15 14:30.00')
GO
~~START~~
datetime
2011-08-15 14:30:00.0
~~END~~


SELECT CONVERT(DATETIME,'2022-10-29 20:01:00.000')
GO
~~START~~
datetime
2022-10-29 20:01:00.0
~~END~~


SELECT CONVERT(DATETIME, '2020')
GO
~~START~~
datetime
2020-01-01 00:00:00.0
~~END~~


SELECT CONVERT(DATETIME, '2022-10-30T03:00:00')
GO
~~START~~
datetime
2022-10-30 03:00:00.0
~~END~~


-- some commits are missing in 2_X_DEV causing unexpected output here
SELECT CONVERT(DATETIME, CONVERT(DATETIMEOFFSET,'2021-01-01 00:00:00.000 +12:00'))
GO
~~START~~
datetime
2020-12-31 12:00:00.0
~~END~~


SELECT CONVERT(DATETIME, '2011-08-15 10:30.00 AMZ')
GO
~~START~~
datetime
~~ERROR (Code: 33557097)~~

~~ERROR (Message: Conversion failed when converting date and/or time from character string.)~~


SELECT CONVERT(DATETIME, '2011-08-15 10:30.00 PMZ')
GO
~~START~~
datetime
~~ERROR (Code: 33557097)~~

~~ERROR (Message: Conversion failed when converting date and/or time from character string.)~~


DECLARE @TM_ICLO TIME = '17:24:07.1766670'
SELECT CONVERT(DATETIME, @TM_ICLO)
GO
~~START~~
datetime
1900-01-01 17:24:07.177
~~END~~


-- Dependent objects
SELECT * FROM test_conv_string_to_datetime_v1
GO
~~START~~
datetime
2017-08-25 13:01:59.0
~~END~~

EXEC test_conv_string_to_datetime_p1
GO
~~START~~
datetime
2017-08-25 13:01:59.0
~~END~~

SELECT test_conv_string_to_datetime_f1()
GO
~~START~~
datetime
2017-08-25 13:01:59.0
~~END~~


SELECT * FROM test_conv_string_to_datetime_v2
GO
~~START~~
datetime
1900-01-01 13:01:59.0
~~END~~

EXEC test_conv_string_to_datetime_p2
GO
~~START~~
datetime
1900-01-01 13:01:59.0
~~END~~

SELECT test_conv_string_to_datetime_f2()
GO
~~START~~
datetime
1900-01-01 13:01:59.0
~~END~~


SELECT * FROM test_conv_string_to_datetime_v3
GO
~~START~~
datetime
1753-01-01 00:01:59.0
~~END~~

EXEC test_conv_string_to_datetime_p3
GO
~~START~~
datetime
1753-01-01 00:01:59.0
~~END~~

SELECT test_conv_string_to_datetime_f3()
GO
~~START~~
datetime
1753-01-01 00:01:59.0
~~END~~


SELECT * FROM test_conv_string_to_datetime_v4
GO
~~START~~
datetime
2017-08-25 13:01:59.0
~~END~~

EXEC test_conv_string_to_datetime_p4
GO
~~START~~
datetime
2017-08-25 13:01:59.0
~~END~~

SELECT test_conv_string_to_datetime_f4()
GO
~~START~~
datetime
2017-08-25 13:01:59.0
~~END~~


SELECT * FROM test_conv_string_to_datetime_v5
GO
~~START~~
datetime
2017-08-25 13:01:59.0
~~END~~

EXEC test_conv_string_to_datetime_p5
GO
~~START~~
datetime
2017-08-25 13:01:59.0
~~END~~

SELECT test_conv_string_to_datetime_f5()
GO
~~START~~
datetime
2017-08-25 13:01:59.0
~~END~~


SELECT * FROM test_conv_string_to_datetime_v6
GO
~~START~~
datetime
2017-08-25 13:01:59.0
~~END~~

EXEC test_conv_string_to_datetime_p6
GO
~~START~~
datetime
2017-08-25 13:01:59.0
~~END~~

SELECT test_conv_string_to_datetime_f6()
GO
~~START~~
datetime
2017-08-25 13:01:59.0
~~END~~


SELECT * FROM test_conv_string_to_datetime_v7
GO
~~START~~
datetime
2017-08-25 13:01:59.0
~~END~~

EXEC test_conv_string_to_datetime_p7
GO
~~START~~
datetime
2017-08-25 13:01:59.0
~~END~~

SELECT test_conv_string_to_datetime_f7()
GO
~~START~~
datetime
2017-08-25 13:01:59.0
~~END~~


SELECT * FROM test_conv_string_to_datetime_v8
GO
~~START~~
datetime
1905-07-11 00:00:00.0
~~END~~

EXEC test_conv_string_to_datetime_p8
GO
~~START~~
datetime
1905-07-11 00:00:00.0
~~END~~

SELECT test_conv_string_to_datetime_f8()
GO
~~START~~
datetime
1905-07-11 00:00:00.0
~~END~~


SELECT * FROM test_conv_string_to_datetime_v9
GO
~~START~~
datetime
2017-08-25 13:01:59.0
~~END~~

EXEC test_conv_string_to_datetime_p9
GO
~~START~~
datetime
2017-08-25 13:01:59.0
~~END~~

SELECT test_conv_string_to_datetime_f9()
GO
~~START~~
datetime
2017-08-25 13:01:59.0
~~END~~


SELECT * FROM test_conv_string_to_datetime_v10
GO
~~START~~
datetime
~~ERROR (Code: 33557097)~~

~~ERROR (Message: Conversion failed when converting date and/or time from character string.)~~


SELECT * FROM test_conv_string_to_datetime_v11
GO
~~START~~
datetime
1900-01-21 00:00:00.0
~~END~~

