
/*
 * ===================================================================================================================
 *                                              1. Basic Output clause test
 * ===================================================================================================================
 */
-- Test Case 1: INSERT with OUTPUT
INSERT INTO OutputTest (ID, Name, Value) 
OUTPUT inserted.ID, inserted.Name, inserted.Value
VALUES (4, 'NewTest', 400);
GO
~~START~~
int#!#nvarchar#!#int
4#!#NewTest#!#400
~~END~~


-- Test Case 2: UPDATE with OUTPUT
UPDATE OutputTest 
SET Value = OutputTest.Value + 50
OUTPUT deleted.Name, deleted.Value as OldValue, inserted.Value as NewValue
WHERE ID = 1;
GO
~~START~~
nvarchar#!#int#!#int
Test1#!#100#!#150
~~END~~


-- Test Case 3: DELETE with OUTPUT
DELETE FROM OutputTest
OUTPUT deleted.ID, deleted.Name, deleted.Value
WHERE ID = 2;
GO
~~START~~
int#!#nvarchar#!#int
2#!#Test2#!#200
~~END~~










































































































