insert into triggers_with_transaction_vu_prepare_t1 values(2, 'second');
go
~~START~~
int
~~END~~

~~ROW COUNT: 1~~

~~START~~
int
1
~~END~~

~~ROW COUNT: 1~~

~~ROW COUNT: 1~~

~~START~~
int
2
~~END~~

~~START~~
int#!#varchar
2#!#second
~~END~~

~~ROW COUNT: 1~~


begin tran;
go
insert into triggers_with_transaction_vu_prepare_t1 values(3, 'third');
go
~~START~~
int
~~END~~

~~ROW COUNT: 1~~

~~START~~
int
1
~~END~~

~~ROW COUNT: 1~~

~~ROW COUNT: 1~~

~~START~~
int
2
~~END~~

~~START~~
int#!#varchar
3#!#third
~~END~~

~~ROW COUNT: 1~~

commit;
go

update triggers_with_transaction_vu_prepare_t2 set c1 = 6;
GO
~~ERROR (Code: 547)~~

~~ERROR (Message: new row for relation "triggers_with_transaction_vu_prepare_t2" violates check constraint "triggers_with_transaction_vu_prepare_t2_c1_check")~~


begin tran
go
update triggers_with_transaction_vu_prepare_t2 set c1 = 6;
go
~~ERROR (Code: 547)~~

~~ERROR (Message: new row for relation "triggers_with_transaction_vu_prepare_t2" violates check constraint "triggers_with_transaction_vu_prepare_t2_c1_check")~~

if (@@trancount > 0) rollback;
go

begin tran
go
insert into triggers_with_transaction_vu_prepare_t1 values(6, 'six');
go
~~ERROR (Code: 547)~~

~~ERROR (Message: new row for relation "triggers_with_transaction_vu_prepare_t1" violates check constraint "triggers_with_transaction_vu_prepare_t1_c1_check")~~

if (@@trancount > 0) rollback;
go

drop trigger triggers_with_transaction_vu_prepare_trig1;
go

create trigger triggers_with_transaction_vu_prepare_trig1 on triggers_with_transaction_vu_prepare_t1 for insert as
begin tran;
update triggers_with_transaction_vu_prepare_t2 set c1 = 6;
commit;
select * from triggers_with_transaction_vu_prepare_t2 order by c1;
select * from inserted;
go

insert into triggers_with_transaction_vu_prepare_t1 values(2, 'second');
go
~~ERROR (Code: 547)~~

~~ERROR (Message: new row for relation "triggers_with_transaction_vu_prepare_t2" violates check constraint "triggers_with_transaction_vu_prepare_t2_c1_check")~~


begin tran;
go
insert into triggers_with_transaction_vu_prepare_t1 values(3, 'third');
go
~~ERROR (Code: 547)~~

~~ERROR (Message: new row for relation "triggers_with_transaction_vu_prepare_t2" violates check constraint "triggers_with_transaction_vu_prepare_t2_c1_check")~~

if (@@trancount > 0) rollback;
go

drop trigger triggers_with_transaction_vu_prepare_trig1;
go

drop trigger triggers_with_transaction_vu_prepare_trig3;
go

create trigger triggers_with_transaction_vu_prepare_trig1 on triggers_with_transaction_vu_prepare_t1 for insert as
begin tran;
update triggers_with_transaction_vu_prepare_t2 set c1 = 2;
commit;
select * from triggers_with_transaction_vu_prepare_t2 order by c1;
select * from inserted;
go

create trigger triggers_with_transaction_vu_prepare_trig3 on triggers_with_transaction_vu_prepare_t3 for delete as
select * from triggers_with_transaction_vu_prepare_t3 order by c1;
insert into triggers_with_transaction_vu_prepare_t3 values(6);
select * from deleted;
rollback tran sp2;
go

insert into triggers_with_transaction_vu_prepare_t1 values(2, 'second');
go
~~START~~
int
~~END~~

~~ERROR (Code: 547)~~

~~ERROR (Message: new row for relation "triggers_with_transaction_vu_prepare_t3" violates check constraint "triggers_with_transaction_vu_prepare_t3_c1_check")~~


begin tran;
go
insert into triggers_with_transaction_vu_prepare_t1 values(3, 'third');
go
~~START~~
int
~~END~~

~~ERROR (Code: 547)~~

~~ERROR (Message: new row for relation "triggers_with_transaction_vu_prepare_t3" violates check constraint "triggers_with_transaction_vu_prepare_t3_c1_check")~~

if (@@trancount > 0) rollback;
go

drop trigger triggers_with_transaction_vu_prepare_trig3;
go

create trigger triggers_with_transaction_vu_prepare_trig3 on triggers_with_transaction_vu_prepare_t3 for delete as
select * from triggers_with_transaction_vu_prepare_t3 order by c1;
insert into triggers_with_transaction_vu_prepare_t3 values(1);
select * from deleted;
rollback tran sp2;
go

drop trigger triggers_with_transaction_vu_prepare_trig1;
go

create trigger triggers_with_transaction_vu_prepare_trig1 on triggers_with_transaction_vu_prepare_t1 for insert as
commit;
update triggers_with_transaction_vu_prepare_t2 set c1 = 2;
select * from triggers_with_transaction_vu_prepare_t2 order by c1;
go

insert into triggers_with_transaction_vu_prepare_t1 values(2, 'second');
go
~~START~~
int
~~END~~

~~ROW COUNT: 1~~

~~START~~
int
1
~~END~~

~~ROW COUNT: 1~~

~~ROW COUNT: 1~~

~~START~~
int
2
~~END~~

~~ERROR (Code: 3609)~~

~~ERROR (Message: The transaction ended in the trigger. The batch has been aborted.)~~


begin tran;
go

insert into triggers_with_transaction_vu_prepare_t1 values(2, 'second');
go
~~START~~
int
~~END~~

~~ROW COUNT: 1~~

~~START~~
int
1
~~END~~

~~ROW COUNT: 1~~

~~ROW COUNT: 1~~

~~START~~
int
2
~~END~~

~~ERROR (Code: 3609)~~

~~ERROR (Message: The transaction ended in the trigger. The batch has been aborted.)~~


drop trigger triggers_with_transaction_vu_prepare_trig1;
go

create trigger triggers_with_transaction_vu_prepare_trig1 on triggers_with_transaction_vu_prepare_t1 for insert as
rollback;
update triggers_with_transaction_vu_prepare_t2 set c1 = 3;
select * from triggers_with_transaction_vu_prepare_t2 order by c1;
go

insert into triggers_with_transaction_vu_prepare_t1 values(2, 'second');
go
~~START~~
int
~~END~~

~~ROW COUNT: 1~~

~~START~~
int
1
~~END~~

~~ROW COUNT: 1~~

~~ROW COUNT: 1~~

~~START~~
int
3
~~END~~

~~ERROR (Code: 3609)~~

~~ERROR (Message: The transaction ended in the trigger. The batch has been aborted.)~~


begin tran;
go

insert into triggers_with_transaction_vu_prepare_t1 values(2, 'second');
go
~~START~~
int
~~END~~

~~ROW COUNT: 1~~

~~START~~
int
1
~~END~~

~~ROW COUNT: 1~~

~~ROW COUNT: 1~~

~~START~~
int
3
~~END~~

~~ERROR (Code: 3609)~~

~~ERROR (Message: The transaction ended in the trigger. The batch has been aborted.)~~


create procedure triggerProc1 as
save tran sp1;
insert into triggers_with_transaction_vu_prepare_t1 values(3, 'third');
rollback tran sp1;
go

create procedure triggerProc2 as
begin tran;
exec triggerProc1;
insert into triggers_with_transaction_vu_prepare_t1 values(3, 'third');
commit;
go

exec triggerProc2;
go
~~START~~
int
~~END~~

~~ROW COUNT: 1~~

~~START~~
int
1
~~END~~

~~ROW COUNT: 1~~

~~ROW COUNT: 1~~

~~START~~
int
3
~~END~~

~~ERROR (Code: 3609)~~

~~ERROR (Message: The transaction ended in the trigger. The batch has been aborted.)~~


drop procedure triggerProc2;
go

drop trigger triggers_with_transaction_vu_prepare_trig1
go

create trigger triggers_with_transaction_vu_prepare_trig1 on triggers_with_transaction_vu_prepare_t1 for insert as
commit;
update triggers_with_transaction_vu_prepare_t2 set c1 = 6;
select * from triggers_with_transaction_vu_prepare_t2 order by c1;
go

create procedure triggerProc2 as
begin tran;
exec triggerProc1;
insert into triggers_with_transaction_vu_prepare_t1 values(6, 'six');
commit;
go

exec triggerProc2;
go
~~ERROR (Code: 547)~~

~~ERROR (Message: new row for relation "triggers_with_transaction_vu_prepare_t2" violates check constraint "triggers_with_transaction_vu_prepare_t2_c1_check")~~


if (@@trancount>0) commit;
go

drop trigger triggers_with_transaction_vu_prepare_trig1;
go

create trigger triggers_with_transaction_vu_prepare_trig1 on triggers_with_transaction_vu_prepare_t1 for insert as
begin tran;
update triggers_with_transaction_vu_prepare_t2 set c1 = 2;
commit;
select * from triggers_with_transaction_vu_prepare_t2 order by c1;
select * from inserted;
go

drop procedure triggerProc1;
go
drop procedure triggerProc2;
go

create table triggers_with_transaction_vu_prepare_tmp__1 (a int not null);
go

insert into triggers_with_transaction_vu_prepare_tmp__1 values (1)
go
~~ROW COUNT: 1~~


create procedure triggerProc1 as
save tran sp1;
insert into triggers_with_transaction_vu_prepare_tmp__1 values (null);
rollback tran sp1;
go

create procedure triggerProc2 as
begin tran;
exec triggerProc1;
insert into triggers_with_transaction_vu_prepare_t1 values(3, 'third');
commit;
go

exec triggerProc2;
go
~~ERROR (Code: 515)~~

~~ERROR (Message: null value in column "a" of relation "triggers_with_transaction_vu_prepare_tmp__1" violates not-null constraint)~~

~~START~~
int
~~END~~

~~ROW COUNT: 1~~

~~START~~
int
1
~~END~~

~~ROW COUNT: 1~~

~~ROW COUNT: 1~~

~~START~~
int
2
~~END~~

~~START~~
int#!#varchar
3#!#third
~~END~~

~~ROW COUNT: 1~~


drop table triggers_with_transaction_vu_prepare_tmp__1 
go

create table triggerErrorTab(c1 int not null);
go

create trigger triggerErr on triggerErrorTab for insert as
insert into triggerErrorTab values(NULL);
insert into invalidTab values(1);
go

insert into triggerErrorTab values(1);
go
~~ERROR (Code: 515)~~

~~ERROR (Message: null value in column "c1" of relation "triggererrortab" violates not-null constraint)~~



drop procedure triggerProc1;
go
drop procedure triggerProc2;
go
drop trigger triggers_with_transaction_vu_prepare_trig1
go


create procedure triggerProc1 as
commit;
go

create procedure triggerProc2 as
exec triggerProc1;
go

create trigger triggers_with_transaction_vu_prepare_trig1 on triggers_with_transaction_vu_prepare_t1 for insert as
exec triggerProc2;
go

insert into triggers_with_transaction_vu_prepare_t1 values(1, 'value1');
go
~~ERROR (Code: 3609)~~

~~ERROR (Message: The transaction ended in the trigger. The batch has been aborted.)~~


drop procedure triggerProc1;
go
drop procedure triggerProc2;
go
drop trigger triggers_with_transaction_vu_prepare_trig1
go


create procedure triggerProc1 as
rollback;
go

create procedure triggerProc2 as
exec triggerProc1;
go

create trigger triggers_with_transaction_vu_prepare_trig1 on triggers_with_transaction_vu_prepare_t1 after insert as
exec triggerProc2;
go

insert into triggers_with_transaction_vu_prepare_t1 values(1, 'value2');
go
~~ERROR (Code: 3609)~~

~~ERROR (Message: The transaction ended in the trigger. The batch has been aborted.)~~


drop procedure triggerProc1;
go
drop procedure triggerProc2;
go
drop trigger triggers_with_transaction_vu_prepare_trig1
go


create procedure triggerProc1 as
rollback tran sp1;
go

create procedure triggerProc2 as
exec triggerProc1;
go

create trigger triggers_with_transaction_vu_prepare_trig1 on triggers_with_transaction_vu_prepare_t1 for insert as
save tran sp1;
exec triggerProc2;
go

insert into triggers_with_transaction_vu_prepare_t1 values(1, 'value3');
go
~~ROW COUNT: 1~~



drop procedure triggerProc1;
go
drop procedure triggerProc2;
go
drop table triggers_with_transaction_vu_prepare_t1;
go
drop table triggers_with_transaction_vu_prepare_t2;
go
drop table triggers_with_transaction_vu_prepare_t3;
go
drop table triggerErrorTab
go

create table triggers_with_transaction_vu_prepare_t1(c1 int, c2 varchar(30), check (c1 < 5))
go

create table triggers_with_transaction_vu_prepare_t2(c1 int, check (c1 < 5))
go

create table triggers_with_transaction_vu_prepare_t3(c1 int, check (c1 < 5))
go

insert into triggers_with_transaction_vu_prepare_t1 values(1, 'first')
go
~~ROW COUNT: 1~~


insert into triggers_with_transaction_vu_prepare_t2 values(1)
go
~~ROW COUNT: 1~~


insert into triggers_with_transaction_vu_prepare_t3 values(1)
go
~~ROW COUNT: 1~~


create trigger triggers_with_transaction_vu_prepare_trig1 on triggers_with_transaction_vu_prepare_t1 for insert as
insert into triggers_with_transaction_vu_prepare_t2 values (2);
go

create trigger triggers_with_transaction_vu_prepare_trig2 on triggers_with_transaction_vu_prepare_t2 for insert as
insert into triggers_with_transaction_vu_prepare_t3 values (2);
go

create trigger triggers_with_transaction_vu_prepare_trig3 on triggers_with_transaction_vu_prepare_t3 for insert as
select 'nest level 3'
go

insert into triggers_with_transaction_vu_prepare_t1 values(2, 'two')
go
~~START~~
varchar
nest level 3
~~END~~

~~ROW COUNT: 1~~

~~ROW COUNT: 1~~

~~ROW COUNT: 1~~


begin tran
go
insert into triggers_with_transaction_vu_prepare_t1 values(6, 'six')
go
~~ERROR (Code: 547)~~

~~ERROR (Message: new row for relation "triggers_with_transaction_vu_prepare_t1" violates check constraint "triggers_with_transaction_vu_prepare_t1_c1_check")~~

if (@@trancount > 0) rollback tran;
go

select * from triggers_with_transaction_vu_prepare_t1;
GO
~~START~~
int#!#varchar
1#!#first
2#!#two
~~END~~


select * from triggers_with_transaction_vu_prepare_t2;
GO
~~START~~
int
1
2
~~END~~


select * from triggers_with_transaction_vu_prepare_t3;
GO
~~START~~
int
1
2
~~END~~


drop trigger triggers_with_transaction_vu_prepare_trig1;
go

create trigger triggers_with_transaction_vu_prepare_trig1 on triggers_with_transaction_vu_prepare_t1 for insert as
insert into triggers_with_transaction_vu_prepare_t2 values (6);
go

insert into triggers_with_transaction_vu_prepare_t2 values(2)
go
~~START~~
varchar
nest level 3
~~END~~

~~ROW COUNT: 1~~

~~ROW COUNT: 1~~


begin tran
go
insert into triggers_with_transaction_vu_prepare_t2 values(6)
go
~~ERROR (Code: 547)~~

~~ERROR (Message: new row for relation "triggers_with_transaction_vu_prepare_t2" violates check constraint "triggers_with_transaction_vu_prepare_t2_c1_check")~~

if (@@trancount > 0) rollback tran;
go

begin tran
go
insert into triggers_with_transaction_vu_prepare_t1 values(3, 'three')
go
~~ERROR (Code: 547)~~

~~ERROR (Message: new row for relation "triggers_with_transaction_vu_prepare_t2" violates check constraint "triggers_with_transaction_vu_prepare_t2_c1_check")~~

if (@@trancount > 0) rollback tran;
go

select * from triggers_with_transaction_vu_prepare_t1;
GO
~~START~~
int#!#varchar
1#!#first
2#!#two
~~END~~


select * from triggers_with_transaction_vu_prepare_t2;
GO
~~START~~
int
1
2
2
~~END~~


select * from triggers_with_transaction_vu_prepare_t3;
GO
~~START~~
int
1
2
2
~~END~~


drop trigger triggers_with_transaction_vu_prepare_trig1;
go
drop trigger triggers_with_transaction_vu_prepare_trig2;
go

create trigger triggers_with_transaction_vu_prepare_trig1 on triggers_with_transaction_vu_prepare_t1 for insert as
insert into triggers_with_transaction_vu_prepare_t2 values (2);
go

create trigger triggers_with_transaction_vu_prepare_trig2 on triggers_with_transaction_vu_prepare_t2 for insert as
insert into triggers_with_transaction_vu_prepare_t3 values (6);
go

insert into triggers_with_transaction_vu_prepare_t3 values(2)
go
~~START~~
varchar
nest level 3
~~END~~

~~ROW COUNT: 1~~


begin tran
go
insert into triggers_with_transaction_vu_prepare_t3 values(6)
go
~~ERROR (Code: 547)~~

~~ERROR (Message: new row for relation "triggers_with_transaction_vu_prepare_t3" violates check constraint "triggers_with_transaction_vu_prepare_t3_c1_check")~~

if (@@trancount > 0) rollback tran;
go

begin tran
go
insert into triggers_with_transaction_vu_prepare_t1 values(3, 'three')
go
~~ERROR (Code: 547)~~

~~ERROR (Message: new row for relation "triggers_with_transaction_vu_prepare_t3" violates check constraint "triggers_with_transaction_vu_prepare_t3_c1_check")~~

if (@@trancount > 0) rollback tran;
go

select * from triggers_with_transaction_vu_prepare_t1;
GO
~~START~~
int#!#varchar
1#!#first
2#!#two
~~END~~

select * from triggers_with_transaction_vu_prepare_t2;
GO
~~START~~
int
1
2
2
~~END~~

select * from triggers_with_transaction_vu_prepare_t3;
GO
~~START~~
int
1
2
2
2
~~END~~


drop table triggers_with_transaction_vu_prepare_t1;
go
drop table triggers_with_transaction_vu_prepare_t2;
go
drop table triggers_with_transaction_vu_prepare_t3;
go

create table triggers_with_transaction_vu_prepare_t1(c1 int not null)
go

create table triggers_with_transaction_vu_prepare_t2(c1 int not null)
go

create table triggers_with_transaction_vu_prepare_t3(c1 int not null)
go

insert into triggers_with_transaction_vu_prepare_t1 values(1)
go
~~ROW COUNT: 1~~


insert into triggers_with_transaction_vu_prepare_t2 values(1)
go
~~ROW COUNT: 1~~


insert into triggers_with_transaction_vu_prepare_t3 values(1)
go
~~ROW COUNT: 1~~


create trigger triggers_with_transaction_vu_prepare_trig1 on triggers_with_transaction_vu_prepare_t1 for insert as
select 'nest level 1'
insert into triggers_with_transaction_vu_prepare_t2 values (2);
go

create trigger triggers_with_transaction_vu_prepare_trig2 on triggers_with_transaction_vu_prepare_t2 for insert as
select 'nest level 2'
insert into triggers_with_transaction_vu_prepare_t3 values (null);
go

create trigger triggers_with_transaction_vu_prepare_trig3 on triggers_with_transaction_vu_prepare_t3 for insert as
select 'nest level 3'
go

begin tran
go
insert into triggers_with_transaction_vu_prepare_t1 values(2)
go
~~START~~
varchar
nest level 1
~~END~~

~~START~~
varchar
nest level 2
~~END~~

~~ERROR (Code: 515)~~

~~ERROR (Message: null value in column "c1" of relation "triggers_with_transaction_vu_prepare_t3" violates not-null constraint)~~

if (@@trancount > 0) rollback tran;
go

begin tran
go
insert into triggers_with_transaction_vu_prepare_t1 values(NULL)
go
~~ERROR (Code: 515)~~

~~ERROR (Message: null value in column "c1" of relation "triggers_with_transaction_vu_prepare_t1" violates not-null constraint)~~

if (@@trancount > 0) rollback tran;
go

select * from triggers_with_transaction_vu_prepare_t1;
go
~~START~~
int
1
~~END~~

select * from triggers_with_transaction_vu_prepare_t2;
go
~~START~~
int
1
~~END~~

select * from triggers_with_transaction_vu_prepare_t3;
go
~~START~~
int
1
~~END~~


drop trigger triggers_with_transaction_vu_prepare_trig1;
go

drop trigger triggers_with_transaction_vu_prepare_trig2;
go

create trigger triggers_with_transaction_vu_prepare_trig1 on triggers_with_transaction_vu_prepare_t1 for insert as
select 'nest level 1'
insert into triggers_with_transaction_vu_prepare_t2 values (NULL);
go

create trigger triggers_with_transaction_vu_prepare_trig2 on triggers_with_transaction_vu_prepare_t2 for insert as
select 'nest level 2'
insert into triggers_with_transaction_vu_prepare_t3 values (3);
go

begin tran
go
insert into triggers_with_transaction_vu_prepare_t1 values(3)
go
~~START~~
varchar
nest level 1
~~END~~

~~ERROR (Code: 515)~~

~~ERROR (Message: null value in column "c1" of relation "triggers_with_transaction_vu_prepare_t2" violates not-null constraint)~~

if (@@trancount > 0) rollback tran;
go

select * from triggers_with_transaction_vu_prepare_t1;
go
~~START~~
int
1
~~END~~

select * from triggers_with_transaction_vu_prepare_t2;
go
~~START~~
int
1
~~END~~

select * from triggers_with_transaction_vu_prepare_t3;
go
~~START~~
int
1
~~END~~

