SELECT SESSIONPROPERTY('QUOTED_IDENTIFIER')
GO
~~START~~
sql_variant
1
~~END~~


-- XML element values
DECLARE @xml XML = '<Root><Child1>Value1</Child1><Child2>Value2</Child2></Root>';
SELECT @xml.value('(/Root/Child1)[1]', 'varchar(100)')
GO
~~START~~
varchar
Value1
~~END~~


-- XML attribute values
DECLARE @xml XML = '<Root Attr1="Value1"><Child1>Value2</Child1></Root>';
SELECT @xml.value('(/Root/@Attr1)[1]', 'varchar(100)')
GO
~~START~~
varchar
Value1
~~END~~


-- XML element or attribute values, with a specific value
DECLARE @xml XML = '<Root><Child1>Value1</Child1><Child2>Value2</Child2></Root>';
SELECT @xml.value('(/Root/Child2[text()="Value2"])[1]', 'varchar(100)')
GO
~~START~~
varchar
Value2
~~END~~


-- XML element or attribute values, with a specific value and path
DECLARE @xml XML = '<Root><ParentNode><Child1>Value1</Child1></ParentNode><ParentNode><Child1>Value2</Child1></ParentNode></Root>';
SELECT @xml.value('(/Root/ParentNode/Child1[text()="Value2"])[1]', 'varchar(100)')
GO
~~START~~
varchar
Value2
~~END~~


-- XML element or attribute values based on a condition
DECLARE @xml XML = '<Root><Child1 Attr1="Value1">Value2</Child1><Child2 Attr1="Value3">Value4</Child2></Root>';
SELECT @xml.value('(/Root/Child1[@Attr1="Value1"])[1]', 'varchar(100)')
GO
~~START~~
varchar
Value2
~~END~~


-- Check if multiple XML elements or attributes value
DECLARE @xml XML = '<Root><Child1>Value1</Child1><Child2>Value2</Child2><Child3>Value3</Child3></Root>';
SELECT @xml.value('(/Root/Child1)[1]', 'varchar(100)') as child1, @xml.value('(/Root/Child2)[1]', 'varchar(100)') as child2, @xml.value('(/Root/Child3)[1]', 'varchar(100)') as child3
GO
~~START~~
varchar#!#varchar#!#varchar
Value1#!#Value2#!#Value3
~~END~~


-- pattern matches single child
DECLARE @xml XML = '<Root><Child>Value1</Child></Root>';
SELECT @xml.value('/Root/Child', 'varchar(100)') as child
GO
~~START~~
varchar
Value1
~~END~~


-- pattern matches multiple childs
DECLARE @xml XML = '<Root><Child>Value1</Child><Child>Value2</Child><Child>Value3</Child></Root>';
SELECT @xml.value('/Root/Child', 'varchar(100)') as child
GO
~~START~~
varchar
~~ERROR (Code: 33557097)~~

~~ERROR (Message: XML Value result is not a single value.)~~


-- XML element values using a variable in the XPath expression
DECLARE @xml XML = '<Root><Child1>Value1</Child1><Child2>Value2</Child2></Root>';
DECLARE @element VARCHAR(20) = 'Child1';
SELECT @xml.value(CONCAT('(/Root/', @element, ')[1]'), 'varchar(100)')
GO
~~ERROR (Code: 33557097)~~

~~ERROR (Message: The argument 1 of the XML data type method "value" must be a string literal.)~~


-- XML element values within a nested XML structure
DECLARE @xml XML = '<Root><Parent1><Child1>Value1</Child1></Parent1><Parent2><Child2>Value2</Child2></Parent2></Root>';
SELECT @xml.value('(/Root/Parent1/Child1)[1]', 'varchar(100)')
GO
~~START~~
varchar
Value1
~~END~~


-- Test with a valid XML document
DECLARE @xml XML = '<root><child>Hello</child></root>';
SELECT @xml.value('(//child)[1]', 'varchar(100)');
GO
~~START~~
varchar
Hello
~~END~~


-- Test with nested XML elements
DECLARE @xml XML = '<root><parent><child1>Test1</child1><child2>Test2</child2></parent></root>';
SELECT @xml.value('(//child1)[1]', 'varchar(100)'), @xml.value('(//child2)[1]', 'varchar(100)');
GO
~~START~~
varchar#!#varchar
Test1#!#Test2
~~END~~


-- Test with an empty XML document
DECLARE @xml XML = '<root></root>';
SELECT @xml.value('(//child)[1]', 'varchar(100)');
GO
~~START~~
varchar
<NULL>
~~END~~


-- Test with an XML document containing special characters
DECLARE @xml XML = '<root><child>Hello & World</child></root>';
SELECT @xml.value('(//child)[1]', 'varchar(100)');
GO
~~START~~
varchar
~~ERROR (Code: 33557097)~~

~~ERROR (Message: could not parse XML document)~~


-- Test with an XML document containing CDATA sections
DECLARE @xml XML = '<root><child><![CDATA[<data>Hello World</data>]]></child></root>';
SELECT @xml.value('(//child)[1]', 'varchar(100)');
GO
~~START~~
varchar
<data>Hello World</data>
~~END~~


-- Test with a large XML document
DECLARE @xml XML = '<root>' + REPLICATE('<item>Data</item>', 10000) + '</root>';
SELECT @xml.value('(/root/item)[1]', 'varchar(100)');
GO
~~START~~
varchar
Data
~~END~~


-- Test with NULL input
DECLARE @xml XML = NULL;
SELECT @xml.value('(//child)[1]', 'varchar(100)');
GO
~~START~~
varchar
<NULL>
~~END~~


-- Test with different data types for the second argument
DECLARE @xml XML = '<root><child>123</child></root>';
SELECT @xml.value('(//child)[1]', 'varchar(100)'), @xml.value('(//child)[1]', 'int'), @xml.value('(//child)[1]', 'varbinary');
GO
~~START~~
varchar#!#int#!#varbinary
123#!#123#!#310032003300
~~END~~


-- Test with mixed content XML
DECLARE @xml XML = '<root>This is <bold>mixed</bold> content</root>';
SELECT @xml.value('(/root)[1]', 'varchar(100)');
GO
~~START~~
varchar
This is mixed content
~~END~~


-- Test with XML comments
DECLARE @xml XML = '<root><!--This is a comment--><child>Hello</child></root>';
SELECT @xml.value('(//child)[1]', 'varchar(100)');
GO
~~START~~
varchar
Hello
~~END~~


-- Test with XML entities
DECLARE @xml XML = '<root><child>Hello &amp; World</child></root>';
SELECT @xml.value('(//child)[1]', 'varchar(100)');
GO
~~START~~
varchar
Hello & World
~~END~~


-- Test with XML attributes
DECLARE @xml XML = '<root><child name="test">Hello</child></root>';
SELECT @xml.value('(//child/@name)[1]', 'varchar(100)');
GO
~~START~~
varchar
test
~~END~~


-- Test with XML fragments
DECLARE @xml XML = '<child1>Test1</child1><child2>Test2</child2>';
SELECT @xml.value('(//child1)[1]', 'varchar(100)'), @xml.value('(//child2)[1]', 'varchar(100)');
GO
~~START~~
varchar#!#varchar
~~ERROR (Code: 33557097)~~

~~ERROR (Message: could not parse XML document)~~


-- Test with Unicode characters
DECLARE @xml XML = N'<root><child>Hello 世界</child></root>';
SELECT @xml.value('(//child)[1]', 'nvarchar(100)');
GO
~~START~~
nvarchar
Hello 世界
~~END~~


-- Test with different XML encodings
DECLARE @xml XML = N'<?xml version="1.0" encoding="UTF-8"?><root><child>Héllò</child></root>';
SELECT @xml.value('(//child)[1]', 'nvarchar(100)');
GO
~~START~~
nvarchar
Héllò
~~END~~


-- Test with XML elements containing line breaks
DECLARE @xml XML = '<root><child>Hello
World</child></root>';
SELECT @xml.value('(//child)[1]', 'varchar(100)');
GO
~~START~~
varchar
Hello<newline>World
~~END~~


-- Test with XML elements containing leading/trailing whitespace
DECLARE @xml XML = '<root><child>  Hello  </child></root>';
SELECT @xml.value('(//child)[1]', 'varchar(100)');
GO
~~START~~
varchar
  Hello  
~~END~~


-- Test with XML elements containing XML namespaces within CDATA sections
DECLARE @xml XML = '<root><child><![CDATA[<ns:data xmlns:ns="http://example.com">Hello</ns:data>]]></child></root>';
SELECT @xml.value('(//child)[1]', 'varchar(100)');
GO
~~START~~
varchar
<ns:data xmlns:ns="http://example.com">Hello</ns:data>
~~END~~


-- Test with XML documents containing internal entities
DECLARE @xml XML = '<?xml version="1.0"?>
<!DOCTYPE root [
<!ENTITY internal "Hello World">
]>
<root>&internal;</root>';
SELECT @xml.value('(/root)[1]', 'varchar(100)');
GO
~~START~~
varchar
Hello World
~~END~~


-- Test with XML documents containing entity references in attributes
DECLARE @xml XML = '<?xml version="1.0"?>
<!DOCTYPE root [
<!ENTITY attr "value">
]>
<root attr="&attr;"></root>';
SELECT @xml.value('(/root/@attr)[1]', 'varchar(100)');
GO
~~START~~
varchar
value
~~END~~


-- Test with XML documents containing namespaces in CDATA sections and attributes
DECLARE @xml XML = '<root xmlns:ns="http://example.com"><child><ns:data>Hello</ns:data><![CDATA[<ns:text>World</ns:text>]]><attr ns:attr="value"/></child></root>';
WITH XMLNAMESPACES('http://example.com' as ns)
SELECT @xml.value('(//ns:data)[1]', 'varchar(100)'), @xml.value('(//child)[1]', 'varchar(100)'), @xml.value('(//child/@ns:attr)[1]', 'varchar(100)');
GO
~~ERROR (Code: 33557097)~~

~~ERROR (Message: 'WITH XMLNAMESPACES' is not currently supported in Babelfish)~~


DECLARE @xml XML = '<root xmlns:ns="http://example.com"><child><ns:data>Hello</ns:data><![CDATA[<ns:text>World</ns:text>]]><attr ns:attr="value"/></child></root>';
SELECT @xml.value('(//ns:data)[1]', 'varchar(100)');
GO
~~START~~
varchar
~~ERROR (Code: 33557097)~~

~~ERROR (Message: could not create XPath object)~~


DECLARE @xml XML = '<root xmlns:ns="http://example.com"><child><ns:data>Hello</ns:data><![CDATA[<ns:text>World</ns:text>]]><attr ns:attr="value"/></child></root>';
SELECT @xml.value('(//child)[1]', 'varchar(100)');
GO
~~START~~
varchar
Hello<ns:text>World</ns:text>
~~END~~


DECLARE @xml XML = '<root xmlns:ns="http://example.com"><child><ns:data>Hello</ns:data><![CDATA[<ns:text>World</ns:text>]]><attr ns:attr="value"/></child></root>';
SELECT @xml.value('(//child/@ns:attr)[1]', 'varchar(100)');
GO
~~START~~
varchar
~~ERROR (Code: 33557097)~~

~~ERROR (Message: could not create XPath object)~~


-- Test with XML documents containing invalid characters
DECLARE @xml XML = '<root>Hello&#0;World</root>';
SELECT @xml.value('(/root)[1]', 'varchar(100)');
GO
~~START~~
varchar
~~ERROR (Code: 33557097)~~

~~ERROR (Message: could not parse XML document)~~


-- Test with XML documents containing XML Digital Signatures
DECLARE @xml XML = '<?xml version="1.0" encoding="UTF-8"?>
<root>
  <child>Hello World</child>
  <Signature xmlns="http://www.w3.org/2000/09/xmldsig#">
    <!-- Digital Signature details -->
  </Signature>
</root>';
SELECT @xml.value('(/root/child)[1]', 'varchar(100)');
GO
~~START~~
varchar
Hello World
~~END~~


-- Test with xpath functions
DECLARE @x XML = '<root></root>';
SELECT @x.value('true()', 'varchar(100)');
GO
~~START~~
varchar
true
~~END~~


DECLARE @x XML = '<root></root>';
SELECT @x.value('false()', 'varchar(100)');
GO
~~START~~
varchar
false
~~END~~


-- Tests with random spaces in between
DECLARE @xml XML = '<artists> <artist name="John Doe"/> <artist name="Edward Poe"/> <artist name="Mark The Great"/> </artists>'
SELECT @xml  .  value  ('(/artists/artist/@name)[1]'  , 'varchar(100)');
GO
~~START~~
varchar
John Doe
~~END~~


SELECT XmlColumn   . value    ('(/artists/artist/@name)[1]'  , 'varchar(100)') FROM babel_5223_xml_value_t1
GO
~~START~~
varchar
John Doe
~~END~~


SELECT babel_5223_xml_value_t1 .   XmlColumn   . value    ('(/artists/artist/@name)[1]'  , 'varchar(100)') FROM babel_5223_xml_value_t1
GO
~~START~~
varchar
John Doe
~~END~~


-- Tests with different case
DECLARE @xml XML = '<artists> <artist name="John Doe"/> <artist name="Edward Poe"/> <artist name="Mark The Great"/> </artists>'
SELECT @xml.VALUE('(/artists/artist/@name)[1]', 'varchar(100)');
GO
~~START~~
varchar
John Doe
~~END~~


DECLARE @xml XML = '<artists> <artist name="John Doe"/> <artist name="Edward Poe"/> <artist name="Mark The Great"/> </artists>'
SELECT @xml.Value('(/artists/artist/@name)[1]', 'varchar(100)');
GO
~~START~~
varchar
John Doe
~~END~~


DECLARE @xml XML = '<artists> <artist name="John Doe"/> <artist name="Edward Poe"/> <artist name="Mark The Great"/> </artists>'
SELECT @xml.VaLuE('(/artists/artist/@name)[1]', 'varchar(100)');
GO
~~START~~
varchar
John Doe
~~END~~


DECLARE @xml XML = '<artists> <artist name="John Doe"/> <artist name="Edward Poe"/> <artist name="Mark The Great"/> </artists>'
SELECT @xml.value('(/artists/artist/@name)[1]', 'varchar(100)');
GO
~~START~~
varchar
John Doe
~~END~~


-- Acceptable argument types
DECLARE @xml XML = '<artists> <artist name="John Doe"/> <artist name="Edward Poe"/> <artist name="Mark The Great"/> </artists>'
SELECT @xml.value('(/artists/artist/@name)[1]', 'varchar(100)');
GO
~~START~~
varchar
John Doe
~~END~~


-- Unacceptable argument types
DECLARE @xml XML = '<artists> <artist name="John Doe"/> <artist name="Edward Poe"/> <artist name="Mark The Great"/> </artists>'
SELECT @xml.value(cast('(/artists/artist/@name)[1]' as VARCHAR(100)), 'varchar(100)');
GO
~~ERROR (Code: 33557097)~~

~~ERROR (Message: The argument 1 of the XML data type method "value" must be a string literal.)~~


DECLARE @xml XML = '<artists> <artist name="John Doe"/> <artist name="Edward Poe"/> <artist name="Mark The Great"/> </artists>'
SELECT @xml.value(cast('(/artists/artist/@name)[1]' as text), 'varchar(100)');
GO
~~ERROR (Code: 33557097)~~

~~ERROR (Message: The argument 1 of the XML data type method "value" must be a string literal.)~~


DECLARE @xml XML = '<artists> <artist name="John Doe"/> <artist name="Edward Poe"/> <artist name="Mark The Great"/> </artists>'
SELECT @xml.value(@xml, 'varchar(100)');
GO
~~ERROR (Code: 33557097)~~

~~ERROR (Message: The argument 1 of the XML data type method "value" must be a string literal.)~~


DECLARE @xml VARCHAR(100) = '<artists> <artist name="John Doe"/> <artist name="Edward Poe"/> <artist name="Mark The Great"/> </artists>'
SELECT @xml.value('(/artists/artist/@name)[1]', 'varchar(100)');
GO
~~START~~
varchar
~~ERROR (Code: 33557097)~~

~~ERROR (Message: Cannot call methods on varchar.)~~


DECLARE @xml NVARCHAR(100) = '<artists> <artist name="John Doe"/> <artist name="Edward Poe"/> <artist name="Mark The Great"/> </artists>'
SELECT @xml.value('(/artists/artist/@name)[1]', 'varchar(100)');
GO
~~START~~
varchar
~~ERROR (Code: 33557097)~~

~~ERROR (Message: Cannot call methods on nvarchar.)~~


DECLARE @xml INT = 1
SELECT @xml.value('(/artists/artist/@name)[1]', 'varchar(100)');
GO
~~START~~
varchar
~~ERROR (Code: 33557097)~~

~~ERROR (Message: Cannot call methods on int.)~~


DECLARE @xml BIGINT = 1
SELECT @xml.value('(/artists/artist/@name)[1]', 'varchar(100)')
GO
~~START~~
varchar
~~ERROR (Code: 33557097)~~

~~ERROR (Message: Cannot call methods on bigint.)~~


DECLARE @xml FLOAT = 1
SELECT @xml.value('(/artists/artist/@name)[1]', 'varchar(100)')
GO
~~START~~
varchar
~~ERROR (Code: 33557097)~~

~~ERROR (Message: Cannot call methods on float.)~~


DECLARE @xml DECIMAL = 1
SELECT @xml.value('(/artists/artist/@name)[1]', 'varchar(100)')
GO
~~START~~
varchar
~~ERROR (Code: 33557097)~~

~~ERROR (Message: Cannot call methods on decimal.)~~


DECLARE @xml NUMERIC = 1
SELECT @xml.value('(/artists/artist/@name)[1]', 'varchar(100)')
GO
~~START~~
varchar
~~ERROR (Code: 33557097)~~

~~ERROR (Message: Cannot call methods on numeric.)~~


DECLARE @xml BIT = 1
SELECT @xml.value('(/artists/artist/@name)[1]', 'varchar(100)')
GO
~~START~~
varchar
~~ERROR (Code: 33557097)~~

~~ERROR (Message: Cannot call methods on bit.)~~


SELECT XmlColumn.value('(/artists/artist/@name)[1]', 'varchar(100)') FROM babel_5223_xml_value_text
GO
~~START~~
varchar
~~ERROR (Code: 33557097)~~

~~ERROR (Message: Cannot call methods on text.)~~


-- UDT on type VARCHAR
SELECT VarUDTColumn.value('(/artists/artist/@name)[1]', 'varchar(100)') FROM babel_5223_xml_value_udt
GO
~~START~~
varchar
~~ERROR (Code: 33557097)~~

~~ERROR (Message: Cannot call methods on varchar.)~~


-- UDT on type IMAGE
SELECT ImageUDTColumn.value('(/artists/artist/@name)[1]', 'varchar(100)') FROM babel_5223_xml_value_udt
GO
~~START~~
varchar
~~ERROR (Code: 33557097)~~

~~ERROR (Message: Cannot call methods on image.)~~


-- UDT on type XML
SELECT XmlUDTColumn.value('(/artists/artist/@name)[1]', 'varchar(100)') FROM babel_5223_xml_value_udt
GO
~~START~~
varchar
<NULL>
~~END~~


-- Tests on different return types
DECLARE @xml XML = '<artists> <artist id="1"/> </artists>'
SELECT @xml.value('(/artists/artist/@id)[1]', 'varchar(10)');
GO
~~START~~
varchar
1
~~END~~


DECLARE @xml XML = '<artists> <artist id="1"/> </artists>'
SELECT @xml.value('(/artists/artist/@id)[1]', 'nvarchar(10)');
GO
~~START~~
nvarchar
1
~~END~~


DECLARE @xml XML = '<artists> <artist id="1"/> </artists>'
SELECT @xml.value('(/artists/artist/@id)[1]', 'char(10)');
GO
~~START~~
char
1         
~~END~~


DECLARE @xml XML = '<artists> <artist id="1"/> </artists>'
SELECT @xml.value('(/artists/artist/@id)[1]', 'nchar(10)');
GO
~~START~~
nchar
1         
~~END~~


-- Check length of output using datalength
DECLARE @xml XML = '<artists> <artist id="1"/> </artists>'
SELECT DATALENGTH(@xml.value('(/artists/artist/@id)[1]', 'varchar(10)'));
GO
~~START~~
int
1
~~END~~


DECLARE @xml XML = '<artists> <artist id="1"/> </artists>'
SELECT DATALENGTH(@xml.value('(/artists/artist/@id)[1]', 'nvarchar(10)'));
GO
~~START~~
int
1
~~END~~


DECLARE @xml XML = '<artists> <artist id="1"/> </artists>'
SELECT DATALENGTH(@xml.value('(/artists/artist/@id)[1]', 'char(10)'));
GO
~~START~~
int
10
~~END~~


DECLARE @xml XML = '<artists> <artist id="1"/> </artists>'
SELECT DATALENGTH(@xml.value('(/artists/artist/@id)[1]', 'nchar(10)'));
GO
~~START~~
int
10
~~END~~


DECLARE @xml XML = '<artists> <artist id="1"/> </artists>'
SELECT @xml.value('(/artists/artist/@id)[1]', 'text');
GO
~~ERROR (Code: 33557097)~~

~~ERROR (Message: The data type 'text' used in the VALUE method is invalid.)~~


DECLARE @xml XML = '<artists> <artist id="1"/> </artists>'
SELECT @xml.value('(/artists/artist/@id)[1]', 'ntext');
GO
~~ERROR (Code: 33557097)~~

~~ERROR (Message: The data type 'ntext' used in the VALUE method is invalid.)~~


DECLARE @xml XML = '<artists> <artist id="1"/> </artists>'
SELECT @xml.value('(/artists/artist/@id)[1]', 'sql_variant');
GO
~~ERROR (Code: 33557097)~~

~~ERROR (Message: The data type 'sql_variant' used in the VALUE method is invalid.)~~


DECLARE @xml XML = '<artists> <artist id="1"/> </artists>'
SELECT @xml.value('(/artists/artist/@id)[1]', 'datetimeoffset');
GO
~~START~~
datetimeoffset
~~ERROR (Code: 33557097)~~

~~ERROR (Message: invalid input syntax for type datetimeoffset: "1")~~


DECLARE @xml XML = '<artists> <artist id="1"/> </artists>'
SELECT @xml.value('(/artists/artist/@id)[1]', 'datetime2');
GO
~~START~~
datetime2
~~ERROR (Code: 33557097)~~

~~ERROR (Message: invalid input syntax for type datetime2: "1")~~


DECLARE @xml XML = '<artists> <artist id="1"/> </artists>'
SELECT @xml.value('(/artists/artist/@id)[1]', 'datetime');
GO
~~START~~
datetime
~~ERROR (Code: 33557097)~~

~~ERROR (Message: invalid input syntax for type datetime: "1")~~


DECLARE @xml XML = '<artists> <artist id="1"/> </artists>'
SELECT @xml.value('(/artists/artist/@id)[1]', 'smalldatetime');
GO
~~START~~
smalldatetime
~~ERROR (Code: 33557097)~~

~~ERROR (Message: invalid input syntax for type smalldatetime: "1")~~


DECLARE @xml XML = '<artists> <artist id="1"/> </artists>'
SELECT @xml.value('(/artists/artist/@id)[1]', 'date');
GO
~~START~~
date
~~ERROR (Code: 33557097)~~

~~ERROR (Message: invalid input syntax for type date: "1")~~


DECLARE @xml XML = '<artists> <artist id="1"/> </artists>'
SELECT @xml.value('(/artists/artist/@id)[1]', 'time');
GO
~~START~~
time
~~ERROR (Code: 33557097)~~

~~ERROR (Message: invalid input syntax for type time: "1")~~


DECLARE @xml XML = '<artists> <artist id="1"/> </artists>'
SELECT @xml.value('(/artists/artist/@id)[1]', 'float');
GO
~~START~~
float
1.0
~~END~~


DECLARE @xml XML = '<artists> <artist id="1"/> </artists>'
SELECT @xml.value('(/artists/artist/@id)[1]', 'real');
GO
~~START~~
real
1.0
~~END~~


DECLARE @xml XML = '<artists> <artist id="1"/> </artists>'
SELECT @xml.value('(/artists/artist/@id)[1]', 'numeric');
GO
~~START~~
numeric
1
~~END~~


DECLARE @xml XML = '<artists> <artist id="1"/> </artists>'
SELECT @xml.value('(/artists/artist/@id)[1]', 'money');
GO
~~START~~
money
1.0000
~~END~~


DECLARE @xml XML = '<artists> <artist id="1"/> </artists>'
SELECT @xml.value('(/artists/artist/@id)[1]', 'smallmoney');
GO
~~START~~
smallmoney
1.0000
~~END~~


DECLARE @xml XML = '<artists> <artist id="1"/> </artists>'
SELECT @xml.value('(/artists/artist/@id)[1]', 'bigint');
GO
~~START~~
bigint
1
~~END~~


DECLARE @xml XML = '<artists> <artist id="1"/> </artists>'
SELECT @xml.value('(/artists/artist/@id)[1]', 'int');
GO
~~START~~
int
1
~~END~~


DECLARE @xml XML = '<artists> <artist id="1"/> </artists>'
SELECT @xml.value('(/artists/artist/@id)[1]', 'smallint');
GO
~~START~~
smallint
1
~~END~~


DECLARE @xml XML = '<artists> <artist id="1"/> </artists>'
SELECT @xml.value('(/artists/artist/@id)[1]', 'tinyint');
GO
~~START~~
tinyint
1
~~END~~


DECLARE @xml XML = '<artists> <artist id="1"/> </artists>'
SELECT @xml.value('(/artists/artist/@id)[1]', 'varbinary(10)');
GO
~~START~~
varbinary
3100
~~END~~


DECLARE @xml XML = '<artists> <artist id="1"/> </artists>'
SELECT @xml.value('(/artists/artist/@id)[1]', 'binary(10)');
GO
~~START~~
binary
31000000000000000000
~~END~~


DECLARE @xml XML = '<artists> <artist id="1"/> </artists>'
SELECT @xml.value('(/artists/artist/@id)[1]', 'bit');
GO
~~START~~
bit
1
~~END~~


DECLARE @xml XML = '<artists> <artist id="1"/> </artists>'
SELECT @xml.value('(/artists/artist/@id)[1]', 'uniqueidentifier');
GO
~~START~~
uniqueidentifier
~~ERROR (Code: 33557097)~~

~~ERROR (Message: invalid input syntax for type uuid: "1")~~


DECLARE @xml XML = '<artists> <artist id="1"/> </artists>'
SELECT @xml.value('(/artists/artist/@id)[1]', 'image');
GO
~~ERROR (Code: 33557097)~~

~~ERROR (Message: The data type 'image' used in the VALUE method is invalid.)~~


DECLARE @xml XML = '<artists> <artist id="1"/> </artists>'
SELECT @xml.value('(/artists/artist/@id)[1]', 'xml');
GO
~~ERROR (Code: 33557097)~~

~~ERROR (Message: The data type 'xml' used in the VALUE method is invalid.)~~


DECLARE @xml XML = '<artists> <artist id="1"/> </artists>'
SELECT @xml.value('(/artists/artist/@id)[1]', 'decimal');
GO
~~START~~
numeric
1
~~END~~


DECLARE @xml XML = '<artists> <artist id="1"/> </artists>'
SELECT @xml.value('(/artists/artist/@id)[1]', 'sysname');
GO
~~START~~
varchar
1
~~END~~


DECLARE @xml XML = '<artists> <artist id="1"/> </artists>'
SELECT @xml.value('(/artists/artist/@id)[1]', 'vector');
GO
~~ERROR (Code: 33557097)~~

~~ERROR (Message: type "vector" does not exist)~~


DECLARE @xml XML = '<artists> <artist id="1"/> </artists>'
SELECT @xml.value('(/artists/artist/@id)[1]', 'sparsevec');
GO
~~ERROR (Code: 33557097)~~

~~ERROR (Message: type "sparsevec" does not exist)~~


DECLARE @xml XML = '<artists> <artist id="1"/> </artists>'
SELECT @xml.value('(/artists/artist/@id)[1]', 'halfvec');
GO
~~ERROR (Code: 33557097)~~

~~ERROR (Message: type "halfvec" does not exist)~~


DECLARE @xml XML = '<artists> <artist id="1"/> </artists>'
SELECT @xml.value('(/artists/artist/@id)[1]', 'timestamp');
GO
~~START~~
binary
3100000000000000
~~END~~


DECLARE @xml XML = '<artists> <artist id="1"/> </artists>'
SELECT @xml.value('(/artists/artist/@id)[1]', 'babel_5223_xml_value_varcharUDT');
GO
~~START~~
varchar
1
~~END~~


DECLARE @xml XML = '<artists> <artist id="1"/> </artists>'
SELECT @xml.value('(/artists/artist/@id)[1]', 'dbo.babel_5223_xml_value_varcharUDT');
GO
~~START~~
varchar
1
~~END~~


DECLARE @xml XML = '<artists> <artist id="1"/> </artists>'
SELECT @xml.value('(/artists/artist/@id)[1]', 'babel_5223_xml_value_sch_varcharUDT');
GO
~~ERROR (Code: 33557097)~~

~~ERROR (Message: type "babel_5223_xml_value_sch_varcharudt" does not exist)~~


DECLARE @xml XML = '<artists> <artist id="1"/> </artists>'
SELECT @xml.value('(/artists/artist/@id)[1]', 'babel_5223_sch1.babel_5223_xml_value_sch_varcharUDT');
GO
~~START~~
varchar
1
~~END~~


DECLARE @xml XML = '<artists> <artist id="1"/> </artists>'
SELECT @xml.value('(/artists/artist/@id)[1]', 'babel_5223_sch2.babel_5223_xml_value_sch_varcharUDT');
GO
~~START~~
varchar
1
~~END~~


DECLARE @xml XML = '<artists> <artist id="1"/> </artists>'
SELECT @xml.value('(/artists/artist/@id)[1]', 'nonexistent');
GO
~~ERROR (Code: 33557097)~~

~~ERROR (Message: type "nonexistent" does not exist)~~


-- NULL values
DECLARE @xml XML = NULL
SELECT @xml.value('(/artists/artist/@name)[1]', 'varchar(100)')
GO
~~START~~
varchar
<NULL>
~~END~~


DECLARE @xml XML = '<artists> <artist name="John Doe"/> <artist name="Edward Poe"/> <artist name="Mark The Great"/> </artists>'
SELECT @xml.value(NULL, 'varchar(100)');
GO
~~ERROR (Code: 33557097)~~

~~ERROR (Message: The argument 1 of the XML data type method "value" must be a string literal.)~~


DECLARE @xml XML = '<artists> <artist name="John Doe"/> <artist name="Edward Poe"/> <artist name="Mark The Great"/> </artists>'
SELECT @xml.value('(/artists/artist/@name)[1]', NULL);
GO
~~ERROR (Code: 33557097)~~

~~ERROR (Message: The argument 2 of the XML data type method "value" must be a string literal.)~~


DECLARE @xml XML = '<artists> <artist name="John Doe"/> <artist name="Edward Poe"/> <artist name="Mark The Great"/> </artists>'
SELECT @xml.value(NULL, NULL);
GO
~~ERROR (Code: 33557097)~~

~~ERROR (Message: The argument 1 of the XML data type method "value" must be a string literal.)~~


-- column as input argument
SELECT XmlColumn.value('(/artists/artist/@name)[1]', 'varchar(100)') FROM babel_5223_xml_value_t1
GO
~~START~~
varchar
John Doe
~~END~~


SELECT babel_5223_xml_value_t1.XmlColumn.value('(/artists/artist/@name)[1]', 'varchar(100)') FROM babel_5223_xml_value_t1
GO
~~START~~
varchar
John Doe
~~END~~


SELECT dbo.babel_5223_xml_value_t1.XmlColumn.value('(/artists/artist/@name)[1]', 'varchar(100)') FROM babel_5223_xml_value_t1
GO
~~ERROR (Code: 33557097)~~

~~ERROR (Message: Remote procedure/function reference with 4-part object name is not currently supported in Babelfish)~~


SELECT Id, XmlColumn.value('(/Root/Child1)[1]', 'varchar(100)') AS Result
FROM babel_5223_xml_value_t2;
GO
~~START~~
int#!#varchar
1#!#Value1
2#!#<NULL>
3#!#Value1
~~END~~


SELECT Id, XmlColumn.value('(/Root/Child2)[1]', 'varchar(100)') AS Result
FROM babel_5223_xml_value_t2 ORDER BY Id;
GO
~~START~~
int#!#varchar
1#!#<NULL>
2#!#Value2
3#!#Value2
~~END~~


-- value function called on SUBQUERY
DECLARE @xml XML = '<artists> <artist name="John Doe"/> <artist name="Edward Poe"/> <artist name="Mark The Great"/> </artists>'
SELECT (SELECT @xml).value('(/artists/artist/@name)[1]', 'varchar(100)')
GO
~~START~~
varchar
John Doe
~~END~~


-- value function called on LOCAL_ID
DECLARE @xml XML = '<artists> <artist name="John Doe"/> <artist name="Edward Poe"/> <artist name="Mark The Great"/> </artists>'
SELECT @xml.value('(/artists/artist/@name)[1]', 'varchar(100)')
GO
~~START~~
varchar
John Doe
~~END~~


-- value function called on LR_BR expr RR_BR
SELECT (CAST('<artists> <artist name="John Doe"/> <artist name="Edward Poe"/> <artist name="Mark The Great"/> </artists>' as XML)).value('(/artists/artist/@name)[1]', 'varchar(100)')
GO
~~START~~
varchar
John Doe
~~END~~


-- value function called on function_call
SELECT babel_5223_xml_value_func1().value('(/artists/artist/@name)[1]', 'varchar(100)')
GO
~~START~~
varchar
John Doe
~~END~~


SELECT dbo.babel_5223_xml_value_func1().value('(/artists/artist/@name)[1]', 'varchar(100)')
GO
~~START~~
varchar
John Doe
~~END~~


-- value function called on spatial function -- this will throw error, only to test nested rewrites
DECLARE @xml XML = '<artists> <artist name="John Doe"/> <artist name="Edward Poe"/> <artist name="Mark The Great"/> </artists>'
SELECT @xml.value('(/artists/artist/@name)[1]', 'varchar(100)').STArea()
GO
~~ERROR (Code: 33557097)~~

~~ERROR (Message: function starea("varchar") is not unique)~~


DECLARE @xml XML = '<artists> <artist name="John Doe"/> <artist name="Edward Poe"/> <artist name="Mark The Great"/> </artists>'
DECLARE @point geometry = geometry::Point(1.0, 2.0, 4326);
SELECT @xml.value('(/artists/artist/@name)[1]', 'varchar(100)').STDistance(@point)
GO
~~START~~
float
~~ERROR (Code: 33557097)~~

~~ERROR (Message: Invalid geometry)~~


DECLARE @xml XML = '<artists> <artist name="John Doe"/> <artist name="Edward Poe"/> <artist name="Mark The Great"/> </artists>'
SELECT @xml.value('(/artists/artist/@name)[1]', 'varchar(100)').STX
GO
~~START~~
float
~~ERROR (Code: 33557097)~~

~~ERROR (Message: Invalid geometry)~~


DECLARE @point1 geometry = geometry::Point(1.0, 2.0, 4326);
DECLARE @point2 geometry = geometry::Point(3.0, 4.0, 4326);
SELECT @point1.STDistance(@point2).value('(/artists/artist/@name)[1]', 'varchar(100)');
GO
~~START~~
varchar
~~ERROR (Code: 33557097)~~

~~ERROR (Message: Cannot call methods on float.)~~


DECLARE @point geometry = geometry::Point(1.0, 2.0, 4326);
SELECT @point.STArea().value('(/artists/artist/@name)[1]', 'varchar(100)');
go
~~START~~
varchar
~~ERROR (Code: 33557097)~~

~~ERROR (Message: Cannot call methods on float.)~~


DECLARE @point geometry = geometry::Point(1.0, 2.0, 4326);
SELECT @point.STX.value('(/artists/artist/@name)[1]', 'varchar(100)');
go
~~START~~
varchar
~~ERROR (Code: 33557097)~~

~~ERROR (Message: Cannot call methods on float.)~~


DECLARE @xml XML = '<artists> <artist name="John Doe"/> <artist name="Edward Poe"/> <artist name="Mark The Great"/> </artists>'
SELECT @xml.value('(/artists/artist/@name)[1]', 'varchar(100)').value('(/artists/artist/@name)[1]', 'varchar(100)').value('(/artists/artist/@name)[1]', 'varchar(100)').value('(/artists/artist/@name)[1]', 'varchar(100)')
GO
~~START~~
varchar
~~ERROR (Code: 33557097)~~

~~ERROR (Message: Cannot call methods on varchar.)~~


DECLARE @xml XML = '<artists> <artist name="John Doe"/> <artist name="Edward Poe"/> <artist name="Mark The Great"/> </artists>'
DECLARE @point geometry = geometry::Point(1.0, 2.0, 4326);
SELECT @xml.value('(/artists/artist/@name)[1]', 'varchar(100)').STDistance(@point).value('(/artists/artist/@name)[1]', 'varchar(100)').STArea()
GO
~~ERROR (Code: 33557097)~~

~~ERROR (Message: function starea("varchar") is not unique)~~


-- different number of arguments than required (Error will be thrown in this scenario)
DECLARE @xml XML = '<artists> <artist name="John Doe"/> <artist name="Edward Poe"/> <artist name="Mark The Great"/> </artists>'
SELECT @xml.value()
GO
~~ERROR (Code: 33557097)~~

~~ERROR (Message: The value function requires 2 argument(s).)~~


DECLARE @xml XML = '<artists> <artist name="John Doe"/> <artist name="Edward Poe"/> <artist name="Mark The Great"/> </artists>'
SELECT @xml.value('(/artists/artist/@name)[1]', 1)
GO
~~ERROR (Code: 33557097)~~

~~ERROR (Message: The argument 2 of the XML data type method "value" must be a string literal.)~~


-- second argument with different quotes
DECLARE @xml XML = '<Root><Child1>Value1</Child1><Child2>Value2</Child2></Root>';
SELECT @xml.value('(/Root/Child1)[1]', 'varchar(100)')
GO
~~START~~
varchar
Value1
~~END~~


DECLARE @xml XML = '<Root><Child1>Value1</Child1><Child2>Value2</Child2></Root>';
SELECT @xml.value('(/Root/Child1)[1]', "varchar(100)")
GO
~~ERROR (Code: 33557097)~~

~~ERROR (Message: The argument 2 of the XML data type method "value" must be a string literal.)~~


DECLARE @xml XML = '<Root><Child1>Value1</Child1><Child2>Value2</Child2></Root>';
SELECT @xml.value('(/Root/Child1)[1]', `varchar(100)`)
GO
~~ERROR (Code: 33557097)~~

~~ERROR (Message: syntax error near '`' at line 2 and character position 39)~~


DECLARE @xml XML = '<Root><Child1>Value1</Child1><Child2>Value2</Child2></Root>';
SELECT @xml.value('(/Root/Child1)[1]', '''varchar(100)''')
GO
~~ERROR (Code: 33557097)~~

~~ERROR (Message: syntax error at or near "''")~~


DECLARE @xml XML = '<Root><Child1>Value1</Child1><Child2>Value2</Child2></Root>';
SELECT @xml.value('(/Root/Child1)[1]', [varchar(100)])
GO
~~ERROR (Code: 33557097)~~

~~ERROR (Message: The argument 2 of the XML data type method "value" must be a string literal.)~~


SET QUOTED_IDENTIFIER OFF
GO

SELECT SESSIONPROPERTY('QUOTED_IDENTIFIER')
GO
~~START~~
sql_variant
0
~~END~~


DECLARE @xml XML = '<Root><Child1>Value1</Child1><Child2>Value2</Child2></Root>';
SELECT @xml.value('(/Root/Child1)[1]', 'varchar(100)')
GO
~~START~~
varchar
~~ERROR (Code: 33557097)~~

~~ERROR (Message: SELECT failed because the following SET options have incorrect settings: 'QUOTED_IDENTIFIER'. Verify that SET options are correct for XML data type methods.)~~


DECLARE @xml XML = '<Root><Child1>Value1</Child1><Child2>Value2</Child2></Root>';
SELECT @xml.value('(/Root/Child1)[1]', "varchar(100)")
GO
~~START~~
varchar
~~ERROR (Code: 33557097)~~

~~ERROR (Message: SELECT failed because the following SET options have incorrect settings: 'QUOTED_IDENTIFIER'. Verify that SET options are correct for XML data type methods.)~~


DECLARE @xml XML = '<Root><Child1>Value1</Child1><Child2>Value2</Child2></Root>';
SELECT @xml.value('(/Root/Child1)[1]', `varchar(100)`)
GO
~~ERROR (Code: 33557097)~~

~~ERROR (Message: syntax error near '`' at line 2 and character position 39)~~


DECLARE @xml XML = '<Root><Child1>Value1</Child1><Child2>Value2</Child2></Root>';
SELECT @xml.value('(/Root/Child1)[1]', '''varchar(100)''')
GO
~~ERROR (Code: 33557097)~~

~~ERROR (Message: syntax error at or near "''")~~


DECLARE @xml XML = '<Root><Child1>Value1</Child1><Child2>Value2</Child2></Root>';
SELECT @xml.value('(/Root/Child1)[1]', [varchar(100)])
GO
~~ERROR (Code: 33557097)~~

~~ERROR (Message: The argument 2 of the XML data type method "value" must be a string literal.)~~


SET QUOTED_IDENTIFIER ON
GO

SELECT SESSIONPROPERTY('QUOTED_IDENTIFIER')
GO
~~START~~
sql_variant
1
~~END~~


-- EVENTDATA().value -- eventdata() is currently not supported
SELECT EVENTDATA().value('/EVENT_INSTANCE/EventType')
GO
~~ERROR (Code: 33557097)~~

~~ERROR (Message: The value function requires 2 argument(s).)~~


-- value function called on XML Query
DECLARE @xml XML = '<artists> <artist name="John Doe"/> <artist name="Edward Poe"/> <artist name="Mark The Great"/> </artists>'
SELECT @xml.query('/artists/artist').value('/artist/@name', 'varchar(100)')
GO
~~ERROR (Code: 33557097)~~

~~ERROR (Message: 'XML QUERY' is not currently supported in Babelfish)~~


-- Dependent objects
SELECT * FROM babel_5223_xml_value_dep_view
GO
~~START~~
varchar
John Doe
~~END~~


EXEC babel_5223_xml_value_dep_proc
GO
~~START~~
varchar
John Doe
~~END~~


SELECT babel_5223_xml_value_dep_func()
GO
~~START~~
varchar
John Doe
~~END~~


SELECT * FROM babel_5223_xml_value_itvf_func()
GO
~~START~~
varchar
John Doe
~~END~~


INSERT INTO babel_5223_xml_value_compcol VALUES (1, '<artist name="Rohit Bhagat" />')
GO
~~ERROR (Code: 33557097)~~

~~ERROR (Message: relation "babel_5223_xml_value_compcol" does not exist)~~


INSERT INTO babel_5223_xml_value_compcol VALUES (2, '<artist />')
GO
~~ERROR (Code: 33557097)~~

~~ERROR (Message: relation "babel_5223_xml_value_compcol" does not exist)~~


SELECT col_xml, comp_col FROM babel_5223_xml_value_compcol ORDER BY id
GO
~~ERROR (Code: 33557097)~~

~~ERROR (Message: relation "babel_5223_xml_value_compcol" does not exist)~~


INSERT INTO babel_5223_xml_value_constraint VALUES ('<artist name="Rohit Bhagat" />')
GO
~~ERROR (Code: 547)~~

~~ERROR (Message: new row for relation "babel_5223_xml_value_constraint" violates check constraint "chknamevalue")~~


INSERT INTO babel_5223_xml_value_constraint VALUES ('<artist />')
GO
~~ROW COUNT: 1~~


-- Testing computed columns and constraints with quoted_identifier as ON
-- Testing computed columns created on wrapper function of xml value when quoted_identifier was ON
INSERT INTO babel_5223_xml_value_compcol1 VALUES (1, '<artist name="Rohit Bhagat" />')
GO
~~ROW COUNT: 1~~


INSERT INTO babel_5223_xml_value_compcol1 VALUES (2, '<artist />')
GO
~~ROW COUNT: 1~~


SELECT col_xml, comp_col FROM babel_5223_xml_value_compcol1 ORDER BY id
GO
~~START~~
xml#!#varchar
<artist name="Rohit Bhagat" />#!#Rohit Bhagat
<artist />#!#<NULL>
~~END~~


-- Testing constraint created on wrapper function of xml value
INSERT INTO babel_5223_xml_value_constraint1 VALUES ('<artist name="Rohit Bhagat" />')
GO
~~ERROR (Code: 547)~~

~~ERROR (Message: new row for relation "babel_5223_xml_value_constraint1" violates check constraint "chknamevalue1")~~


INSERT INTO babel_5223_xml_value_constraint1 VALUES ('<artist />')
GO
~~ROW COUNT: 1~~


-- Testing view created on xml value when quoted_identifier was OFF
SELECT * FROM babel_5223_xml_value_dep_view2
GO
~~START~~
varchar
John Doe
~~END~~


-- Testing computed columns created on wrapper function of xml value when quoted_identifier was OFF
INSERT INTO babel_5223_xml_value_compcol2 VALUES (1, '<artist name="Rohit Bhagat" />')
GO
~~ROW COUNT: 1~~


INSERT INTO babel_5223_xml_value_compcol2 VALUES (2, '<artist />')
GO
~~ROW COUNT: 1~~


SELECT col_xml, comp_col FROM babel_5223_xml_value_compcol2 ORDER BY id
GO
~~START~~
xml#!#varchar
<artist name="Rohit Bhagat" />#!#Rohit Bhagat
<artist />#!#<NULL>
~~END~~


-- Testing constraint created on wrapper function of xml value when quoted_identifier was OFF
INSERT INTO babel_5223_xml_value_constraint2 VALUES ('<artist name="Rohit Bhagat" />')
GO
~~ROW COUNT: 1~~


INSERT INTO babel_5223_xml_value_constraint2 VALUES ('<artist />')
GO
~~ROW COUNT: 1~~


SET QUOTED_IDENTIFIER OFF
GO

SELECT SESSIONPROPERTY('QUOTED_IDENTIFIER')
GO
~~START~~
sql_variant
0
~~END~~


-- Testing computed columns and constraints with quoted_identifier as OFF 
-- Testing computed columns created on wrapper function of xml value when quoted_identifier was ON
INSERT INTO babel_5223_xml_value_compcol1 VALUES (1, '<artist name="Rohit Bhagat" />')
GO
~~ERROR (Code: 33557097)~~

~~ERROR (Message: INSERT/UPDATE failed because the following SET options have incorrect settings: 'QUOTED_IDENTIFIER, ')~~


INSERT INTO babel_5223_xml_value_compcol1 VALUES (2, '<artist />')
GO
~~ERROR (Code: 33557097)~~

~~ERROR (Message: INSERT/UPDATE failed because the following SET options have incorrect settings: 'QUOTED_IDENTIFIER, ')~~


SELECT col_xml, comp_col FROM babel_5223_xml_value_compcol1 ORDER BY id
GO
~~START~~
xml#!#varchar
~~ERROR (Code: 33557097)~~

~~ERROR (Message: SELECT failed because the following SET options have incorrect settings: 'QUOTED_IDENTIFIER'. Verify that SET options are correct for XML data type methods.)~~


-- Testing constraint created on wrapper function of xml value when quoted_identifier was OFF
INSERT INTO babel_5223_xml_value_constraint1 VALUES ('<artist name="Rohit Bhagat" />')
GO
~~ERROR (Code: 33557097)~~

~~ERROR (Message: SELECT failed because the following SET options have incorrect settings: 'QUOTED_IDENTIFIER'. Verify that SET options are correct for XML data type methods.)~~


INSERT INTO babel_5223_xml_value_constraint1 VALUES ('<artist />')
GO
~~ERROR (Code: 33557097)~~

~~ERROR (Message: SELECT failed because the following SET options have incorrect settings: 'QUOTED_IDENTIFIER'. Verify that SET options are correct for XML data type methods.)~~


-- Testing view created on xml value when quoted_identifier was OFF
SELECT * FROM babel_5223_xml_value_dep_view2
GO
~~START~~
varchar
~~ERROR (Code: 33557097)~~

~~ERROR (Message: SELECT failed because the following SET options have incorrect settings: 'QUOTED_IDENTIFIER'. Verify that SET options are correct for XML data type methods.)~~


-- Testing computed columns and constraints with quoted_identifier as OFF 
-- Testing computed columns created on wrapper function of xml value when quoted_identifier was OFF
INSERT INTO babel_5223_xml_value_compcol2 VALUES (1, '<artist name="Rohit Bhagat" />')
GO
~~ERROR (Code: 33557097)~~

~~ERROR (Message: INSERT/UPDATE failed because the following SET options have incorrect settings: 'QUOTED_IDENTIFIER, ')~~


INSERT INTO babel_5223_xml_value_compcol2 VALUES (2, '<artist />')
GO
~~ERROR (Code: 33557097)~~

~~ERROR (Message: INSERT/UPDATE failed because the following SET options have incorrect settings: 'QUOTED_IDENTIFIER, ')~~


SELECT col_xml, comp_col FROM babel_5223_xml_value_compcol2 ORDER BY id
GO
~~START~~
xml#!#varchar
~~ERROR (Code: 33557097)~~

~~ERROR (Message: SELECT failed because the following SET options have incorrect settings: 'QUOTED_IDENTIFIER'. Verify that SET options are correct for XML data type methods.)~~


-- Testing constraint created on wrapper function of xml value when quoted_identifier was OFF
INSERT INTO babel_5223_xml_value_constraint2 VALUES ('<artist name="Rohit Bhagat" />')
GO
~~ERROR (Code: 33557097)~~

~~ERROR (Message: SELECT failed because the following SET options have incorrect settings: 'QUOTED_IDENTIFIER'. Verify that SET options are correct for XML data type methods.)~~


INSERT INTO babel_5223_xml_value_constraint2 VALUES ('<artist />')
GO
~~ERROR (Code: 33557097)~~

~~ERROR (Message: SELECT failed because the following SET options have incorrect settings: 'QUOTED_IDENTIFIER'. Verify that SET options are correct for XML data type methods.)~~


SET QUOTED_IDENTIFIER ON
GO

SELECT SESSIONPROPERTY('QUOTED_IDENTIFIER')
GO
~~START~~
sql_variant
1
~~END~~


SELECT student FROM babel_5223_xml_value_school_details ORDER BY id
GO
~~START~~
xml
<student classid="1" rollid="1" studentname="StudentA" />
<student classid="1" rollid="2" studentname="StudentB" />
<student classid="1" rollid="3" studentname="StudentC" />
<student classid="2" rollid="1" studentname="StudentD" />
<student classid="2" rollid="2" studentname="StudentE" />
~~END~~


INSERT INTO babel_5223_xml_value_school_details VALUES (6, '<student classid="2" rollid="3" studentname="StudentF" />')
GO
~~START~~
int#!#xml
~~END~~

~~ROW COUNT: 1~~


INSERT INTO babel_5223_xml_value_school_details VALUES (7, '<student classid="2"  rollid="4" studentname="Rohit" />')
GO
~~START~~
int#!#xml
7#!#<student classid="2"  rollid="4" studentname="Rohit" />
~~END~~

~~ROW COUNT: 1~~


INSERT INTO babel_5223_xml_value_school_details VALUES (8, '<student classid="1"  rollid="4" studentname="NotAStudent" />')
GO
~~START~~
int#!#xml
7#!#<student classid="2"  rollid="4" studentname="Rohit" />
8#!#<student classid="1"  rollid="4" studentname="NotAStudent" />
~~END~~

~~ROW COUNT: 1~~


UPDATE babel_5223_xml_value_school_details
SET student=CAST('<student classid="1" rollid="4" studentname="StudentG" />' as XML)
WHERE id=7
GO
~~START~~
int#!#xml
8#!#<student classid="1"  rollid="4" studentname="NotAStudent" />
~~END~~

~~ROW COUNT: 1~~


DELETE FROM babel_5223_xml_value_school_details WHERE id=8
GO
~~START~~
int#!#xml
~~END~~

~~ROW COUNT: 1~~


-- Tests when Quoted Identifier is OFF
SET QUOTED_IDENTIFIER OFF
GO

SELECT SESSIONPROPERTY('QUOTED_IDENTIFIER')
GO
~~START~~
sql_variant
0
~~END~~


DECLARE @xml XML = '<artists> <artist name="John Doe"/> <artist name="Edward Poe"/> <artist name="Mark The Great"/> </artists>'
SELECT @xml.value('(/artists/artist/@name)[1]', 'varchar(100)')
GO
~~START~~
varchar
~~ERROR (Code: 33557097)~~

~~ERROR (Message: SELECT failed because the following SET options have incorrect settings: 'QUOTED_IDENTIFIER'. Verify that SET options are correct for XML data type methods.)~~


SELECT XmlColumn.value('(/artists/artist/@name)[1]', 'varchar(100)') FROM babel_5223_xml_value_t1
GO
~~START~~
varchar
~~ERROR (Code: 33557097)~~

~~ERROR (Message: SELECT failed because the following SET options have incorrect settings: 'QUOTED_IDENTIFIER'. Verify that SET options are correct for XML data type methods.)~~


SELECT babel_5223_xml_value_t1.XmlColumn.value('(/artists/artist/@name)[1]', 'varchar(100)') FROM babel_5223_xml_value_t1
GO
~~START~~
varchar
~~ERROR (Code: 33557097)~~

~~ERROR (Message: SELECT failed because the following SET options have incorrect settings: 'QUOTED_IDENTIFIER'. Verify that SET options are correct for XML data type methods.)~~


-- QUOTED_IDENFIER related error should be thrown in following query and not argument invalid error
DECLARE @xml XML = '<artists> <artist id="1"/> </artists>'
SELECT @xml.value('(/artists/artist/@id)[1]', 'sql_variant');
GO
~~ERROR (Code: 33557097)~~

~~ERROR (Message: The data type 'sql_variant' used in the VALUE method is invalid.)~~


-- error "cannot call method on int" should be thrown in following query and not QUOTED_IDENFIER related error
DECLARE @xml INT = 1
SELECT @xml.value('(/artists/artist/@name)[1]', 'sql_variant');
GO
~~ERROR (Code: 33557097)~~

~~ERROR (Message: The data type 'sql_variant' used in the VALUE method is invalid.)~~


SET QUOTED_IDENTIFIER ON
GO

SELECT SESSIONPROPERTY('QUOTED_IDENTIFIER')
GO
~~START~~
sql_variant
1
~~END~~


-- error "cannot call method on int" should be thrown in following query and not argument datatype invalid error
DECLARE @xml INT = 1
SELECT @xml.value('(/artists/artist/@name)[1]', 'sql_variant');
GO
~~ERROR (Code: 33557097)~~

~~ERROR (Message: The data type 'sql_variant' used in the VALUE method is invalid.)~~


-- argument datatype invalid error should be thrown
DECLARE @xml XML = '<artists> <artist name="John Doe"/> <artist name="Edward Poe"/> <artist name="Mark The Great"/> </artists>'
SELECT @xml.VALUE('(/artists/artist/@name)[1]', 'sql_variant');
GO
~~ERROR (Code: 33557097)~~

~~ERROR (Message: The data type 'sql_variant' used in the VALUE method is invalid.)~~


-- Currently, we only support XPATH 1.0 as input for XML value function. 
-- Hence following queries will throw error
DECLARE @x XML;  
DECLARE @f BIT;  
SET @x = '<root Somedate = "2002-01-01Z"/>';  
SET @f = @x.value('/root[(@Somedate cast as xs:date?) eq xs:date("2002-01-01Z")]', 'varchar(100)');
SELECT @f;
GO
~~ERROR (Code: 33557097)~~

~~ERROR (Message: invalid XPath expression)~~


DECLARE @x XML;  
DECLARE @f BIT;  
SET @x = '<Somedate>2002-01-01Z</Somedate>';  
SET @f = @x.value('/Somedate[(text()[1] cast as xs:date ?) = xs:date("2002-01-01Z") ]', 'varchar(100)');
SELECT @f;
GO
~~ERROR (Code: 33557097)~~

~~ERROR (Message: invalid XPath expression)~~


DECLARE @xml XML = '<root><child>Hello</child></root>';
SELECT @xml.value('(//*:child)[1]');
GO
~~ERROR (Code: 33557097)~~

~~ERROR (Message: The value function requires 2 argument(s).)~~


