-- Check if an XML element exists
DECLARE @xml XML = '<Root><Child1>Value1</Child1><Child2>Value2</Child2></Root>';
DECLARE @result1 VARCHAR(50) = CASE WHEN @xml.exist('/Root/Child1') = 1 THEN 'The Child1 element exists' ELSE 'The Child1 element does not exist' END;
SELECT @result1
GO
~~START~~
varchar
The Child1 element exists
~~END~~


-- Check if an XML attribute exists
DECLARE @xml XML = '<Root Attr1="Value1"><Child1>Value2</Child1></Root>';
DECLARE @result2 VARCHAR(50) = CASE WHEN @xml.exist('/Root/@Attr1') = 1 THEN 'The Attr1 attribute exists' ELSE 'The Attr1 attribute does not exist' END;
SELECT @result2
GO
~~START~~
varchar
The Attr1 attribute exists
~~END~~


-- Check if an XML element or attribute exists, with a specific value
DECLARE @xml XML = '<Root><Child1>Value1</Child1><Child2>Value2</Child2></Root>';
DECLARE @result3 VARCHAR(70) = CASE WHEN @xml.exist('/Root/Child2[text()="Value2"]') = 1 THEN 'The Child2 element with value "Value2" exists' ELSE 'The Child2 element with value "Value2" does not exist' END;
SELECT @result3
GO
~~START~~
varchar
The Child2 element with value "Value2" exists
~~END~~


-- Check if an XML element or attribute exists, with a specific value and path
DECLARE @xml XML = '<Root><ParentNode><Child1>Value1</Child1></ParentNode><ParentNode><Child1>Value2</Child1></ParentNode></Root>';
DECLARE @result4 VARCHAR(100) = CASE WHEN @xml.exist('/Root/ParentNode/Child1[text()="Value2"]') = 1 THEN 'The Child1 element with value "Value2" under ParentNode exists' ELSE 'The Child1 element with value "Value2" under ParentNode does not exist' END;
SELECT @result4
GO
~~START~~
varchar
The Child1 element with value "Value2" under ParentNode exists
~~END~~


-- Check if an XML element or attribute exists based on a condition
DECLARE @xml XML = '<Root><Child1 Attr1="Value1">Value2</Child1><Child2 Attr1="Value3">Value4</Child2></Root>';
DECLARE @result6 VARCHAR(80) = CASE WHEN @xml.exist('/Root/Child1[@Attr1="Value1"]') = 1 THEN 'The Child1 element with Attr1="Value1" exists' ELSE 'The Child1 element with Attr1="Value1" does not exist' END;
SELECT @result6
GO
~~START~~
varchar
The Child1 element with Attr1="Value1" exists
~~END~~


-- Check if multiple XML elements or attributes exist
DECLARE @xml XML = '<Root><Child1>Value1</Child1><Child2>Value2</Child2><Child3>Value3</Child3></Root>';
DECLARE @result7 VARCHAR(50) = CASE WHEN @xml.exist('/Root/Child1') = 1 AND @xml.exist('/Root/Child2') = 1 AND @xml.exist('/Root/Child3') = 1 THEN 'All Child elements exist' ELSE 'One or more Child elements are missing' END;
SELECT @result7
GO
~~START~~
varchar
All Child elements exist
~~END~~


-- Check if an XML element exists using a variable in the XPath expression
DECLARE @xml XML = '<Root><Child1>Value1</Child1><Child2>Value2</Child2></Root>';
DECLARE @element VARCHAR(20) = 'Child1';
DECLARE @result8 VARCHAR(50) = CASE WHEN @xml.exist(CONCAT('/Root/', @element)) = 1 THEN 'The ' + @element + ' element exists' ELSE 'The ' + @element + ' element does not exist' END;
SELECT @result8
GO
~~ERROR (Code: 33557097)~~

~~ERROR (Message: The argument 1 of the XML data type method "exist" must be a string literal.)~~


-- Check if an XML element exists within a nested XML structure
DECLARE @xml XML = '<Root><Parent1><Child1>Value1</Child1></Parent1><Parent2><Child2>Value2</Child2></Parent2></Root>';
DECLARE @result9 VARCHAR(70) = CASE WHEN @xml.exist('/Root/Parent1/Child1') = 1 THEN 'The Child1 element exists under Parent1' ELSE 'The Child1 element does not exist under Parent1' END;
SELECT @result9
GO
~~START~~
varchar
The Child1 element exists under Parent1
~~END~~


-- Test with a valid XML document
DECLARE @xml XML = '<root><child>Hello</child></root>';
SELECT @xml.exist('(//child)[1]');
GO
~~START~~
bit
1
~~END~~


-- Test with nested XML elements
DECLARE @xml XML = '<root><parent><child1>Test1</child1><child2>Test2</child2></parent></root>';
SELECT @xml.exist('(//child1)[1]'), @xml.exist('(//child2)[1]');
GO
~~START~~
bit#!#bit
1#!#1
~~END~~


-- Test with an empty XML document
DECLARE @xml XML = '<root></root>';
SELECT @xml.exist('(//child)[1]');
GO
~~START~~
bit
0
~~END~~


-- Test with an XML document containing special characters
DECLARE @xml XML = '<root><child>Hello & World</child></root>';
SELECT @xml.exist('(//child)[1]');
GO
~~ERROR (Code: 33557097)~~

~~ERROR (Message: could not parse XML document)~~


-- Test with an XML document containing CDATA sections
DECLARE @xml XML = '<root><child><![CDATA[<data>Hello World</data>]]></child></root>';
SELECT @xml.exist('(//child)[1]');
GO
~~START~~
bit
1
~~END~~


-- Test with a large XML document
DECLARE @xml XML = '<root>' + REPLICATE('<item>Data</item>', 10000) + '</root>';
SELECT @xml.exist('(/root/item)[1]');
GO
~~START~~
bit
1
~~END~~


-- Test with NULL input
DECLARE @xml XML = NULL;
SELECT @xml.exist('(//child)[1]');
GO
~~START~~
bit
<NULL>
~~END~~


-- Test with different data types for the second argument
DECLARE @xml XML = '<root><child>123</child></root>';
SELECT @xml.exist('(//child)[1]'), @xml.exist('(//child)[1]'), @xml.exist('(//child)[1]');
GO
~~START~~
bit#!#bit#!#bit
1#!#1#!#1
~~END~~


-- Test with mixed content XML
DECLARE @xml XML = '<root>This is <bold>mixed</bold> content</root>';
SELECT @xml.exist('(/root)[1]');
GO
~~START~~
bit
1
~~END~~


-- Test with XML comments
DECLARE @xml XML = '<root><!--This is a comment--><child>Hello</child></root>';
SELECT @xml.exist('(//child)[1]');
GO
~~START~~
bit
1
~~END~~


-- Test with XML entities
DECLARE @xml XML = '<root><child>Hello &amp; World</child></root>';
SELECT @xml.exist('(//child)[1]');
GO
~~START~~
bit
1
~~END~~


-- Test with XML attributes
DECLARE @xml XML = '<root><child name="test">Hello</child></root>';
SELECT @xml.exist('(//child/@name)[1]');
GO
~~START~~
bit
1
~~END~~


-- Test with XML fragments
DECLARE @xml XML = '<child1>Test1</child1><child2>Test2</child2>';
SELECT @xml.exist('(//child1)[1]'), @xml.exist('(//child2)[1]');
GO
~~ERROR (Code: 33557097)~~

~~ERROR (Message: could not parse XML document)~~


-- Test with Unicode characters
DECLARE @xml XML = '<root><child>Hello 世界</child></root>';
SELECT @xml.exist('(//child)[1]');
GO
~~START~~
bit
1
~~END~~


-- Test with different XML encodings
DECLARE @xml XML = N'<?xml version="1.0" encoding="UTF-8"?><root><child>Héllò</child></root>';
SELECT @xml.exist('(//child)[1]');
GO
~~START~~
bit
1
~~END~~


-- Test with XML elements containing line breaks
DECLARE @xml XML = '<root><child>Hello
World</child></root>';
SELECT @xml.exist('(//child)[1]');
GO
~~START~~
bit
1
~~END~~


-- Test with XML elements containing leading/trailing whitespace
DECLARE @xml XML = '<root><child>  Hello  </child></root>';
SELECT @xml.exist('(//child)[1]');
GO
~~START~~
bit
1
~~END~~


-- Test with XML elements containing XML namespaces within CDATA sections
DECLARE @xml XML = '<root><child><![CDATA[<ns:data xmlns:ns="http://example.com">Hello</ns:data>]]></child></root>';
SELECT @xml.exist('(//child)[1]');
GO
~~START~~
bit
1
~~END~~


-- Test with XML documents containing internal entities
DECLARE @xml XML = '<?xml version="1.0"?>
<!DOCTYPE root [
<!ENTITY internal "Hello World">
]>
<root>&internal;</root>';
SELECT @xml.exist('(/root)[1]');
GO
~~START~~
bit
1
~~END~~


-- Test with XML documents containing entity references in attributes
DECLARE @xml XML = '<?xml version="1.0"?>
<!DOCTYPE root [
<!ENTITY attr "value">
]>
<root attr="&attr;"></root>';
SELECT @xml.exist('(/root/@attr)[1]');
GO
~~START~~
bit
1
~~END~~


-- Test with XML documents containing namespaces in CDATA sections and attributes
DECLARE @xml XML = '<root xmlns:ns="http://example.com"><child><ns:data>Hello</ns:data><![CDATA[<ns:text>World</ns:text>]]><attr ns:attr="value"/></child></root>';
WITH XMLNAMESPACES('http://example.com' as ns)
SELECT @xml.exist('(//ns:data)[1]'), @xml.exist('(//child)[1]'), @xml.exist('(//child/@ns:attr)[1]');
GO
~~ERROR (Code: 33557097)~~

~~ERROR (Message: 'WITH XMLNAMESPACES' is not currently supported in Babelfish)~~


DECLARE @xml XML = '<root xmlns:ns="http://example.com"><child><ns:data>Hello</ns:data><![CDATA[<ns:text>World</ns:text>]]><attr ns:attr="value"/></child></root>';
SELECT @xml.exist('(//ns:data)[1]')
GO
~~ERROR (Code: 33557097)~~

~~ERROR (Message: could not create XPath object)~~


DECLARE @xml XML = '<root xmlns:ns="http://example.com"><child><ns:data>Hello</ns:data><![CDATA[<ns:text>World</ns:text>]]><attr ns:attr="value"/></child></root>';
SELECT @xml.exist('(//child)[1]')
GO
~~START~~
bit
1
~~END~~


DECLARE @xml XML = '<root xmlns:ns="http://example.com"><child><ns:data>Hello</ns:data><![CDATA[<ns:text>World</ns:text>]]><attr ns:attr="value"/></child></root>';
SELECT @xml.exist('(//child/@ns:attr)[1]');
GO
~~ERROR (Code: 33557097)~~

~~ERROR (Message: could not create XPath object)~~


-- Test with XML documents containing invalid characters
DECLARE @xml XML = '<root>Hello&#0;World</root>';
SELECT @xml.exist('(/root)[1]');
GO
~~ERROR (Code: 33557097)~~

~~ERROR (Message: could not parse XML document)~~


-- Test with XML documents containing XML Digital Signatures
DECLARE @xml XML = '<?xml version="1.0" encoding="UTF-8"?>
<root>
  <child>Hello World</child>
  <Signature xmlns="http://www.w3.org/2000/09/xmldsig#">
    <!-- Digital Signature details -->
  </Signature>
</root>';
SELECT @xml.exist('(/root/child)[1]');
GO
~~START~~
bit
1
~~END~~


-- Test with xpath functions
DECLARE @x XML = '<root></root>';
SELECT @x.exist('true()')
GO
~~START~~
bit
1
~~END~~


DECLARE @x XML = '<root></root>';
SELECT @x.exist('false()')
GO
~~START~~
bit
1
~~END~~


-- Tests with random spaces in between
DECLARE @xml XML = '<artists> <artist name="John Doe"/> <artist name="Edward Poe"/> <artist name="Mark The Great"/> </artists>'
SELECT @xml  .  exist  ('/artists/artist/@name'  )
GO
~~START~~
bit
1
~~END~~


SELECT XmlColumn   . exist    ('/artists/artist/@name'  ) FROM babel_5222_xml_exist_t1
GO
~~START~~
bit
1
~~END~~


SELECT babel_5222_xml_exist_t1 .   XmlColumn   . exist    ('/artists/artist/@name'  ) FROM babel_5222_xml_exist_t1
GO
~~START~~
bit
1
~~END~~


-- Tests with different case
DECLARE @xml XML = '<artists> <artist name="John Doe"/> <artist name="Edward Poe"/> <artist name="Mark The Great"/> </artists>'
SELECT @xml.EXIST('/artists/artist/@name')
GO
~~ERROR (Code: 33557097)~~

~~ERROR (Message: schema "master_@xml" does not exist)~~


DECLARE @xml XML = '<artists> <artist name="John Doe"/> <artist name="Edward Poe"/> <artist name="Mark The Great"/> </artists>'
SELECT @xml.Exist('/artists/artist/@name')
GO
~~ERROR (Code: 33557097)~~

~~ERROR (Message: schema "master_@xml" does not exist)~~


DECLARE @xml XML = '<artists> <artist name="John Doe"/> <artist name="Edward Poe"/> <artist name="Mark The Great"/> </artists>'
SELECT @xml.ExIsT('/artists/artist/@name')
GO
~~ERROR (Code: 33557097)~~

~~ERROR (Message: schema "master_@xml" does not exist)~~


DECLARE @xml XML = '<artists> <artist name="John Doe"/> <artist name="Edward Poe"/> <artist name="Mark The Great"/> </artists>'
SELECT @xml.eXiSt('/artists/artist/@name')
GO
~~ERROR (Code: 33557097)~~

~~ERROR (Message: schema "master_@xml" does not exist)~~


-- Acceptable argument types
DECLARE @xml XML = '<artists> <artist name="John Doe"/> <artist name="Edward Poe"/> <artist name="Mark The Great"/> </artists>'
SELECT @xml.exist('/artists/artist/@name')
GO
~~START~~
bit
1
~~END~~


-- Unacceptable argument types
DECLARE @xml XML = '<artists> <artist name="John Doe"/> <artist name="Edward Poe"/> <artist name="Mark The Great"/> </artists>'
SELECT @xml.exist(cast('/artists/artist/@name' as VARCHAR(100)))
GO
~~ERROR (Code: 33557097)~~

~~ERROR (Message: The argument 1 of the XML data type method "exist" must be a string literal.)~~


DECLARE @xml XML = '<artists> <artist name="John Doe"/> <artist name="Edward Poe"/> <artist name="Mark The Great"/> </artists>'
SELECT @xml.exist(cast('/artists/artist/@name' as text))
GO
~~ERROR (Code: 33557097)~~

~~ERROR (Message: The argument 1 of the XML data type method "exist" must be a string literal.)~~


DECLARE @xml XML = '<artists> <artist name="John Doe"/> <artist name="Edward Poe"/> <artist name="Mark The Great"/> </artists>'
SELECT @xml.exist(@xml)
GO
~~ERROR (Code: 33557097)~~

~~ERROR (Message: The argument 1 of the XML data type method "exist" must be a string literal.)~~


DECLARE @xml VARCHAR(100) = '<artists> <artist name="John Doe"/> <artist name="Edward Poe"/> <artist name="Mark The Great"/> </artists>'
SELECT @xml.exist('/artists/artist/@name')
GO
~~ERROR (Code: 33557097)~~

~~ERROR (Message: Cannot call methods on varchar.)~~


DECLARE @xml NVARCHAR(100) = '<artists> <artist name="John Doe"/> <artist name="Edward Poe"/> <artist name="Mark The Great"/> </artists>'
SELECT @xml.exist('/artists/artist/@name')
GO
~~ERROR (Code: 33557097)~~

~~ERROR (Message: Cannot call methods on nvarchar.)~~


DECLARE @xml INT = 1
SELECT @xml.exist('/artists/artist/@name')
GO
~~ERROR (Code: 33557097)~~

~~ERROR (Message: Cannot call methods on int.)~~


DECLARE @xml BIGINT = 1
SELECT @xml.exist('/artists/artist/@name')
GO
~~ERROR (Code: 33557097)~~

~~ERROR (Message: Cannot call methods on bigint.)~~


DECLARE @xml FLOAT = 1
SELECT @xml.exist('/artists/artist/@name')
GO
~~ERROR (Code: 33557097)~~

~~ERROR (Message: Cannot call methods on float.)~~


DECLARE @xml DECIMAL = 1
SELECT @xml.exist('/artists/artist/@name')
GO
~~ERROR (Code: 33557097)~~

~~ERROR (Message: Cannot call methods on decimal.)~~


DECLARE @xml NUMERIC = 1
SELECT @xml.exist('/artists/artist/@name')
GO
~~ERROR (Code: 33557097)~~

~~ERROR (Message: Cannot call methods on numeric.)~~


DECLARE @xml BIT = 1
SELECT @xml.exist('/artists/artist/@name')
GO
~~ERROR (Code: 33557097)~~

~~ERROR (Message: Cannot call methods on bit.)~~


SELECT XmlColumn.exist('/artists/artist/@name') FROM babel_5222_xml_exist_text
GO
~~START~~
bit
~~ERROR (Code: 33557097)~~

~~ERROR (Message: Cannot call methods on text.)~~


-- UDT on type VARCHAR
SELECT VarUDTColumn.exist('/artists/artist/@name') FROM babel_5222_xml_exist_udt
GO
~~START~~
bit
~~ERROR (Code: 33557097)~~

~~ERROR (Message: Cannot call methods on varchar.)~~


-- UDT on type IMAGE
SELECT ImageUDTColumn.exist('/artists/artist/@name') FROM babel_5222_xml_exist_udt
GO
~~START~~
bit
~~ERROR (Code: 33557097)~~

~~ERROR (Message: Cannot call methods on image.)~~


-- NULL values
DECLARE @xml XML = NULL
SELECT @xml.exist('/artists/artist/@name')
GO
~~START~~
bit
<NULL>
~~END~~


DECLARE @xml XML = '<artists> <artist name="John Doe"/> <artist name="Edward Poe"/> <artist name="Mark The Great"/> </artists>'
SELECT @xml.exist(NULL)
GO
~~ERROR (Code: 33557097)~~

~~ERROR (Message: The argument 1 of the XML data type method "exist" must be a string literal.)~~


DECLARE @xml XML = NULL
SELECT @xml.exist(NULL)
GO
~~ERROR (Code: 33557097)~~

~~ERROR (Message: The argument 1 of the XML data type method "exist" must be a string literal.)~~


-- column as input argument
SELECT XmlColumn.exist('/artists/artist/@name') FROM babel_5222_xml_exist_t1
GO
~~START~~
bit
1
~~END~~


SELECT babel_5222_xml_exist_t1.XmlColumn.exist('/artists/artist/@name') FROM babel_5222_xml_exist_t1
GO
~~START~~
bit
1
~~END~~


SELECT dbo.babel_5222_xml_exist_t1.XmlColumn.exist('/artists/artist/@name') FROM babel_5222_xml_exist_t1
GO
~~ERROR (Code: 33557097)~~

~~ERROR (Message: Remote procedure/function reference with 4-part object name is not currently supported in Babelfish)~~


SELECT Id, CASE WHEN XmlColumn.exist('/Root/Child1') = 1 THEN 'The Child1 element exists' ELSE 'The Child1 element does not exist' END AS Result
FROM babel_5222_xml_exist_t2;
GO
~~START~~
int#!#text
1#!#The Child1 element exists
2#!#The Child1 element does not exist
3#!#The Child1 element exists
~~END~~


SELECT Id, CASE WHEN XmlColumn.exist('/Root/Child2') = 1 THEN 'The Child2 element exists' ELSE 'The Child2 element does not exist' END AS Result
FROM babel_5222_xml_exist_t2 ORDER BY Id;
GO
~~START~~
int#!#text
1#!#The Child2 element does not exist
2#!#The Child2 element exists
3#!#The Child2 element exists
~~END~~


-- Exist function called on SUBQUERY
DECLARE @xml XML = '<artists> <artist name="John Doe"/> <artist name="Edward Poe"/> <artist name="Mark The Great"/> </artists>'
SELECT (SELECT @xml).exist('/artists/artist/@name')
GO
~~START~~
bit
1
~~END~~


-- Exist function called on LOCAL_ID
DECLARE @xml XML = '<artists> <artist name="John Doe"/> <artist name="Edward Poe"/> <artist name="Mark The Great"/> </artists>'
SELECT @xml.exist('/artists/artist/@name')
GO
~~START~~
bit
1
~~END~~


-- Exist function called on LR_BR expr RR_BR
SELECT (CAST('<artists> <artist name="John Doe"/> <artist name="Edward Poe"/> <artist name="Mark The Great"/> </artists>' as XML)).exist('/artists/artist/@name')
GO
~~START~~
bit
1
~~END~~


-- Exist function called on function_call
SELECT babel_5222_xml_exist_func1().exist('/artists/artist/@name')
GO
~~START~~
bit
1
~~END~~


SELECT dbo.babel_5222_xml_exist_func1().exist('/artists/artist/@name')
GO
~~START~~
bit
1
~~END~~


-- Exist function called on spatial function -- this will throw error, only to test nested rewrites
DECLARE @xml XML = '<artists> <artist name="John Doe"/> <artist name="Edward Poe"/> <artist name="Mark The Great"/> </artists>'
SELECT @xml.exist('/artists/artist/@name').STArea()
GO
~~ERROR (Code: 206)~~

~~ERROR (Message: The function starea is found but cannot be used. Possibly due to datatype mismatch and implicit casting is not allowed.)~~


DECLARE @xml XML = '<artists> <artist name="John Doe"/> <artist name="Edward Poe"/> <artist name="Mark The Great"/> </artists>'
DECLARE @point geometry = geometry::Point(1.0, 2.0, 4326);
SELECT @xml.exist('/artists/artist/@name').STDistance(@point)
GO
~~ERROR (Code: 206)~~

~~ERROR (Message: The function stdistance is found but cannot be used. Possibly due to datatype mismatch and implicit casting is not allowed.)~~


DECLARE @xml XML = '<artists> <artist name="John Doe"/> <artist name="Edward Poe"/> <artist name="Mark The Great"/> </artists>'
SELECT @xml.exist('/artists/artist/@name').STX
GO
~~ERROR (Code: 33557097)~~

~~ERROR (Message: column notation .stx applied to type "bit", which is not a composite type)~~


DECLARE @point1 geometry = geometry::Point(1.0, 2.0, 4326);
DECLARE @point2 geometry = geometry::Point(3.0, 4.0, 4326);
SELECT @point1.STDistance(@point2).exist('/artists/artist/@name');
GO
~~ERROR (Code: 33557097)~~

~~ERROR (Message: Cannot call methods on float.)~~


DECLARE @point geometry = geometry::Point(1.0, 2.0, 4326);
SELECT @point.STArea().exist('/artists/artist/@name');
go
~~ERROR (Code: 33557097)~~

~~ERROR (Message: Cannot call methods on float.)~~


DECLARE @point geometry = geometry::Point(1.0, 2.0, 4326);
SELECT @point.STX.exist('/artists/artist/@name');
go
~~ERROR (Code: 33557097)~~

~~ERROR (Message: Cannot call methods on float.)~~


DECLARE @xml XML = '<artists> <artist name="John Doe"/> <artist name="Edward Poe"/> <artist name="Mark The Great"/> </artists>'
SELECT @xml.exist('/artists/artist/@name').exist('/artists/artist/@name').exist('/artists/artist/@name').exist('/artists/artist/@name')
GO
~~ERROR (Code: 33557097)~~

~~ERROR (Message: Cannot call methods on bit.)~~


DECLARE @xml XML = '<artists> <artist name="John Doe"/> <artist name="Edward Poe"/> <artist name="Mark The Great"/> </artists>'
DECLARE @point geometry = geometry::Point(1.0, 2.0, 4326);
SELECT @xml.exist('/artists/artist/@name').STDistance(@point).exist('/artists/artist/@name').STArea()
GO
~~ERROR (Code: 206)~~

~~ERROR (Message: The function stdistance is found but cannot be used. Possibly due to datatype mismatch and implicit casting is not allowed.)~~


-- different number of arguments than required (Error will be thrown in this scenario)
DECLARE @xml XML = '<artists> <artist name="John Doe"/> <artist name="Edward Poe"/> <artist name="Mark The Great"/> </artists>'
SELECT @xml.exist()
GO
~~ERROR (Code: 33557097)~~

~~ERROR (Message: The exist function requires 1 argument(s).)~~


DECLARE @xml XML = '<artists> <artist name="John Doe"/> <artist name="Edward Poe"/> <artist name="Mark The Great"/> </artists>'
SELECT @xml.exist('/artists/artist/@name', 1)
GO
~~ERROR (Code: 33557097)~~

~~ERROR (Message: The exist function requires 1 argument(s).)~~


-- EVENTDATA().exist -- eventdata() is currently not supported
SELECT EVENTDATA().exist('/EVENT_INSTANCE/EventType')
GO
~~ERROR (Code: 33557097)~~

~~ERROR (Message: function eventdata() does not exist)~~


-- Exist function called on XML Query
DECLARE @xml XML = '<artists> <artist name="John Doe"/> <artist name="Edward Poe"/> <artist name="Mark The Great"/> </artists>'
SELECT @xml.query('/artists/artist').exist('/artist/@name')
GO
~~ERROR (Code: 33557097)~~

~~ERROR (Message: 'XML QUERY' is not currently supported in Babelfish)~~


-- Dependent objects
SELECT * FROM babel_5222_xml_exist_dep_view
GO
~~ERROR (Code: 33557097)~~

~~ERROR (Message: relation "babel_5222_xml_exist_dep_view" does not exist)~~


EXEC babel_5222_xml_exist_dep_proc
GO
~~START~~
bit
1
~~END~~


SELECT babel_5222_xml_exist_dep_func()
GO
~~START~~
bit
1
~~END~~


SELECT * FROM babel_5222_xml_exist_itvf_func()
GO
~~ERROR (Code: 33557097)~~

~~ERROR (Message: function babel_5222_xml_exist_itvf_func() does not exist)~~


INSERT INTO babel_5222_xml_exist_compcol VALUES (1, '<artist name="Rohit Bhagat" />')
GO
~~ERROR (Code: 33557097)~~

~~ERROR (Message: relation "babel_5222_xml_exist_compcol" does not exist)~~


INSERT INTO babel_5222_xml_exist_compcol VALUES (2, '<artist />')
GO
~~ERROR (Code: 33557097)~~

~~ERROR (Message: relation "babel_5222_xml_exist_compcol" does not exist)~~


SELECT col_xml, comp_col FROM babel_5222_xml_exist_compcol ORDER BY id
GO
~~ERROR (Code: 33557097)~~

~~ERROR (Message: relation "babel_5222_xml_exist_compcol" does not exist)~~


INSERT INTO babel_5222_xml_exist_constraint VALUES ('<artist name="Rohit Bhagat" />')
GO
~~ERROR (Code: 33557097)~~

~~ERROR (Message: relation "babel_5222_xml_exist_constraint" does not exist)~~


INSERT INTO babel_5222_xml_exist_constraint VALUES ('<artist />')
GO
~~ERROR (Code: 33557097)~~

~~ERROR (Message: relation "babel_5222_xml_exist_constraint" does not exist)~~


SELECT student FROM babel_5222_xml_exist_school_details ORDER BY id
GO
~~START~~
xml
<student classid="1" rollid="1" studentname="StudentA" />
<student classid="1" rollid="2" studentname="StudentB" />
<student classid="1" rollid="3" studentname="StudentC" />
<student classid="2" rollid="1" studentname="StudentD" />
<student classid="2" rollid="2" studentname="StudentE" />
~~END~~


INSERT INTO babel_5222_xml_exist_school_details VALUES (6, '<student classid="2" rollid="3" studentname="StudentF" />')
GO
~~START~~
int#!#xml
~~END~~

~~ROW COUNT: 1~~


INSERT INTO babel_5222_xml_exist_school_details VALUES (7, '<student rollid="4" studentname="StudentG" />')
GO
~~START~~
int#!#xml
7#!#<student rollid="4" studentname="StudentG" />
~~END~~

~~ROW COUNT: 1~~


INSERT INTO babel_5222_xml_exist_school_details VALUES (8, '<student classid="2" studentname="StudentH" />')
GO
~~START~~
int#!#xml
7#!#<student rollid="4" studentname="StudentG" />
8#!#<student classid="2" studentname="StudentH" />
~~END~~

~~ROW COUNT: 1~~


INSERT INTO babel_5222_xml_exist_school_details VALUES (9, '<student classid="2" rollid="4" />')
GO
~~START~~
int#!#xml
7#!#<student rollid="4" studentname="StudentG" />
8#!#<student classid="2" studentname="StudentH" />
9#!#<student classid="2" rollid="4" />
~~END~~

~~ROW COUNT: 1~~


INSERT INTO babel_5222_xml_exist_school_details VALUES (10, '<student classid="2" />')
GO
~~START~~
int#!#xml
7#!#<student rollid="4" studentname="StudentG" />
8#!#<student classid="2" studentname="StudentH" />
9#!#<student classid="2" rollid="4" />
10#!#<student classid="2" />
~~END~~

~~ROW COUNT: 1~~


UPDATE babel_5222_xml_exist_school_details
SET student=CAST('<student classid="1" rollid="4" studentname="StudentG" />' as XML)
WHERE id=7
GO
~~START~~
int#!#xml
8#!#<student classid="2" studentname="StudentH" />
9#!#<student classid="2" rollid="4" />
10#!#<student classid="2" />
~~END~~

~~ROW COUNT: 1~~


DELETE FROM babel_5222_xml_exist_school_details WHERE id=10
GO
~~START~~
int#!#xml
8#!#<student classid="2" studentname="StudentH" />
9#!#<student classid="2" rollid="4" />
~~END~~

~~ROW COUNT: 1~~


-- Currently, we only support XPATH 1.0 as input for XML exist function. 
-- Hence following queries will throw error
DECLARE @x XML;  
DECLARE @f BIT;  
SET @x = '<root Somedate = "2002-01-01Z"/>';  
SET @f = @x.exist('/root[(@Somedate cast as xs:date?) eq xs:date("2002-01-01Z")]');  
SELECT @f;
GO
~~ERROR (Code: 33557097)~~

~~ERROR (Message: invalid XPath expression)~~


DECLARE @x XML;  
DECLARE @f BIT;  
SET @x = '<Somedate>2002-01-01Z</Somedate>';  
SET @f = @x.exist('/Somedate[(text()[1] cast as xs:date ?) = xs:date("2002-01-01Z") ]')  
SELECT @f;
GO
~~ERROR (Code: 33557097)~~

~~ERROR (Message: invalid XPath expression)~~


DECLARE @xml XML = '<root><child>Hello</child></root>';
SELECT @xml.exist('(//*:child)[1]');
GO
~~ERROR (Code: 33557097)~~

~~ERROR (Message: invalid XPath expression)~~


-- Unsupported XML functions VALUE(), QUERY(), MODIFY()
DECLARE @xml XML = '<artists> <artist name="John Doe"/> <artist name="Edward Poe"/> <artist name="Mark The Great"/> </artists>'
SELECT @xml.value('(/artists/artist/@name)[1]','varchar(20)')
GO
~~ERROR (Code: 33557097)~~

~~ERROR (Message: 'XML VALUE' is not currently supported in Babelfish)~~


DECLARE @xml XML = '<artists> <artist name="John Doe"/> <artist name="Edward Poe"/> <artist name="Mark The Great"/> </artists>'
SELECT @xml.query('/artists/artist')
GO
~~ERROR (Code: 33557097)~~

~~ERROR (Message: 'XML QUERY' is not currently supported in Babelfish)~~


DECLARE @xml XML = '<Root><Child1>Value1</Child1><Child2>Value2</Child2></Root>';
SET @xml.modify('replace value of (/Root/Child2/text())[1] with "NewValue"');
SELECT @xml;
GO
~~ERROR (Code: 33557097)~~

~~ERROR (Message: 'XML MODIFY' is not currently supported in Babelfish)~~

