
starting permutation : { s1s s1u1 s2u1 s1c s2c s1s }
step s1s: SELECT * from child ORDER BY child_value ASC;
~~START~~
int#!#int
1#!#5
2#!#10
~~END~~

step s1u1: UPDATE child SET child_value = 12 where child_key = 1;
~~ROW COUNT: 1~~

step s2u1: UPDATE child SET child_value = 20 WHERE child_key in (SELECT TOP 1 child_key FROM child ORDER BY child_value DESC)
~~ROW COUNT: 1~~

step s1c: COMMIT;
~~ERROR (Code: 33557097)~~
~~ERROR (Message: [42000] [Microsoft][ODBC Driver 17 for SQL Server][SQL Server]could not serialize access due to read/write dependencies among transactions (33557097) (SQLExecDirectW))~~

step s2c: COMMIT;
step s1s: SELECT * from child ORDER BY child_value ASC;
~~START~~
int#!#int
2#!#10
1#!#12
~~END~~


starting permutation : { s1i s2i s1s s2s s2c s1c }
step s1i: INSERT INTO child VALUES (3, 15);
~~ROW COUNT: 1~~

step s2i: INSERT INTO child VALUES (4, 20);
~~ROW COUNT: 1~~

step s1s: SELECT * from child ORDER BY child_value ASC;
~~START~~
int#!#int
1#!#5
2#!#10
3#!#15
~~END~~

step s2s: SELECT * from child ORDER BY child_value ASC;
~~START~~
int#!#int
1#!#5
2#!#10
4#!#20
~~END~~

step s2c: COMMIT;
~~ERROR (Code: 33557097)~~
~~ERROR (Message: [42000] [Microsoft][ODBC Driver 17 for SQL Server][SQL Server]could not serialize access due to read/write dependencies among transactions (33557097) (SQLExecDirectW))~~

step s1c: COMMIT;

starting permutation : { s1u1 s2u2 s1s s1c s2c }
step s1u1: UPDATE child SET child_value = 12 where child_key = 1;
~~ROW COUNT: 1~~

step s2u2: UPDATE child SET child_value = 5 where child_value >= 6
~~ROW COUNT: 1~~

step s1s: SELECT * from child ORDER BY child_value ASC;
~~START~~
int#!#int
2#!#10
1#!#12
~~END~~

step s1c: COMMIT;
~~ERROR (Code: 33557097)~~
~~ERROR (Message: [42000] [Microsoft][ODBC Driver 17 for SQL Server][SQL Server]could not serialize access due to read/write dependencies among transactions (33557097) (SQLExecDirectW))~~

step s2c: COMMIT;
